header,rating,review_date,comment,trip_verified,aircraft,type_of_traveller,seat_type,route,date_flown,seat_comfort,cabin_staff_service,food_and_beverages,ground_service,value_for_money,wifi_and_connecticity,recommend,wifi_and_connectivity
"""I do not recommend""",2,2018-04-06,"New York JFK to Georgetown. Miserable experience with Caribbean Airlines. The check-in agents at JFK were  disrespectful - not a single smile, didn’t want to use my credit card for my 2nd luggage because it was too many fields to enter into the AR system. The airplane is very antiquated. For example, the cloth seat covering appears dirty, tray table is dirty, windows had cracks, flight attendants are forgetful, and restroom is dirty. I do not recommend using Caribbean Airlines.",True,Boeing 737,Family Leisure,Economy Class,New York JFK to Georgetown,April 2018,1,2,"<span class=""star fill"">1</span>",1,1,,False,
"""standards continue to drop""",2,2018-02-14,"Port of Spain to Kingston. I think that the menu for this airline should be revised. To have sandwiches as cold as the air conditioning unit is not the best and even if as a cold sandwich the bread is usually dry. The hot meals (breakfast) specifically the potatoes with a bun are both dry, I'm unsure if the eggs are real eggs or if its liquid or powdered eggs but these things should also be made clear as it is easy to get allergies from certain foods. I have been traveling for more than 4 yrs with this airline and its standards continue to drop.",True,,Solo Leisure,Economy Class,Port of Spain to Kingston,February 2018,1,1,"<span class=""star fill"">1</span>",3,1,,False,
"""Crew excellent on one hour flight""",9,2018-02-12,"Flew Georgetown to Port of Spain. First leg of Georgetown to Toronto was excellent. I found out someone had bumped me out of my aisle seat and I was now in a window seat but check-in staff were excellent in trying to find a solution. Boarding was early and smooth - funny how efficient things are when no rush! Crew excellent on one hour flight. Great cockpit announcements. Bar service fast and efficient. Only drawback was ancient cabin but hey, it was a short flight.",True,Boeing 737,Business,Economy Class,Georgetown to Port of Spain,February 2018,2,5,,5,4,,True,1
"""cabin was tired and dirty""",3,2018-02-11,"This should have been one review as I purchased a ticket from Georgetown through to Toronto. However on arrival in Trinidad we were told we would have to deplane and change aircraft. In any other airport it would be simple. Not in Trinidad! Zero ground staff and we waited in a queue for 30 minutes and only after I asked were we advised that the boarding pass printer was down. Finally had to issue new boarding passes. Why? Then go through security again and head to the gate. I had found out my seat was changed to a window from an aisle and Trinidad gate agent said no other aisles available but on boarding I saw the emergency exit was free. He lied. Flight left 20 minutes late and Captain said it was a mechanical issue but a pax boarded at departure so was it mechanical? Seat cushion was non-existent and cabin was tired and dirty. Also greeted in Y by a nasty flight attendant who started to harangue me for putting duty free in the overhead bin as it could fall out. A simple move of the bags already there fixed that potential issue. Flight attendant watched and scowled as I sorted out the bags and solved her stacking issue. So much better to give crap to customers than fix the problem! 75 minutes after take off ""lunch"" arrives. I have never seen anything so gross in my life. Just serve nothing if this is the best you can do. No pre meal beverage service, only done at the same time as the so called ""meal"". After meal waited over an hour for pick up of the ""tray"" and no after dinner beverages offered. This was a nearly 6 hour flight! No service for 2 hours and no warning that feature movie was going to start. Of course no request to lower blinds so couldn't see tiny overhead screens anyway. They say free entertainment but no headsets provided. Bar service 90 minutes from Toronto and later the ridiculous and old fashioned warning to turn off phones and Ipads as landing soon. Hello! It doesn't matter on US or Canadian aircraft why on Caribbean Airlines? To top it off took 60 minutes for bags to arrive in Toronto. I love Caribbean Airlines ad campaign in Georgetown with slogan ""Demand Value"". Really? As a customer, how about demanding a smile or two? Maybe crew was so miserable as they were missing Carnival?",True,Boeiung 738,Business,Economy Class,Port of Spain to Toronto,February 2018,1,2,"<span class=""star fill"">2</span>",2,3,,False,1
"""worst experience ever""",1,2018-01-11,New York to Montego Bay. By far the worst experience ever. Yesterday was a day just like any other. I walked in to JFK receiving notification that the terminal was flooded and it is partially closed. I walked up with my daughter 2 years old and my mother in law who was in a wheelchair. The receptionist was very unhelpful and rude with the way she handled us. We got up to the waiting area to board the airplane where you could see chattering between airline workers. We boarded the plane and after 1 hour of waiting we were told that there is a problem with a heater and that they were trying to fix it. And other hour later we were told that we had to board another plane. No apology was made. There were kids on the flight. And not even a drink was offered. No phone call nothing. I went to the desk to ask for a call and none was given and was told a manager would have to approve. I waited and received no response. We departed about 12 something for a flight that should have left at 7:15. We got to Jamaica told to make my mother in law walk to meet the wheelchair as none was waiting for her. Got down to immigration and to the baggage claim where one of my bag was not present. All the representatives were up and about trying to find stuff for people who could not find their luggage. When I finally spoke to someone they told me I would have to come back after signing a missing baggage claim and that I should call the number given or they would call me. Until this time no one has reached out to me. I call the airport and was transferred to the airline representative and was hung up on twice. After that I called back and with told by the front desk of the airport that they would have to call me and tell me what to do. I waited 2 hours after coming off the airline to be told that my bag (car seat) was maybe not here. This is an inconvenience because after having a delayed flight and a hungry child for almost the whole day. Had to let my one handed mother in law hold my child until we got to Kingston. The representatives were not at all helpful had to wait 2 hours to be told that the car seat was maybe left in New York. No reassurance or outline of how I would receive anything. And it’s almost one full day and no response. Not to mention the meal that was provided. Crackers and tea would have been better.,True,,Family Leisure,Economy Class,New York to Montego Bay,January 2018,1,1,"<span class=""star fill"">1</span>",1,1,,False,
"""Terrible customer service""",3,2017-12-31,"Port of Spain to Georgetown. This is by far the worst airline ever dealt with. Up to date no compensation, I was telling myself I wouldn't take the airline ever again but I did because I needed to get to Guyana. They lost the stroller seat which was declared missing on June 27th and up to date, did not find it, would not reimburse me for damaged luggage. I did not receive any compensation for the stroller seat and no responses since October. Terrible customer service.",True,,Family Leisure,Economy Class,Port of Spain to Georgetown,November 2017,3,3,"<span class=""star fill"">3</span>",3,3,,False,
"""Wonderful service from the ground up""",10,2017-10-23,"✅ Verified Review |  Toronto to Port of Spain. Wonderful service from the ground up. Check in was fast and efficient at Pearson Airport. Flight was on time. The crew were warm, professional and smiling and  chatting with passengers. The head flight attendant and one of the other FA's I have encountered on previous Caribbean Airlines flights are outstanding representatives of true Trinbagonian charm and friendliness. The Captain and first officer kept us well informed during the smooth and enjoyable flight. The food was tasty although small portions and a fairly wide choice of non alcoholic drinks were readily available on board.",False,Boeing 737-800,Business,Economy Class,Toronto to Port of Spain,October 2017,3,5,"<span class=""star fill"">3</span>",4,4,,True,
"""major room for improvement""",5,2017-10-07,"✅ Verified Review | Quite a mediocre airline with a semi-good landside operation and quite a good airside one. The Good: Counter service is good. Quick and efficient check-in with friendly (enough) agents. Tickets are easy to purchase on-line or at their offices. The aircraft are in good condition. Seats are clean, if basic. Pitch is more than other carriers. Free sealed air-buds. Attendants are accommodating, well trained and efficient. Each seat has a free to take Caribbean Beat magazine, IMHO the best Caribbean publication. The meals and drinks are still complimentary and of high quality for an airline. Safety is paramount. The airline has a good compliment of flight officers and properly maintained aircraft. The Bad: The web-site is very dated. Changes cannot be made leading to: Don't try to contact the airline. Responses to e-mails take well over 5 days, sometimes months. The call centre seems to be bogged down. Seat pitch could be better. I'm 5'11"" and it's comfortable until the person in front decides to recline. There is very little entertainment. A complimentary movie on those tiny drop-down screens that even Lifetime won't show and some audio channels The Ugly: It's the only airline apart from AA where one gets ""grumpy"" FAs. Again, communication is horrible. All in all not the worst but there is major room for improvement, particularly landside operations.",False,Boeing 737-800,Solo Leisure,Economy Class,Port of Spain to Kingston,September 2017,3,4,"<span class=""star fill"">3</span>",4,4,,True,
"""wonderful service they provide""",10,2017-03-26,"✅ Verified Review |  New York JFK to Montego Bay. Caribbean Airlines made arrangements for a wheelchair at the airports going and returning. At JFK, we arrived early and were checked in immediately and they had the wheelchair right as I checked in. Then we were taken to lounge followed by taking us to the gate. We sat in 3c and 3f. Very nice seats. Because of the freezing temps that morning, we had a slight delight because of possible fuel line link but the pilot played it safe. After about an hour we were cleared to leave. As I had previously ordered our meals, we enjoyed a cheese omelet and delicious fish cakes, the best rum punch and best coffee ever. The economy class had the cheese omelet also. The movie shown was Mr. Church, a relatively new movie. Excellent flight with a wheelchair waiting at the gate. Crew was just terrific. Our return flight was on March 18 and again, terrific check in, quick and easy. Wheelchair waiting for me at check in. We sat in the same seats on the returning flight. Dinner was chicken and poached salmon, although they ran out of the key lime pie, we had delicious grilled fruit with a mango salsa, a rum punch, excellent coffee and a Hennessy brandy. Ecomony had sandwiches that night, I believe it was ham and cheese but not sure . The movie shown was Dr. Strange, unfortunately the tv screen wasn't working well, this happens. Crew was good but we got spoiled by the crew on the 11th. Again the wheelchair was waiting for us at the gate and since we have global entry, we were out within 15 minutes. Luggage was out first both in Montego Bay and JFK. We have taken Caribbean Airlines for a number of years and only once had an issue with crew, which was years ago. We chose them because of the wonderful service that they provide and they still give meals whether you are in business or economy. Our recommendation is to arrive at the airports early, less stress and less people.",False,,Couple Leisure,Business Class,New York JFK to Montego Bay,March 2017,5,5,"<span class=""star fill"">5</span>",5,5,,True,5
"""staff was excellent""",10,2016-10-30,"✅ Verified Review |  My flight from Miami to Port of Spain with Caribbean Airlines was the most comfortable, staff was excellent the attendant was brilliant. With service like that you can never ask more.  I can give thumbs up to that staff. Thanks for everything.",False,,Business,First Class,MIA to POS,October 2016,4,5,"<span class=""star fill"">3</span>",4,5,,True,
"""customer service was terrible""",3,2016-05-15,"First flight was an overnight flight from Toronto to Trinidad. No air-conditioning, seats so uncomfortable and they would not turn off any of the lights, so to get any rest was impossible. When we got to Trinidad we were soaked in sweat, cranky and tired. Our flight from Trinidad to Tobago was wonderful, seats were comfortable and we had air. On our way back from Tobago to Trinidad the customer service was terrible, they took no credit for their mistakes, rude and misleading. Everyone around us had the same treatment as we did. Thankfully we had a local person to help us through it otherwise we would have missed all of our flights. Our flight from Trinidad back to Toronto was ok, food was ok. Again, no customer service. We had to place our plates and cups on the floor before anyone would pick up our trash. Thankfully we had some A/C. Even though they were direct flights I think I would take another airline with longer layovers then go with this airline again.",False,,Couple Leisure,Economy Class,YYZ to POS,May 2016,1,2,"<span class=""star fill"">2</span>",1,1,,False,
"""very helpful and smiley""",8,2016-03-19,Port of Spain to Tobago with Caribbean Airlines and an excellent service. On time departure flight. It's one of shortest flights but service is good. Value for money. Ground staff are very helpful and smiley. No inflight entertainment or food. It's okay cause it's only 20 mins flight. Overall good service.,False,ATR 72,Solo Leisure,Economy Class,POS to TAB,March 2016,3,3,,4,5,,True,
"""never make mistake of choosing again """,3,2016-03-10,"I travelled from Port of Spain to Toronto on the 29th February with my wife and son of 6 months. Our flight was at 1:35am so we arrived at the airport around 10:25pm only to find a very long line for Economy Class check-in. We later discovered that this was due to the fact that it was the only line for all international economy class passengers. My son already being in a trouble mood because he had long missed his bed time, my wife decided that we would try to check-in at the Priorty/Business Class check-in counter. We went right up to the agent who accepted to check us in but made us rearrange our bags several times to get an exact weight of 23kg even though one of our bags was only over by 800g. Then apparently there was a problem with my wife's name on her passort that didn't match the name they had in their system. I explained to her that on our out-bound flight from Toronto at no time was any mention made of this problem but she insisted that this was the case and that they had to change the name for them to allow on the flight. It took them 45 mins to change the name with us standing at the counter baby in hand. In all 1 hour 30 mins to check-in, a first for me! Once on board the plane things weren't much better. The flight was full and with there only being 6 abreast seating, my wife was stuck between me a another guy with the baby on her lap in a row with not much leg room or seat width. We were not comfortable at all and to make matters worse the heat was turned up to 25° it felt like. When we mentioned it to the flight attendant she simply made some excuse about it being normally hotter in the front of the plane. Never heard of such a thing! Our meal on this 6 hour red-eye flight, consisted of a very small croissant with cheese and pack 4 chocolate biscuits. Pitiful! Inflight entertainment from the 1980's with overhead screens, poor image quality and sound. All in all, a very bad experience that we will never make the mistake of choosing again even if we have take several connecting fights get to Trinidad. Flyer beware!",False,Boeing 737-800,Family Leisure,Economy Class,POS to YYZ,February 2016,1,2,"<span class=""star fill"">1</span>",1,1,,False,
"""attendants very accommodating""",9,2016-02-06,"Trinidad to New York return. Check in was quick with the flight leaving on time. The cabin attendants were very accommodating, food was very tasty. The return trip was also excellent, dinner onboard was excellent. I recommend anyone to try Caribbean Airlines.",False,Boeing 737-800,Family Leisure,Economy Class,POS to JFK,December 2015,5,5,"<span class=""star fill"">2</span>",5,5,,True,
"""highly recommend them""",8,2016-01-26,"New York JFK to Port of Spain. This was my first flight with Caribbean Airlines and I have to say it was one of the best flight experiences. The staff was courteous and informative, there was a meal which we did not anticipate, and no problems at all. I highly recommend them.",False,,Solo Leisure,Economy Class,JFK to POS,January 2016,3,4,"<span class=""star fill"">4</span>",4,5,,True,
"""not worth flying""",1,2016-01-01,"Fort Lauderdale to Montego Bay with Caribbean Airlines. It is not worth flying this airline. We lost a whole day in Jamaica due to delays, and all they gave us was a $15 each voucher for food. We ended up spending $100 in food for the day (airports are expensive), plus gas to drive around and do nothing while we waited for our flight.  When you rarely get a vacation, missing a whole day of a week is worth a lot - a hell of a lot more than $15 each.  I sent a letter to the airline, and received no response.",False,,Couple Leisure,Economy Class,FLL to MBJ,October 2015,3,3,,1,1,,False,
"""worst airline I have experienced""",2,2015-12-03,"My Caribbean Airlines flight to Kingston was on November 26th at 1am. I got to JFK Airport around 10pm. On the screen, it said my flight was cancelled. I asked one of the staff what was going on, all she said was I had to stand in line and speak with the staff in the counter. Standing in line took about 2 hours. I was already pissed off because they could have informed me beforehand via email or phone that my flight was cancelled instead of me having to rush to the airport and stand in line in the middle of the night. As I understand from other people standing in line, they were trying to book the passengers to different flights that evening as chance passengers. When it was finally my turn, the only flight available that they offered me was at 9am or 1am the following day (Nov 27th), it was 12 midnight already. They didn't offer complimentary room to stay for the night. If I chose the 9am flight, I'll have to sleep in the airport for 9hours until my flight. The staff was very rude. He acted like I was stupid for asking questions. Not a single apology from any of them for the fact that I was inconvenienced. The staff was acting like I was the one inconveniencing him. No reason was given on why the flight was cancelled. The next evening, I was at the airport again at 10pm for my 1am flight (Nov 27th), It was good news for me when I saw that the flight will be leaving on time. When it was my turn in, the lady at the front charged me an extra $25 for my 2nd luggage. I complained because I know I was allowed 2 luggages to check in at 50lbs each. She reviewed their policy and said okay I didn't have to pay anymore. This same lady took a long time checking me in, because she was busy gossiping with fellow staff members. It's such a disappointment seeing unprofessional and rude employees.  Long story short, worst airline I have ever experienced.",False,,Solo Leisure,Economy Class,JFK to Kingston,November 2015,2,1,,1,1,,False,
"""I felt helpless and conned""",1,2015-12-02,"Caribbean Airlines from Kingston to Ft Lauderdale. For the first time in my life I felt helpless and conned. I was called at 3:30 in the morning of November 26, 2015 to say my flight was delayed that should be leaving at 6:10 same morning until 12 noon. I sat and waited at the airport. I checked in at 9am started boarding at 11:45 which should be since 11:30. 12 noon no passengers were on the plane as they placed us in an area to sit after they took our boarding passes. About 1/2 hour to 45 mins. when passengers started to ask questions and was irated they sent someone to lie to us - when that wasn't accepted the head of engineer came to tell us they were having a mechanical problem with the engine. I was at the airport since 4:10am, didn't sleep all night, haven't eaten and was being talked to as if I was begging a plane ride. I asked to be rebooked as I was going away for only four days and they kept my bags until there were no flights out. They started boarding sometime after 2pm and the plane was still not fixed as they were awaiting a part to come from New York at 4pm. With all this happening the customer service was poor as it seemed we were being avoided like a plague. I missed thanksgiving dinner with my family and a business meeting. I didn't leave until the Friday morning as I opted not to go again. Then this flight was delayed too and on coming back my flight was delayed for over an hour without explanation. What a joke!",False,,Solo Leisure,Economy Class,Kingston to Ft Lauderdale,November 2015,3,2,,1,1,,False,
"""no one can give an explanation""",2,2015-11-27,"Ft Lauderdale to Montego Bay. Thanksgiving day was a disaster, flight schedule to leave at 9:40am was cancelled. They said delayed 3:45pm, then 4:45, then 5:45, now 6:45. Very frustrating and no one can give an explanation. The workers at the podium said no one is giving them any information so they dont know what is going on. This is unacceptable and not good service. They will be my last resort for travelling if need be.",False,BW030,Couple Leisure,Economy Class,FLL to MBJ,November 2015,3,3,"<span class=""star fill"">1</span>",3,2,,False,
"""a bait and switch""",1,2015-11-15,"We booked our Caribbean Airlines flight because it was the earliest one leaving New York at 6am, and latest leaving Montego Bay at 7pm. A week later we get an email saying our flight there is now scheduled for 7:15 and a day later they send another saying our flight home is now scheduled for 5:30. Talk about a bait and switch. Now we're at the airport and at check in they tell us the flight is delayed and we won't be boarding until 8:30. A great start to the vacation!",False,,Couple Leisure,Economy Class,JFK to MBJ,November 2015,,,,1,1,,False,
"""no entertainment system at all""",3,2015-11-09,"We flew Caribbean Airlines from New York JFK to Port of Spain and back. Both flights were delayed by about 1.5 hrs without good reasons. JFK-POS had no entertainment system at all, return flight had some but a lot of control units didn't work at all or sound was awful - six of us were flying plus I tried some other available seats, so I can say with certainty that a lot of units were defective. Food was very mediocre but acceptable, so were the crews. Bottom line: if it is much cheaper than competition, then it is worth it, otherwise - stay away.",False,,Solo Leisure,Economy Class,JFK to POS,November 2015,3,3,"<span class=""star fill"">1</span>",3,3,,False,1
"""good value for money""",6,2015-11-04,"My wife and I travelled with Caribbean Airlines in August 2015 from Port of Spain to New York JFK Airport. We did not experience any problems with check in (having previously used the web check in service), the flight was on time and the staff were friendly and professional. The flight was on time. The flight experience was mostly comfortable and staff very polite. The complimentary meal was tasty and the entertainment being offered was satisfying even though, with one screen located above for every few seats, one has to strain one's neck and eyes to view it. The seating space was also a bit small and I felt there should have been a few extra inches of space between myself and the seat in front of me. Nevertheless, the flight overall was enjoyable and there were no major issues. I would definitely fly with this airline again as the cost was reasonable and the experience was good value for money.",False,,Couple Leisure,Economy Class,POS to  JFK ,August 2015,2,3,"<span class=""star fill"">2</span>",3,4,,True,
"""the worst experience I have had""",2,2015-09-08,"I have been flying to Jamaica for years and this flight has been the worst experience I have had. My flight from Kingston back to New York was supposed to take off at 7:30p.m on September 02. I checked in around 5p.m and I was told the flight was delayed. I sat in my seat for another two hours only to hear from a vendor in airport that my flight was canceled. It was not announced to us and, I sat there thinking I was going home that night. I went to the information desk and then they finally told me that the flight was canceled and I have a choice of going to a hotel or going back to where I was staying. They didn't have any information about when the next flight would be, or what was the cause for it to be canceled. Around after one the next morning I received a call letting me know that they have a flight at 6:30a.m. I checked in around 5am and once again my flight was delayed. I board the plane after 7am and my plane did not take off till 9am that morning. My overall experience with Caribbean Airlines was a disgrace. This is not an experience that I would like to deal with again.",False,,Solo Leisure,Economy Class,Kingston to New York,September 2015,1,2,"<span class=""star fill"">1</span>",1,3,,False,1
