header,rating,review_date,comment,trip_verified,aircraft,type_of_traveller,seat_type,route,date_flown,seat_comfort,cabin_staff_service,food_and_beverages,ground_service,value_for_money,wifi_and_connecticity,recommend,wifi_and_connectivity
"""will never fly with them again""",1,2022-08-12,"I had to cancel my flight; it was a flex ticket. They charge you a $50 fee and the refund take at least 9 months to get your money back. This is ridiculous, I will never fly with them again.",True,,Family Leisure,Economy Class,Trinidad and Tobago to Havana,August 2022,,,,,1,,False,
"""cancel flights without notice""",1,2022-07-20,"Not Verified |  This airline cancelled my roundtrip flight that I paid almost $800 USD for and refused to reimburse me! They cancel flights without notice so you will get to the airport and that's when you know it's been cancelled. Their workers were so dismissive and did not want to help me by even putting me on the next flight like any other airline would have. They also have the oldest, slowest and most outdated systems you could ever imagine. The slowest lines, no online customer service chat, no self-check-in?  They left me stranded in New York. I cried because I could not afford another ticket at the prices they were telling me. I had to buy a ticket through another airline to go home.",False,,Solo Leisure,Economy Class,Kingston to New York,July 2022,,,,1,1,,False,
"""my trip exceeded expectations""",9,2022-06-22,"Was originally due to travel in March 2022, but, tested positive for Covid19. Caribbean Airlines differed my ticket to a later date, at no cost. When I was ready to fly in May 2022, the call centre was able to rebook quite simply. I used the opportunity to upgrade my ticket to Business Class which the agent did over the phone, simple transaction. I use the APP for all my Flight Management with regard to seats, meal requests etc.. BW600/26JUN POS/YYZ operated on-time. It was my first time using the new B737 MAX8 and was really impressed with the comfort of the cabin. The ergonomics of the seat made for a super comfortable 6hr flight. The IFE is a big improvement on this aircraft and the aesthetic of the cabin is also very mod looking. Once of the highlights of this flight was the ability to pre-order a meal. In this case, it was the Stewed Chicken with Macaroni Pie, Callaloo, Fried Plantain. A full on Sunday lunch on a Thursday night, LOL. Food was a generous amount and very tasty. Upon arrival in YYZ, I was expecting delays exiting the aircraft and getting thru Immigration and Customs. News of lengthy delays preceded my trip, but, it was actually very easy. BW607/09JUN YYZ/POS via GEO. Another on-time departure, early in fact. I opted for this flight via GEO because I preferred a daytime flight vs the red-eye which operates non-stop YYZ/POS, no regrets. Had a nice late breakfast in the lounge at Pearson and then a another delicious pre-ordered meal as we took off towards Guyana. This time, I ordered the Curry Chicken (or Chicken Curry) with Dhal and Rice. It was also a very generous amount and very tasty. Great flight down into the Southern Caribbean. The crew: On both flights, my cabin crew were amazing. They really do stand out from crews on other airlines in my opinion. They are warm and compassionate and their service is graceful. Extremely professional. Overall, my trip with Caribbean Airlines exceeded expectations and look forward to flying with them again soon. I always feel that I have already arrived home when I step aboard a Caribbean Airlines flight, no matter which gateway destination, I'm at.",True,Boeing 737 MAX8,Solo Leisure,Business Class,Port of Spain to Toronto,June 2022,5,5,"<span class=""star fill"">5</span>",4,4,,True,3
"""not be using this airline ever again""",2,2022-04-19,"Not Verified |  
I bought a ticket to SVG and for the reason that my son lost his job, he cancelled that, and then rebook when he was told it takes 6- 9 month to get back his refund which was less than half. Caribbean Airlines takes 6-9 months to refund money but he had to pay 250$ to rebook. This is high class robbery.  I will not be using this airline ever again.",False,,Solo Leisure,Economy Class,Toronto to Trinidad,April 2022,,,,,1,,False,
"""This is disrespectful and fraudulent""",1,2022-03-20,"A ticket was purchased for January 2, 2021 to leave from Havana, Cuba. Unfortunately the government of Cuba shut down all flights. In May of 2021 we requested a refund since it was apparent that only flights financially benefiting the Cuban government would be leaving Cuba. Caribbean Airlines did advise it would take up to 5-6 months to process the refund. We are now almost to a year with no refund. When I contact the refund department of Caribbean Airlines they send an auto email that someone will call within 48 hours. Of course no one calls. When I call the customer service line then I get put on hold multiple times then always eventually a disconnected line every single time. This is disrespectful and fraudulent. I want my money returned!",True,,Solo Leisure,Economy Class,Havana to Georgetown,May 2021,1,1,,1,1,,False,
"""went above and beyond""",10,2021-10-30,"Not Verified |  Staff was very helpful, did not have a acceptance pass to enter my home land of Trinidad and Tobago after traveling 200 miles from Boston MA for a funeral my mon and brothers was stuck missing one acceptance letter and not being able to board due to the letter Mr. Willcott at the ticket center went above and beyond and helped find the missing travel pass. He made things happen for us.",False,,Family Leisure,Economy Class,New York to Trinidad and Tobago,October 2021,5,5,,5,5,,True,
"""refund process will take a minimum of 9 months""",1,2021-08-24,"Cancelled a return flight purchased through Caribbean Airlines. It was a FLEX/economy flight which states it's 100% refundable. But of course, you must read the fine print which says there is a USD$50 processing fee. The refund process will take a minimum of 9 months. I can see other people leaving reviews are still waiting on their refunds. Basically, you are paying them to sit on your money for 9+ months. If customer service was better and explained why it was so ridiculous, this would have been a better experience but of course, it was terrible. They were extremely short and rude. Unfortunately, CAL is the only airline flying to Trinidad & Tobago. As soon as any other airlines start flying to Trinidad & Tobago, fly with them instead.",True,,Solo Leisure,Economy Class,Toronto to Port of Spain,August 2021,,,,,1,,False,
"""not yet received my refund""",1,2021-04-20,"Not Verified |  I was supposed to fly on Caribbean Airlines in October 2020 to Kingston. However Caribbean airlines cancelled my flight and wanted to put me on another flight 14 hours later. This was not convenient for the purpose of my travel so I told them that that flight would not suffice. They told me it could take “up to ninety business days for a refund”. It is now seven months since September 30, 2020 and I have not yet received my refund of $493. I have contacted the airlines at least five times now. I have contacted Expedia. I have contacted BBB and I have even written an email to the CEO of the airlines. All they are telling me is that my refund was submitted to the refund department.",False,,Business,Economy Class,New York to Kingston,September 2020,,,,,1,,False,
"""nothing to credit or refund me""",1,2021-03-26,"This airline cancelled my flight due to COVID in March 2020 and is now refusing to issue me a refund or a credit. The customer service rep was incredibly rude to me over the phone. When I asked to be transferred to speak with someone else, she hung up on me. $700 on a flight and they can do absolutely nothing to credit or refund me. Very disappointing, especially because we are repeat customers.",True,,Couple Leisure,Economy Class,New York to Montego Bay,April 2020,,,,,1,,False,
"""one year later and still no refund and lies, lies, lies""",1,2021-02-15,"I paid for my ticket in February 2020 but because of Covid my flight got cancelled. I applied for a refund because my Father received a refund for the same Day returning flight. It is now February 14, 2021, a year later and all I have heard is excuses and lies! They even had the nerve to block me on Facebook rather than issue a refund. They even said a refund was issued and after 14 days said it never was and I should receive it soon, one year later and still no refund and lies, lies, lies. So disappointed in my Caribbean Airlines position in this matter.",True,,Solo Leisure,Economy Class,Toronto to Trinidad,March 2020,5,5,"<span class=""star fill"">5</span>",1,1,,False,1
"""would not give me a refund back""",1,2020-12-08,"Not Verified |  I had to cancel my flights due to COVID and they would not give me a refund back. Instead, one of their team members chose a date without letting me know and rebooked my flights. A few weeks later, my sister who was scheduled for the same flight ended up getting a full refund along with a few others I know. I'm not entirely sure why I was not getting a refund and why they kept accusing me of re-booking my tickets when I never did! Also, my last travel with them to Guyana was a horrible experience!",False,,Family Leisure,Economy Class,New York to Guyana,September 2020,,,,,1,,False,
"""ought to be illegal!""",1,2020-03-20,"St Marteen to Port of Spain. I arrived at St Marteen airport to travel home via Trinidad as a layover due to the COVID issue. At the Caribbean counter, the representative was not accepting people so my flight was canceled. I asked, so that's it? I can't fly? He said, no. He said I could try another airline and that I could get a refund online, then he turned away, dismissing me. I went home, took back my apartment and rental vehicle, and made plans to just stay and deal with things, told my family to not expect me home due to the developing situation and traveling issues (we had already spent money we don't have trying to get me there and back). The next day, I went online and was told the man had lied. They told me I would have to travel, set another date and that was as good as they could manage. I'm sorry, but I did not cancel my plans. Apparently, Trinidad was closed before the ticket was ever sold. Why did you sell a ticket for a place that was closed to anyone but nationals? That ought to be illegal!",True,,Solo Leisure,Economy Class,St Marteen to Port of Spain,March 2020,,,,1,1,,False,
"""told I would receive a refund""",2,2020-03-19,New York to Montego Bay. I will never book another Caribbean airlines flight again!! I booked the airline for my wedding in jamaica for a 7am flight on 02/26/2020 and they called me at 5 am and cancelled my flight without giving me any reason. They could not tell me why my flight was cancelled the representative on the phone was unsure. I had around 100 people meeting me for my wedding and they told me the next available flight was at 4pm and was subject to delays. The whole day would have been missed by the time i travelled after landing in jamaica. I had to cancel my reservation in which i was told i would receive a refund. I have not received any refund or notification in writing or emails that i would be getting a refund. Only to wait 21 business days. When i called the airline no person would even tell me the status of my refund. I am completely left in the dark. I can not understand how an airline could conduct business in this manner. Also the reliability of this airline is completely compromised. I had to spend an extra 700$ to book a whole new flight the morning of the cancellation.,True,,Family Leisure,Economy Class,New York to Montego Bay,February 2020,1,1,"<span class=""star fill"">1</span>",1,1,,False,1
"""I filed a dispute""",1,2020-03-05,"On November 15, 2019, I went to Caribbean Airline’s website to purchase three tickets to Barbados, for $223.20 per ticket. The flights were scheduled to leave around 2:40 pm, on November 15th, and arrive in Barbados around 10 pm that same night. I selected three flights with this flight information. When I received confirmation of the flights, it stated that the flights would arrive around 9 am the next morning, on November 16th. That was not the flight times that I selected. I immediately called Caribbean Airlines Customer Service and informed the representative that there was a mistake with the flight times on the confirmation. I stayed on the phone with her for about five minutes while she looked up my flight information. She instructed me to go to the Caribbean Airlines’ counter in the Miami Airport and have the Desk Agent change the flights. I waited for about 1.5 hours for this change. The Desk Agent also spoke with her Supervisor and they both worked on changing my flight. After waiting for approximately 1.5 hours at the Caribbean Airlines’ counter, the Desk Agent told me that there are no longer any seats available on the flights that I selected. I requested a full refund, at the counter, since the flights that I originally selected were not available anymore. I also requested to speak with the Supervisor that was helping her to change the flights. She denied my request and informed me that I would have to call Customer Service again because they do not issue refunds at the counter. She also stated that Customer Service would be able to issue a full  refund. I walked away from the counter and called Customer Service. I spoke to a different Customer Service Representative than before. I explained the situation. She informed me that the reason the Desk Agent instructed me to call Customer Service was because the Desk Agent knew that I would NOT be able to get a refund at all. And the Desk Agent didn’t want to have a confrontation at the counter. So, the Desk Agent passed me back to the Customer Service Department, according to the Customer Service Rep. This Customer Service Rep said that she could only issue a flight credit. I stated that I was not interested in a flight credit because it was their error on their part with booking the wrong flights. She told me that the only person able to issue a full refund was a Supervisor. I then, requested to speak with a Supervisor. After waiting on hold for 30 minutes, the phone line was suddenly disconnected. I thought it was a mistake or maybe a bad signal on my phone. I called Customer Service again and repeated the same situation regarding booking flights for a specific time and the flight confirmation coming back with a different time. I immediately asked to speak with a Supervisor after explaining the situation. This time, I waited about 15 minutes on hold and the phone line disconnected again. My phone did not have a bad signal. They purposely disconnected the line to prevent a conversation with a Supervisor, who may or may not have been able to resolve the issue. After, a second disconnection and hours of trying to have my issue resolved, I filed a dispute with American Express to receive a credit for these flights.",True,,Solo Leisure,Economy Class,Port of Spain to Bridgetown,November 2019,,,,1,1,,False,
"""communication is less than poor""",1,2019-10-03,"New York to Montego Bay. Flight time was 7 am. After 9 am we were told the flight may not leave as there is a technical problem. The communication between the company and its customers is less than poor. Finally around 1130 we went from not leaving to departure soon. We don’t live near the airport, we left at 1 am to make our flight. The only thing Caribbean did was hand out $12 vouchers which most establishments would not take. Steer clear, the flight was no bargain, the plane was old and dated. We tried dealing with Caribbean but would only say they don’t take phone complaints.",True,,Couple Leisure,Premium Economy,New York to Montego Bay,September 2019,1,2,,1,1,,False,1
"""My bag never arrived""",1,2019-08-04,"New York to Port of Spain. The worst customer service. My bag never arrived from JFK to Trinidad, I made a report upon my arrival and was told that they would call me once the bag was found and they would send it to me at my final destination, Antigua. Three days later, I had made more than 40 calls to the airline in New York and Trinidad, 300 USD dollars in international calls, and I received zero calls from the airline informing about the case. I was treated disrespectfully, someone hung up the phone on me when I politely insisted for assistance and information. I emailed the CEO and a director of the company asking for their help, no response, just a customer officer responded saying they would look into it. This is a disaster and I strongly advise against this airline.",True,,Business,Business Class,New York to Port of Spain,August 2019,3,4,"<span class=""star fill"">1</span>",1,1,,False,2
"""poor customer service""",3,2018-12-12,"Not Verified |  I made reservations for my daughter and her husband to Tobago, however when the email arrived her name was spelt incorrectly. I then called to make the change, I was put on hold at least four times, each lasted at least 10 mins. I was told all of the times that I had to wait on a supervisor's report of the recording. I was then told I was the one who misspelt my daughter's name. I called the very next day, requesting a listen of the recording. I was then transferred to customer service I was told I can't and they had to send the recording to another supervisor again I was put on hold for at least 13mins. this time I was told that I will not be able to listen to the recording. this time someone tried to explain that the travel is between Trinidad and Tobago and sometimes if a letter is missing they can overlook it, however if they don't I will have to pay for the error. This is poor customer service, even though they are the only airline operating the bridge between T&T its highly unprofessional.",False,,Couple Leisure,Economy Class,Trinidad to Tobago,October 2018,,,,,2,,True,
"""service representative negligence""",1,2018-11-10,"New York to Montego Bay. I bought a 2 way ticket on Caribbean Airlines. Before my return trip I received an email from the airline saying that my flight was cancelled and I was reaccommodated on a flight the following day. I was not able to travel on the date they gave me so I called more than a week before the given date to find out my options. The representative on the phone  was rude and unwilling to help. She said I had to pay a rebooking fee plus the difference to get on a new flight with the same airline. I was not advised that I could place that ticket on hold for future use or that I could receive a refund as my flight being cancelled happened on the airline's part, certainly not mine. I received no refund and no credit either. I had to buy a new return ticket because of Caribbean Airline's customer service representative negligence due to inadequate customer service training of the airline's staff.",True,,Family Leisure,Economy Class,New York to Montego Bay,August 2018,1,2,"<span class=""star fill"">1</span>",1,1,,False,1
"""small airline with great qualities""",10,2018-10-08,"Traveled from Miami to Port of Spain on a Boeing 737-800. Check in was smooth and quick. Purchased a Caribbean Plus seat, 9C. As a member of Caribbean Airlines club, check in process is via the business class counter. I proceeded to the LATAM club. This club was very clean and offered light snacks, free wifi, charging ports for electronic devices. After, I proceeded to the gate for boarding. Boarding process was very easy as Club members board after business class passengers. Upon arrival into the aircraft, I was personally greeted by the purser. He checked my boarding pass and directed me to my seat. My seat was very comfortable and very spacious. I highly recommend purchasing a Caribbean Plus seat. The advertised seat pitch is 37 inches and seat recline was great. The meal service was excellent and comprised of chicken breast, noodles and vegetables. The meal was delicious. The flight attendants were very friendly and professional. The flight left five minutes early and arrived into Trinidad 25 minutes early. The landing was the smoothest landing ever. The captain and his first officer were outstanding.This is a small airline with great qualities and I hope it continues.",True,Boeing 737-800,Business,Premium Economy,Miami to Port of Spain,October 2018,5,5,"<span class=""star fill"">4</span>",5,4,,True,
"""staff very unfriendly""",3,2018-08-22,"Newark to Georgetown via Port of Spain. Check in staff in Newark misinformed me about my bags being checked all the way through to Georgetown, I bought duty free in EWR and it was a hassle getting it through Port of Spain. Staff at front desk made me wait until they were ready to walk me through the gates.  On both outgoing and return trips I found the staff, with a couple notable exceptions, very unfriendly. Seemed they thought they were doing me a huge favor. You guys need to either retrain these staff or get rid of them as they are doing damage to your reputation. On return trip I was literally refused to be sold Duty Free because no one at the front desk told me that I had to place the duty free in my checked luggage? When I arrived in Port of Spain it seems that they had a procedure for handling it for in transit passengers. I ended up buying the Duty Free in Port of Spain at a higher price as well!  Flight delays were not even explained properly. With one exception the ground staff showed little empathy with the fact that a 2 hour delay could have messed up my interconnecting flight. The agent that checked me in was rude and very curt. She signaled me to walk up to her desk then had me wait several minutes while she finished the prior task she was working on before even greeting me. Why not just leave me in the line so I could go to another agent who would be ready to do my transaction? I had zero confidence that she would have given me any useful information given her demeanor. I had to ask around ince inside the terminal building until I found someone who was able to explain that the interconnecting flight would also be delayed.",True,,Family Leisure,Economy Class,Newark to Georgetown via Port of Spain,August 2018,3,4,"<span class=""star fill"">1</span>",1,3,,False,1
"""changed our flight 5 times""",1,2018-07-02,"Not Verified | New York JFK to Port of Spain. Horrible, they changed our flight 5 times before we even boarded. The result was a different date and a very inconvenient red eye. No flexibility at all, no refunds at all. Never again",False,,Family Leisure,Economy Class,New York JFK to Port of Spain,July 2018,1,1,"<span class=""star fill"">1</span>",1,1,,False,1
"""Avoid this airline like the plague""",1,2018-06-19,"Not Verified |  Due to fly Trinidad to Tobago with Caribbean Airlines. Terrible airline. Flights are leaving every 30 minutes to the same destination (interisland) and instead of sending the next flight on the next plane, ours has been delayed. 2 hours and counting. 3 flights have left with later departure times than ours. Same situation both directions. Avoid this airline like the plague.",False,,Family Leisure,Economy Class,Trinidad to Tobago,June 2018,1,1,,1,1,,False,
"""A wonderful experience""",10,2018-06-15,"Port of Spain to New York. A wonderful experience from Caribbean Airlines, the flight departed on time and arrived before scheduled on the trip up. The seats were comfortable and the food was good, in my opinion there is no competition to Caribbean's food. The flight attendants were very friendly and attentive.",True,Boeing 737-800,Solo Leisure,Economy Class,Port of Spain to New York,June 2018,5,5,,5,5,,True,
"""worst airline I’ve traveled""",1,2018-05-25,"New York JFK to Port of Spain. The worst service all around except for the one lady who gave me a smile on the way back to NY. Went to Trinidad for 2 days to attend a funeral so tickets were booked at last minute. After calling several times to their customer service line I was given a price that was higher than online. The lady was rude and of no help. Booked tickets online, of course double the usual price but that’s expected, not sure why. The planes were dirty, crew to and from were not friendly, makeup on the ladies was a mess, bathrooms are a mess, seats hard and dirty and extremely uncomfortable. My seat couldn’t recline which resulted in a backpain that lasted a day and half. Not nice especially when you have to go to work as soon as you’re out of the airport. I didn’t bother to eat the food, the carts were dirty too. By far the worst airline I’ve traveled in. Wish I had other options but they were the only one flying at that time.",True,,Solo Leisure,Economy Class,New York JFK to Port of Spain,May 2018,1,1,"<span class=""star fill"">1</span>",1,1,,False,1
"""reward system is not worth it""",1,2018-04-09,"Port of Spain to New York JFK. I am a very frequent flyer with Caribbean Airlines for the past 2 years I have taken approx 10 round trip flights with them which got me to their silver tier rewards status. I was supposed to be entitled to 4 upgrades to first class and free tickets based on my mileage. The most disappointing thing about this program is when you are ready to redeem your mileage they have blackout dates, your first class upgrades means you cannot buy a regular economy ticket, you would need to buy a flex or an ""upgradable"" ticket which is almost the exact cost of a business class ticket. This is not choosing to fly with Caribbean. Their reward system is not worth it.  For frequent flyers the rewards are the deciding factor and Caribbean Airlines is not on par with international competition.",True,,Family Leisure,Economy Class,Port of Spain to New York JFK,April 2018,1,1,,1,1,,False,
