header,rating,review_date,comment,trip_verified,aircraft,type_of_traveller,seat_type,route,date_flown,seat_comfort,cabin_staff_service,food_and_beverages,ground_service,value_for_money,wifi_and_connecticity,recommend,wifi_and_connectivity
"""a pleasant surprise""",6,2018-07-18,"Dubrovnik to Zurich. Flying business with Edelweiss was a pleasant surprise, this low cost branch of Swiss offered excellent service, great food and excellent comfort. The only downside was that there was no access to Airport lounge at departure, which was very dissatisfying as it is one of the main reasons I chose to fly business.",True,A320,Couple Leisure,Business Class,Dubrovnik to Zurich,April 2018,5,5,,2,4,,True,
"""seating most uncomfortable""",1,2018-06-24,"Birmingham to San Jose via Zurich using Helvetic Airways and Edelweiss. We used four flights on this particular trip with Swiss or its share code partners, none of which were on time, an average of 1 hour late. We had never flown via Edelweiss previously and probably will never do so again as the experience was not good. Our first bad experience was an email request to Swiss for assistance about our booking, we never had a reply to our request even 14 days after it was put in the only reason we ever did get an answer was because I obtained the email directly to Swiss CEO. On board the aircraft the service you will receive at best can be described as average in economy class, probably a little better in economy plus or business. No free alcoholic beverages in economy class you will be charged for a beer or glass of wine with the meal you will receive and the average cost is around $10 per drink. Comfort on Board and hidden extra expense in Economy Class. The seating setup is probably the most uncomfortable we have experienced on a long haul carrier, the seats are very tight and small little of no room to move and we are only small bodied people 1.64 and around 70kgs. Although the aircraft are new and clean the comfort level in economy class is extremely bad and we would not recommend it. If your baggage is overweight (above 23kgs) you will be charged an excess baggage fee of approximately $200 per suitcase.",True,,Couple Leisure,Economy Class,Birmingham to San Jose via Zurich,June 2018,1,2,"<span class=""star fill"">4</span>",2,2,,False,3
"""a terrible airline""",1,2018-06-19,"Received an email at 3pm on day of travel to let us know that the Zurich-Cape Town leg of our flight had been moved from 10pm that evening to 8am the following morning. Annoying but compounded by fact that the Amsterdam to Zurich leg of our flight had also been cancelled and it was therefore impossible to get to Zurich in time to catch the delayed flight to Cape Town. Edelweiss offered no explanation, apology or assistance so had to rebook flights for my family and I, cancel and rebook hire car at extra cost and rebook accommodation as would now be arriving after midnight (meaning that we lost a day of our holiday as well). On our return I wrote to Edelweiss to request compensation only to be told that as they are a Swiss airline they do not need to do so and therefore would not - their reply as follows: ""Edelweiss adheres to the legal texts of the prescribed ordinances and we therefore stick to our previous statement. The legal text of Regulation (EC) 261/2004 does not provide for compensation in the case of delayed flights. For final clarification, we refer to the judgment of the district court Bülach, 02.02.2016, which has become legally valid and published: No compensation payments are due for late flights to and from Switzerland."" All-in-all a terrible experience with a terrible airline - customer service = zero. Avoid",True,,Family Leisure,Economy Class,Amsterdam to Cape Town via Zurich,April 2018,1,1,,1,1,,False,
"""They give our seat away""",1,2018-05-31,Zurich to Cape Town. Me and my wife go on Edelweiss Air website to buy  ticket as review was so good. When we book we see we can book our seats and it was still empty and was happy to get all the good seats for flight out and return. The day when we check in we can't and call the airline and they say we only have pay for our Economy Max seats and not for the ticket. How can it not included the flight? We need to fly and then we say ok we will pay for the flight and they say sorry its full. They give our seat away. That is so bad that we need to pay for another flight. So bad customer services and super bad website.,True,,Couple Leisure,Economy Class,Zurich to Cape Town,April 2018,1,,,1,1,,False,
"""break two checked in bags""",1,2018-05-31,❌ Not Verified |  Edinburgh to Zurich.This airline managed to break two of my hard shell Samsonite bags! I have the best luggage Rimowa and Samsonite and this airline managed to break two checked in bags on two different flights! They have not been helpful in repairing the bags. They say I have to repair them and send them the bill but offer no place to do the repairs. They are not responding to emails and are extremely rude to deal with. My husband and I have not been able to get any response or help in repairing or replacing these bags and despite the fact that they are the only airline with direct flights from Zurich to Edinburgh we would never fly them again and would stick to British aAirways.,False,,Business,Economy Class,Edinburgh to Zurich,April 2018,1,1,,1,1,,False,
"""overall a good carrier""",6,2017-12-29,"My wife and I travelled from Cape Town to Barcelona via Zurich in November 2017 with our 8 month old baby on Edelweiss / Swiss Air. My review is in connection with the long-haul flights between Cape Town and Zurich. Edelweiss is overall a good carrier. The aircraft was new, clean and engendered trust in the airline, however there are two points which the airline has to improve upon: Accommodating babies. On the Cape Town to Zurich leg, there was insufficient time to book a seat at the bulkhead with a Bassinet, however the Cape Town ground crew assisted us and upgraded us to 'Economy Max' which provided us with bulkhead seating and a bassinet for our baby to sleep in, which was appreciated and not expected. However upon our return trip, which ironically was when we had the foresight to try to book a bulkhead seat in normal economy, we found that in trying to book a bulkhead seat and a bassinet (both on the website and via email correspondence) ,the airline did not accommodate us. We even paid 58CHF to secure 2 seats, however there were no bulkhead seats available and NO provision for parents with babies who actually need those bulkhead seats due to the bassinet facilities. Upon arrival at both Barcelona and Zurich Airports - on return to Cape Town - the ground crew would not or could not help us. We therefore had to travel 12 hours with a baby on our lap between Zurich and Cape Town and noted that the bulkhead seats were not occupied by people with babies. A most uncomfortable arrangement, with airline crew not assisting in making it any more easy for us or offering more suitable seating with a bassinet. It is totally unacceptable that no provision is made for booking with infants on the website or via email. We did send an email about 3 days prior to our trip, but this was only answered upon retuning to Cape Town. Not acceptable. The boarding system is chaotic. Not only in Cape Town, but Barcelona and Zurich. Everyone rushes at the same time to board the aircraft upon announcement of boarding. Why does the airline not look at what Singapore Airlines or other airlines do in boarding in a systematic and orderly fashion - thereby reducing an anxious and chaotic boarding process. They are a Swiss Airline after all - one would expect it! Ironically, upon getting into the aircraft, the aircrew constantly harass passengers with an announcement basically saying that passengers much step aside and get in their seats as soon as possible to allow other passengers to board. Surely if they instituted an orderly boarding system, this would actually be far more efficient, and this announcement would be unnecessary?",True,A340-300,Family Leisure,Economy Class,Barcelona to Cape Town via Zurich,November 2017,3,3,"<span class=""star fill"">3</span>",3,2,,True,
"""had a problem with our baggage""",3,2017-12-01,"Zurich to Mauritius. We had a problem with our baggage. They arrived three days late. we had to waste some hours of our holidays to shop the minimum we need. Now, it is more than one month that I'm claiming for the money we had to spend. They always have problems when receiving the mail or the attachment documents. I have travel a lot in my life. It is the first time that my luggage have been lost but you can be sure that I'm not going to travel with them again even if I have to pay more for a ticket.",True,,Couple Leisure,Economy Class,Zurich to Mauritius,October 2017,2,1,"<span class=""star fill"">3</span>",1,2,,False,1
"""stewardess lack of empathy""",1,2017-07-03,"✅ Verified Review |  Paris CDG to San Jose via Zurich. Terrible experience, Its been 3 days and they have not responded to my emails about my missing luggage, the people at the airport said they never loaded the luggage on the plane in Paris and that I have to file a report with the airline, but the airline is not responding to any emails. I was surprised about how terrible the service was, even though I reserved seats for the first row because my wife and I traveled with our 19 month old on lap and I asked for a cradle, they assigned me on two middle seats with no aisles. When I asked the stewardess if she would help us she just said the flight was full and looked upset about the baby, I understand other passengers looking upset about a baby on a long flight, they are not supposed to provide any service to you but the stewardess lack of empathy with our situation was bothersome. When I asked if they had baby food like the one they gave us on the flight towards Paris she said that I had to have ordered it prior to the flight.",False,A340-300,Family Leisure,Economy Class,Paris CDG to San Jose via Zurich,June 2017,1,1,"<span class=""star fill"">1</span>",1,3,,False,
"""It was a perfect flight""",10,2017-07-02,"✅ Verified Review |  
I got upgraded to Economy Max on this 11.5 hour flight from Zurich to San Jose, Costa Rica. It was a perfect flight. Highly motivated staff, good legroom, excellent seat with a very big IFE screen. Good selection of movies. The food was very good. I loved the extra warm and crunchy fresh bread they handed out. They only had one type of beer and two types of red wine but they were all good. Beer could have been colder, though. Nice touch with the Mövenpick ice cream mid flight. Toilets very clean and I appreciated the the free mouth wash offered. The vase with red roses was a nice touch too. It was really how economy travel should be, but now a days you have to pay extra for what used to be the norm. I am glad the option exists tough, as the jump to business class is too big in most cases. Well done Edelweiss!",False,A340-300,Solo Leisure,Premium Economy,Zurich to San Jose,June 2017,5,5,"<span class=""star fill"">5</span>",4,4,,True,
Edelweiss Air customer review,6,2017-04-29,"✅ Verified Review |  Cape Town to Zurich. My experience did not start very well, because I could not do the online check-in. So, I when to the airport CPT very early for check-in. Ground service was very disorganized. When ground staff arrived there was some people queueing, but the staff ignored those people and organized the queue has people was not there... confusing between passengers occurred just because the staff did not made a small effort. When I got to the check-in desk, the staff did not make any effort to get me a better seat as asked. After spending a couple of hours waiting, we board on time. When I was getting in the plane, my seat was changed, and it was changed for a window seat, that I do not like. I look to my original seat, and there was not even children involved in the changing. No reason was gave to me. If they mess up with something, they should had changed me to a better seat, not a worst seat. Confort was not good, legs space was small. Food was just ok, and entertainment was very good.",False,,Business,Economy Class,Cape Town to Zurich,March 2017,2,4,"<span class=""star fill"">5</span>",2,4,,False,
"""courteous crew and service""",8,2017-02-01,✅ Verified Review |  Stockholm to Zurich with a courteous crew and in-flight service. Hot snack and drinks were served in this two-hour flight. The flight was rather empty so I had the entire row to my self. Movie was shown on main screen so there was some entertainment if caught unguarded. Inflight magazine was also nice.,False,A320,Solo Leisure,Economy Class,Stockholm to Zurich,January 2017,4,5,"<span class=""star fill"">3</span>",3,4,,True,
"""great travel experience""",9,2016-10-28,"✅ Verified Review | Zurich to Marsa Alam. Great travel experience on this Edelweiss flight to Egypt. Flight was not fully booked so we had a full row for ourselves. We were served a typical Swiss breakfast with bread, butter, jam, yoghurt and a fruit salad. Bread was served warm, directly from the oven and you could take as much as you like. Cabin crew was very friendly and helpful. Only thing to complain is the inflight entertainment system, which for a 4 hour flight is a bit basic. But I heard that by now even this has been updated.",False,A320,Family Leisure,Economy Class,ZRH to RMF,December 2015,4,5,"<span class=""star fill"">2</span>",5,5,,True,
"""staff were also great""",8,2016-10-26,"Edelweiss Air were great flying from Edinburgh to Zurich. Firstly, the price was considerably cheaper than flying with a low-cost carrier to an airport further away from my final destination (I was visiting a friend in Konstanz - these flights were cheaper than EasyJet to either Basel or Stuttgart). I was given a free meal, albeit cold (with freshly baked hot bread), for a 2h flight. The staff were also great with me when I asked them how to get to the Airport train station (in a different building to where you land) to continue my journey to Konstanz. The return was equally satisfying.",False,,Solo Leisure,Economy Class,EDI to ZRH,August 2016,4,4,,4,5,,True,1
"""Trouble free journey""",10,2016-09-08,"✅ Verified Review |  Vancouver to Zurich. I was a little sceptical about travelling on a Leisure airline long-haul even in Business class (part of a round-world fare). Edelweiss Air proved me wrong. Great cabin crew, a great aircraft with full flat beds. Great food. Trouble free journey.",False,A330,Couple Leisure,Business Class,YVR to ZRH,September 2016,4,5,"<span class=""star fill"">5</span>",4,4,,False,
"""ridicously tight seating""",2,2016-06-28,"✅ Verified Review |  Las Vegas to Zurich with Edelweiss Air. Ridicously tight seating in Economy class made this one of my least relaxing long-haul flights ever. Being a relatively standard size (190 cm) I was surprised to find that I simply couldn't sit normally without my knees touching (or rather pressing hard into) the seat in front of me. When the passenger in the row in front of me reclined his seat, I felt like a sardine - with badly hurting knees. Sleeping was completely impossible, and hadn't it been for the nice and friendly crew and the above average IFE that helped kill the 10 hours I was wide awake, it would have been my worst flight ever. Avoid this airline in Economy class at all costs if you're taller than 165-170 cm.",False,A330,Solo Leisure,Economy Class,LAS to ZRH,June 2016,1,4,"<span class=""star fill"">4</span>",3,1,,False,
"""service was very poor""",2,2016-04-18,"✅ Verified Review |  Phuket to Zurich with Edelweiss Air. The service during the flight was very poor and the attitude of the cabin crew with passengers was really rude.  In addition, after paying more than 600EUR for a flight ticket, they ask you to pay extra money if you want an alcoholic drink, otherwise you just can drink coke, ale or orange juice.",False,,Couple Leisure,Economy Class,HKT to ZRH,March 2016,2,1,"<span class=""star fill"">4</span>",2,1,,False,1
"""cannot rely on Edelweiss""",3,2016-01-20,"No recommendation for Edelweiss. They cancelled our flight from Zurich to Marsa Alam (planned for 25th February 2016) without notifying us to the earliest possible moment. It is only 4 weeks before our holidays and we had to call the hotline, to find out, that they wont fly! This is the second time this is happening. In 2013 we had the same issue with Edelweiss - flight cancelled 15 days before departure, which is unacceptable for a ""holiday flight"". The only option they offered to us now was to fly from Zurich via Geneva to Cairo, which is 700km away from our target destination, Marsa Alam. Service and comfort is okay, but that does not weigh up the cancelled flights. You simply cannot rely on Edelweiss Air.",False,,Couple Leisure,Business Class,ZRH to RMF,February 2015,3,4,,2,1,,False,
"""recommend this airline""",10,2016-01-09,"Edelweiss Air is one of the best.  We flew Zürich to Cape Town on a cabin that had just been refurbished, premium economy has great leg room, food service is amazing and the PTV offers a large choice of programes. Staff very friendly and proactive. I would recommend this airline.",False,A330,Couple Leisure,Premium Economy,ZRH to CPT,February 2015,5,5,"<span class=""star fill"">5</span>",4,5,,True,
"""satisfied with high standards""",10,2016-01-07,"Dusseldorf to Larnaca via Zurich, and it was the first time I flew with Edelweiss Air. I was satisfied with the high standards and service provided. The flight lasted 3 hours and the crew served the passengers the snack, meal, dessert. Metal cutlery was provided to all passengers instead of plastic.",False,,Solo Leisure,Economy Class,DUS to LCA via ZRH,January 2016,5,5,,5,5,,True,
"""terrible customer service""",1,2015-10-20,"A couple of days before leaving for Florida, got an email from Edelweiss offering an upgrade to Business for cash. Less than an hour later I called and booked the upgrade for my wife and I. A short while later got another email from them, telling me there were no upgrades available! Terrible customer service.",False,A330,Couple Leisure,Economy Class,Zurich to Tampa,October 2015,1,2,,1,1,,False,
"""ridiculously tight seating""",2,2015-09-28,"A supremely competent cabin crew can't make up for ridiculously tight seating. We paid quite a bit extra to fly Edelweiss Air from Las Vegas to Zurich on a friend's recommendation, and were shocked at how little space we had. If the person in front of you reclines, you are forced to recline just to see the screen in front of you. I can't stress how uncomfortable the seating was. Worse, they place ads on their video system trying to sell ""Economy Max"" seating for 200 Swiss francs a seat. They tout these are ""anti-thromboses"" seats. So the seat I paid $1500 for is a ""pro-thromboses"" seat? Great crews, incredibly uncomfortable seating. Never again.",False,A330,Couple Leisure,Economy Class,LAS to ZRH,September 2015,1,4,"<span class=""star fill"">3</span>",2,1,,False,
"""Most uncomfortable flights""",5,2015-09-20,"Most uncomfortable flights with Edelweiss Air between Tampa and Zurich in economy class. The distance between seats (the pitch) appears to have been reduced a bit. What makes it worse however is that the seat back recline is disproportionately huge. When the passenger seating in front of you fully reclines his seat, that seat back comes to about three inches from your nose. And you are supposed to enjoy in this position the otherwise very good choice of movies and other entertainment available on your individual screen. If you have any food or drink on your tablet when that passenger decides to slam his seat back to full recline, it will be squished, possibly spilling wine etc on your lap. Your only recourse is to hold that drink in your hand and, in turn, recline your own seat back encroaching on the passenger behind you. And if you can’t eat in that reclined position, too bad. The crew don’t make the usual announcement that all the other airlines make when they serve food, asking people to kindly bring their seat back in the upright position to accommodate their fellow travellers.Most important thing for me is seat comfort, particularly leg room. Would not use them again when traveling to Zurich or beyond.",False,A330,Couple Leisure,Economy Class,TPA to ZHR,September 2015,2,4,"<span class=""star fill"">4</span>",4,4,,False,
"""excellent Edelweiss Air flight""",10,2015-09-13,"We had an excellent Edelweiss Air flight from Zurich to Larnaca. Captain gave information about the flight in a very friendly manner. The crew was helpful and smiley. Food was not so tasty but it is quite normal for airline food. I had flew Edelweiss Air from Larnaca to Zurich as well and the flight was also great.  P.S I am one of those who are scared of planes, although I have to fly quite a lot, but Edelweiss Air has gained my confidence.",False,,Business,Economy Class,Zurich to Larnaca,September 2015,4,5,"<span class=""star fill"">4</span>",5,5,,True,
Edelweiss Air customer review,10,2015-08-22,"We flew to Havana from Barcelona via Zurich and back (2 adults, 2 kids). BCN-Zurich-BCN leg with Swiss was good. Zurich-HAV-Zurich with Edelweiss was a very nice experience. Cabin crew very professional and attentive. In the return flight we were upgraded to Economy Premium. IFE had little films in Spanish - apart from that flying Edelweiss is recommended.",False,A330-300,Family Leisure,Economy Class,Barcelona to Havana via ZRH,August 2015,5,5,"<span class=""star fill"">3</span>",5,5,,True,
Edelweiss Air customer review,10,2015-07-22,"YVR-ZRH return. on the way there sat in Premium Economy. I'm 6'2"", 250 lbs and had more than enough leg room,. width could have been a bit more but all in all a good experience. Cabin crew was courteous, food was good. Return leg sat in Economy (row 15A), I recommend not sitting that row as it's the first row of economy and has premium economy seats reclining into you. Best to book row 16 or back. TV technology best I've seen, but movies/tv shows a bit out of date. Games are easy to play and don't bother person in front of you. Zurich airport is decent size but not as busy as Frankfurt or London. I recommend Edeleweiss.",False,,Solo Leisure,Premium Economy,Vancouver to Zurich,June 2015,4,5,"<span class=""star fill"">4</span>",5,5,,True,
Edelweiss Air customer review,9,2015-07-02,"Very good flight, comfortable seat with enough space, good service and meals.",False,A320,Business,Economy Class,ZRH to TFS,July 2015,4,4,"<span class=""star fill"">3</span>",5,4,,True,
Edelweiss Air customer review,1,2015-06-28,"Reservations is difficult to reach if calling from USA primarily because of their operating hours and time difference. I called multiple times and waited at one point for 40min for an agent. Finally an agent answered the line only to advise me the office was now closed and to please call tomorrow. The reason for my repeated call was seat assignments. I don't mind and expected to pay for advanced seat selection how ever neither the website nor the call center was helpful. The website finally received the required update and we confirm our seat selection. The flight crew was friendly, competent and helpful. Food was typical. Seat room and pitch terrible. When we arrived our bags didn't. Absolutely terrible customer service. We are unable to reach anyone and have yet to hear from Edelweiss. I am not impressed with some of Edelweiss customer service.",False,,Family Leisure,Economy Class,Vancouver to Zurich,June 2015,1,5,"<span class=""star fill"">5</span>",1,2,,False,
Edelweiss Air customer review,10,2015-06-18,"Flew from Tampa to Zurich. Found the flight attendants to be very professional and attentive. Many good entertainment options, which made the 10 hour flight go by quickly. Plain interior was very clean and looked updated. The cabin temp was oddly warm for the Tampa-Zurich flight until about the last hour, which made sleeping a bit difficult. Flight back, though, was much more comfortable. To get a seat assignment, we had to pay $40 each way per person, which I thought was a bit steep, but glad we did so we were guarranteed to sit together as the flights were rather full. Would definitely use them again when traveling to Zurich or beyond.",False,A330,Family Leisure,Economy Class,Tampa to Zurich via Tampa,June 2015,3,5,"<span class=""star fill"">5</span>",5,4,,True,
Edelweiss Air customer review,10,2015-05-27,I flew in Economy Class from Zurich to Malé on 16th of May and back on 24th of May 2015. I have to say I am very impressed by the service provided. Cabin staff were very dedicated (it was the same staff on both flights as they were also staying in the Maldives for a week). The night flight on the outward leg was only half full which made a quick Service possible and I could sleep in an empty middle row. Very good meals (real cutlery and a real glass) frequent drinks and the alcoholic beverages (for which you have to pay) are of good quality and moderate in price. I also liked the Mövenpick icecream provided in mid-flight on the return flight (a day flight). The inflight entertainment is a very good product with an up-to-date movie selection. But the major bonus has been the consistent friendliness of the entire crew. I felt a strong sense for hospitality among the staff and would definitely fly with them again if the schedule suits me.,False,,,Economy Class,,,4,5,"<span class=""star fill"">5</span>",,5,,True,
