header,rating,review_date,comment,trip_verified,aircraft,type_of_traveller,seat_type,route,date_flown,seat_comfort,cabin_staff_service,food_and_beverages,ground_service,value_for_money,wifi_and_connecticity,recommend,wifi_and_connectivity
"""food is absolutely awful and totally sub-standard for business class""",2,2022-10-25,"Apart from the lie flat bed this is basically Premium Economy. The food is absolutely awful and totally sub-standard for business class. This is one of the main reasons I say it is more premium economy. The tray is not at all business class, small and cramped. The plates not at all up to standard. My main was a sausage! Can you believe this? The accompaniment of hash browns were soggy because chef in his wisdom had them up against cabbage...which of course is wet. So a main of a sausage, wet hash browns and cabbage. I didn't eat this mess. Disgraceful. My wife's salmon was swimming in oil and inedible. The dessert might have been acceptable but it was tiny...hardly a full spoonful. The drinks selection is basic. A two type wine selection for Red and white....no quality spirits...no dessert wine. No cheese board for after. The IFE is dated with a very small selection. The only thing that was good were the cabin crew. Excellent and I could see they were embarrassed regarding the food. No. This was beyond disappointing. We were totally surprised at their ""business"" class. We would not fly this airline again.",True,A340-300,Couple Leisure,Business Class,Zurich to Mauritius,September 2022,4,5,"<span class=""star fill"">1</span>",4,1,,False,
"""experiences were very pleasant""",9,2022-10-25,"This was my second long-haul flight with Edelweiss. Both experiences were very pleasant. I paid $85 extra for the exit row window seat, and this would normally be a wise investment. In fact, the load factor on this flight was so low that whole rows of 4 seats were open and available for sleeping. The two meals were tasty and adequate. The flight attendants were cheerful and efficient. I enjoyed the inflight entertainment which had clear screens and a wide selection for viewing and/or listening. To be honest, if the flight had been crowded, the tight seat pitch would have made the trip considerably less comfortable. I look forward to my next flight with Edelweiss.",True,A340,Solo Leisure,Economy Class,Zurich to Tampa,October 2022,3,5,"<span class=""star fill"">5</span>",4,5,,True,
"""Customer service is non-existing""",1,2022-10-24,"How do you evaluate a medium-haul flight in economy? Overall they are pretty much all the same, until something goes wrong, and that's when you can really have a feeling of the level of the airline. Long queue for check-in in La Palma, could be improved but not too bad. 45 minutes delay at departure due to strong head-wind from coming flight (nice way of saying we wanted to save some fuel), but the captain was confident that with tail-wind we will arrive on time. Too bad he missed his first attempt of landing, and didn't have time to land before airport closure at 11pm. We landed 40 minutes later, 250km away from what was supposed to be our final destination. FA didn't say much and kept saying that we will know more once on ground. That was a LIE!! 0 out of 10 in terms of taking responsibilities. At baggage claim there is no personnel from the airline, just a poor staff from the airport trying to do whatever she can. And the message was clear : you're on your own. It's 1am, you're 250km away from where you were supposed to land, and there won't be any help from the airline to get you to your final destination. Meanwhile, we finally get an email from the airline : ""We ask you to make your own arrangements for a hotel and transportation to your final destination."" Followed by a couple of restrictions on budget. What a joke!! Customer service is non-existing, this airline is a shame for Star Alliance. It's going to be a while before you see me again on a Swiss flight.",True,A320,Solo Leisure,Economy Class,La Palma to Zurich,October 2022,3,1,"<span class=""star fill"">3</span>",1,1,,False,
"""Very disappointing lack of service care""",5,2022-10-10,Not Verified |  Were not flown to our booked destination and I incurred out of pocket expenses in order to arrive at my booked destination. Customer after care when I wrote to the airline requesting reimbursement has been non existent. Not even a courtesy of we will review it. Very disappointing lack of service care.,False,,Couple Leisure,Economy Class,Zurich to Santa Cruz de la Palma,September 2022,4,4,,3,2,,False,
"""A surprisingly great flight""",10,2022-06-25,"A surprisingly great flight thanks to the cheerful and friendly crew, free food and beverages and comfortable seats. They're slimline seats but with thick padding and have ample legroom. There's an in-flight entertainment system via wifi which works well. The captain kept us well informed during the flight and we arrived in time at Dubrovnik.",True,A320,Couple Leisure,Economy Class,Zurich to Dubrovnik,June 2022,5,5,"<span class=""star fill"">5</span>",4,5,,True,5
"""most pleasant long haul economy flight""",8,2022-05-07,"This was one of the most pleasant long haul economy flights I have ever taken. I was in the window seat of the emergency exit (seat 29A). The seat is somewhat narrow, but it has unlimited leg room. The onboard service was cheerful and efficient. We were served two good meals, and the for-purchase beverages were reasonably priced. I was impressed with how hard the crew worked. I saw attendants regularly cleaning the rest rooms, and they responded instantly if someone rang the call button. The entertainment screens were bright and easy to operate, and there was a fine selection of movies, games, and TV shows. We were delayed an hour and a half out of Zurich, but there were regular updates. The negative aspect of this experience is customer service. They invite passengers to bid on upgrades to premium economy or business class, but the web site will only accept bids if your ticket was booked directly on the Edelweiss website. They have a customer service telephone number that only allows local calls. Any attempt to reach them from abroad for simple assistance in selecting seats in economy is met with an instantly dropped call.",True,A340,Solo Leisure,Economy Class,Zurich to Tampa,May 2022,4,5,"<span class=""star fill"">5</span>",1,5,,True,
"""FA were extremely courteous""",8,2022-04-06,Zurich to Las Palmas. Edelweiss is still performing a very good service in business class. The meal in business is somewhat reduced as before covid - no more cheese. Ample choice of drinks including Champagne and some Swiss wines. FA were extremely courteous. The flights to Canary islands were never pleasant - longer flights usually in smaller planes (so no wide-body planes ) however Edelweiss is one of the best choices to reach those destinations.,True,A320,Business,Business Class,Zurich to Las Palmas,March 2022,4,5,,5,4,,True,
"""understanding and kindness to older people apparently is not part of their policy""",2,2022-03-30,"My parents, both 90 years old, with a business class reservation were removed from their seats before departure because my mother apparently was not wearing her mask correctly. She was reminded a few times, she is hard of hearing at 90!, and then they were both removed from the plane. I understand airline policies about mask mandates, but minimal understanding and kindness to older people apparently is not part of Swiss/Edelweiss policy. I myself have had already my share of bad experience with Swiss, after a flight was cancelled (during covid, I have no problem with that) but Swiss rebooked me for the day before my scheduled departure and no email nor telephone notification. In addition, when I bought a new flight and purchased a seat, with printed confirmation from Swiss, at check-in they announced I was not on the flight list and they argued with me for 2 hours at check-in before they finally let me run to the gate. Oh yes, they did acknowledge that they see my seat reservation, but I was not listed as a passenger. I personally will never book with Swiss again.",True,,Family Leisure,Business Class,Tenerife Sud to Zurich,March 2022,3,1,,3,3,,False,
"""Comfortable and pleasant journey""",8,2021-10-25,"Not Verified |  We left Zurich 10 minutes late, which is acceptable but can always be improved. Comfortable and pleasant journey. Even the return, apart from some problems by plane, aieport, many people without arrogant business class passed in front and the flight staff made them pass without problems. Even if my bags were with the priority mark, they arrived last, there may have been a problem with the load. Good company and kindness of the hostesses. Siamo partiti da Zurigo con 10 min di ritardo, il che è accettabile ma si può sempre migliorare. Viaggio comodo e gradevole. Anche il ritorno a parte qualche problema in aereo porto , tante persone senza business class molto arroganti passavano davanti e il personale do volo li ha fatti passare senza problemi. Anche se le mie valige erano con il contrassegno priority sono arrivate per ultime c’è forse stato un problema al carico. Buona compagnia e gentilezza delle hostess.",False,A320,Couple Leisure,Business Class,Zurich to Catania,September 2021,4,4,,4,3,,True,
Edelweiss Air customer review,1,2021-08-08,"A real vacation plane: old seating, crew in quality and training not to be compared with a regular 4 Star Airline. Boarding: pure chaos. Despite Covid-19, the business passengers were boarded first and the economy passengers were then crowded in the aisle. Seat: uncomfortable, old. Little inclination. Food: good, at least on one flight. Plane: despite departure point Zurich, the plane was dirty! On the return flight, the table was still dirty (Covid? Hygiene?). Business class & plane: A320 with economy seats. Seat pitch miserable. Seat comfort miserable. Entertainment: Old movies - only viewable on devices you brought yourself. An A320 for 5.5 hours with economy seating in business class - an insult! Conclusion: cheap product at a high price. Never again Edelweiss!",True,A320,Couple Leisure,Business Class,Zurich to Hurghada,March 2021,1,2,"<span class=""star fill"">1</span>",3,1,,False,1
"""happily fly them again""",10,2021-07-23,"Surprisingly pleasant flight, while most airlines have gone no frills, Edelweiss still offers a sandwich and soft drinks, and a cookie and juice prior to landing. Friendly staff, nice flight, would happily fly them again.",True,A320,Solo Leisure,Economy Class,Antalya to Zurich,July 2021,5,5,,5,5,,True,
"""Business class is total fraud""",1,2021-04-12,"Business class is total fraud! Twice the price. Total waste of money! 1) No priority check in in Lanzarote. Despite 3 million tourists a year coming through the airport in Lanzarote, they don't have online check in. But 50m queues, 2 hours before check in like it was some developing country in 1984. When check in opens, they briefly check in business class, then allow economy passengers to move to the business queue, which is then always blocked. No staff checks if you have business ticket or not. So unless you are 2 hours before check-in, there is no priority check in. This time there was an Edelweiss person, but he didn't do much good, compared to the other times where it was just 'I don't give a damn' Swissport personal. Waste of money. 2) There is no priority security. 3) There is no priority boarding. A lady shouted faintly ""business' once, waited for 20 seconds, then started boarding all other passengers. Didn't matter since we all ended up in the same overheated bus anyway! So actually, if you go early during this 20 seconds window of priority boarding, you end up waiting longer than economy. 4) The food is just some microwaved slime. 5) The seats are exactly the same as economy class on this flight. Yes there was a seat free in between, but how is that more comfortable if the seat itself is small and short leg room. 6) The carpet was dirty, the seats old and ripped. Never again will I book business class with Edelweiss. A total rip off.",True,,Solo Leisure,Business Class,Lanzarote to Zurich,April 2021,1,2,"<span class=""star fill"">1</span>",1,1,,False,1
"""Old and uncomfortable seats""",1,2020-04-05,"Buenos Aires to Zurich connecting to Amsterdam with Swiss. The Business Class is below average. Old and uncomfortable seats. I am 1,90m tall and my feet didn't find into the foot-space when the seat is turned into bed. They serve the cheapest champagne and the BOSE headphones have been removed.",True,,Business,Business Class,Buenos Aires to Amsterdam via Zurich,November 2019,1,1,,1,1,,False,
"""baby bassinet was not allowed""",1,2020-02-03,"Ho Chi Minh City to Amsterdam via Zurich. Travelling with 8,5 month baby. Tried to get baby bassinet but was not allowed, only for 8 months old, Apparently 8 months and a few days is not good enough. (weight and length were within requirements). Not willing to support us in seat arrangement and giving us incorrect information so we were not able to arrange ourselves both inbound and outbound.",True,,Family Leisure,Economy Class,Ho Chi Minh City to Amsterdam via Zurich,January 2020,1,3,"<span class=""star fill"">3</span>",1,1,,False,
""" was actually not bad""",5,2019-10-26,Not Verified |  Zurich to Newark. Staff was very friendly and the food was not bad. The drinks were frequent and alcohol included which was great. There were customers who smelled as though they had not showered in days. They were up and moving all flight. Several passengers yelled at them as the airline attendants did not address their lack of concern for other passengers. Had it not been for these people the flight would not have been bad.  For a 9 hour flight the airline was actually not bad all things considered.,False,A330-300,Couple Leisure,Economy Class,Zurich to Newark,October 2019,3,4,"<span class=""star fill"">3</span>",3,3,,True,1
"""our return flight had been cancelled""",2,2019-10-26,"Not Verified |  Zurich to San Diego. Upon printing our boarding passes for a trip to Europe we discovered that our return flight on Edelweiss Air had been cancelled. We called the airline and asked about the cancellation. The customer service person told us that there were no seats to San Diego within 3 days in either direction on the calendar on Edelweiss Air. They found us a flight on Lufthansa out of Frankfurt one day later which required us to fly from Zurich to connect to Frankfurt then on to San Diego. The customer service person assured us that the airline would compensate us for our hotel accommodation for the extra day and told us to contact customer service via email. We did and then our hotel bill was declined because, they said that there was 3 week notice to us before our flight (our trip was 3 weeks, how convenient). I was very disappointed in the mixed message I received from Edelweiss representatives. They knew our flight was cancelled well before our trip's departure and failed to contact us. We feel they dropped the ball and then made us pay for their decision to cancel our flight.",False,,Couple Leisure,Economy Class,Zurich to San Diego,September 2019,3,4,"<span class=""star fill"">4</span>",1,1,,False,
"""was given a meat dish when I had ordered vegetarian""",1,2019-08-21,"Not Verified |  Was not happy with this flight, leaving from Birmingham to Vancouver we booked a vegetarian meal, but was given a meat dish and when asked for a vegetarian they said we needed to book it, which I did on my online check in. The same happened on my return, I was given a meat dish when I had ordered vegetarian. Check-in at Vancouver nearly took 50 min with 15 people in front, they had no ground staff. I will not be flying with Edelweiss Air again, very disappointed with this.",False,,Couple Leisure,Economy Class,Vancouver to Birmingham via Zurich,August 2019,1,1,"<span class=""star fill"">1</span>",1,1,,False,1
"""Overall a great service""",9,2019-08-06,"Zurich to Tenerife. Very pleasant experience with Edelweiss. Check in at Zurich is done by Swiss. It was efficient and staff was helpful. Boarding started 10minutes later than planned but once boarding was completed we were ready to go on time. I was travelling with two young children and the cabin crew were very attentive with us throughout the flight. They offered a kids pack with crayons and a a booklet with activities. The children breakfast was offered first and then to the rest of the passengers. Breakfast was very nice, with two types of cheese, and two types of ham, yogurt, fresh warm bread loafs were offered twice with a choice of white and brown bread. It felt like a business class service. During the 4 hour flight drinks were offered a number of times. The seating comfort was good (we were sitting in row 7). Seats had a decent recline whilst also leaving sufficient knee space. The seatbacks had a special small tray were passengers can install and attach their tablets. Flight crew communicated before departure to advise of a slight delay due to traffic at the airport and throughout the flight offering details of the routing and arrival times. Arrival at Tenerife was on time and the baggage was delivered with less than 10 minutes wait. Overall a great service and good value for money.",True,A320,Family Leisure,Economy Class,Zurich to Tenerife,August 2019,5,5,"<span class=""star fill"">3</span>",5,5,,True,1
"""I would highly recommend""",10,2019-07-26,"San Diego to Zurich. Excellent from start to finish. Punctual, professional and passionate. Everything from seat comfort, and service, to in-flight entertainment and meals was well above expectations. I left very impressed to say the least. I would highly recommend this airline.",True,A340-300,Couple Leisure,Economy Class,San Diego to Zurich,July 2019,5,5,"<span class=""star fill"">5</span>",5,5,,True,
"""service was so good""",10,2019-07-01,"Zurich to Calgary. Was awesome service. The staff was awesome, service was so good as well as Foods and drinks. Clean “Washroom and a smiling face",True,,Business,Economy Class,Zurich to Calgary,June 2019,5,5,,5,5,,True,
"""all was excellent""",9,2019-05-02,"I booked a flight form Cape Town to Zurich using Edelweiss Air being aware the airline is the Swiss holiday operator, so I was expecting a mediocre service as you can expect for the price paid and class of market served. Totally to the contrary all was excellent, the plane not only very clean but looking new, the crew friendly and efficient, the entertainment system good with new movies and the food very good with real cutlery and a glass wine glass that enhances taste. The only minus point was the price charged for the alcoholic beverages, but on the other hand, the airline has to make money somewhere and it avoids passengers imbibing in excess. On my future travels I will definitely consider this airline again.",True,A340-300,Solo Leisure,Economy Class,Cape Town to Zurich,April 2019,4,5,"<span class=""star fill"">5</span>",5,5,,True,
"""the selection of films was good""",9,2019-04-14,"Zurich to Ho Chi Minh. We paid 149 CHF to Upgrade to economy max each way. Thoroughly worth it, had 4 seats each on the way out, and 2 seats each on the return. Even without this bonus it would've been worth the money as the extra legroom and recline was nice. I found the food to be acceptable both ways, especially the fresh bread. I disagree with a previous contributor as I thought the selection of films was good, much better than recent trips on Virgin Atlantic and Thai - recommended.",True,A340,Couple Leisure,Premium Economy,Zurich to Ho Chi Minh,April 2019,4,4,"<span class=""star fill"">5</span>",4,5,,True,
"""worst experience ever""",1,2019-04-13,"Not Verified |  Zürich to Seville. My worst experience ever. The flight was scheduled to depart Zurich at 16.30h, and I was happy to see there was no departure delay. So we left in time, but after about an hour in the air, the plane returned to Zurich due to technical problems. After landing in Zurich again, we were waiting for some 3 hours in the airplane. they were looking for some spare parts to repair the airplan, until they finally figured out that there was a spare part, but they did not get clearance to build it in. So we were shipped back to the gate. no information there, just a never ending queue of people. We left and went home, just to get a message finally that we were scheduled for another flight - 48 hours later. Instead of leaving Friday for the weekend, they scheduled us to leave Sunday evening.",False,,Couple Leisure,Economy Class,Zürich to Seville,April 2019,4,2,,1,1,,False,
"""I would avoid Edelweiss""",2,2019-04-10,"Ho Chi Minh City to Zurich. We booked this flight with Swiss but we actually flew with Edelweiss. Unfortunately, this airline is not a good one for long haul flights. The legroom was horribly inadequate and the whole flight was uncomfortable. We asked to be in seats with more legroom and offered to pay for this, but they said these sits are reserved for families with kids. In the airplane I saw plenty of people half my size sitting at those sits with extra room, so clearly they did not tell us the truth. Also, the food served was very poor, especially the breakfast. They also wanted to charge 8 swiss francs for a serving of wine. The ticket price was normal, so I would expect to at least get some drinks included. For anyone who flew with an Asian airline for a long distance trip, Edelweiss is simply bad. I would avoid Edelweiss for any long haul flights and would only use for short distance flights.",True,A340-300,Couple Leisure,Economy Class,Ho Chi Minh City to Zurich,April 2019,1,3,"<span class=""star fill"">4</span>",2,2,,False,1
"""airline was absolutely excellent""",9,2019-02-08,"I had originally booked this flight from Zurich to Ho Chi Minh City with Swiss Air. Then I found out it was operated with Edelweiss Air. I’m so glad they did. The airline was absolutely excellent. The service on there was first class even in economy you were treated and cared for like you were the only passengers on the flight. I can’t praise the cabin crew enough for how friendly they were, how generally interested in us and couldn’t do enough for us. Food without a doubt the best I’ve ever had on an airline. A cheese and meat platter for breakfast was a total wow factor. All meals very tasty. Legroom perfect. Only downside the movies weren’t great. But by no means does that dampen my incredible experience on this airline.",True,A340-300,Couple Leisure,Economy Class,Zurich to Ho Chi Minh City ,January 2019,5,5,"<span class=""star fill"">3</span>",5,5,,True,5
"""Service was superb!""",8,2019-01-30,"Zurich to Ho Chi Minh City. Seated row 6 which has a lot of legroom. Plane interior was refurbished: new seats, touch screen, OkK/ good selection of movies. Service was superb! Food quality is good.",True,A340-300,Couple Leisure,Economy Class,Amsterdam to Ho Chi Minh City via Zurich,January 2019,5,5,"<span class=""star fill"">4</span>",3,5,,True,
"""Outstanding customer service""",8,2019-01-10,"Zürich to Buenos Aires. A nice surprise. Very clean aircraft, great food (I had vegetarian), the bread is probably the best I had in a commercial flight, limited entertainment system but does the Job. Outstanding customer service in all points. Negative issues: seats are hard as rock, leg space is minimal. Once seats are reclined the distance between my nose and the TV were 12 cm. I am sure in business it was not that bad.",True,A340,Solo Leisure,Economy Class,Zürich to Buenos Aires,January 2019,1,5,"<span class=""star fill"">4</span>",5,5,,True,
"""the food not so great""",7,2018-12-30,"Not Verified |  We had a return flight to Ho Chi Minh from Birmingham via Zurich with Edelweiss, never used them before so did not know what to expect. Could not choose your seat unless you had paid in advance or until 24 hours when you could check in online. Easy flight from Birmingham to Zurich with a very short changeover that we were concerned but there was no need at all. You were asked if you had the correct visa for Vietnam before boarding and checked. The plane itself was clean, reasonably spacious (as can be for economy!)and the crew very friendly and helpful. We found the food to be not so good though but the fresh bread that went round was a much better idea. Much the same on the return trip but the one thing we had a problem with was we could not check in on line, I did email Edelweiss and to their due they did mail me back within a couple of hours and report a fault. Again most ok but the food not so great but did enjoy their continental style breakfast!",False,A340,Couple Leisure,Economy Class,Birmingham to Ho Chi Minh via Zürich,December 2018,3,5,"<span class=""star fill"">3</span>",4,4,,True,
"""not allowed access to Lounge""",9,2018-09-05,"Not Verified |  Larnaca to Zurich. Flight was satisfactory but my biggest gripe is that I was not allowed access to the Business Lounge at Larnaca Airport, surely this should be automatic when paying for Business.",False,A320,Solo Leisure,Business Class,Larnaca to Zurich,August 2018,3,3,,3,3,,True,
"""shame for a Swiss carrier""",5,2018-08-22,"Zurich to Mykonos. Total shame for a Swiss carrier. Less space than on easyjet and Ryanair but incredibly expensive for nothing. Food was ok, and the crew was not authentic.",True,A320,Couple Leisure,Economy Class,Zurich to Mykonos,July 2018,1,3,"<span class=""star fill"">1</span>",4,1,,False,1
