header,rating,review_date,comment,trip_verified,aircraft,type_of_traveller,seat_type,route,date_flown,seat_comfort,cabin_staff_service,food_and_beverages,ground_service,value_for_money,wifi_and_connecticity,recommend,wifi_and_connectivity
"""very competent flight crew""",10,2022-11-12,"From one of the friendliest check-in staff and very competent flight crew, perfect flight. On time departure, good legroom on board, loved my flight with FlySafair!",True,,Solo Leisure,Economy Class,Johannesburg to Cape Town,November 2022,4,5,,5,4,,True,
"""Shame on you Safair for poor service""",3,2022-11-07,"My mother in law who is 88 years old was booked to go to Durban as an assisted passenger. At Or Tambo airport a Safair staff member escorted her to the boarding area of the plane. When she got to Durban, she and an elderly couple who were also as assisted passengers, waited on board to be helped out the plane. This service was not forthcoming by the cabin crew. They decided to then disembark by themselves, because they were not attended to. When my mother in law went to collect her luggage which was supposed to be on carousel 4, it was nowhere to be found, she was given the run around on the collection area. Eventually it was found on carousel 1, imagine a frail 88 year old person trying to take her luggage of the carousel by herself, she could have fallen and injured herself. She was traumatized and disrespected in this process. This could have been prevented if Safair cabin crew had done their job's and escorted her and the other elderly couple of the plane. Shame on you Safair for poor service and disrespecting elderly people, where's your sense of Ubunyi?",True,,Family Leisure,Economy Class,Johannesburg to Durban,November 2022,3,1,,2,2,,False,
"""Overall cannot complain""",7,2022-11-04,Not Verified |  Check in easy and quick baggage check smooth. Plane left on time. Landed a head of schedule. Slight tired interior. Staff on board friendly. Overall cannot complain.,False,Boeing 737,Family Leisure,Economy Class,Johannesburg to Port Elizabeth,October 2022,3,4,,4,3,,True,
"""more than 50 minutes for our luggage""",1,2022-10-30,"Landed at 16:20 Disembarked at 16:25. This is the info given to our transport. Then waited until 17:20 - that is more than 50 minutes for our luggage! We phoned the airport manager. He informed us that Safair chose not to use the airport’s luggage transport, but their own, which is LPO Agents. There was an official sitting where the luggage was supposed to come out. She did not even look up (from her afternoon nap!). Would have been nice if she could have just informed everybody why no luggage was coming? Shockingly bad service!",True,,Couple Leisure,Economy Class,Lanseria to Cape Toen,October 2022,1,4,,1,1,,False,
"""staff on plane excellent""",10,2022-10-18,"Once again, flight on time / early. Contact centre easy to get hold of and organized a change efficiently. Check in online no hassle, staff on plane excellent, comps to Robin on this mornings flight, she was a great example of working with a smile. The only negative is obviously the increase in flight costs but that's everywhere.",True,,Solo Leisure,Economy Class,Lanseria to Durban,October 2022,4,5,,5,3,,True,
"""stop stealing our time, money and energy""",1,2022-10-07,"Not Verified | Durban to Johannesburg. FA 477 and 478 always have faults and flights are delayed. My wife and I commute between Durban and Johannesburg. This is the second time now that one of her flights will be 3hrs delayed. This is entirely unacceptable and inexcusable. We spend so much money for this ridiculous service with poorly trained staff. Wake up and stop stealing our time, money and energy.",False,,Solo Leisure,Economy Class,Durban to Johannesburg,October 2022,3,2,"<span class=""star fill"">1</span>",1,1,,False,1
"""Smooth, efficient flight experiences""",10,2022-09-21,"Durban to Cape Town and return. Smooth, efficient flight experiences both ways. Website worked well for purchase and check-in. Bag check-in only begins 2 hours before departure. As a result, the queue at the bag check-in counter for flight 161 was very long as Safair has a number of flights departing Durban in the late morning and noon hour. Was happy I had paid for priority (standard) service as the queue was very short for the priority desk check-in and bag drop. Both flights were completely full. One huge plus for this airline is the seats cannot be reclined. Good decision, Safair! Snacks and beverages were offered for sale on both flights. Maybe it was my ears, but the cabin of the 737-800 seemed to me to be noisier than the cabin of the older 737-400 we rode on coming back. We struggled to hear the pilot's announcements on the -800, but could understand the announcements with no problem on the -400. My daughter commented that the legroom on the -400 seemed to be greater than on the -800. Both flights arrived and departed on time. At both airports, our bags were waiting for us on the carousel upon our arrival. We'll definitely fly with this airline again.",True,Boeing 737-800 / 400,Family Leisure,Economy Class,Durban to Cape Town,September 2022,3,5,,5,5,,True,
"""Crew were friendly and efficient""",9,2022-09-05,Excellent flights between Johannesburg and Mauritius. We paid for extra legroom (which was worth the money as normal seats are quite cramped). Both flights left on time and arrived slightly ahead of schedule. Crew were friendly and efficient and we were even provided with a box of food which was unexpected.,True,,Couple Leisure,Economy Class,Johannesburg to Mauritius,August 2022,4,5,,5,4,,True,
"""I had to forfeit my ticket""",1,2022-09-02,"Flysafair has very poor service. I missed my flight to Durban because my international flight was delayed. Upon arrival at OR Tambo, I paid to be on standby, but it appears many people were being placed before me.  I will never ever take it again. I had to forfeit my ticket and purchase another ticket from another airline.",True,,Solo Leisure,Economy Class,Johannesburg to Durban,May 2022,,,,1,1,,False,
"""Absolute ridiculous service""",1,2022-09-01,"Not Verified |  Absolute ridiculous service on a flight delay of more than 4 hours. Firstly the airline issues some vanilla notice as if this is standard practice, and later on even tried to argue that I’m not entitled to go on standby for an earlier flight as the original flight was only delayed not cancelled. Secondly, there is still no explanation or even apology for the terrible service provided. Clearly Safair’s dominant position on the domestic flight market is going to their heads and timekeeping or customer service is no longer of much concern.",False,,Business,Economy Class,Johannesburg to Cape Town,September 2022,2,1,,1,1,,False,
"""treated the cabin crew like dirt""",4,2022-08-30,What a horrible experience. The flight was delayed with 3 hours. Then drunken disorderly passengers swearing shouting and passing comments and treated the cabin crew like dirt.,True,,Couple Leisure,Economy Class,Lanseria to Durban,August 2022,3,5,,3,5,,True,
"""option to purchase priority is an absolute scam""",5,2022-08-09,"Overall a comfortable flight but extremely frustrated that I paid for priority check in and boarding and received neither on both our flight there and back! Feel ripped off and like the option to purchase priority is an absolute scam. Still had to wait in all the quest both at the check-in counters and on boarding the flights. If you can’t deliver the service, don’t offer it and certainly don’t charge your customers for it. I had 2 other passengers with me who I also paid priority for. What a waste!",True,,Family Leisure,Economy Class,Johannesburg to Durban,August 2022,3,4,,1,1,,True,
"""such poor behaviour from an airhostess""",2,2022-07-25,"Not Verified |  When exiting from flight Joburg to Cape Town FA204 I experienced your airhostess are exceptionally rude. The flight was busy disembarking and after standing up tp proceed to the back of the plane she ordered me very disrespectfully to return to my seat. I was four rows forward and had no options to return back to my seat as there were people behind me. I had to asked her repeatedly to let me pass. She again insisted - deeply embarrassing me in front of everyone. As a 44 year old disabled woman I was left feeling deeply humiliated - like a child being shouted at by an adult. I appreciate that staff need to keep order, but this was taken way too far. In all the years that i have travelled i have never ever experienced such poor behaviour from an airhostess.",False,,Business,Economy Class,Johannesburg to Cape Town,July 2022,2,1,"<span class=""star fill"">1</span>",4,3,,False,
"""additional R250 for a small 4kg bag""",1,2022-05-28,"My boyfriend and I are regular traveller's and always use this airline. I'm deeply disappointed by this company's outrageous policy regarding their ""by piece"" luggage requirements. My additional bag weighed 14kgs, however I had to pay an additional R250 for a small 4kg bag, even though the combined weight of both bags were 5 kgs below the maximum weight. Is this the way to treat your regular and loyal customers, who are required to have one bag big enough to meet the maximum weight requirements?",True,,Solo Leisure,Economy Class,Johannesburg to Durban,May 2022,4,4,"<span class=""star fill"">1</span>",2,4,,False,1
"""horrendous experience""",1,2022-04-09,"Johannesburg to Durban. When arriving at Durban on the 6th of April 2022, my luggage never arrived. I was directed to the Swissport counter to report the missing luggage and was told that they will locate my luggage and have it delivered to my hotel. It is now the 9th of April and I have since returned to Johannesburg and still no bag, no answers and no way of following up or receiving feedback. I have tried the Flysafair customer careline, where I've just been looped from one automated response to the next, with no options relating to missing luggage. I've have chatted to at least 3 agents on the WhatsApp line, but as soon I describe my problem the agents logged and sends a message that my query has been resolved, which it certainly has not. I have no spent my entire Saturday at a small office in OR Tambo trying to get someone to assist me with finding my luggage. Absolutely horrendous experience!",True,,Business,Economy Class,Johannesburg to Durban,April 2022,1,4,,1,1,,False,
"""disappointed by the professionalism by the flight attendants""",4,2022-04-07,"My family and I are absolutely disappointed by the professionalism by the flight attendants. We had an issue with another passenger with placing our luggage in the overhead bin and none of the attendants came to assist instead they saw it fit to just stare at us. When it was our turn to disembark from the plane, the flight attendant skipped our seat and proceeded to allow other passengers to leave the plane. I did not appreciate the flight attendants tone when we ordered snacks, she was not friendly. The service was just appalling and disappointing.",True,,Family Leisure,Economy Class,Cape Town to Lanseria,April 2022,4,1,"<span class=""star fill"">3</span>",3,3,,True,
"""really disappointed in this type of service""",2,2022-03-30,"Despite the fact that we were there as per the 90 minutes expectation and there was no end to the queues in sight, we were told that we cannot board the flight 10 minutes prior to its departure. Flysafair took no responsibility whatsoever for the long queue and we were sent from pillar to post trying to find assistance with almost none of their employees being able to give us the answers we need. Had they been competent and knowledgeable, we may have been able to board the flight in time but instead wasted so much money. That's exactly what they want it seems. We were told that we could be on the wait list for a non refundable R300 and couldn't even tell us how many people are on the list already. Paid the fee and it turned out that more than 13 were already on the wait list so not only does that just show how many people weren't able to make it in time but also how they get you to pay because you hope that you may be next on the wait list. I'm really disappointed in this type of service in this age",True,,Business,Economy Class,Cape Town to Johannesburg,September 2021,,,,1,1,,False,
"""not be flying this airline again""",1,2022-01-18,"Do not travel on this airline if you value your luggage -- they may return it damaged, and then wipe their hands of the situation by sending you an email saying what happens to the baggage is out of their control because it has to - and I quote directly the nonsense they sent me -- ""pass through the hands of several service providers in the airport context."" Unbelievable that they don't respect their customers enough to compensate for damaging their luggage. Particularly don't recommend them if you are travelling with children (in my case, two small children) - they damaged my child's car seat so as to make it completely unuseable then said I could no longer make a claim once I had stepped out of the airport. Apparently after a flight you are expected to then traipse around a large airport and track down their lost luggage office which is nowhere to be found, while dragging along two small, tired children, in order for them to believe you're not making this up (who has the time?) They claim reporting directly at their (invisible) lost luggage office is for ""transparency"" reasons, when actually transparency on their part would have been them telling you they can't be trusted to safely check in a car seat. Flying is expensive, as is a child car seat. The least you'd expect is to get the service you paid for. Will not be flying this airline again.",True,,Family Leisure,Economy Class,Johannesburg to East London,January 2022,1,1,"<span class=""star fill"">1</span>",1,1,,False,1
"""cabin crew and flight crew were exceptionally friendly""",10,2022-01-10,"Outstanding! Our flights between Johannesburg (Lanseria International Airport) and Cape Town were both very pleasant. All of the staff including the check-in staff, cabin crew and flight crew were exceptionally friendly, patient and professional. Compared to former and existing low-cost airlines in South Africa, FlySafair is by far the best! There was a one-hour delay leaving Cape Town due to a baggage handling issue (no fault of FlySafair) but it was handled well by the crew and much time was made up in flight. Boarding and disembarking the aircraft was also handled very well. Lastly, the aircraft was exceptionally clean and felt very spacious especially compared to other low-cost airlines both locally and abroad. Well done and thank you FlySafair!",True,Boeing 737-800,Family Leisure,Business Class,Cape Town to Johannesburg,January 2022,5,5,,5,4,,True,
"""priority booking absolutely non sensical""",6,2021-12-11,We are extremely disappointed in the way and manner we were treated in boarding flight FA305 to Cape Town. First the priority line and normal queues were allowed to embark at the same time which makes the priority booking absolutely non sensical. When I raised what I believe was a valid complaint the ground staff merely stated my complaint will be noted. I believe this treatment meted out by you to your priority clients call for a reimbursement as this conduct is incongruous to say the least. I am on my way to Cape Town for an urgent medical procedure and my wife also had cancer which makes standing in the sun a most unpleasant experience. We were allowed to leave the terminal building but then had to stand in the sun for an extended period before being allowed to embark. The excuse was the number of wheelchair passengers delaying embarkation. But why are we not retained in the terminal building till those passengers have been seated. We have started to support Safair but I will have to rethink after this incident as it never happened with any airline and I have been flying since the early 70s .We book on your business class package and are then treated as second class citizens.,True,,Couple Leisure,Business Class,Lanseria to Cape town,December 2021,4,4,,1,2,,False,
"""two amazing flight attendants""",10,2021-11-29,To the two amazing flight attendants who were working at the front on flight FA210 traveling from Joburg to Cape Town on Saturday (the 27th) departing at 16:10 I would just like to say thank you so much for the extra care you gave to the elderly passengers (my mother included) on that flight. Your care and going the extra mile is truly appreciated (my apologies I did not get your names but thank you both).,True,,Couple Leisure,Economy Class,Johannesburg to Cape Town,November 2021,4,5,,3,4,,True,
"""they were 30 minutes late taking off and landing""",3,2021-09-27,"Terrible.....they state they are the most on time airline....yet they were 30 minutes late taking off and landing. They state they don't serve food or drink because of ""no touch"" yet they give water ""touched"" by attendant and you have to put your mouth on the top of water where the attendant touched. Where hot coffee kills viruses but their water apparently is ok. It is a farce for them take more money by using Covid to take your money with nothing special in exchange. Why they won best airline in 2019 and claim they are the most on time airline in the world is beyond.me.",True,,Family Leisure,Economy Class,Johannesburg to Durban,September 2021,1,1,,3,1,,False,
"""Both flights very pleasant""",10,2021-09-27,"Not Verified |  Cape Town to Lanseria and Lanseria to Cape Town. Both flights very pleasant under the current COVID circumstances. Easy priority check-in, bag drop and boarding from both airports. Ground staff and crew onboard young and friendly. No in-flight service as this is an LCC carrier. Aircraft interiors clean and comfortable. For disembarkation, you remain seated until the crews disembark row by row from both the forward and rear exits - very organised and will definitely fly them again.",False,Boeing 737-800,Couple Leisure,Economy Class,Cape Town to Lanseria,September 2021,4,5,,5,4,,True,
"""missed their flight with 3 minutes""",1,2021-09-23,"Not Verified |  My parents booked a flight for the 22nd of September. The queues were so full and no one to help people that they missed their flight with 3 minutes. Their website say to be there 90 minutes before the time which we were. But the queues were so full they were not able to get through. They were placed on standby for the whole day and they told them at the end of the day only to go home and come back again at tomorrow mornings flight. Again no one to help them along with 25 other people also missing their flight because the flysafair staff didnt help them and then there was absolutely no line at customer care ... while waiting for the people to tell them at 5:20 if there is space, no one communicated with them and they waited until 6:15 and even after the flight took off, no one communicated with the passengers on what is going on. Worst service we ever got from any airline.",False,,Couple Leisure,Economy Class,Johannesburg to George,September 2021,,,,1,1,,False,
"""Everything went smoothly""",8,2021-09-17,"Everything went smoothly. I didn’t expect much. Ground and cabin staff were really friendly and didn’t check the cabin bag for weight, smooth boarding process, there even was free water. Flight was perfectly on time. I paid 70 ZAR for exit row seats that were comfortable.",True,Boeing 737,Business,Economy Class,East London to Johannesburg,September 2021,4,5,,5,5,,True,
"""so disappointed in FlySaFair""",1,2021-08-14,"We were already on the aircraft and it had started moving then it turned out that there was a technical issue on the aircraft. We had to go back into the airport and we waited for approximately 5 hours for the problem to be fixed. We were left in the dark for a very long time about what was happening. Secondly I do not understand why the aircraft was not checked thoroughly before the messengers got on. Our lives were put at risk and the R80 voucher we were given to buy food was not enough. Lastly, the fact that we were expected to fly in that same aircraft on its own is problematic. My whole day was messed up because of this delay and FlySaFair did not do much to ensure that they make up for this. Yet if the tables were turned I would've been expected to pay a penalty for being late/delaying. I am so disappointed in FlySaFair.",True,,Family Leisure,Economy Class,Cape Town to Johannesburg,August 2021,2,1,,1,1,,False,
"""inattentiveness regarding the wearing of face masks""",1,2021-08-03,Disappointed by the cabin crew's inattentiveness regarding the wearing of face masks. Counted at least 1 person not wearing a mask during the first 10 minutes sitting on the flight before take-off. In-flight attendant did not tell them to put on their masks even though the passenger was clearly visible in an aisle seat until a passenger requested an in-flight attendant to tell the person to put on their mask. During the flight there were more than 4 children not wearing face masks that were not asked to put on their masks and upon disembarking the aircraft the cabin crew also failed to point this out to the parents and let the children walk out and climb onto a bus without face masks.  I was very uncomfortable during the entire flight.,True,,Solo Leisure,Economy Class,Cape Town to Johannesburg,August 2021,2,1,,1,2,,False,
"""Everything went smoothly""",9,2021-07-16,"No-frills ride from Durban to Cape Town. Everything went smoothly. Check-in was very busy because several flights were all leaving at the same time, but the queue flowed nicely and the wait wasn't too long. Onboard, the seats don't recline, a huge plus in my mind! We'll ride with them again.",True,Boeing 737-800,Family Leisure,Economy Class,Durban to Cape Town,July 2021,2,5,,4,4,,True,
"""like to thank you once again""",10,2021-06-30,"Missing our flight - Our daughter sent us surprising news and photos of her engagement. This then ended up in calls of joy and needless to say loss track of time and missed our flight. Feeling like naughty school kids, we had to go and collect our luggage and go to the booking office and explain the situation and showing the pictures of the engagement as a reason for missing the flight. I must say, it was quite laughable for all and the situation was turned around by an overwhelming gesture from FlySafair and the Cape Town staff working on the 26th June at around 18:30 to 22:00 for there professionalism, understanding, friendliness and patients and by rebooking us on a flight the next day ""free of charge"". The wife and I would like to thank you once again from the bottom of our hearts and will see you on our next flight.",True,,Family Leisure,Economy Class,Cape Town to Johannesburg,June 2021,3,4,,5,5,,True,
"""Thank you for helping me""",10,2021-06-02,Not Verified |  Good day FlySafair. I would like to thank the manager ands the two other gents whom assisted me with my baggage at the check in counter after being refused to go through the gate for having too many bags. Thank you for helping me through the airport staff entrance in order for me not to miss my flight due to repacking my bags. Sadly I did not catch their names but they will know whom they are. My flight was at 3.55pm Johannesburg to George Regards.,False,,Solo Leisure,Economy Class,Johannesburg to George,May 2021,5,5,,5,5,,True,
"""I would not recommend using their services""",1,2021-05-28,Due to the flight being cancelled as a result of COVID my party of 3 were unable to fly in March 2020. I have been trying to get a refund but have only been offered vouchers. These are of no use to us as we live in the UK and are not going to South Africa again. I have had to accept only 55% of the value of the tickets in a cash refund as the airline has taken 45%. The airline said they did not cancel the flight the government did. I was able to get a full refund from Emirates who were to fly us to South Africa and back. Keeping 45% of the money is dishonest in my view. Were I ever to visit SA again I would not fly with them. In these uncertain times of COVID I would not recommend using their services.,True,,Couple Leisure,Economy Class,Cape Town to East London,June 2020,1,1,,1,1,,False,
"""I’ve always preferred FlySafair but not anymore""",1,2021-04-26,"I’ve always preferred FlySafair but not anymore. I needed to change my flight about 5 days prior but the system was down. I kept calling daily, asked a friend to do this for me at the airport but got absolutely no assistance. On the day of departure, at the boarding gate, I was told that the gate closed a minute before I arrived and my bag was already offloaded. So offloading my bag took a minute I suppose. All this could have been avoided had I gotten help changing my flight. The staff attitude is the worst! I’m disappointed! Definitely hoping I never have to fly with them! So much for the cheapest airline, now I understand why it’s important to pay a little extra for an exceptional service.",False,,Solo Leisure,Economy Class,Johannesburg to Cape Town,April 2021,2,1,,1,2,,False,
FlySafair customer review,1,2021-04-24,Due to the system failure we couldn't book in online. Since we traveled from far we arrived minutes late at check-in and they refused to let us through and promised to put us on the next available flight with no additional costs. However they charged us an extra R2000. This is extremely unprofessional from an airline which knew their booking system was at fault. Will never fly with them again.,True,,Couple Leisure,Economy Class,Durban to Cape Town,April 2021,1,3,,4,2,,False,
