header,rating,review_date,comment,trip_verified,aircraft,type_of_traveller,seat_type,route,date_flown,seat_comfort,cabin_staff_service,food_and_beverages,ground_service,value_for_money,wifi_and_connecticity,recommend,wifi_and_connectivity
"""overall a satisfactory experience""",7,2021-04-07,This was overall a satisfactory experience. I was particularly pleased with COVID protocols which eliminated any contact. Boarding was not done in groups which I feel is necessary in these times. There was a ground staff member going down the line checking IDs which is commendable to ease scanning. Upon entry into the cabin there was hand sanitizer available. Crew was friendly and the trip was on par with others by Safair that I was happy with. The crew were courteous and presentable. We arrived on time.,True,Boeing 737-800,Solo Leisure,Economy Class,Cape Town to Johannesburg,April 2021,4,5,,5,5,,True,
"""regretfully a terrible experience""",1,2021-04-02,"Not Verified |  This is my 2nd time flying with Fly Safair and it was regretfully a terrible experience as I reached Fly Safair at 7:30 my Flight was for 7:55, I was advised that the doors are already closed this has been the 2nd time I was told to reschedule my flight and pay and additional R647.",False,,Couple Leisure,Economy Class,Johannesburg to Durban,March 2021,3,2,"<span class=""star fill"">1</span>",1,1,,False,2
"""not respectful to senior passengers""",1,2021-01-01,"Not Verified |  Staff were semi friendly but not respectful to senior passengers, our luggage was man handled, one suitcase was damaged on the corner. My husband and I will never ever use local airlines again, you guys can actually go and learn from other countries about customer service and respect for the elderly, Zambian airlines crew have very friendly cabin crew and service.",False,Boeing 747-400,Family Leisure,Business Class,From King Shaka to O.R Tambo via Limpopo,December 2020,2,1,,1,1,,False,
"""I felt robbed""",1,2020-12-28,"Johannesburg to Cape Town. The worst customer service ever, I was made to pay for a 7kg hand bag. This is the hand bag that I always travel with and no one bothered to explain how on earth my bag was charged without measuring it. I felt robbed and still want my refund.",True,Boeing 747,Solo Leisure,Economy Class,Johannesburg to Cape Town,December 2020,1,1,"<span class=""star fill"">1</span>",1,1,,False,1
"""I won’t fly with them again""",1,2020-12-22,"I checked in 24hours before my flight so that I could sit at the front window seat but when I went to board, they made me move to the back aisle seat because the plane wasn’t full and they needed me to balance the plane. After they forced me to move, they failed to clear an error with my boarding and decided to offload my bag from the plane instead of checking whether I was onboard or not. I landed at 4pm, it’s now after 11am the next day, I still don’t have my bag and no one is answering my calls. I won’t fly with them again.",True,,Solo Leisure,Economy Class,Durban to Cape Town,December 2020,3,3,,1,2,,False,
"""I'm so disappointed""",2,2020-12-11,"Our flight got delayed from 20:45 to 23:00,traveling with my 6 year old son. Worst experience for his first flight, he fell asleep on the benches while waiting for our flight that kept getting delayed until 23:00. We missed our transport in Johannesburg, just imagine. What a hell of a day! I regret booking a late flight and this is my first experience with FlySafair. I'm so disappointed, if I had know I would have booked another time or used another airline. No explanation, just that there was a delay with another inbound flight.",True,,Family Leisure,Economy Class,Durban to Johannesburg,December 2020,3,4,,1,1,,False,
"""no agents to answer any calls""",1,2020-11-19,Not Verified |  This airline is pathetic and are impossible to get hold of. Their whatsapp doesn't exist and they have no agents to answer any calls. I booked a ticket with them and i said the payment didnt go through so i then used a different card incase it was an issue with my card and it still did not go through. The next day I tried again and it worked. The following day I checked my credit card statement and saw that all three payments had gone through! There is no-one at Flysafair to answer and help sort out my situation.,False,,Couple Leisure,Economy Class,Johannesburg to George,November 2020,,,,,1,,False,
"""Our seats were cancelled""",1,2020-11-11,"Fly Safair - Running the monopoly in SA. Walking towards the counter, already checked in an hour before the flight, I have a medical condition meaning I cannot stand for very long periods of time and stayed seated while the able passengers stood in the queue for over 20 min to board. Not wanting to be the one that holds up the flight and only with a a handbag, I walked toward the counter as I could not run because of AS. The Safair staff member then promptly closed the door, to tell me I'm late his face implying that I should have run, we explained that I have a medical condition and therefore could not run. The 20 m gap, People were still boarding the plane, we begged him to allow us que, his comment to me was, mam you don't look sick. Our seats were cancelled. They said Good luck to you, come back in the morning. With no place to stay in Durban and no transport, I walked a few more meters and my back was in so much pain, that I asked for a wheelchair, do I have any rights?",True,,Business,Economy Class,Durban to Cape Town,November 2020,,,,1,1,,False,
"""shouted at me in front of other people""",4,2020-11-06,"I had a problem when i was doing the last check in before i board, i was only holding my phone which had my boarding pass on. The lady who was checking me in shouted at me in front of other people checking in asking me if it was my first time to fly as i didnt know that i have to present my id. It was so embarrassing and she went on and on. I did email flysafair with the complaint and noone got back to me. The way she shouted at me was like I'm a small kid.",True,,Solo Leisure,Economy Class,Johannesburg to George,November 2020,3,3,,2,2,,False,
"""Will not use them again""",1,2020-03-14,"Johannesburg to George. 2 hour delay, old planes would not recommend. Poor communication from the airline. Will not use them again. Cheap in this case means cheap planes.",True,,Family Leisure,Economy Class,Johannesburg to George,March 2020,1,2,,2,2,,False,
"""toilet was disgusting""",7,2020-02-20,"My flight FA295 on 19th February 2020 from Cape Town to Johannesburg on FlySafair was good until I had the misfortune to use the toilet. It was disgusting, dirty grimy and appeared as if it had not been cleaned for weeks.",True,,Couple Leisure,Economy Class,Cape Town to Johannesburg,February 2020,5,5,,5,5,,True,
"""the plane was delayed""",2,2020-02-01,"I booked my daughter on the FlySafair flight, SA161 Durban to Cape Town.  When she checked in this morning, she received an sms to tell her the plane was delayed. The flight was due to depart at 09:30, the revised departure time was 15:30. She was advised that she could book another flight with another airline and FlySafair would refund us within 14 to 21 working days. The knock on effect is that we have to try and arrange new lifts and her meeting at the university would be postponed. How is FlySafair rated the most on time airline in South Africa? From now on I will book my daughter on British Airways as I travel almost weekly for business and the longest delay has been 15 mins.",True,,Solo Leisure,Economy Class,Durban to Cape Town,January 2020,,,,4,3,,False,
FlySafair customer review,1,2020-01-27,"Johannesburg to Durban. Shocking attitude from all the staff. Pretentious and entitled. So disappointed. I was standing at the gate with a coffee waiting to board but nobody called last boarding calls. So walked to the desk and the staff were appalling and refused me onto the flight. Literally on the button for gate closing time. I will never use FlySafair again, even if their fares are the cheapest.",True,,Solo Leisure,Economy Class,Johannesburg to Durban,January 2020,1,1,,1,1,,False,
"""we were very disgusted with the service""",2,2020-01-08,"Not Verified |  East London to Cape Town with FlySafair. The inflight service was absolutely abominable. The air hostesses went down the aisle once then closed the service for stocktake for the rest of the flight. That is poor management, stocktake should happen after the plane has landed and the passengers have disembarked. Also they did not come and remove the rubbish and asked the passengers to clean up themselves. We were asked to place the rubbish in the seat pocket. So we were very disgusted with the service I believe that that is a management issue and that needs to be addressed promptly.",False,Boeing 737,Couple Leisure,Economy Class,East London to Cape Town,January 2020,3,1,,4,2,,False,
"""we were 5 mins late""",2,2019-12-26,"Johannesburg to Cape Town. Very bad service at the airport, nowhere were it states that wheelchair people are required to be an hour early for check in, we were 5 mins late and sent to book new flight. The guy standing next to us had the same problem, he was helped very fast.",True,,Family Leisure,Economy Class,Johannesburg to Cape Town,December 2019,,,,1,1,,False,
"""It was a good flight""",2,2019-12-24,"Cape Town to Johannesburg. It was a good flight, departed in time landed before schedule even though it was a bit of a rough landing due to the fact that the weather condition were not suitable. And it is value for money. I only paid R536 rand and I got a window seat. What I'm not happy about is that the beer was so hot but I won't complain.",True,Boeing 737-800,Solo Leisure,Economy Class,Cape Town to Johannesburg via Johannesburg,December 2019,4,5,"<span class=""star fill"">2</span>",5,5,,True,2
"""worst service dealing with a lost bag""",1,2019-12-23,Not Verified |  Johannesburg to Cape Town. Absolutely worst service dealing with a lost bag. 2 of 4 bags were lost. One has since been recovered but no one can locate the other. No one is being helpful and they're telling us what we want to hear not what is actually happening. We cannot continue with our holiday because they're stringing us along and we have to wait for the bag to be recovered. We are staying an hour and a half from the airport so it is even harder to plan the days waiting for this bag.,False,,Family Leisure,Economy Class,Johannesburg to Cape Town,December 2019,3,3,,1,1,,False,
"""I had the best flight""",10,2019-12-08,"Durban to Cape Town. I had the best flight with my 3 kids. Best staff. Was assisted by staff who went out of their way to make sure that our experience was the best. They really are an asset to the company. Everything went smoothly, on time and well organised.",True,,Family Leisure,Economy Class,Durban to Cape Town,December 2019,4,3,,5,5,,True,
"""Customer care extremely poor""",2,2019-11-17,Durban to Johannesburg. Customer care is extremely poor. FlySafair is another typical airline with zero scruples. They are willing to make one pay additional for a flight change but reimbursement for a cheaper flight isn't re-compensated. One should just clap their hands and be thankful.,True,,Business,Economy Class,Durban to Johannesburg,November 2019,3,3,,1,1,,False,
"""pathetic staff service""",1,2019-11-11,Cape Town to Johannesburg. Absolutely pathetic staff service at baggage check. First the staff where arguing amongst each other as none wanted to help me. Then the lady looked me in the eye and mumbled stuff in her own language twice during the process. Never smiled once and did not exchange any pleasantries. I will next time pay more just to avoid this type of service,True,,Business,Economy Class,Cape Town to Johannesburg,November 2019,3,1,,1,1,,False,
"""Excellent service""",10,2019-11-04,Durban to Johannesburg. Excellent. The flight departed on time and actually reached early. The airline also kept me posted on all aspects of the flight. I even got an SMS indicating the carousel number of my baggage. Excellent service and I will definitely fly with Flysafair again,True,,Couple Leisure,Economy Class,Durban to Johannesburg,November 2019,3,3,,5,5,,True,
"""my dissatisfaction as a customer""",1,2019-09-30,"I was so excited as this was my first time flying. I arrived early so I wouldn't miss my flight from Joburg to Durban I then checked in and was then told to go to gate C12 at 9h30 Am, then a lady checked our tickets and advised we can go sit elsewhere as we were complaining of the coldness of the boarding area. She then advised we can come back at 10h50 for Boarding . When we returned we found 2 lines and were not sure which one to join so I went in front to ask the lady who was going through the line checking the ticket which line to join and she just said go at the back of the line to me and other people who were also enquiring about the same thing. We then all went to the back of the Priority boarding line as per her instructions ,n ext thing we know after standing in the line she tells us we standing in the wrong line and we need to go at the back of the other line. I was so disappointed at her lack of customer care etiquette and strongly feel it should be addressed.  We then arrive at our Destination and we were seated at least 3 seats from the back so we took that time to take Selfies of us inside the plain for the 1st time while moving to the front to my shock the English lady flight attendant rudely told us to stop taking selfies and vacate the plain. I asked her why she had to be so rude as it is not as if we were still seated but moving to the front. She responded by rolling her eyes and didn't bother acknowledging my dissatisfaction as a customer nor did she apologize either.",True,,Couple Leisure,Economy Class,Johannesburg to Durban,September 2019,4,1,,1,3,,False,
"""gladly fly with them again""",6,2019-09-17,"Cape Town to Johannesburg. On this short flight everything went fine. Boarding in Capetown was fast and well-organized - they seem to be really good in efficiently handling arriving and boarding passengers. Staff was nice. Slim Boeing seats are terrible, but bearable on this trip. Catering is at the lower end, but prices are ok. Arrival at remote position, but again very efficient in getting us into the terminal. Will gladly fly with them again.",True,Boeing 737-400,Solo Leisure,Economy Class,Cape Town to Johannesburg,September 2019,1,5,,5,3,,True,
"""suitcases were damaged""",4,2019-09-16,My complaint is not necessarily with the Airline but more so with the Ground Staff at either OR Tambo or George airports or Both. In the past year I have noticed a lot of Scratches and dents on our luggage. ( This even on the Cape Town Flights). We have even gone as far as wrapping them at a hefty price to try and protect them.( Wrapping price has jumped rapidly over a short time - Currently R90-00 and expecting it to be R100-00 soon). On our trip yesterday (FA 228 16h05 - OR Tambo to Georg ) I was horrified at the condition of my and my Wife's suitcases. We specifically purchased more expensive and robust luggage cases to prevent damage. Well to no avail as they were damaged. One can clearly see that the suit cases were carelessly and violently thrown from a distance. Many people are complaining of the same thing. Then there was also the situation of the Airbridge at Gate C 13 at OR Tambo that is out of order. Many old people and ladies with babies had to walk down the stairs onto ground level and back up into the plane. This is very unprofessional for a Major Airport.,True,,Couple Leisure,Economy Class,George to Johannesburg,August 2019,3,3,"<span class=""star fill"">2</span>",2,4,,True,
"""Crew weren't helpful at all""",4,2019-09-03,"Cape Town to Durban. Had a bit of a struggle breathing while on board. Decided to move to the back of the plane as the passenger next to me was asleep and leaning towards me, which was a bit uncomfortable. Crew weren't helpful at all. Found me by the cabin, but asked me to move back as they had to get on with their work. Props to the fellow passenger who offered to help.",True,,Solo Leisure,Economy Class,Cape Town to Durban,August 2019,2,2,,2,2,,False,
"""staff went out of their way""",10,2019-08-31,"Not Verified | Sat 25 Aug 2019 my dad had to take a flight from George to Johannesburg via Safair, but forgot his ID book at home and could not board the flight. He had to get his ID book and come back for the later flight, but was without transport to get back home. The staff went out of their way and beyond to assist him and made sure he got onto the next available flight even assisting him to sort out his ID to be able to board. We just want to thank these two people and give them our sincerest appreciation - we have never had customer service like this - Thank you so much - you guys are amazing.",False,,Couple Leisure,Economy Class,George to Johannesburg,August 2019,5,5,"<span class=""star fill"">1</span>",5,5,,True,1
"""unprofessional staff experience""",1,2019-08-24,"George to Johannesburg. This was the most unprofessional staff experience I ever come across in my life. The woman at the ticket office in George does not deserve to have a job. She was rude, unprofessional and seemingly untrained for the position she is hired for. To the point where we cancelled our ticket and booked with Kulula air. The flysafair can take about a 100 tips from them.",True,,Solo Leisure,Economy Class,George to Johannesburg,August 2019,,,,1,1,,False,
"""Would not recommend them""",3,2019-08-04,"No one can spoil your day better than FlySafair. Landed in Johannesburg with missing baggage and I was told that they are a low budget airline and they don't compensate. Now I have to buy new clothes and toiletries for a morning meeting while waiting for them to deliver my bag. In addition, the staff om duty that I reported the incident to was very rude. Would not recommend them to anyone.",True,,Business,Economy Class,Cape Town to Johannesburg,August 2019,4,3,,1,3,,False,
"""I wont recommend this airline""",1,2019-07-29,Cape Town to Johannesburg. This is honestly the worst service that I've received from all airlines. The staff at the Cape town airport is rude and incompetent. The only person willing to help was the manager at the safair counter. Your check in department don't have any people skills. I refuse to pay for a service that treats us this way. They are totally unprofessional. I wont recommend this airline to anyone,True,Boeing 737-800,Solo Leisure,Economy Class,Cape Town to Johannesburg,July 2019,2,3,,1,1,,False,
"""I am very disappointed""",1,2019-07-03,"Cape Town to Johannesburg. I will never ever make use of FlySafair again. I am very disappointed. How do you people book a family with 3 small children on different seats even if we booked it a 3 weeks before the flight? When boarding, a hour before takeoff i must find out that i need to go to the Police station to with a copy of my children's ID's to certify them. How do you charge an extra R250 per bag? This is unacceptable.",True,,Family Leisure,Economy Class,Cape Town to Johannesburg,July 2019,1,4,,1,1,,False,
"""we were late to check-in""",2,2019-06-23,"Not Verified |  Port Elizabeth to Johannesburg. This morning Me and My fiance need to flight back to Johannesburg, at 8:40. At Check-in they say we have missed are flight. I told the lady at the check-in that its only 8:05, she said sorry but you have missed your flight. Just because we were late to check-in.  They told me that they only have a flight to Johannesburg at 20:50 and i need to pay R1100 to ensure we have a place on the flight.",False,,Couple Leisure,Economy Class,Port elizabeth to Johannesburg,June 2019,2,3,"<span class=""star fill"">2</span>",1,2,,False,1
"""staff were nothing less than accommodating""",10,2019-06-19,"Not Verified |  Port Elizabeth to Durban with FlySafair. I would like to compliment your ground staff / check-in staff who were on duty at PE airport at 14h30 on Friday 14th June. I had a really ill colleague travelling with me to Durban, and requested if they could help me with 'assisted boarding' as I hadn't requested that when the booking was made. Your staff were nothing less than accommodating and amazing in the way in which they took over and took care of her from check-in to her getting into the vehicle in Durban.",False,,Business,Economy Class,Port Elizabeth to Durban,June 2019,5,5,,5,5,,True,
"""ridiculous to pay extra for bag""",1,2019-06-08,Cape Town to Lanseria. Pathetic Service! Will never ever fly with them again. Unfriendly service and ridiculous to pay extra for bag. Thank you Kulula for great service always!,True,,Business,Economy Class,Cape Town to Lanseria,June 2019,1,1,,1,1,,False,
"""It was so cheap""",10,2019-05-29,Not Verified |  Johannesburg to Cape Town. The flight was perfect the flight attendants were very nice. Overall it was a good flight. It was so cheap and the money was worth it I couldn't believe you can fly for just about five hundred rand it was nice.,False,Boeing 737-800,Family Leisure,Economy Class,Johannesburg to Cape Town,December 2018,3,5,,5,5,,True,
"""did not provide compensation""",1,2019-05-23,Johannesburg to Durban. I had to attend a funeral in Durban on 17/5 at 10 30am. Booked a 6.30am flight. This flight was delayed for 5 hours. Only left Johannesburg at 11.30am. Did not make it to the funeral. The purpose of going to Durban was not met. Safair did not provide compensation for the delay.,True,,Family Leisure,Economy Class,Johannesburg to Durban,May 2019,1,2,,1,1,,False,
"""told me I have missed my flight""",2,2019-05-03,"Johannesburg to  Durban. I am disgusted with the service I received at OR Tambo with the Ticket sales when I came to check-in for my flight that was at 11:05-12:20 to King Shaka international airport, the agent looked me in the eye and told me I have missed my flight when the flight was still within the airport, when I got there in time for my flight. I was shook for a moment he refused to print my ticket and dismissed me to look for other flights that at at 1600. The guy did not provide the customer service to ensure that passengers make it on the flight booked. I do not have money to waste I am never flying with you guys ever again. I had to book Mango to make to Durban on time and make it to work and they exceed customer expectations!",True,,Solo Leisure,Economy Class,Johannesburg to  Durban,April 2019,1,1,,1,1,,False,
"""Terrible customer service""",2,2019-04-12,"Not Verified |  Terrible customer service, call centre takes ages to response and they keep putting you on hold for a significant time. I booked a ticket single for my wife and myself, Johannesburg to Durban I changed my flight paid a huge change fee almost the same price as my ticket for a day earlier. I received confirmation that my flight was change, and they added a return flight. I needed to change my wifes flight for an earlier flight on the web site I selected her flight and the system automatically assumed its a return flight Durban to Johannesburg no warning all all I choice a flight and when we received the confirmation slip her flight is a return flight. Tried calling the call centre for assistance I am waiting on the line and put on hold now for 29 minutes. I don't recommend this airline surprised that they won best airline award.",False,,Couple Leisure,Economy Class,Johannesburg to Durban,April 2019,1,1,"<span class=""star fill"">1</span>",1,1,,False,1
"""website is not clear""",1,2019-04-09,"Port Elizabeth to Johannesburg. There are hidden cost when you fly with FlySafair. The website is not clear about additional costs such as luggage, what is included, or what is excluded.",True,,Solo Leisure,Economy Class,Port Elizabeth to Johannesburg,April 2019,1,1,,1,1,,False,
"""not use this airline again""",2,2019-03-27,Johannesburg to Cape Town. The worst flight and service encountered - from counter where they insisted I pay an additional amount of R250 for baggage (about 13kg) to be loaded - to the actual flight where staff treated passengers very badly. we had to stand on the side for over 20 minutes to allow staff to proceed with the onboard refreshment trolly sales. Why can't SAFAIR advertise a price including the allowed booked-in luggage as all other airlines? Instead they charge you extra for luggage other than hand luggage. I will not use this airline again.,True,,Solo Leisure,Economy Class,Johannesburg to Cape Town,March 2019,2,1,"<span class=""star fill"">1</span>",1,2,,False,1
