header,rating,review_date,comment,trip_verified,aircraft,type_of_traveller,seat_type,route,date_flown,seat_comfort,cabin_staff_service,food_and_beverages,ground_service,value_for_money,wifi_and_connecticity,wifi_and_connectivity,recommend
"""smallest space between seats""",1,2018-12-03,"Not Verified |  Paris to Madrid. This airline has the smallest space between seats, I can't even open a notebook to work during the flight.  I avoid this airline just because of that - their competitors (low-budgets) have more space. So if you fly for business and you hope to work during the flight, then choose any other airline.",False,,Business,Economy Class,Paris to Madrid,November 2018,1,3,,3,1,,,False
"""give me this stupid connection""",2,2018-10-30,"Gran Canaria to Zürich via Madrid. They give me this stupid connection and when my plane landed they did not wait for me. Only 5 mins late, but of course it was not my fault. My other connection had delay like always. Have to wait 4 hours for the next plane.On my way back i also had more than 3 hours delay. I paid 500CHF and its a horrible company and you have to pay everything in the plane. Not even a glass of water they offer you for free. Never again will i fly with Iberia.",True,,Solo Leisure,Economy Class,Gran Canaria to Zürich via Madrid,October 2018,3,2,"<span class=""star fill"">1</span>",1,1,,1,False
"""missed my connection in Paris""",1,2018-09-29,"My flight was originally on Delta from Salt Lake City to Madrid for both business and pleasure. Due to Delta leaving 3.5 hours late I missed my connection in Paris and as all the Delta Partner flights were booked going down to Madrid that evening they put me on an Iberia flight. This gave me a 4 hour layover or so in Paris so you would think my luggage would have arrived. It didn't. I figured it would show up a day or so later because how do you lose luggage for longer than that and I made the mistake of only making only one pair of underclothes and two shirts in my backpack. As the days progressed with no luggage I was told by Iberia to hold onto my receipts for reimbursement as I had to by clothes I could wear for my conference, makeup and some clothes for the vacation portion of my trip. I didn't go wild. Finally, on the 9th day of no luggage they contacted me to say it was found and now in Madrid. That didn't help as I was in Barcelona. I instructed them to send it to my home in Utah to which they told me they would send me the shipping information. They never did. Three days later there was a knock at my door at 4:50 a.m. that freaked me out because I wasn't expecting anyone. It ended up being my luggage. Luckily, it was all there. Unfortunately, the story doesn't end there. When the Iberia representative told me to hang onto my receipts he gave me an email address to send all my documentation. I did so knowing that reimbursement could take up to 30 days. After 3 weeks of radio silence from Iberia I contacted them to check the status and they said they never received my paperwork! They gave me a new email address and I resubmitted again. This time I saw emails from them saying they were processing and I could expect a check in approximately 30 days. Fast forward to this week. At day 36 I called them and was told that they couldn't help me. That I would need to lodge a complaint through their website. I immediately did and received an email that said it could take up to 21 days to respond. When I got home that day there was a check in the mail for less than half of the amount submitted. I've since contacted them without response. The customer service of this airline is unbelievably horrible! As Iberia was the airline I last flew with when the luggage went missing, according to airline regulations they are responsible for whatever happens to it.",True,A320,Business,Economy Class,Paris to Madrid,June 2018,3,3,,3,1,,,False
"""missed our connecting flight""",1,2018-08-24,"On 14 May 2018, my wife and I were booked on Iberia Express flight No 12 3877 from Santiago de Compostela to Madrid. The flight was scheduled to leave Santiago de Compostela at 9.15 am but due to a fault with the de-icing mechanism on the port engine of the aircraft, the flight was delayed and eventually took off from Santiago at 11.26 am, landing at Madrid at 12.20 pm. As a result of the delayed flight, we missed our connecting flight, from Madrid to Bucharest which departed at 12.15 pm. The Iberia staff at Madrid airport were most unhelpful in solving our problem and were rude and dismissive. A large number of passengers on the flight lost connections. The attitude and service was appalling.  To add insult to injury, our baggage and 21 other passengers’ baggage did not arrive in Madrid with our flight. We put in a baggage claim and our two bags eventually arrived late afternoon at Terminal 4 which I had to go searching for and which I found going around and around on a carousel all on their own and which could have been taken by any other passenger. The Iberia baggage claim staff had promised that they would keep the bags for us in their office once they arrived from Santiago, but this was not done. This is shocking service. In the meantime, we had to travel back and forth from Terminal 4 to Terminal 1 on two occasions in search of our baggage. As a result of the delayed Santiago - Madrid flight, we had to purchase two new airline tickets with another airline because we were a “no show” for the Tarom flight to Bucharest. I phoned Iberia Express in Madrid from Romania on many occasions and at great expense in order to investigate lodging a claim for compensation under the EU Regulations. I was told to lodge a claim online which I tried on numerous occasions but each time I tried to submit the claim, the message I received we that the Santiago flight number does not correspond to any Iberia or Iberia Express flight number. I phoned Madrid again and one of the customer service people said that she could not understand why the website is rejecting my application because the flight number I put into the system was correct. She then told me to send my claim by email to which I did but received a reply that the email address is for “internal use only”. I once again phoned Iberia in Madrid and the customer service person promised to investigate the problem and get back to me but I have never received a call back from her or anyone else. I have tried on 23 occasions to submit my claim online with the same result, the online system keeps telling me that the flight number does not correspond to and Iberia or Iberia Express flight number. In desperation, I wrote a letter to the CEO of Iberia and sent the letter by email and mailed it to him on 28 June 2018. I have not had the courtesy of a response from him our his staff.",True,,Couple Leisure,Economy Class,Santiago De Compostela to Madrid,May 2018,1,1,,1,1,,,False
"""Totally appalling experience""",3,2018-07-21,"I flew Business Class to Las Palmas from Cardiff. Flights excellent and on-time, I couldn't fault their performance. What overshadowed the whole trip was the way in which I was treated in Madrid Airport by a gate clerk. I entered the wrong line for priority boarding and eventually was able to join the correct line. For some reason this angered the woman at the gate who decided to explode with anger at me for no reason about why I was in the wrong queue etc. I was so shocked by her behaviour. When I told her off for speaking to me in such an aggressive way and I took back my passport with a curt ""thank you"" she ran down the jetty (leaving her desk and other passengers) to verbally abuse me more.  I have never experienced anything quite like it in 15 years of flying Iberia. I put in a complaint about her behviour but heard nothing back.  Totally appalling experience and never again.",True,A320,Business,Business Class,Cardiff to Gran Canaria via Madrid,July 2018,1,2,,1,3,,,False
"""easy departure and punctuality""",9,2018-06-30,"Stuttgart to Madrid. Cabin crew friendlier than customers. Wifi to see movies on the cellphone, easy departure and punctuality. Finger use in airports, never had to use a bus to get to the plane. It does not seem a low-cost airline at all and I try to use it whenever I can.  The only ""but"" is that the cabin crew are too permissive with customers leaving their backpacks in the trolley-cabins. If you get late to the plane you might not have space because of this.",True,,Solo Leisure,Economy Class,Stuttgart to Madrid,June 2018,3,5,"<span class=""star fill"">5</span>",4,5,,5,True
"""a miserable experience""",1,2018-06-15,"Marrakesh to Malta via Madrid. Most disorganized airline I have had the misfortune of flying!! Our complaint with Iberia airlines began when we were stuck waiting to board at the rear doors of the aircraft on the steps in the hot Moroccan sun for 20 minutes, only to be told they needed to close the rear door so we would have to walk to the front. My mother, with her bad knee, and I walked back to the front doors of the aircraft where we were the last ones on board. At the top of the steps a man begins putting tags on our hand luggage without saying a word to us. I ask if this means they will have to be checked and he just says “No space” and gestures inside. I understand we are the last ones on the plane (not intentionally) so there is no space left but they could at least tell us what was happening with our bags instead of taking our luggage without a word. Inside the plane, there is no soap in the toilets which we realized after another passenger spilt Coca Cola on top of my mother wearing all white. Now the belt is ruined, shirt stained, and my mother is completely sticky. On arrival in Madrid, we wait to collect our bags next to the plane as the agent in Marrakech had instructed us. One of the flight attendants informed us that our bags were “probably” en route to the final destination of Malta. We replied that there was no information given, as to our final destination, so we deduced that the bags must be in Madrid. We are then told that “most likely” our bags were in Madrid but we would have to go outside security to collect them and then come back. After waiting at the baggage claim the bags finally arrived. We narrowly made our next flight and were one of the last on this flight as well. On our next flight we were lied to by two agents saying there was absolutely no space for our bags but once we were inside we found at least 10 empty spaces (as well as numerous empty seats) that we could have used rather than leaving our bags to get lost again. Overall a miserable experience flying with Iberia, I would recommend flying any of the low-cost airlines who have a better standard of service than this. I would have rather swam through the med than gone through this. My mother might not have many trips left and this company certainly ruined one of them.",True,,Family Leisure,Economy Class,Marrakesh to Malta via Madrid,June 2018,1,1,,1,1,,,False
"""a pleasant experience""",6,2018-06-01,"Madrid to Gatwick. Flight was on time. At first it looks like the seat pitch is fine. This has been achieved by removing the seat pocket one normally finds below the tray table. However, once person in front declined their seat it became very unpleasant. The tray table came close to my stomach and it would have been very difficult to use the table. Fortunately there was an empty row across and one was able to move seats. The WiFi worked but it only allows you to watch information and movies on Iberia Express page and you are unable to surf the net or send emails, go on Facebook etc. The movie and TV selection was quite good but as there is no seat charger I didn't want to lose my charge so did not use it in the end. The crew were largely absent but drinks and food menu (all charged) was very adequate for short haul budget flight. All in all a pleasant experience bar the ridiculous seats.",True,,Solo Leisure,Economy Class,Madrid to Gatwick,May 2018,1,4,"<span class=""star fill"">2</span>",2,3,,1,True
""" I really recommend it""",9,2018-02-19,"I flew from Berlin Tegel to Madrid on February 18, the flight was on time and we arrived to Madrid before the set time. Check in was fast too. Nice flight, kind cabin crew, good service and also confortable seats with spacious legroom. I really recommend it.",True,,Family Leisure,Economy Class,Berlin to Madrid,February 2018,4,5,,5,4,,3,True
"""ground staff were really forceful""",1,2018-02-10,"Flew Madrid to London Gatwick. There is very minimal leg room on these planes. I'm not tall (165cm or around 5'5) and I felt cramped in. It's fine for a short flight, but 2.5 hours to London is pushing it. Beware that they will try to force you to check in your luggage, even though there is a lot of space in the cabin. The ground staff were really forceful that the overhead lockers were full, but they were half empty when I got on the plane - whole overhead lockers of empty space. They may claim to be the most punctual airline in the world, but they have downright dishonest ways of doing it. This isn't the first time it's happened to me on this airline. Staff are very much ""that's not my job"" kind of people. There is absolutely no difference between these flights and the other low cost airlines, except, and I never though I'd say this, the staff on other low cost airlines are a lot better at their jobs. I will be avoiding Iberia Express in future. Unfortunately they do some routes that no one else does, but for those flights I guess I'll just have to accept that there's no way I can be in a rush.",True,,Solo Leisure,Economy Class,Madrid to London Gatwick,February 2018,1,1,,1,2,,,False
"""Not a comfortable experience""",4,2018-02-05,"Gran Canaria to Madrid. From start to finish I felt like there was so many problems. Firstly I arrived at the airport early so I didn't have to leave my baggage in the hold. However everyone who was priority was allowed on before. They put people into groups so I was group 3 the last even though I was the first near the gate. After that my luggage was put into hold. Once on the flight the staff seemed disconnected and also flustered themselves, I suppose because things don't run smooth. The back of my seat was broken so I had to be transferred next to a mother and small baby crying, at this point I just wanted to rest. The food and drinks were overpriced and I had to pay £2.50 for a tea which was that bad I had to ask for it to be changed. The hot water was not warm enough to brew the tea so it ended up looking like dirty dishes water. At the other end of the flight I waited over 20 mins to get off the plane and then a further half an hour to get my bag which was only very small. Not a comfortable experience in total and wouldn't think of flying again with them. easyJet is a much better option for low cost.",True,,Solo Leisure,Economy Class,Gran Canaria to Madrid,February 2018,2,3,"<span class=""star fill"">4</span>",1,2,,3,False
"""seat comes with a charging point """,7,2017-10-09,"✅ Verified Review |  Madrid to Nice. Check-in at Terminal 4 Madrid airport was fairly easy where there are many self service kiosks available. After obtaining a boarding pass from the self service kiosk, I had to drop my check-in baggage at designated counters a short walk away. A staff member checked to ensure that the baggage tag is tagged on correctly before accepting the baggage. The boarding gate was a good 20-25mins walk away. Boarding was orderly. The flight was over 90% full and overhead cabin space was quite limited. Seats in economy cannot recline but it was not a problem. There is no inflight entertainment. Each seat comes with a charging point located below the seat so it takes a bit of a search to be able to locate it.",False,,Solo Leisure,Economy Class,Madrid to Nice,September 2017,3,4,,4,4,,,True
"""bumping people off""",1,2017-09-18,"✅ Verified Review |  Madrid to Amsterdam. Overbooking the flight and bumping people off when everyone shows up. We are requested to spend the night at the airport and take the flight the next day (not just a few hours later, but the next day). It is scandalous you pay for a ticket but apparently don't have a guaranteed seat. They assured us that it was the company's policy and it was written in small letters on the terms and conditions of the tickets.",False,,Couple Leisure,Economy Class,Madrid to Amsterdam,September 2017,,,,1,1,,,False
"""half hearted business class """,6,2017-09-04,"✅ Verified Review |  Madrid to Dublin August 31st. Have flown with these before found them ok, I needed to booked a changeable ticket and as there was very little difference in the full economy fare and businesses class. Check in, lounge, fast-track all fine, boarding was fine too ( usual haul to gate 4 at the very end of Terminal 4) I was in front row and to be honest the seat was not the most comfortable it's the usual standard 3 seats layout with middle seat left free which in theory only gives you more arm room. Cabin crew were nice but very distant and almost came acrosss as Robotic like they were programmed . Inflight meal was omelette, fruit, crossaint (breakfast) I wasn't offered a 2nd cup of coffee and I had to press bell to get a Fanta - my previous flights with Iberia Express found the crew very attentive. The Immfky.com wifi wasn't working and the crew didn't know a lot about it. Overall not bad but, it's a half hearted business class in comparison to others. I would still fly with them.",False,A320,Solo Leisure,Business Class,Madrid to Dublin,August 2017,1,3,"<span class=""star fill"">1</span>",4,3,,1,True
"""staff were very nice and helpful""",10,2017-08-16,"✅ Verified Review |  Flew Iberia Express from Madrid to Rennes. Very good punctuality, we arrived 20 minutes before the scheduled time. The Immfly WiFi connection works very well. Great variety of content like films, series, TV programs for flights of less than three hours. The staff were very nice and helpful.",False,A320,Family Leisure,Economy Class,Madrid to Rennes,August 2017,4,5,"<span class=""star fill"">5</span>",5,5,,5,True
"""Value for money too""",7,2017-07-29,"✅ Verified Review |  Short hop from London Gatwick to Madrid. First time on Iberia Express. Check-in was chaos and was told I was lucky to have a seat as flight was over booked by 10 people. Not good. BA codeshare flight, however you cannot check in at BA static machines to check-in. Manual check in only. Flight was crowded and a bit cramped. But showed all the traits of low-cost (which it is) and a legacy airline for back-up. Crew actually friendly and worked hard which is not always the Iberia way given my previous poor long-haul experiences on Iberia - this point was refreshing today!. Value for money too and would use again. Did not purchase anything but prices looked reasonable.",False,,Solo Leisure,Economy Class,Gatwick to Madrid,July 2017,3,5,,2,5,,,True
"""because the system failed""",1,2017-07-29,✅ Verified Review |  Madrid to Amsterdam. We checked in a day before leaving. They charged us 30 euro for our luggage. The day of leaving we had to pay again 60 euro for our luggage.  Otherwise our luggage would be hold in Madrid. By reclamation on the general desk they told us it was because the system failed and we had to deal with it. Although it was the mistake of Iberia. By entering the plane all storage cabin were full. For our handluggage there was no space. The stewardess told us to keep our handluggage under our seats - most of the passenger took 2 pieces of handluggage with them. Some of them 3 pieces! So we had to pay double and other paasenger could take all there luggage with them in the cabin.,False,,Business,Economy Class,Madrid to Amsterdam,July 2017,1,1,,1,1,,,False
"""not worth the upgrade""",3,2017-07-12,"✅ Verified Review |  Madrid to Krakow. Poor business class service for the money paid. I upgraded to business class cabin on my flight to get more comfort and more space. The boarding service in Madrid was confusing with various lines. Upon boarding  I was offered an orange juice.The seat is not very comfortable and did not recline. The meal was bad - I received cheese, crackers, Oliver, piece of chorizo, some potatoes and grapefruit. For a business class experience this was below par. The flight attendant was nice and was the best part of the trip. She returned the bag I left on the aircraft and ran after me to give it back. Very nice. The toilet was quite dirty and there was no soap left.  All in all not worth the upgrade, food needs improvement and the cleanliness levels need to get better.",False,A320,Solo Leisure,Business Class,Madrid to Krakow,July 2017,2,3,,1,1,,,False
"""crew appeared disinterested""",3,2017-06-21,"✅ Verified Review |  Santiago to Madrid. Cabin crew appeared disinterested and would not make eye contact with me when pushing the trolley. The first time was when I wanted to purchase drinking water. After the trolley was pushed two seats behind me I had to turn round & get the attention of passengers. The second time was when Cabin Crew were doing a rubbish run, this time the flight attendant was looking the other way as I tried to get her attention.  I was in the middle seat & found it difficult to move in the cramped seating because of the sleeping passenger in the aisle seat. It appeared to me that the quicker the trolley was pushed down the aisle the less work the hostess had to do.",False,,Solo Leisure,Economy Class,Santiago to Madrid,June 2017,2,1,,5,3,,,True
"""the worst experience I have had""",1,2017-06-05,"✅ Verified Review |  Flew London Gatwick to Madrid with Iberia Express. This was perhaps the worst experience I have had in a long time, this brings budget to a new meaning and is even more frustrating considering I booked via British Airways. This is perhaps the worst economy that I have ever experienced in my life, the seats are the most cramped that I have ever come across and are worse that other budget airlines. I don't wish this airline on anyone.",False,,Business,Economy Class,London Gatwick to Madrid,May 2017,1,1,"<span class=""star fill"">1</span>",2,1,,,False
"""a great low cost experience""",9,2017-04-08,"✅ Verified Review | Berlin to Madrid with Iberia Express. Very efficient boarding, the crew were making space in the overhead stowage and accompanying passengers to their seats which is very rare in Europe. The flight left Berlin late on a Friday evening most of the passenger were grumpy but the cabin crews have been smiling throughout the flight paying attention to small details. Definitely a great low cost experience.",False,A320,Business,Economy Class,Berlin to Madrid,April 2017,2,5,"<span class=""star fill"">3</span>",4,5,,4,True
"""quality of the food was horrible""",2,2017-04-07,"✅ Verified Review | Madrid to Dublin with Iberia Express. The trip was terrible, I travelled alongside my boyfriend. The plane departed 30 minutes late which honestly could of been more toleratable if we hadn't been put onto the plane like a herd of sheep. After take off we realised that all around us there were babies, not just one but 4. Every single child was screaming at the same time and they were uncontrolable. I am just wondering, how is a person supposed to ""relax and enjoy their journey"" when nobody seems to give a damn about the other passangers. The staff were just as frustrated as the other passangers who had to sit through a 2.5 hour flight but did not assist. Also I would like to mention that I ordered a Carbonara pasta and what I was given was a pot full of water and powder. The quality of the food was horrible, and was definitely not worth the price. Definetly not choosing this airline ever again.",False,,Couple Leisure,Economy Class,Madrid to Dublin,April 2017,1,2,"<span class=""star fill"">2</span>",2,1,,2,False
"""blacklisted from the airline""",1,2017-01-09,"✅ Verified Review |  Dublin to Madrid. Awful service. They couldn't find one of our tickets on their system in Dublin, then argued with us and told us it was our fault. The check-in agent told us we were then 'blacklisted from the airline'. A week after our flight the airline took EUR56.42 from my account without my knowledge. I've asked for a reason and they won't tell me why or give a refund of the money. Terrible service.",False,,Couple Leisure,Economy Class,DUB to MAD,December 2016,1,4,,1,1,,,False
"""penny pinching rip off""",2,2016-11-11,"✅ Verified Review |  Madrid to Manchester with Iberia Express, and paid 350 euros one way to have a little extra space and a simple hot meal usually provided on this route. The meal has been substituted now with snacks such as olives in a sealed bag and a powder cup soup. But they have the nerve to display a soup bowl on their brochure. Iberia, has become a penny pinching rip off.",False,,Business,Business Class,MAD to MAN,November 2016,2,4,,3,1,,,False
