header,rating,review_date,comment,trip_verified,aircraft,type_of_traveller,seat_type,route,date_flown,seat_comfort,cabin_staff_service,food_and_beverages,ground_service,value_for_money,wifi_and_connecticity,wifi_and_connectivity,recommend
"""flight left without our bags""",1,2022-09-16,The flight left without our bags. Customer service have done nothing for us. We are now in Spain for 6 days with a baby and no bags have arrived. They lie and do not stick to the customer contracts. Avoid this airline at all costs.,True,,Family Leisure,Economy Class,Manchester to Madrid,September 2022,1,1,"<span class=""star fill"">1</span>",1,1,,1,False
"""worst airline I have ever flown""",2,2022-08-23,This is the worst airline I have ever flown. I am emerald on oneworld (Iberia is part of the alliance) and the experience was worse than anything I have experienced.  Upon boarding the flight attendants watch you like a hawk to make sure you are not one KG over the limit or that your bag is not too large. They count how many bags you put in the overhead bin and come running down the isle on boarding if they see you put more than one bag in the overhead. They also asked how much the bag weighed. Granted we are first on board due to status. They changed the seats on every reservation the day of check in from the exit row to the last row of the aircraft and they split our seats up. Never will I fly them again. The only nice thing was being able to use the lounge. Other than that they are bad.,True,A320,Couple Leisure,Economy Class,Barce;ona to Madrid,August 2022,1,1,,2,2,,,False
"""Service is very basic""",1,2022-05-21,"Madrid to Tenerife Norte. The experience was of such a kind that next time I will take another company to reach Tenerife and very willing to do the transfer to North Tenerife by car to avoid Iberia Express by flying to South. Service is very basic: no choice for the meal and it was fish - not pleasant for some people - lukewarm white wine and gin tonic out of a can premixed. FA aattitude could be best described as ""ok we have to serve you"". One bag was missing and for the people handling at the airport, it seems nearly like a crime that I was not speaking Spanish. My bag was delivered a day later and I did not even start a claim to get the payment of some essential items like socks, and shaving items.",True,A321,Business,Business Class,Madrid to Tenerife Norte,May 2022,2,1,,1,1,,,False
"""call center is terrible""",1,2022-04-11,Not Verified | Madrid to Lanzarote. Their customer service call center is terrible. It's a scam. They will put you on hold for more than an hour. After one hour they tell you that their system is not working and that you have to call back later. They probably work remote with nobody supervising them and put the customers on hold while they go out shopping. I will never fly with them again.,False,,Family Leisure,Economy Class,Madrid to Lanzarote,April 2022,1,1,,1,1,,,False
"""completely disappointing experience with this airline!""",3,2022-04-02,"Not Verified |  My first time flying Iberia Express and it was terrible. Check in complete chaos, unorganized and I waited nearly an hour and only had hand luggage. Seats very small and no leg room. My flight took off 1 hour late which caused me to miss my connection in Madrid. Customer service at airport rude and didn’t explain anything, just handed me a ticket for the next day! When I said I can see online that business seats are open on a later flight (same day) I was told it isn’t possible to put me in business class. Overall completely disappointing experience with this airline!",False,,Solo Leisure,Economy Class,Las Palmas to Madrid,April 2022,2,3,"<span class=""star fill"">1</span>",1,2,,1,False
"""Overall a very nice flight""",8,2022-01-25,"Flew them before and despite low cost, business class is a joy. I booked economy but on check in I was able to purchase an upgrade for a really small fee which included lounge access and pre-boarding. Seats are a bit cramped for someone over 1.90 meters, but with an empty middle seat, not an issue. Service was great: staff was very attentive, though not fluent in English, they cared for their passengers. A really nice warm lunch was provided with beverages. Spanish products are served and I like this pride for their county. Wifi was available for a small fee. Overall a very nice flight (2.15 h) and perfectly on time.",True,A320,Solo Leisure,Business Class,Amsterdam to Madrid,January 2022,3,5,,4,5,,4,True
"""Absolutely unacceptable customer service""",1,2021-11-12,"When flying intra Europe there is not much to review abot the services in the air, nowadays not so much difference anymore. More important is the difference on the ground. Let me tell you my experience with IB Express. Check in Sevilla: 5 IB counters open, 2 for eco class to MAD, 1 for biz class to MAD, to for other flights. Long queue on eco class while staff in other counters have not helped me out. It took me longer than the flight to get checked in even though I had done online check in, but no special counter for that. Transfer Madrid: There have been two boarding gates beside each other, both have been used for two different flights which depart at the same time. It was not clear for what flight the announcements have been, also the English has been very bad and was not really understandable. Hamburg: Luggage did not make it to Hamburg. The counter for filing the problem was not staffed till one hour after landing. Then two staff appear and when seeing around 10 people queuing there one said ""Everyday same problem"". Wow!! There have been 10 people waiting, one staff left and let the other one doing the work, it took him 10 minutes per person to file the claims. Fortunately I was number 3 in the queue so I was able to leave the airport 2 hours after landing. Absolutely unacceptable customer service and the reaction of the staff clearly shows that situation seems to be normal and not an exception. One airline more on my blacklist.",True,A320,Solo Leisure,Economy Class,Seville to Hamburg via Madrid,November 2021,1,2,,1,1,,1,False
"""staff were very cautious about mask wearing""",8,2021-09-01,"No frills flight in a high density A321, mainly used between continental Spain and islands. Boarding was well organized to maintain social distancing and staff were very cautious about mask wearing. Luggage was delivered immediately.",True,A321 NEO,Couple Leisure,Economy Class,Madrid to Palma,August 2021,3,3,,4,5,,,True
"""did not let us board the flight""",1,2021-08-15,"While boarding a plane to Santorini and despite of having all required covid related documents, Iberia Express did not let us board the flight. Further, they did not take our bags off the airplane. Since we did not make the flight to Greece, we stayed in Spain without our luggage and had to buy the essentials to last few days. We are back in USA now and still don't have our bags and it's been 5 days. Iberia customer service is terrible, their luggage tracing system is a complete mess, rude uncaring staff on the phone and in airport unwilling to help.",True,,Couple Leisure,Economy Class,Madrid to Santorini,August 2021,,,,1,1,,,False
"""a nice experience""",7,2021-07-29,"Not Verified | Stuttgart to Las Palmas via Madrid. Before the flight, I needed to contact their hotline. The German hotline is a total disaster. Even after having tries it for more than 20 times it was impossible to reach someone. You are redirected from one announcement to another and at the end you get kicked out. Unacceptable and unprofessional. Finally I called Iberia in Spain and - to my surprise - not only did I reach someone just after three attempts. My problem was solve immediately by a friendly and competent employee. Due to the bad experience with the German hotline, we had very limited expectations regarding the flights. But - to our surprise again - all flights were quite enjoyable. Nice staff, good food, decent space. And all flights were on time. It is not a real business class but very good value for money. Overall, a nice experience and nothing to complain about. But Iberia badly needs to improve their German service hotline.",False,A320/321,Couple Leisure,Business Class,Stuttgart to Las Palmas via Madrid,July 2021,3,4,"<span class=""star fill"">4</span>",4,5,,4,True
"""your staff were simply disgusting in their attitude""",1,2021-07-25,"Not Verified |  I have just missed a flight with your airline through no fault of my own. I arrived at Palma, Mallorca airport with more than enough time to board the domestic flight I was meant to board. Having talked with a few others who were in line with me, we were becoming worried we’d miss the flight. Someone went to check and was told the check in gate was opened now, there were absolutely no over head speaker announcements for passengers for flight IB3923 at 11.20 Palma to Madrid on 25/7/21 to come forward ahead of the line to board immediately. We all missed our flight. To my amazement your staff were simply disgusting in their attitude towards what had gone on, there was absolutely no remorse from either of them and I was simply told to book another flight as if it was just another normal thing and we’ve all got the financial capacity to afford it. This is the worst experience I’ve had with a company in my life let alone an airline company and you should be appalled and ashamed of your staff member attitudes and inadequacy in processing a larger number of passengers wanting to check into there respective flights. I can safely say having had the worst customer service I’ve ever received I will never recommend you to anyone.",False,,Solo Leisure,Economy Class,"Palma, Mallorca to Athens via Madrid",July 2021,1,1,,1,1,,,False
"""No refund given from Iberia""",1,2021-05-09,"Not Verified |  No refund given from Iberia, after 20 emails and several phone call attempts to recover my fee, still no refund issued to me after they cancelled the flight due to covid. They refuse to give me back my money without supplying any flight, unprofessional and terrible customer service. I will never use Iberia again.",False,,Solo Leisure,Economy Class,London Gatwick to Madrid,June 2020,1,1,"<span class=""star fill"">1</span>",1,1,,1,False
"""Two weeks later I'm still waiting""",1,2020-07-03,"They cancelled 2 of my flights due to the coronavirus. For the first flight, I stupidly accepted a voucher, only to find out that they've trebled the prices of flights next year. I decided to ask for a refund for my second flight. Their cancellation form only gives options for voucher, rebooking and 'other'. Their facebook people told me to select 'other'. I did this and got an email a day later telling me that their customer services would be in touch in 'a few days'. Two weeks later I'm still waiting.  I don't mind waiting for a refund, but waiting just to apply for a refund is disgraceful.",True,,Family Leisure,Economy Class,Gatwick to Madrid,July 2020,,,,,1,,,False
"""Great job for a low-cost""",8,2020-02-16,"Gran Canaria to Madrid. Great job for a low-cost airline. Punctual, and excellent onboard entertainment system. Maybe the seats are a little bit cramped, but it is low cost.",True,A320,Couple Leisure,Economy Class,Gran Canaria to Madrid,February 2020,3,4,"<span class=""star fill"">5</span>",5,4,,4,True
"""Iberia's low cost subsidiary""",4,2020-02-13,Madrid to Copenhagen.  While the flight was on time I find both the quality of the plane and the service at the airport under standard of what to be expected from a flag carrier. Even though it this is Iberia's low cost subsidiary this plane was about 20 years old and it showed. Their on demand service with movies worked so slowly that it close to pointless. I generally had the feeling that I had payed a heavy overprise so I expected much and got a service like a low cost airline. The only choice from Copenhagen to Madrid is Iberia Express if not wanting to support Ryanair.,True,A320,Couple Leisure,Economy Class,Madrid to Copenhagen,January 2020,2,2,"<span class=""star fill"">1</span>",1,1,,1,False
"""unsatisfied and disappointed""",1,2019-11-19,"Beirut to Tenerife via Madrid. Yesterday (November the 16th), I took a flight from Beirut to Tenerife with a stop in Madrid to my surprise once I reached my final destination my luggage never arrived. (and I still haven't received it). After 40 minutes of waiting for it at the luggage conveyor belt, I realized it wasn’t there. I tried asking around and found an Iberia desk with an agent who reassured me by telling me that the luggage had arrived and that it was located in the floor downstairs, so naturally, I went to that floor and searched for around 15 minutes but it wasn't there. So, I went back to the agent to let him know that I still did not find my luggage and he told me that he would check again by himself. After having disappeared for over 20 minutes, he informed me that it was still in Madrid. So I had just lost 1 hour searching for something that wasn’t even there (after having flown for over 6 hours, with an 8-hour layover so you can imagine how tired I was) I started wondering: Why did he tell me before to search for it elsewhere? Did he even check and track my luggage when I first mentioned it wasn't there? Anyway, the agent took some information in order to send me luggage on the next day (today, November the 17th) and guaranteed that it will definitely arrive on a plane coming from Madrid to Tenerife. I got reassured as I saw a flyer mentioning an award Iberia (the airline I had just taken) received for its lost baggage's management. However, no one contacted me and I didn’t get any information on my missing luggage! Therefore, I called Iberia's office located at Tenerife’s Airport through several numbers and no one ever answered (one phone number wasn’t even working). I even called Iberia's headquarters office in England and was given another number to call. I had again wasted 1 hour between unanswered calls and automated answering machines for this same matter. Until I finally got my answer and to my surprise, my luggage was still in Madrid even though the airport agent assured me I was going to get it by today! I realize now how inconsistent this airport agent is, and how unprofessional and terrible Iberia's lost and found service is. The worst part is that Iberia is supposedly awarded for lost luggage management? All full of lies!! We live in a century where time is money. I already wasted a considerable amount of time on this matter and I can’t afford wasting more of it to get respected and have my luggage back! I am a very unsatisfied and disappointed customer, especially that it’s my first day at work tomorrow and don’t have a decent piece of clothes! I will make sure to never take this airline again if given the choice and would certainly never recommend it.",True,,Business,Economy Class,Beirut to Tenerife via Madrid,November 2019,1,2,,1,1,,1,False
"""service is extremely limited""",3,2019-11-11,"Tenerife to Madrid. The plane was not cleaned very well, the service is extremely limited a small hot dish with some rice and pork and a miniscule cake. A small glass of orange juice as welcome, only one service of drinks FA were closing the curtain very often. Long waiting in Madrid before the gate was open.",True,A320,Business,Business Class,Tenerife to Madrid,November 2019,2,2,,3,2,,,False
"""it was a decent flight""",4,2019-09-14,"Tenerife to Madrid and it was a decent flight, actually the ground staff was very polite because they also changed my seat as I asked for it. I was feeling a bit sick and very weak during the flight so before taking off I´ve asked for a blanket and a pillow and the lady brought it to me. The seats are not too bad if you are in not seating in the middle, where I was located, although the airplane was not clean, which I think it´s a shame.",True,A320-200,Solo Leisure,Economy Class,Tenerife to Madrid,July 2019,2,3,,3,3,,,False
"""doesn't offer a little snack""",6,2019-09-14,"Madrid to Tenerife. I was booked on this flight as connecting from Venice, and this was operated by Iberia Express. I went to the counter as I wanted to change seat, if possible, as my friends had another seat assigned. When I went to the counter there were two people sitting there, one lady which was the first one I went to, which asked me to wait, as she was on her phone, I was upset so I just went to the other hostess which was very kind and bit sarcastic,  and he helped me out with the tickets. Once at the gate my friends which were coming from another connecting flight, had a big delay which was almost overlapping with our next flight to Tenerife. I was afraid that they would have missed their flight. When I talked to the hostess, she was looking like she was not caring. When they started to understand what the issue was, they tried to make sure that they could make it, as it was just a little overlapping delay than. Luckily, we made it to the flight and before taking off the flight attendant came to all the passengers to offer some water. Iberia doesn´t offer a little snack, which I could almost understand on a 45 minutes flight, but that flight was 2/2.5h long. The flight was basically a night flight, so everything went smooth until we reached the destination.",True,A319-100,Solo Leisure,Economy Class,Madrid to Tenerife,August 2019,2,2,,1,3,,,False
"""refund of the airport taxes""",3,2019-09-02,"Berlin to Madrid. For personal reasons I couldn't travel. The website is not accessible for complaints or doubts. After looking in Intenet, I found a telephone where you can call them and ask. Once I got in touch I asked for a refund of the airport taxes. It is true that they return them, but they charge a management fee higher than the fees, so they do not return anything. From the consumer's point of view, we are unprotected.",True,,Solo Leisure,Economy Class,Berlin to Madrid,September 2019,,,,,2,,,False
"""they refused to return it""",1,2019-08-13,"I had a flight Tenerife - Madrid - Paris on 7th on June. Customer service told me I can buy additional baggage during online check-in. I did it once which cost me 40 euro. But baggage wasn't added. Okay, I called customer service again and asked why. They advised me to try again, 40 euros were withdrawn from my bank account. After that there were still no baggage in my order. I had to drive to the airport the day before my flight to buy baggage manually from the Iberia desk. Everything went good, and I finally got my baggage. But they still couldn't see two of my other attempts to buy it. So I tried to return money with the help of bank. After two months they refused to return it as they see the service as it was provided.",True,,Couple Leisure,Economy Class,Tenerife to Madrid,June 2019,1,1,,1,1,,,False
"""I had been placed on standby""",1,2019-08-06,"Madrid to Fuerteventura. I tried before I departed to check in but the site kept crashing so had no choice to wait till Madrid. Got to the check in counter to find that I had been placed on standby as they claimed to the flight was over booked. Went to the gate as instructed, the attendant there was very unhelpful and said wait till everyone has boarded to see if there is a seat available. So I waited with 10 others in the same situation. Lucky was able to get a seat, in fact all waiting people got a seat. Boarded the plane and found someone in my allocated seat. Asked them about it and she said the stewardess said she could sit there as it was a spare seat. Ok if it was a known spare seat why was I waitlisted? In fact after all the 10 of us who were standby boarded tgete were a couple of empty seats left. Also the ticket clearly said snack included in the flight but you had to pay for them. Arrived at the destination and went to collect bags. After all the bags had been off loaded almost half of the planes passengers bags had not arrived.  Mine was still in Madrid with the rest of the passengers bags. How can an Airline forget half of the bags?",True,A320,Business,Economy Class,Madrid to Fuerteventura,August 2019,1,1,,1,1,,,False
"""did not receive a refund""",1,2019-07-19,"I booked a flight to Madrid from Dusseldorf for 09.07.2019. The flight was cancelled last minute after midnight and we were just informed via email about an alternative flight which includes a stopover London and which required 3 times more time to reach. And even we didn't approve this change they don't refund the ticket's cost or any other action. We did not get on the alternative flight we did not opt for. After attempting to reach customer services via telephone they wanted us to open a ticket because they cannot see the incident in their system. And after opening a ticket and waiting for 5 more days we did not receive a refund but a joke: Dear Customer, we apologize for the inconvenience caused by the incident on your flight I23137 dated 9/07/2019. In order to carry out our daily operation, we depend on external factors that are beyond our scope of control and before which we have no possibility of action. Our main objective is to offer a better service to our customers every day and reduce the impact of these factors on their experience. Unfortunately, and despite our efforts, in this case, we were not been able to prevent our customers from being affected. We thank you for your understanding and reiterate our apologies for not having fulfilled your expectations. We hope your next flights are satisfactory. Thank you for continuing trust in Iberia. Kind regards, Iberia Express Customer Services",True,,Solo Leisure,Economy Class,Dusseldorf to Madrid,July 2019,3,2,,1,1,,,False
"""unpleasant and unfriendly staff""",4,2019-04-30,"Madrid to Santa Cruz de La Palma with Iberia Express. Too small space for legs if you are over 180 cm, quite unpleasant and unfriendly staff (like most Iberia staff) with very limited knowledge of English.",True,A321,Couple Leisure,Economy Class,Madrid to Santa Cruz de La Palma ,April 2019,2,2,,2,2,,,False
"""Horrible customer support""",1,2019-02-26,"Amsterdam to Porto via Madrid. My experience with Iberia is quite upsetting, it pretty much started even before I got into the plane. I ordered my ticket a while before the flight was supposed to happen and 2 days before takeoff I went over to the website to select my seats and do my online check-in, however, when I tried to do so I was met with a fee for each seat. Due to the fact that I went from the Netherlands to Portugal via Spain, I had to pay for 4 seats, each seat was at least €8 and at most €14, which came down to an additional €32 at the very least just to be able to sit. This was the first time ever I ordered tickets with Iberia as normally I fly via other companies and I was never asked to pay for my seats before unless they provided me with extra space for my legs or other luxury benefits. I called Iberia and was met with an extremely rude customer service person who barely spoke any English. I told him that I couldn't pay for the seats as the only payment method they offered was via credit card, which I don't have; He said: ""If you don't want to pay you can just go and pay at the airport"" to which I replied: Well, I am currently in the payment screen for a reason, it's just impossible to pay like this. His response remained the same, giving me a feeling like I was being cheap. Once I finally boarded the first plane everything was alright, of course, food and drinks were overpriced by a lot but I was actually quite thirsty and bought myself a coke, then some turbulence happened, the plane started to shake and a moment later I found myself, my seat and the ground below me covered in coke, the flight attendants looked at me with a rather unamused face and threw me some wipes to clean myself and my seat while speaking to me in Spanish, when I said I don't speak nor understand Spanish she shrugged and walked off. Horrible customer support, flight attendants don't care and aren't helpful, due to not being able to choose my own seats I had some horrible experiences with other customers on the plane which I didn't describe.",True,,Solo Leisure,Economy Class,Amsterdam to Porto via Madrid,February 2019,1,1,,1,1,,,False
"""Overall bad service""",4,2018-12-04,"Madrid to Florence. Do not fly this airline, it is not worth the risk of ruining your trip. We were flying from Amsterdam with a final destination of Florence. We checked two bags. First leg of the flight was Amsterdam to Madrid, which was fine. Second flight from Madrid to Florence: no AC on the airplane, it was uncomfortable and warm the entire 2.5 hour flight. To make matters worse, half an hour before landing we were told due to some conditions we would need to land at the Pisa airport, not Florence. Please keep in mind Pisa is an hour and a half from Florence. We get to Pisa, our bags are not here. We have to call Iberia (because they do not have a counter at the Pisa airport) who tell us our luggage will not arrive in Florence until tomorrow. We are only in Florence for one day, on top of that the person tells me I can’t even open up a claim with him over the phone, I have to go to an Iberia counter. He was not apologetic at all. And why would they have a system where you can’t open a lost baggage claim over the phone? Not efficient. The airline did provide a bus for passengers to go from the Pisa airport to Florence airport, but we had to wait an entire hour for it. Overall bad service and seriously not worth your risk of ruining your trip. Don’t fly this airline.",True,,Couple Leisure,Economy Class,Madrid to Florence,December 2018,2,5,"<span class=""star fill"">2</span>",1,2,,1,False
