header,rating,review_date,comment,trip_verified,aircraft,type_of_traveller,seat_type,route,date_flown,seat_comfort,cabin_staff_service,food_and_beverages,ground_service,value_for_money,wifi_and_connecticity,recommend,wifi_and_connectivity
"""have lost our money for both flights""",1,2022-08-29,"Two friends independently booked flights for 9th October online. The website automatically moved the flights to 10th October without telling us because the 9th was unavailable. We only became aware that they had done so when we received the booking confirmations. Immediately we called the call centre, who refused to cancel or refund the flight, so we have lost our money. I contacted them through Twitter, but they continued to blame us, refusing to accept that the website had automatically moved it. We are both not stupid people, and would not have independently made the same mistake, but that is what is implied. We have lost our money for both flights through no fault of our own. Customer service is awful. To clarify - we did not take the flights, so I cannot comment on ground service, seat comfort, etc.",True,,Solo Leisure,Economy Class,Milos to Athens,August 2022,,,,,1,,False,
"""our baggage was not there""",1,2022-07-12,"We had a flight from Sofia to Paros with a connecting flight from Athens. Everything was fine until they changed our return ticket from 21.00 to 07.00.  When we checked in our baggage everything seemed fine, they told us that we dont need to pick it up at Athens, it will be directly transported to Paros Airport. When we arrived our baggage was not there, we reported this problem and the lady at the counter was extremely impatient. We asked her if she knows an estimate time or any indication when this will be fixed and how long does it usually take. She advised 24 hours. 24 hours have passed and we still do not have our baggage. We tried calling the number they provided us - no answer. We called the airline support - no help at all, they couldnt do anything since they were from a different department. After calling more than 30 times the baggage support number, on the next day some lady picked up. They advised that we can buy something for 40€ per day, but lets be honest, 40€ cant even handle my pants in this resort. Awful service. Our trip is ruined.",True,,Couple Leisure,Economy Class,Athens to Paros,July 2022,2,4,,2,1,,False,
"""Unfortunately when arriving in Athens no bags""",1,2021-09-19,"Heads up for anyone planning travel in the Greek Islands. After visiting 3 Greek islands our last stop was Athens flying from Naxos to Athens on Olympic Air. Short flight, very convenient, and reasonably priced compared to Ferry option. Unfortunately when arriving in Athens no bags. This is a typical practice by Olympic as the small planes quickly are over weight limits and if you are unlucky no bags when you arrive. In our case the bags are being put on the Ferry and will arrive 3 days later. Not a great situation when on holiday. Strongly encourage folks to think about this risk when taking these short flights between the islands.",True,,Couple Leisure,Premium Economy,Naxos to Athens,September 2021,3,3,,1,1,,False,
"""will not refund any thing""",1,2021-09-17,"Not Verified |  My travelling partner tested positive for COVID 2 days before the flight and we were then unable to travel. Called the airline immediately - 4 times never got through - finally did - a curt and snappy agent - told us there was no chance to do anything. Will charge you for cancelling, will not refund any thing, will charge you again to move to a different date. Paid for extra bags, no refund, taxes paid will not be refunded. 300 euro paid for 2 people for a one way flight lasting 30 minutes.",False,,Couple Leisure,Economy Class,Mykonos to Athens,September 2021,1,1,,1,1,,False,
"""Queue for check-in, delayed flight""",5,2021-08-02,"Rhodes to Athens delayed by 42 mins. Very sad to see the delays in Olympic Air flights. Queue for check-in, delayed flight, barely any checking of my COVID vaccination status for domestic flight, no parking at jetway gates, no air conditioning in airport buses in 40 degrees. The cabin is still operated very well and the flight attendants are very helpful.",True,A321,Family Leisure,Economy Class,Rhodes to Athens,August 2021,4,5,,1,4,,True,
"""too big for carry-on luggage""",2,2021-06-06,"We arrived to the ticket counter at 5am to get our boarding passes, there were 7 of us. The person attending looked at our luggage and said only one of our luggage was too big for carryon so we paid $25 eoros to check it in. When we arrived to the gate and were about to board they attendant said that 4 other of our luggage were too big for carry-on luggage, same luggage we had on carry-on on 4 other flights we took to get to Santorini. Because we did not pay at the counter it would be 40 euros per luggage. I told the attendant that the person in the ticket counter told us they were ok for carry-on, and that person was actually also now helping with boarding so I pointed to her.  One was the person in the ticket counter and the other identified herself as the supervisor. We talked to her telling her that 40 euros was extreme when we could have paid 25 euros at the ticket counter, it was like talking to the wall. She didn't look at us and really didn't care what we were saying. They did that to 4 other people that were also tourists. Its seemed like they were deliberately misleading people to charge more money. It was very upsetting because the flight had so much space available for our luggage. They should train their staff with better customer service.",True,,Family Leisure,Economy Class,Thira to Athens,June 2021,3,3,,1,1,,False,
"""had to document the luggage for 40 euros""",1,2021-06-06,"At check in, the agent reviewed our carry on luggage and said it was fine to take to the airplane. But the door another agent said it was too big and we had to document the luggage for 40 euros. We explained the situation but agents at the door keep ignoring us, just wanted the payment. The plain had many empty seats and a lot of room for carry on luggage but none of that matter.",True,,Family Leisure,Economy Class,Thira to Athens,June 2021,3,3,,1,1,,False,
"""must make passengers feel secure""",1,2021-04-24,"I flew for business from Kavala to Athens. For a domestic flight I paid the same price as for going to Paris or Frankfurt. They packed us in a tiny airplane filled with passengers. Between the arrival and its departure there was not enough time to disinfect the aircraft. During the flight some passengers had brought their own dinner on board, spending as a result almost all the flight without masks in a jam packed environment. As if this was not enough when arrived in Athens they packed us in busses in order to reach the airport. Very disappointed. If companies want to survive the pandemic in the long term, they must make passengers feel secure.",True,DHC-8 400 ,Business,Economy Class,Kavala to Athens,April 2021,1,4,,4,1,,False,
"""All Covid measures applied""",10,2020-11-09,Not Verified |  Chios to Athens. Nice flight. Economical ticket. All Covid measures applied. Friendly staff. Gave us a treat. Professionalism. Arrived earlier than scheduled. Punctual and always with a smile. Will certainly fly with Olympic Air again.,False,Bombardier Q400,Solo Leisure,Economy Class,Chios to Athens,May 2020,5,5,"<span class=""star fill"">5</span>",5,5,,True,4
"""smiling and courteous cabin crew""",9,2020-10-21,"Not Verified |  Efficient and polite check-in at Athens Airport, buses used to access aircraft for boarding. Greeted at aircraft door by smiling and courteous cabin crew who tried to keep order when passengers were finding their seats but the problem was that people were not listening to crew instructions and were not maintaining social distance. Many were British tourists I'm sorry to say. Very short flight, just 20 minutes and we landed early. Polite goodbye from crew. Nice flight.",False,ATR,Solo Leisure,Economy Class,Athens to Mykonos,October 2020,3,5,"<span class=""star fill"">2</span>",5,5,,True,
"""the staff were quite unfriendly and rude""",1,2020-10-20,"Most unpleasant flight ever. Their method of boarding the plane wasn’t very Covid-19 friendly so if you are someone who is concerned I wouldn’t recommend you travel on this airline. Most airlines board back to front to keep crossing paths with others to a minimum. Where as this airline boarding all window seats, then all middle, the all aisle seats together in bit seat order meaning that there were about 40+ people all trying to get ton in each bath and crossing paths. They also wouldn’t let you use the overhead lockers above you which causes you having to walk up and down the aisles to find space and then squeezing past people to get back to your seat. The worst thing about the journey was the staff were quite unfriendly and rude. If you want to ruin a relaxing holiday and come back stressed - 10/10 would recommend,",True,,Couple Leisure,Economy Class,Santorini to Athens,October 2020,1,1,,1,1,,False,
"""find reasons to charge you more""",2,2020-09-17,"I flew with Olympic air from Crete to Athens. They have an inconvenient website which is not very clear of what baggage is allowed. When you go for bag drop the crew, with attitude find all the reasons to charge you more. I will avoid to fly with them from now on.",True,A320-200,Solo Leisure,Economy Class,Heraklion to Athens,September 2020,2,2,,1,1,,False,
"""staff was unaware of such visa""",2,2019-10-28,I and two of my friends had a flight from Santorini to Athens. I had a long term schengen Visa which allowed me to roam the European union before I came to Santorini where my Visa was checked multiple times. Turned out the ground staff was unaware of such visa. Thanks to one person among those who let me in. Then one of the air hostess skipped me for the chocolates and cookies.  Though I don't have any complaints from other air hostess who were friendly and fine.,True,,Solo Leisure,Economy Class,Santorini to Athens,October 2019,5,1,,1,1,,False,
"""Great service and great people""",8,2019-09-22,"The self check in was extremely busy especially because of the congestion at the Athens Airport. However, Aegean/Olympic agents were helpful and move me fast. Flight was on time and the ATR was clean, comfortable; food service and beverages was very generous. I found out that the Athens-Malta leg is run under the Olympic brand and they feed you well. Indeed, they announced Olympic when they went on air, but I was holding a Aegean Ticket. This is when I found out that its a double brand. We arrive on time in Malta. It was an ATR aircraft so I was not expecting any sort of in-flight entertainment and WiFi. Its was a short leg. I would love to fly Aegean/Olympic again. Great service and great people, distinctively Greek.",True,ATR,Solo Leisure,Economy Class,Athens to Malta,August 2019,4,5,,4,5,,False,
"""charge of 70 euros for luggage""",2,2019-08-28,"Heraklion to Athens. My husband and I were very disappointed with the unexpected charge of 70 euros (35 each) for our luggage. We were on our way back to Athens from Heraklion after almost 2 weeks of travelling to different islands with our 2 luggage (where are you supposed to leave them?). Finally, we were returning to Athens to catch our flight home and the attendant at the desk told us we had to pay for the luggage. After trying to explain to her, unsuccessfully, the situation, she kept going in circles. Where’s the courtesy to tourists who are coming to the country to spend their money, sounds like abuse to me. Well, I know I sound bitter, and I am. I don’t think is fair.",True,,Couple Leisure,Economy Class,Heraklion to Athens,August 2019,2,2,,1,1,,False,
"""last minute delays""",1,2019-08-12,Chania to Athens. Be aware of this airline delays. I lost 1 day of my 4 days vacation due to their last minute delays. It's sad that during summer morning flights should be delayed.,True,,Family Leisure,Economy Class,Chania to Athens,August 2019,3,3,,4,2,,False,
"""other flight wouldn’t wait""",2,2019-08-08,"Santorini to Istanbul via Athens. Santorini flight to Athens delayed 2 hrs. The other flight in transit from Athens to Istanbul same airline (Olympic / aegean) wouldn’t wait although only around 30 mins behind schedule.  In result, they gave us another flight 9 hrs later from Athens to Istanbul. And as a result, we couldn’t able to catch our third flight from Istanbul to ASR. We had to deal with the flight to ASR ourselves with Turkish airline. They cannot able to help although they are partners. We had to get the flight on the next day to ASR from Istanbul. All the things planned and hotel are ruined.",True,,Couple Leisure,Economy Class,Santorini to Istanbul via Athens,August 2019,3,4,,1,3,,False,
"""Worst check-in experience""",2,2019-08-08,Athens to Sitia. Passengers are forced by ground staff at ATH to use the self-tagging system of luggage without any efficient help or guidance. Response of indifferent handling agents: “It is the company’s policy”. Worst check-in experience ever. Cabin crew should better get rid of haughty attitude towards passengers and shape up with some professionalism…,True,Dash 8 Q400,Solo Leisure,Economy Class,Athens to Sitia,July 2019,2,2,,1,2,,False,
Olympic Air customer review,10,2019-07-31,"Not Verified |  Athens to Chios. The staff was very nice and polite. How short the flight may be, 45 min. including take off and landing, they were still serving snacks and refreshments. I am a tall person, 1,85, so the seats were a bit small, but that was no problem at all. Because it is a small airplane. When our baggage was delayed last year, it was handled very well, they flew it in the same day on the next flight. Over all it isn't for nothing that it is the best domestic airline!",False,Dash 8 Q400,Family Leisure,Economy Class,Athens to Chios,July 2019,3,5,,3,5,,True,
"""flight itself was fine""",5,2019-06-25,"Rhodes to Athens with Olympic Air. The flight itself was fine. The A320 was clean, with those typical hard-cushioned thinner type seats albeit with good legroom. You also get a free sugar kick via a paper cup of coke, a cookie and a candy in a swift non-dentist-friendly service which is not much, yet already 3x more than what you get on an LCC. Engaged FAs with a certain flair also add to the appeal. The problem was that the flight was delayed for over an hour yet no one considered it a good idea to inform people already queing up at the gate. It was only 5 mins after the original departure time (still on the gate screen) that a ground handling lady showed up to inform passengers that the plane hadn't taken off yet from Athens, so she couldn't really say when we would fly. Why on earth would A3 just let people go airside at what is easily one of the busiest airports per square ft, just to try to find a spot to seat for hours with no info? And even if the airport staff at Rhodes is overwhelmed, why don't you use the app to inform passengers? As I type this, I see that the Sunday flight was also an hour and 15 mins late. Is that a pattern? Bottom line, if you are booking your flights independently, allow plenty of slack for your connecting flights as high season ramps up.",True,A320,Couple Leisure,Economy Class,Rhodes to Athens,June 2019,2,3,"<span class=""star fill"">2</span>",3,5,,True,1
"""Seat space was so limited""",4,2019-02-12,Olympic Air flight from Athens to Rhodes was operated by Aegean. The flight departed on time and reached destination on time. No food or beverages served on 1 hour flight. Seat space was so limited. Very disappointing.,True,A321,Couple Leisure,Economy Class,Athens to Rhodes,July 2018,1,4,,5,3,,False,
"""better service, lower price""",9,2018-11-19,"Direct flight a new service from Athens to Catania and return. It was full of Italian tourists returning home. I asked them why they do not travel with Alitalia. They replied that they got better service, lower price and they do not have to go via fiumicino.",True,,Business,Economy Class,Athens to Catania,June 2018,5,5,"<span class=""star fill"">3</span>",5,5,,True,3
"""there are always problems""",2,2018-09-21,"Kefalonia to Athens. I fly Olympic regularly between Athens and Kefalonia and there are always problems. This trip, the online check in failed. At the airport I had to pay 5 euro for extra leg room and it took them an hour to process the payment. Then I was told the plane was so full my hand baggage had to go in the hold. The plane was not full and there was plenty of space in the overhead storage. Needless to say, the flight was late and on arrival in Athens the baggage took a long time to arrive. Avoid if possible.",True,Boeing 737,Business,Economy Class,Kefalonia to Athens,September 2018,1,3,,1,3,,False,
"""the worst airline""",1,2018-08-28,"Myself and my girlfriend had a flight from Milos to Athens today 27/08/2018 arriving at 2pm to catch another 2 connection flights to Slovenia from Athens. For some reason the aircraft was small for the number of passengers booked in that flight, so they decided to leave us out together with some other passengers, giving 250 euros to compensate this mistake. The problem is we had to buy new flights for tomorrow morning which cost 700 dollars plus the accomodation and transport in Athens, plus I've been trying to contact their customer service for over 3 hours and no one picks the phone. It was definitely the worst airline I have dealt with.",True,,Couple Leisure,Economy Class,Milos to Athens,August 2018,1,1,,1,1,,False,
"""not recommend this airline""",2,2018-08-14,"I had my flight booked in the evening at 23:00 from Chania to Athens. Due to unforseen circumstances my partner had to leave earlier in the morning to a different destination. I was at Chania airport from 11am for that reason and I asked at the Olympic Air desk about availability of earlier flights instead of waiting alone till 11pm at the airport. I found the staff very unhelpful reporting that there are seats left at the 18:00 flight but I have to pay 60 euros extra fee for the change of flight. I was expecting a little bit more understanding, especially since they saw me standing there all day in front of them until 5pm. I value kindness and morality above money, but clearly this is not the case for this company. I would not recommend this airline for that reason.",True,,Solo Leisure,Economy Class,Chania to Athens,August 2018,2,2,,1,1,,False,
"""I would fly again""",10,2018-07-02,"Athens to Catania. Direct excellent flight, everything was on schedule, departure, flight time and arrival at Catania Airport. Service was excellent though not enough space in the aircraft. This is why the airplane was fully booked from Italian tourists. I would fly again. I saved valuable time instead of flying via Rome.",True,,Business,Economy Class,Athens to Catania,June 2018,5,5,,5,5,,True,
"""Cabin crew were friendly""",8,2017-10-03,"✅ Verified Review |  Athens to Tirana. After 4 hour waiting in Athens the smooth boarding process started. Bus transfer to the propeller aircraft. The flight was full and just took 1 hour 20 minutes. Usually on such short intra european flights there is no inclusive meal service. To my surprise, direct after take-off a sandwich was served with free beverages, beer or wine. Thereafter coffee or tea with a small cookie. Like european flights 20 years ago. Cabin crew were friendly and we landed on time in Tirana.",False,DHC-8 400,Solo Leisure,Economy Class,Athens to Tirana,September 2017,3,4,,4,4,,True,
"""it was a pity that the flight was so short""",10,2017-10-01,"✅ Verified Review |  Flew Milos to Athens. I always like to fly Olympic Air (and Aegean) because I love the product these airlines offer, and this flight fulfilled my expectations. First of all the flight time is not even 25 minutes. The cabin was very clean and fresh, we had a great flight attendant who was a shining example for the industry: professional, friendly and caring. She handled (alone!) the fourty-seater, fully booked plane effortlessly. It is amazing that on such a short hop you get a choice of beverages and a snack. Great Job Olympic, it was a pity that the flight was so short.",False,ATR 42-600,Solo Leisure,Economy Class,Milos to Athens,September 2017,4,5,,4,5,,True,
"""Highly recommended""",10,2017-09-04,✅ Verified Review |  Kavala to Athens. Flight departed on time. Smooth boarding. Crew were extremely professional and polite. Snacks and beverages were served. Smooth arrival at Athens International Airport. Baggage delivery was fast. Highly recommended.,False,DH8D,Business,Economy Class,Kavala to Athens,September 2017,5,5,,5,3,,True,
"""friendly services rendered""",9,2017-07-04,"✅ Verified Review | Very good organization and attitude from Olympic Air flight staff. Continous non stop service from Athens to Thessaloniki and wide variety of drinks, foods and beverages. Short flight however all passengers were smiling with the friendly services rendered. Reached destination earlier than the scheduled time. I would travel again.",False,,Solo Leisure,Economy Class,Athens to Thessaloniki,May 2017,5,5,"<span class=""star fill"">3</span>",4,5,,True,
"""Crew very professional""",10,2017-06-07,"✅ Verified Review |  Athens to Belgrade. Flight booked with Aegean Airlines but operated by Olympic Air. Relatively small aircraft for a short route (Athens to Belgrade) and a bit slower than jets, however it was pretty pleasant and the bonus is that there is no middle seats and also the views were great. Some Israeli passenger were pretty worried and a bit aggitated, as some friends were coming from another (connection) flight and they had not showed up, however the crew informed them that that the aircraft would be waiting for them and they would not miss the flight. They were pretty professional and the 3 connecting passengers showed up. The aircraft departed with a minimal delay of 10 minutes and landed almost on time. Althouh they charge for checked luggage and the aircraft is small, the situation was pretty ok. Relatively good size baguette was served, which tasted well, a sweet snack and 2 rounds of drinks. Crew very professional. Buses were used on both airports - this aircraft is not compatible with bridges. to sum up it was a nice and comfortable flight. Totally recommended!",False,Q400,Solo Leisure,Economy Class,Athens to Belgrade,June 2017,4,5,"<span class=""star fill"">4</span>",5,5,,True,
"""experience summed up as marvellous""",10,2017-03-26,"✅ Verified Review |  Heraklion to Athens. After a rather fast bus boarding procedure and a kindly welcome by the cabin crew, the plane took off in time. The breakfast was excellent for a 40 minutes flight: warm criossants, a delicius cappucino with a perfect milk froth, greek yoghurt, local vegetables and a variety of cheeses which came along with chocolates, and several other snacks; not to mention the large options of beverages. The flight experience can be summed up as marvellous!",False,A320,Solo Leisure,Business Class,Heraklion to Athens,March 2017,5,5,"<span class=""star fill"">5</span>",4,5,,True,
"""service is exemplary""",8,2016-09-05,"Connection from Athens to Zante with Olympic Air. Although the flight was marginally delayed we still managed to arrive on time on the island. These internal short hop flights are always full but service is exemplary, plane clean and a pleasure to utilise for Greek island ""hopping!"" Same again in 2017 for my annual visit.",False,,Couple Leisure,Economy Class,ATH to ZTH,August 2016,4,4,,4,3,,True,
"""cabin crew very helpful""",9,2016-09-02,✅ Verified Review |  I flew Olympic Air from Athens to Chios. The cabin crew was very helpful and I was amazed that snacks and drinks were served in such a sort flight (about 25 mins). The pilots were very informative and performed perfect landing despite strong winds. The aircraft was very clean. I would fly with Olympic Air again.,False,Bombardier Dash 8 Q400,Solo Leisure,Economy Class,ATH to JKH,September 2016,4,5,,5,4,,True,
"""crew service was excellent""",8,2015-09-30,"Olympic Air takes most of the flights within the Greece. Even though the flight was very short, around 30 minutes, crew service was excellent. The weather was bad, severe turbulence and the steward was outstanding. He manages to calm us down even though the flight was not very pleasant due to the bad weather. The plane was the one with propellers which was a little loud, but it is fun. Due to the bad weather they did not any snacks or drinks, but we did not care, we just wanted to land in one piece. The view from the plane was marvellous while we were landing, the nature in Greece is wonderful. And overall, we were very satisfied with the service of Olympic Air.",False,,Couple Leisure,Economy Class,Athens to Skiathos,June 2015,3,5,,5,5,,True,
Olympic Air customer review,9,2015-08-10,"We have flown with Olympic Air twice, once was from Athens to Kefaloania, and the 2nd time was from Zakynthos back to Athens. Both were pleasant. The crew, food, drinks, service and view out the window was great. Would fly Olympic Air again.",False,DHC-8-400,Family Leisure,Economy Class,Athens to kefalonia,July 2015,5,5,,3,4,,True,
Olympic Air customer review,8,2015-07-21,"Flight attendants were very polite and helpful. It's aircraft are not very well preserved (the interior of the aircraft). The seats were comfortable but you could see they where a bit worn at their edges, also the windows are very blurry and scratched.",False,Dash 8 Q400,Family Leisure,Economy Class,Athens to Skyros,July 2015,4,5,,4,4,,True,
