header,rating,review_date,comment,trip_verified,aircraft,type_of_traveller,seat_type,route,date_flown,seat_comfort,cabin_staff_service,food_and_beverages,ground_service,value_for_money,wifi_and_connecticity,recommend,wifi_and_connectivity
"""Avoid a headache""",1,2022-09-28,"The boarding protocol and check engine took so long that they couldn’t depart at 1 am, then, around 2 am, Lima airport stop Sky Airline flying, because of being so late. In consequence, all the passengers had to wait until 5 am to do can flight to Miami. Many of us lost international connections because of this, with no solution just excuses. Avoid a headache and waste of time and money.",True,,Solo Leisure,Economy Class,Lima to Miami,September 2022,1,1,,1,1,,False,
"""Excellent experience throughout""",10,2022-08-09,"Excellent experience throughout. We were meant to fly from SCL (Santiago, Chile) to ZCO (Osorno) on 8 Aug. Our first attempt was thwarted as we were unable to land at the destination airport due to heavy fog and had to head back to our origin (the crew would have fallen out of duty, which made a diversion impossible). Communication and management of the situation were flawless. We were kept up to date at all times, and we were given generous meal vouchers. To top things off, we were even provided with a compensatory voucher for our next journey with the airline. The latter came in totally unexpected, as the hiccup was of course not the airline’s fault and beyond their control. After a two-hour wait at SCL and once the fog had cleared, SKY flew us to our destination. A big thank you and well done to the staff at SKY Airline, both visible and behind the scenes, for this seamless, passenger-friendly, and pleasant experience.",True,A320neo,Solo Leisure,Economy Class,Santiago de Chile to Osorno,August 2022,4,5,,5,5,,True,
"""Good manners would go a long way""",6,2022-07-20,"On July 10 2022 I flew Sky Airlines from Lima to Cusco. Passengers are forced to board the plane by walking on the tarmac on cold weather, to be transported by bus to the plane. Seats are uncomfortable, no entertainment onboard, no snacks or drinks. For my trip, double face masks were enforced. I was wearing only one, but one flight attendant demanded me that I wore two masks instead of one. Flight crew came out rude and authoritative. Good manners would go a long way.",True,,Family Leisure,Economy Class,Cusco to Lima,July 2022,1,1,"<span class=""star fill"">1</span>",4,4,,False,1
"""Stay away from Sky! You have been warned!""",1,2022-07-16,"I have to agree with previous reviewers that this is absolutely the worst airline I have ever dealt with. No idea how they are able to stay in business. I purchased the ticket for my friend, from Buenos Aires to Cancun, roundtrip. Her flight was supposed to be yesterday afternoon. They sent her an email in the morning saying that her flight was cancelled until today. You are not able to call to talk to a human, they only use texts. During the texting they informed her that because her flight was cancelled that she would have to contact the third party that I purchased the ticket from, to arrange the second leg of her flight, from Lima to Buenos Aires. She called them (Travelgenio) and they told her they had nothing to do with it. Now she's at the airport in Cancun and they're telling her, in person, that Travelgenio changed her flight, not them. They're refusing to look at the email that Sky sent her. If she gets to Lima they're telling her she'll have to layover for 26 hours! She's going to miss out on work and a family gathering. And no fault of hers or mine whatsoever. It's a complete nightmare and communication break down. Stay away from Sky! You have been warned!",True,,Solo Leisure,Economy Class,Buenos Aires to Lima via Cancun,July 2022,1,1,"<span class=""star fill"">1</span>",1,1,,False,1
"""The worse airline I ever met""",1,2022-07-06,The worse airline I ever met. I change the date of my flight they charge me 15 dollars and they say everything is fine I do no have another payment and at the airport they can't find my flight reservation I gave them all my information my tickets and they just say they can't find me after send me from a place to another and when I call sky airlines suddenly I have 195 dollars to pay for change the date of my flight. Finally I pay and then they said you are already late for your flight. I ask them if I can go in another flight they say you have to pay 195 dollars. I explained them I just paid 8 minutes ago they say you missed that flight. They make me lose my time at the airport if they just could and tell me you need to paid instead of make wait until last minute so I can pay for nothing and miss my flight and make me pay again.,True,,Family Leisure,Economy Class,Cuzco to Lima,July 2022,1,1,"<span class=""star fill"">1</span>",1,1,,False,2
"""ended up paying for my flight three times over""",1,2022-05-26,"I booked a roundtrip flight from Lima to Cusco with Sky Airline on March 14. This flight was booked on Sky's website, NOT through a third party. The return flight was to leave Cusco at 8:10pm. On April 25, Sky Airline sent an email to say that they have moved the flight to 12:50pm. I wasn't going to arrive in Cusco on my way back from Machu Picchu Pueblo until 2:32pm via Inca Rail. Therefore, moving the flight seven hours earlier meant that I would be unable to catch this flight. Their email gave a link to apply for a full refund which would be processed within 30 days of application. I submitted that on April 26 and got a confirmation email of receipt sent to my inbox. However, one month later and multiple attempts to get in touch with the airline via follow-up emails and live chat have been unsuccessful. I ended up having to book a new last-minute flight with LATAM, so I ended up paying for my flight three times over. Disgusting and unprofessional!",True,,Couple Leisure,Economy Class,Lima to Cusco,May 2022,,,,,1,,False,
"""charged us for our backpacks""",1,2022-05-04,We are foreigners and kind of used to people trying to rob us in Peru just because we are tourists but this was too much and we got really mad. Sky Airline charged us for our backpacks which are 10kg and 15kg. They charged us $36 per backpack even though we said one of them is a carry on and fit the carry on sizes. It says $12 baggage fee online but the truth is $18 when you want to add it on their website. I asked the man if we still can buy online at the counter and he said no. But we would have and should have. I don’t recommend!,True,,Couple Leisure,Economy Class,Tarapoto to Lima,May 2022,1,1,,1,1,,False,
"""wanted me to do a PCR test""",1,2022-04-17,"This airline uses deceptive practices. I bought a ticket CJC- SCL in Chile and was denied check in because apparently the Ministry of Health has disabled my mobility pass for travel in Chile. First, getting into Chile I had an active Mevacuno access and pass, also PCR negative from entry to arrival in Santiago x2 tests. With my access to Mevacuno, my mobility pass was still current, yet Sky airline wanted me to do a PCR test before they could check in online. This was my last flight before flying international the next day. I tried seeking help to no avail on the app, no customer phone line, and limited staff/counter time especially in Calama, Chile. I couldn't get help from Sky Airlines Chile. In the end I bought LATAM TICKETS and boarded without issues so as to not miss my international flight. MY rapid PCR IN Santiago, Chile is negative. The use of incorrect information, and poor customer service makes this the worst experience in my international travels. Do not travel with this airline especially with COVID-19 protocols and economic challenges.",True,,Solo Leisure,Economy Class,,April 2022,,,,1,1,,False,
"""one of the worst experiences I have ever had""",2,2022-03-05,"I fly frequently and have never written a review before but was so incredibly frustrated with the experience this morning in Calama, Chile. I was at the airport an hour forty minutes before departure and sitting next to the gate. Right before departure, I heard my name. I went down and they had denied my luggage boarding due to a bottle of insect repellent. In the last month, I had flown with the same luggage from Miami, Santiago, Puerto Montt, Ushuaia, Buenos Aires, Santiago again without issue. They said it was too late to change flights and would put me on the next flight 8 hours later! I said I wanted them to switch me to a different airline but they said they couldn't do it. They even suggested I would need to pay a rebooking fee although they later dropped that. Even if we had hustled, I could have made the flight and we could just thrown away the repellent which cost a few dollars. But instead the person at the counter ignored me, after recognizing my presence and helped other people who weren't even flying. I have flown so many times in my life and it was one of the worst experiences I have ever had. Absolutely incredible the complete disregard and ignorance to customer service in a customer service based industry.",True,,Solo Leisure,Economy Class,Calama to Santiago,March 2022,3,3,,3,3,,False,
"""difficult to get in touch with""",1,2021-09-08,Booked 4 round trip flights from Lima to Cusco. Had to cancel two of the flights because of a Covid scare. Entered the names and documents ids for the two that were unable to attend and it canceled the return flights for my wife and I as well but none of the documentation showed which flights were cancelled and the reservation still looked the exact same on their website. It wasn’t until attempting to check in that we realized what occurred. Had to rebook at a last minute price and use the entire voucher so now have to repurchase flights for the other two individuals. Customer service was extremely difficult to get in touch with and was no help when we finally did.,True,,Couple Leisure,Economy Class,Lima to Cusco,September 2021,,,,,2,,False,
"""feel as though they stole from me""",1,2020-06-17,"I will not use this airline again if I can help it. I am sorry that I couldn't fly to Peru. And I am sorry that you are not able to provide a service. But if I am not allowed to fly, then I should get my money back. I feel as though that is common decency. Refusing to refund those who can in no way fly because of COVID, I feel is bad business and reflect bad corporations. I am very unhappy and feel as though they stole from me because of conditions out of my hands, but the Peruvian Government hands.",True,,Couple Leisure,Economy Class,Lima to Cusco,June 2020,,,,,1,,False,
"""their service is very bad""",1,2020-01-21,"Santiago to Buenos Aires. I will never fly with this airline again and despite being a little cheaper than the competition, their service is very bad. It all starts with their website, I got an error message when trying to booking a flight there and tried to do it again with another card (getting the same error message). It turned out that they booked the same flight to the same person twice and when I reached out to customer service over the phone they said I had to do it over email. I did it on December 6 and after several attempts and follow ups, I am finally giving up!",True,,Solo Leisure,Economy Class,Santiago to Buenos Aires,November 2019,1,1,"<span class=""star fill"">1</span>",1,1,,False,1
"""very bad experience""",1,2020-01-13,Arequipa to Lima. I had a very bad experience with this airline. No good information about the delay and no support or refund because of my missed connection flight and resulting hotel costs etc. Would never fly again with them.,True,,Solo Leisure,Economy Class,Arequipa to Lima,January 2020,1,1,,1,1,,False,
"""Online check-in did not work""",4,2019-12-20,"Lima to Mendoza via Santiago. Online check-in did not work. My layover was 4 hours and 10 minutes, so the airline would not check my luggage to my final destination. I had to collect baggage at my layover, clear customs, and recheck it again. Was charged separate checked luggage fee for each connecting flight. Legroom was among the shortest I have ever seen.",True,,Solo Leisure,Economy Class,Lima to Mendoza via Santiago,December 2019,2,3,"<span class=""star fill"">1</span>",1,3,,False,
"""unpleasant flying experiences""",1,2019-12-18,"Sao Paulo to Santiago. One of the most unpleasant flying experiences. It seems like the airline staff has no concept of customer service. Unusually long check-in at the counters. Took every passenger more than 10 mins to check-in. Did not accept the online boarding pass, so had to stand in a queue. On a 4 hour flight, they do not even offer water for free ($3 for a bottle), which is inhumane. No inflight entertainment and very uncomfortable seats that do not recline. When the flight landed and parked, the gates did not open for 30 mins and no explanation was offered. Which was pathetic",True,,Solo Leisure,Economy Class,Sao Paulo to Santiago,December 2019,1,1,"<span class=""star fill"">1</span>",2,2,,False,
"""asked to postpone the flight""",1,2019-12-17,"Lima to Arequipa. I had a very bad experience with this airline. I was in Peru and my mother was very ill. She passed away the day I had to fly with Sky from Arequipa to Lima. We had asked to postpone the flight. They never answer. You have to spend hours at the phone to try to get someone to manage your problem. Still today I am waiting for their answer. I am back in Germany, I had to buy a ticket for 300 dollars from Arequipa to Lima (Lan ticket) to get my international flight.",True,,Family Leisure,Economy Class,Lima to Arequipa,November 2019,,,,,1,,False,
"""hand luggage about 2cm too high""",1,2019-12-01,"Calama to Santiago. We had a bad experience with this airline. We had normal size hand luggage but Sky Airlines say they are about 2cm too high. We did not have any other hand luggage just a large bag We gave up for which we paid of course. So now we paid 60€ take hand luggage with us in airplane.  Also for me (1,90m, thin) seats are too small so I cannot sit without legs on the side. All in all very bad experience.",True,A319,Couple Leisure,Economy Class,Calama to Santiago,November 2019,1,3,"<span class=""star fill"">1</span>",1,2,,False,1
"""my reservation was cancelled""",1,2019-11-11,"Terrible experience due to inexistent customer service. I had booked online a flight Lima to Santiago then a second flight Santiago to Buenos Aires. On the day of my first flight, as I want to check in on Internet, I realized that my reservation was cancelled, without notice and without explanation. I called the service center through my hotel, they never picked up although I was calling during the announced opened hours. I went to the airport, the Sky airline counters repeated me they were unable to help me. I had to call the service center to deal with an internet purchase. It's a Peruvian number and I don't have a working cell in Peru. They told me my only option was to use public phones, which I did on my money, still without luck. The supposedly available customer service line never picked up. Because no one on ground could apparently help me, I eventually lost that flight. And obviously lost the second flight in this way, along with a couple of 100$. Needless to say, I couldn't cancel it properly because, guess what. The customer service, well, never picked up my call. I honestly never had such bad experience with any airline customer service. I am pending on potential partial refund of the second ticket.",True,,Solo Leisure,Economy Class,Lima to Buenos Aires via Santiago,November 2019,,,,1,1,,False,
"""paying the US$70 to board""",1,2019-08-31,"Santiago to La Serena. When boarding the preferential boarding line for the bank of Chile (whose preferential customers are allowed to carry luggage at no cost), they asked us for the identity card and credit card of the bank of Chile and let us pass, along with Our hand luggage without any problem. That to 6 of us, while 2 of our friends are told that they have to pay for the luggage for not being customers of the Bank of Chile. The rest of our friends board the plane, while I returned with my wife to the boarding counter to try to help our friends thinking that with our benefit from the Bank of Chile, with the Master Card and Visa Infinite Black cards of both, we could also include our other 2 friends who travel under the same reservation of ours. We failed to convince the person at the counter, who finally charged our friends US$35 for each hand luggage. In the meantime they told us to board while they were paying, but we stayed to wait for them. But the worst comes later. The person at the counter, angry because we claim to try to help our friends and recorded the situation, told us that now we also have to pay US$35 for hand luggage, US$70 in total. At that time we showed her again our ID and black cards from the bank of Chile and we explained that we had already passed a while ago, but there was no case. She told us that we should have gone to the check in counter to qualify for the benefit. I have flown about 20 times with Sky Airlines in recent years using the benefit of the Bank of Chile and had never had a problem with my hand luggage using the benefit, having almost never gone through the check in counter. Moreover, one of the main reasons to choose Sky vs Other airlines is for this benefit. Additionally, I mentioned that we tried unsuccessfully to go through the preferred counter to try to change my seat for emergency exit and pass the baggage but there was a huge line of about 30 people and a single counter attending, which made it absolutely unfeasible and we would miss the flight waiting more than an hour at the preferred customers line. After a long discussion with the person at the boarding counter and about closing the door of the plane, they called the supervisor to try to fix the situation. But the supervisor was inflexible, she understood nothing about the situation and told us that if we didn't pay the US$70, the plane would let us down. Even after a couple of payment attempts, the payment machine did not work for them. Even so, she did not want to make the exception, while the gate was already closed. Finally, and with tremendous discomfort, we ended up paying the US$70 to board, while large numbers of passengers, without even being clients of the bank, passed their luggage without paying and without anyone telling them anything. After this I asked the supervisor for her name in order to write a claim. But she didn't want to give me her name, saying that if I insist, she would let me down the flight. One thing is to have no-criteria to handle the situation. But another much more serious is not to be responsible for that non-criteria, without being willing to give the name and abusing the power at that time when the plane was going to let us down.",True,A320,Business,Economy Class,Santiago to La Serena,August 2019,3,4,,1,1,,False,
"""canceled  flight without any notice""",1,2019-08-24,"Cusco to Lima. They canceled the flight without any notice. We found out when we arrived to the airport by 2 uninformed employees who couldn't tell us when and if we would have had an alternative flight. We had to go to Lima because the day after we would have come back to Europe, thus we bought 2 more tickets by own with LATAM at the cost of 450 us$, in addition to the 180us$ already spent with Sky airline. The company'employees told us we could only ask for a refund in Lima. When we arrived in Lima, the clerk dumped us and left us the call center number. A Peruvian number, that if you don't have a local mobile is difficult to contact. The centralist told me that I had the right to a refund and that it would be arrived within 15 days. I really want to see what'll happen. For now we just felt cheated.",True,,Couple Leisure,Economy Class,Cusco to Lima,August 2019,,,,1,1,,False,
Sky Airline customer review,1,2019-05-15,Buenos Aires to Santiago. Staff have no intention to speak in English - not all of us speaks Spanish. My friend's got damaged on first flight. Couldn't get help or no one to complain. Just gave email address and walked off. Not even sorry. Second flight was even worse. Lagguage got lost and the same. Asked for hotel and another people translated that bag will came with next flight and be delivered to your hotel.  Next day took a couple hours until those staff found bag.,True,A320,Couple Leisure,Economy Class,Buenos Aires to Santiago,May 2019,3,1,,1,1,,False,
"""Leg space was adequate""",6,2018-11-16,"Santiago de Chile to Buenos Aires. Sky Airline is a low cost airline based in Santiago, Chile. I took a short flight of 2 hours from Santiago to Buenos Aires. The flight departed on time. As a low cost airline, seating is in one class. Leg space was adequate. The crew came around to sell drinks and snacks shortly after takeoff. My overall impression of the airline is that it will get you safely to your destination with no frills.",True,A320,Solo Leisure,Economy Class,Santiago de Chile to Buenos Aires,November 2018,3,3,,4,4,,True,
Sky Airline customer review,1,2018-08-15,Lima to Santiago. One of the worst airlines I have flown. We were put on and off the plane twice for two separate mechanical issues. Then they lost our luggage and the gate agents were clueless on what to tell people. I eventually had to buy a new ticket on a different airline.,True,,Business,Economy Class,Lima to Santiago,August 2018,3,3,,1,1,,False,
"""exactly as you'd expect""",1,2018-06-21,"I flew with Sky Airline from Santiago to Calama (the closest airport to the Atacama desert) and when getting my baggage it was broken - the strap of my backpack was damaged. I told airline-personnel at the airport but they refused to help and just pointed at the customer service which was supposed to contact me within 10 days. Of course I never heard of them so I wrote an email myself. It took quite a while for them to respond but with the same result as directly at the airport - they acknowledged the problem but refused to stand for it.  So in case you fly with them, hope that everything will be fine afterwards, you probably won't get compensated otherwise. The flight was exactly as you'd expect it from a low-cost airline - they got me from A to B.",True,,Couple Leisure,Economy Class,Santiago de Chile to Calama,February 2018,3,3,,3,1,,False,
"""Customer service is non-existent""",1,2017-12-18,"Flew Sky Airline from Punta Arenas to Santiago. Horrible airline, pay the extra for LATAM. Customer service is non-existent. The booking process is completely broken and doesn’t work reliably on iOS devices. Flights don’t run on time. Passengers booked on the same PNR aren’t seated together unless you pay more. They managed to leave our luggage behind, and had no staff or baggage services to help.",True,,Couple Leisure,Economy Class,Punta Arenas to Santiago ,December 2017,3,4,"<span class=""star fill"">1</span>",1,2,,False,1
"""good low cost alternative""
",6,2017-12-11,Good low cost alternative to LATAM. With a group I flew from Santiago to Punta Arenas. The flights were on time and the service was very good. The only comments are that the seat pitch isn't brilliant (we flew once on newer aircraft) the pitch seemed limited. And the check in at SCL was a bit of a nightmare. If checking in bags turn up 2 hours pre departure as there were queues. Would fly with Sky again as their prices are favourable compared to the national carrier. If you're from Europe this airline is comparable to Easyjet.,True,A319,Couple Leisure,Economy Class,Santiago to Punta Arenas,November 2017,3,5,,3,5,,True,
"""seat pitch better than expected """,6,2016-10-30,"Buenos Aires to Lima via Santiago de Chile. Their web page is not fully functional in English and booking does not go smooth all the time as some reviewers already wrote. I was booking two separate tickets for two different flights and one payment was not accepted but I got confirmation number. To avoid being charged multiple times I used both contact form and provided email contact to ask about payment but never got an answer. After checking with card provider that card was not charged I bought ticket for the other flight few days later. Payment was accepted and confirmation mail sent with the new booking number. Online check in is available 2 days and 3h in advance and boarding passes need to be printed and presented during baggage drop off. Luggage drop off was done at normal check in counter, 23kg hold luggage is included in ticket price. Planes are boarded from the last row and it was well organised. Both flights were full. Planes are in fine condition and clean, there are ads in the cabin but not too many. Seat pitch was better than expected and I had enough space even on longer flight to Lima which is 3h30m long. Buy on board have few options and is affordably priced. Pesos and U$ are only accepted. FAs were well groomed and professional. There was no selling of lottery and similar things, flight deck gave info about the flights and bridges were used all the time for boarding and disembarking. Both flights left and arrived on time. Few days after the first flight feedback survey was sent and it was in Spanish, no option to choose Englis. Messy web page, problematic booking and lack of communication after pushed down the airport and flight experience which could be described as good as any European short haul experience, legacy or LCC.",False,A319,Solo Leisure,Economy Class,EZE to LIM via SCL,October 2016,3,4,,3,3,,True,
