header,rating,review_date,comment,trip_verified,aircraft,type_of_traveller,seat_type,route,date_flown,seat_comfort,cabin_staff_service,food_and_beverages,ground_service,value_for_money,wifi_and_connecticity,recommend,wifi_and_connectivity
"""Good service and polite""",8,2022-05-20,Good. It would be better if the flight time is more punctual. My flight is a little delayed. Anyway the staff are really nice. Good service and polite.,True,,Business,Economy Class,Bangkok to Phuket,May 2022,4,5,,4,4,,True,
"""Excellent service quality2",10,2022-05-18,Excellent service quality. Professional people from ticketing to call centre to handling flight changes and flight cancellation to ground staff to cabin crews as well as cabin cleanliness. On time. Recommend.,True,,Business,Economy Class,Hat Yai to Bangkok,May 2022,5,5,,5,5,,True,
"""flight experience is very pleasant""",10,2022-05-18,"The overall flight experience is very pleasant. The seats are clean, comfortable, and spacious. The flight crews are very hospitable and efficient. The safety measures are well-practiced. The disembarkment procedure is clear and efficient.",True,A320-200,Family Leisure,Economy Class,Krabi to Bangkok,May 2022,5,5,,5,5,,True,
"""the crew were nice and helpful""",9,2022-05-17,"Although no service on flight due to Covid the crew were nice and helpful. Captain landing at SVB was smooth and not a bus gate, wonderful flight will fly with Thai Smile again.",True,A320-200,Business,Economy Class,Chiang Rai to Bangkok,May 2022,4,4,,4,4,,True,
"""I recommend to try other airlines""",6,2022-05-15,Overall was fine except flight delayed observed very often for this particular flight. As it’s almost the last leg of the operating aircraft. Noticed delays as a consequence from previous legs always. I recommend to try other airlines.,True,A320,Solo Leisure,Economy Class,Bangkok to Chiang Mai,May 2022,3,3,"<span class=""star fill"">1</span>",3,3,,False,
"""Good flight, on time""",9,2022-05-15,"Good flight, on time. But check-in was very slow because not all passengers had their documents in order. A small snack was served, it was tasty. However blanket was not available and the cabin was somewhat chilly.",True,,Solo Leisure,Economy Class,Vientiane to Bangkok,May 2022,5,5,,5,5,,True,
"""Excellent service""",10,2022-05-05,Excellent service with COVID-19 situation. The best width seat in economy class airlines. Flight attendants wear plastic cover and hand gloves with great service.,True,A320-200,Couple Leisure,Economy Class,Chiang Mai to Bangkok ,May 2022,5,5,,5,5,,True,
"""efficient and helpful crew""",9,2022-04-19,The process of check in to boarding was good. Aircrafts are neat and clean. Managed by efficient and helpful crew. Keep up the good work.,True,A320 200,Business,Economy Class,Kolkata to Bangkok,April 2022,5,5,,5,5,,True,
"""Great domestic airline""",10,2022-04-17,"Great domestic airline, staff is responsive, Covid-19 measures are in place and all is fantastic. We love the experience using this airline.",True,A320-200,Couple Leisure,Economy Class,Bangkok to Phuket,April 2022,5,5,"<span class=""star fill"">5</span>",5,5,,True,5
"""It was a good experience""",9,2022-04-16,"Everything as it should be. No delays, very pleasant and helpful staff, aircraft quite new and in a fine condition. Check-in fast and unproblematic. It was a good experience.",True,A320,Solo Leisure,Economy Class,Udon Thani to Bangkok,April 2022,4,5,,4,5,,True,
"""Cordial staff with smiles""",10,2022-04-09,Well organized and very systematic boarding and unboarding. Cordial staff with smiles. Simple internet booking and special discount for senior citizens that touch the heart.,True,A330,Solo Leisure,Economy Class,Chiang Mai to Bangkok,April 2022,5,5,,5,5,,True,
"""check-in is a disaster""",4,2022-03-17,"The check-in is a disaster. Due to the fact, that I have 3hours connection time in Bangkok, my luggage wasn’t checked through as it would leave me enough time to do this myself in Bangkok. My connection was with Thai Airways and the poster at check-in states “connecting you with Star Alliance”.",True,,Solo Leisure,Economy Class,Phuket to Bangkok ,March 2022,3,3,,1,2,,False,
"""poor passenger announcement service from both pilot and crew""",5,2022-03-10,New aircraft but poor passenger announcement service from both pilot and crew. Especially when flying the PA system in the aircraft was made in very low volume. I couldn't hear any information of the flight from pilot at all. No food and drink serve in flight during COVID19. They prepared only a little piece of snack and drink for passengers before disembarking at the destination airport.,True,A320,Solo Leisure,Economy Class,Bangkok to Trang,March 2022,3,2,"<span class=""star fill"">1</span>",3,3,,False,1
"""cancellations to be dealt with more efficiently""",8,2022-03-08,Check in at airport counter to be reviewed and expedited. Refund on cancellations to be dealt with more efficiently due to airline cancelling flights on the given date.,True,,Solo Leisure,Economy Class,Mumbai to Bangkok,March 2022,5,5,,3,5,,True,
"""Very comfortable and great service!""",10,2022-03-07,Not Verified |  Managed to get a promo. Excellent value including 20k luggage. Would definitely with this airline again. Very comfortable and great service! Highly recommended.,False,,Couple Leisure,Economy Class,Phuket to Bangkok,March 2022,5,5,,5,5,,True,
"""whole experience was so good""",10,2022-03-05,"Not Verified |  My flight back from Bangkok Suvarnabhumi to Ubon Ratchathani on 28 February with ThaiSmile was possibly the best flight I have had – a near-new A320-200, more leg room than I have had before in Economy Class, helpful and happy cabin crew carrying out flight procedures. Masks on the flight and no meals, but a lovely little parcel of Danish pastry and water for all as we disembarked. The whole experience was so good!",False,A320-200,Solo Leisure,Economy Class,Bangkok to Ubon Ratchathani,February 2022,5,5,,5,5,,True,
"""disappointed that the window was dirty""",7,2022-01-24,"Not Verified |  Flight was comfortable, but I’m a bit disappointed that the window was dirty and I cleaned it up. As you know, one of the pleasures of travel is the view from the airplane windows, so I expect Thai Smile Airways to be thorough when cleaning up.",False,,Solo Leisure,Economy Class,Bangkok to Udon Thani,January 2022,4,4,,4,5,,True,
"""service is up to standard""",9,2022-01-19,"Not Verified |  Very good service but check-in took some time, departed and arrived on time. Flight attendants are quite friendly, seat is quite comfortable. Overall service is up to standard.",False,A320,Family Leisure,Economy Class,Bangkok to Udonthani,January 2022,5,5,,4,5,,True,
"""Highly recommend Thai Smile""",10,2022-01-16,Great airline. Love the music and cabin staff are lovely. From check in to landing it was a pleasure from start to finish. Highly recommend Thai Smile.,True,,Solo Leisure,Economy Class,Bangkok to Chiang Mai,January 2022,4,5,,5,5,,True,
"""online check-in system too difficult""",4,2022-01-07,Uncomfortable to enter aircraft you must ride the bus. And in the waiting room it was very bad smell because the engine pollution from bus came inside waiting room. And online check-in system too difficult it just 24 hours before departure it would be better if 72 or 48 hours.,True,,Family Leisure,Economy Class,Bangkok to Chiang Mai,January 2022,4,4,"<span class=""star fill"">2</span>",4,2,,False,
"""Meal was not good enough""",9,2022-01-04,"Meal was not good enough. Only, water bottle (small) and 1 piece of bake (basic). However, due to Covid situation, seat should allocate properly. Beside that, cabin crew services, cleanliness and others was good.",True,,Solo Leisure,Economy Class,Bangkok to Chiang Mai,December 2021,4,5,"<span class=""star fill"">1</span>",5,4,,True,1
"""Airline personnel were very professional and helpful""",8,2021-12-17,"Not Verified |  We found it easy to book directly with Thai Smile website. We needed to book some overweight bags and that was easy to do by buying tickets in category Smile Plus. Cost about $100 usd (3200 Baht) for a one-way ticket). There were 3 flights from BKK to Udon Thani each day, which was convenient. The airport was not very busy and the Thai Smile check in counters were well staffed and the wait time was very short. Airline personnel were very professional and helpful. Safety measures were enforced and we felt safe flying. Our tickets included a meal that we did not eat on board, but the crew packed it up so we could take it with us, that is a nice touch. One final consideration is there is a fee for canceling or changing a ticket if your plans change. Some airlines allow changes with no fees.",False,,Couple Leisure,Premium Economy,Bangkok to Udon Thani,December 2021,4,5,,5,4,,True,
"""prices are reasonable""",10,2021-12-16,"Easy internet booking, quick check-in, check-in and on-time flight. The reception is perfect and the prices are reasonable. Good flexibility in the event of a flight modification.  Reservation par internet facile, enregistrement rapide, check in et vol a l’heure. L’accueil est parfait et les tarifs sont raisonnables. Bonne souplesse en cas de modification de vol.",True,,Couple Leisure,Economy Class,Bangkok to Khon Kaen,December 2021,5,5,,5,5,,True,
"""Was an excellent trip""",10,2021-09-24,"Was an excellent trip. Boarded on time, departed on time, arrived 5 min early. No food & beverage service in flight but small snack provided to you when you deboard the plane.",True,A320,Solo Leisure,Economy Class,Phuket to Bangkok,September 2021,5,5,,5,5,,True,
"""Boarding done smoothly""",10,2021-09-23,"Not Verified | Flight on time, both at departure and arrival. Boarding done smoothly. At arrival, passengers were advised to leave the plane according to their seat numbers, that was very orderly and efficient.",False,,Couple Leisure,Economy Class,Chiang Mai to Bangkok,September 2021,4,5,,4,5,,True,
"""Very cheap and reasonable fee""",10,2021-06-23,"Very cheap and reasonable fee. Very comfortable, convenient also free to sit if that seat available and not much crowd each row.",True,,Solo Leisure,Economy Class,Hat Yai to Bangkok,June 2021,4,5,,5,5,,True,
"""good support on cabin crew""",10,2021-05-25,Not Verified |  Bangkok to Hat Yai. The cabin are very clean. Very good support on ground staff. Good meal and good support on cabin crew. The seats are comfortable.,False,A320,Business,Economy Class,Bangkok to Hat Yai,May 2021,5,5,,5,5,,True,
"""Very careful regulations""",10,2021-05-03,"Very careful regulations for prevention of COVID-19 infection, i.e. spraying door handles of lavatory for each passenger after they've finished using it, including spraying the handles of each storage or overhead locker.",True,Boeing 737-200,Business,Economy Class,Nakhon Si Thammarat to Bangkok,May 2021,5,5,,5,5,,True,
"""we felt super safe the whole way""",10,2021-04-22,"Not Verified |  Definitely worth paying a little extra to get the Thai Plus flights. 30kg of checked luggage on domestic routes, airport lounge with great service and yummy food, lovely cabin crew with even more tasty treats, very clean cabin and very helpful staff all the way through from our check in. Very organised with Covid and we felt super safe the whole way. No issues with our luggage. Will make Thai Smile our preferred carrier from now on.",False,,Couple Leisure,Premium Economy,Bangkok to Phuket,April 2021,4,5,,5,5,,True,
"""World class services with professional cabin crew""",10,2021-04-12,World class services with professional cabin crew. High level protocol and procedure for Covid-19 situation which adds a lot more confident to customer. I enjoy flying with Thai Smile every time.,True,Boeing 747,Solo Leisure,Economy Class,"Bangkok, Thailand to Chiang Mai, Thailand",April 2021,5,5,,5,5,,True,
"""service was comfortable""",9,2021-04-11,"Thai smile never delayed for me. The service was comfortable. I love baggage up to 20 kgs, and a passenger who can select seat by themselves.  A snack beverage so delicious as especially ""Pa Thong Koe"".",True,A320,Business,Economy Class,Bangkok to Nan,March 2021,5,5,,5,5,,True,
"""All the staff are friendly and helpful""",10,2021-04-09,The service is very nice. All the staff are friendly and helpful. Check in counter very fast. In this corona time the airline conducted the safety system very well. They provide a snack box in the bag after you landed. The food was very good.,True,A320-200,Solo Leisure,Economy Class,Bangkok to Hat Yai,April 2021,4,5,,5,3,,True,
"""COVID-19 measure is implemented throughout""",10,2021-03-17,"Seat is comfort, great service. Snack box is provided on-flight. COVID-19 measure is implemented throughout the service. Best of all is all flights are on time. Ground service staff are good old friends from Thai Airways with great service.",True,,Solo Leisure,Economy Class,Chiang Mai to Bangkok,March 2021,4,5,,4,4,,True,
"""The seats dirty""",2,2021-03-07,"Hat Yai to Bangkok. The seats dirty, a lot of the scrap of snack on the seat. Window near the seat also dirty. And now COVID-19 still happening in Thailand but Air Hostess seems not care.",True,,Family Leisure,Economy Class,Hat Yai to Bangkok,March 2021,2,1,"<span class=""star fill"">3</span>",1,1,,False,
"""good services by Thai Smile""",10,2021-03-05,"Efficient boarding, crews provided good services indeed, captain made and provided adequate announcement. Baggage came out quite quick. Overall is good services by Thai Smile Airways.",True,A320,Solo Leisure,Economy Class,Bangkok to Nakhon Si Thammarat,February 2021,5,5,,4,5,,True,
"""staff on board were in a good mood""",10,2021-03-03,"The airport is relatively quiet. Many stores are still closed. My airline had a good service. The staff on board were in a good mood, smiling, and service minded. Economy seat is comfortable enough for me.",True,,Family Leisure,Economy Class,Phuket to Bangkok,March 2021,5,5,"<span class=""star fill"">3</span>",5,5,,True,5
"""I think its service reaches the standard of Thai Airways""",10,2021-01-12,"This is not my first time flying with WE. For me, I think its service reaches the standard of Thai Airways (TG) in just a smaller cabin. Price: reasonable. Ground staff: helpful and efficient. Cabin crew: good looking, service-minded and caring. Snack box: delicious and reasonable. Overall: I like everything when flying with both WE and TG.",True,A320,Solo Leisure,Economy Class,Chiang Rai to Bangkok,January 2021,5,5,"<span class=""star fill"">4</span>",5,5,,True,
"""crew give excellent service""",10,2020-12-24,The cabin crew give excellent service. The cabin is clean and confort. Ground staff check-in is fast. The flight is on time. The price is affordable.,True,A320-200,Business,Economy Class,Khon Kaen to Bangkok,December 2020,5,5,,5,5,,True,
"""Comfortable seat with reasonable legroom""",8,2020-12-15,"Comfortable seat with reasonable legroom. Good quality meals. Booking via website was quite easy but the function of adding e-ticket to Apple wallet was not working. However, the link received via email did the job of adding e-ticket to Apple wallet like a breeze.",True,A320-200,Solo Leisure,Economy Class,Bangkok to Phuket,December 2020,4,4,"<span class=""star fill"">1</span>",4,4,,True,
"""No social distancing""",5,2020-12-07,"Not Verified |  Khon Kaen to Bangkok. The inflight service is not so good. No social distancing (there are many empty seats). I can't change my seat, why?? The position of the seat is not appropriate for my back, sometimes I have got back pain.",False,A320,Business,Economy Class,Khon Kaen to Bangkok,December 2020,1,2,"<span class=""star fill"">1</span>",3,5,,False,1
"""There was no food for the kid""",5,2020-12-06,"There was no food for the kid and when we ask the cabin crew, she just told that we need to request for it when we make a reservation. In my opinion i think this is not right coz when we book the ticket the airline have all the information of the traveller. They should prepare it according to the information that they receive. Or otherwise the airline should prepare something as the option for the kid if they not going to check their passenger list. Phuket to Bangkok, the food on the flight is kua - gling (คั่กลิ้งไก่) which is no way the children can eat it.",True,,Family Leisure,Economy Class,Phuket to Bangkok,December 2020,5,3,,5,4,,True,
"""messages through super loudspeakers""",6,2020-12-01,"Boarding via a bus gate- Despite the covid, social distancing measures are being encouraged haphazardly by Thai Smiles and other relevant Thai authority, ground staff just packed the buses, literally other passengers are breathing over your neck. I was on the first bus, that included all premium cabin pax and top tier frequent flyers.  And what will sequential disembarking do to help prevent spreading of COVID, if the crew just send the passengers to be packed in the bus ride to the gate? The much talked-about Chinese Donut was served with custard dipping. It was handed out on tray with the donut in a little paper box. All without wrapping or covers, and it was served with no cutlery. Again, this is very insensible, given the fact that just a few days ago, there have been reports on recent surges of new locally infected sars COVID cases in Thailand. And certainly not everyone enjoys greasy and oily donut dipped in just sugary carb rich custard. PA on board is obsessed with PA by both crew and recorded messages blasting through super loudspeakers. The PA are redundantly made by crew, and again by pre-recorded messages- in TH, EN and CH. Most of WE flights are between 50 to less than 90 mins. PA before take-off, inflight, pre-landing and arrival blasted very loudly throughout the flight! I would say it is just too much annoying.",True,A320-200,Solo Leisure,Economy Class,Bangkok to Ubon Ratchathani ,December 2020,5,4,"<span class=""star fill"">1</span>",3,3,,True,
"""Service is good""",10,2020-11-22,"The flight was on time. The ground staff took care us. The passenger room was clean. The air hostesses said sawasdee and guide us about seat / security. They follow up about security such as belt, seat and window. Service is good.",True,,Family Leisure,Economy Class,Bangkok to Chiang Mai,November 2020,5,5,,5,5,,True,
"""not provided free 10 kgs plus luggage""",7,2020-11-21,Hat Yai to Bangkok. They’re not provided free 10 kgs plus luggage for Royal orchid plus program (I’m a silver member) even on the website of them still show this benefit.,True,,Solo Leisure,Economy Class,Hat Yai to Bangkok,November 2020,3,5,,2,4,,False,
"""comfortable seats and very pleasant crew""",10,2020-11-20,"Thai Smile schedule reliable and on time. Cabin clean, comfortable seats and very pleasant crew. Although it’s budget category, check-in baggage 20kg is included in the fare. Seat reservation is free too. And snacks and drinks are served even for a 1-hour flight.",True,,Family Leisure,Economy Class,Chiang Mai to Bangkok,November 2020,5,4,,4,5,,True,
"""flight attendants are nice and helpful""",10,2020-11-20,"Bangkok to Khon Kaen. Thai Smile is my first choice when I travel by plane. The seat is comfortable, more leg room. The flight attendants are nice and helpful. Smooth taking off and landing.",True,A320,Solo Leisure,Economy Class,Bangkok to Khon Kaen,November 2020,5,5,"<span class=""star fill"">5</span>",5,5,,True,
"""Everything was delightful""",10,2020-11-19,"Very efficient, courteous, pleasant and professional from check-in to the gate agent, to cabin crew and finally when the baggage arrived at baggage claim. Everything was delightful. I would gladly fly THAI Smile again.",True,A320-200,Family Leisure,Economy Class,Bangkok to Chiang Rai,November 2020,5,5,"<span class=""star fill"">3</span>",5,5,,True,
"""Cabin staff service is excellent""",10,2020-11-12,"Friendly ground staff, convenient, easily access check in point. Cabin staff service is excellent. The cabin is very clean. The snack is delicious. Take off time is punctual.",True,A340,Solo Leisure,Economy Class,Bangkok to Hat Yai,November 2020,5,5,"<span class=""star fill"">5</span>",5,5,,True,
"""I'm not impressed""",1,2020-11-09,"I'm not impressed. At the check in counter, staff said they don't have a direct flight and asked if I came to wrong airline. So I showed her my ticket in an email. I was told that the flight was canceled but I didn't receive any email, call or message. After that there was one nice staff member who came to help me redo the ticket but it was a  connecting flight, my only choice that I have to wait in Bangkok for 3 hours and I had to cancel my spa in Phuket. I am really disappointed that I just noticed when I came to check-in, and I had to change my plans on that day immediately.",True,A320-200,Solo Leisure,Economy Class,Chiang Mai to Phuket,November 2020,4,3,,2,1,,False,
"""Cabin crew are polite""",10,2020-11-09,Cabin crew are polite and great service on short flight. In cabin very comfortable and clean toilets. Ground staff are service minded with clear answers.,True,A320,Business,Economy Class,Bangkok to Khon Kaen,November 2020,5,5,"<span class=""star fill"">5</span>",5,5,,True,
"""not like anything about this airline""",1,2020-11-08,Bangkok to Phuket. The only reason I flown with Thai Smile was that Thai Airways has not yet resumed its operation. But I do not like anything at all about this airline. There is some hiccing-up every time I fly with them.,True,A320,Business,Economy Class,Bangkok to Phuket,November 2020,2,2,"<span class=""star fill"">1</span>",1,2,,False,
"""The cabin was not cleaned at all""",1,2020-11-02,"Not Verified |  The cabin was not cleaned at all. I couldn't understand why there was a large amount of waste of used and dirty tissue paper in the seat pocket even though under COVID-19 hygiene management at this airline is only superficial, and the true nature is not understood. When I complained to CA, there was no apology, it was just garbage collection. Furthermore, they sprayed disinfectant on me, which has nothing to do with garbage. It is unthinkable that the safety of passengers has been ensured by providing such services that are impossible under common sense. Flight No. WE282/1 Nov. Seat No.50H.",False,A320-200,Solo Leisure,Economy Class,Phuket to Bangkok,November 2020,1,1,,4,1,,False,
"""Excellent airline to fly""",10,2020-10-29,Excellent airline to fly with. I like all the services they provided with the price of their Economy level. The booking is easy and this airline offer special price for senior citizen at 20% discount of its fare.,True,A320-200,Solo Leisure,Economy Class,Chiang Mai to Bangkok,October 2020,5,5,,4,5,,True,
"""Very good service""",9,2020-10-28,Phuket to Bangkok. Very good service even it is a short flight. The flight attendants are professional on both safety and the flight service. The snack is good even though during COVID.,True,,Couple Leisure,Economy Class,Phuket to Bangkok,October 2020,4,5,,5,5,,True,
"""cabin staff and ground staff service good quality""",10,2020-10-27,"Flexible, comfortable (big) seat, low cost, service minded, free seat selection and free Snack. Free luggage service, cabin staff and ground staff service good quality.",True,A320-200,Solo Leisure,Economy Class,Hat Yai to Bangkok,October 2020,5,5,"<span class=""star fill"">4</span>",5,5,,True,4
"""An excellent service""",10,2020-10-26,An excellent service provided by Thai Smile Airways crews. They always smile. A short flight only 50 mins but delicious snack and drink provided. The welcome announcement made very clear by captain including time to be landing and weather forecast. I will continue fly with Thai Smile Airways.,True,A320,Solo Leisure,Economy Class,Nakhon Si Thammarat to Bangkok,October 2020,5,5,,5,5,,True,
"""comfortable and enjoyable flight""",10,2020-10-20,"Flight departed before time and arrived much earlier than planned in Bangkok. Boarding and disembarkation was speedy and efficient whilst maintaining social distancing guidelines. Plane was very clean, whilst the cabin crew were friendly, polite and efficient. In-flight snack was good and made use of environmentally friendly utensils and packaging. All in all a very comfortable and enjoyable flight in these challenging circumstances",True,A320,Couple Leisure,Economy Class,Phuket to Bangkok,October 2020,5,5,,5,5,,True,
"2Good service and light snack""",10,2020-10-09,Bangkok to Ubon Ratchathani . On time performance. Good service and light snack. Feel comfortable during flight. Cabin Crew are smiling while they do service to passengers.,True,A320-200,Family Leisure,Economy Class,Bangkok to Ubon Ratchathani ,October 2020,4,4,,5,5,,True,
"""everything was perfect""",10,2020-10-01,"Cabin cleanliness is outstanding. Onboard refreshment is ok when compared with the flight duration. I expected nothing more. Crews were working professionally when having to deal with the covid-19 situation. 20kg Luggage allowance is notable when compared with the same range flight fares of competitors. Overall, everything was perfect.",True,32A,Business,Economy Class,Bangkok to Phuket,October 2020,5,5,"<span class=""star fill"">5</span>",5,5,,True,
"""Great inflight services""",10,2020-09-29,"User-friendly ticket booking website. The fee already included 20 kg luggage allowance. No hidden cost. Check-in was simple and smooth. Great inflight services. Clean and well-maintained interior. Free light meal: Japanese rice with teriyaki grilled Mackerel and a bottle of water. Free drinks choosing from tea, coffee, or orange juice. Seat was comfy. Nothing to complain. Great flying experience overall.",True,A320-200,Business,Economy Class,Bangkok to Hat Yai,September 2020,4,5,"<span class=""star fill"">4</span>",5,5,,True,
