header,rating,review_date,comment,trip_verified,aircraft,type_of_traveller,seat_type,route,date_flown,seat_comfort,cabin_staff_service,food_and_beverages,ground_service,value_for_money,wifi_and_connecticity,recommend,wifi_and_connectivity
"""a very pleasant flight""",10,2020-09-13,"Flight left early - about 10 minutes. Flight crew were very efficient and observed all the COVID-19 mandates. Food was very good - sausage and egg omelet with a bottle of water. And, I have been flying for over 50 years and today was the first time I have seen organized deplaning - buy about 2 rows at a time. This was so nice that getting off the plane was as organized as getting onboard. Prices are very fair and competitive and I really appreciate not having to pay extra for checked baggage. Other airlines charge 300-400 Thai baht for 20 kilograms. All in all, a very pleasant flight with an early departure and arrival.",True,A320-200,Solo Leisure,Economy Class,Muang Khon Kaen to Bangkok,September 2020,5,5,,5,5,,True,
"""nice cabin crew""",10,2020-09-10,Bangkok to Hat Yai. Perfect service with nice cabin crew. Very nice support from ground staff. Flight on time and early departure. Food packaging is quite clean and food is good quality.,True,A320,Couple Leisure,Economy Class,Bangkok to Hat Yai,September 2020,4,5,,5,5,,True,
"""good service from staff""",9,2020-09-10,Khon Kaen to Bangkok. Good service from staff and a nice snack. Cleanliness and nice service onboard. Free luggage loaded. Comfortable seat and room for legs.,True,,Business,Economy Class,Khon Kaen to Bangkok,September 2020,5,5,"<span class=""star fill"">5</span>",4,5,,True,
"""A wonderful flight""",10,2020-08-20,"A wonderful flight during the Covid-19 pandemic in Thailand. They surprise customers after the flight landed by gave us a snack and drink before we leave the airplane. For the cabin staff, they are very happy to give us the best services.",True,,Solo Leisure,Economy Class,Bangkok to Chiang Mai,August 2020,5,5,,5,5,,True,
"""Poor baggage handling""",9,2020-08-03,Efficient check in with social distancing. Smooth boarding procedures. On time arrival. Poor baggage handling at Phuket Airport by Airport Authority of Thailand. The carousel stopped as soon as the last baggage showed up on the belt. Didn't bother to let them roll to allow passengers to pick them up. Many people had to scramble to walk to luggage to pick up off the belt.,True,A320,Family Leisure,Economy Class,Bangkok to Phuket,August 2020,4,4,,4,5,,True,
"""friendly cabin crew""",10,2020-07-29,"Phuket to Bangkok. Comfortable seat with pitch and width, free to choose your seat, supportive and friendly cabin crew, fly on time, have a lot of slot to choose flight,",True,,Solo Leisure,Economy Class,Phuket to Bangkok,July 2020,5,5,,5,5,,True,
"""attendants were helpful and polite""",10,2020-06-26,"It was a domestic short flight for about only 1 hour. Due to Covid-19, no food was served on flight, but there are snacks and water bottles which passengers can pick up before leaving the plane. When entering the plane, all passengers are provided with face masks etc. in sealed packages. All flight attendants were helpful and polite. The seats are more comfortable with wider space than other domestic flight within Thailand.",True,,Solo Leisure,Economy Class,Bangkok to Ubonratchathani,June 2020,5,5,,5,4,,True,
"""Excellent service""",10,2020-06-17,"Udon Thani to Bangkok. Excellent service at a very fair price I always chose Thai Smile for my domestic flights and highly recommend. Baggage allowance included, not like some other airlines.",True,,Solo Leisure,Economy Class,Udon Thani to Bangkok,June 2020,5,5,,5,5,,True,
"""manage very bad for me""",4,2020-04-03,"Bangkok to Khon kaen. I booked flight to kkc WE044 on 1 apr dep 13:35 This time I selected seat no 55C but this flight has been canceled. But I have new flight WE042 same day dep on 11:05 I changed seat and selected seat again seat no 39A, but when I checked in my boarding pass seat no 57K. If I selected already but the airline change my seat not fair. It’s very far from exit doors - if the airline need to change must change seat better than I have right. I understand airline seat management by omitting 1 seat in the current situation. But when I booked seat 39A the seat 39B and C still available I must sit on my seat but you manage very bad for me.",True,A318,Solo Leisure,Economy Class,Bangkok to Khon kaen,April 2020,1,2,"<span class=""star fill"">1</span>",2,4,,False,1
"""gets better and better""",10,2020-03-28,"Chiang Mai to Bangkok. I have been flying with Thai Smile for 5 years. The service always improves and it gets better and better. Moreover, the cabin crew are helpful, friendly, warm and industrious to deliver a passenger professionally. The food usually changes, which depends on the period of time you fly as well. The meal is free of charge that means all class passengers (even if you fly in economy, you will get food onboard). A passenger who books in Smile Plus (Premium economy) can access Royal Orchid Lounge from Thai Airways for free. I would definitely recommend this airline to anyone. Thai Smile Airways is a subsidiary of Thai Airways, so the quality of service and food quite similar but I think Thai Smile is better than the mother company.",True,A320,Solo Leisure,Premium Economy,Chiang Mai to Bangkok,March 2020,5,5,"<span class=""star fill"">5</span>",5,5,,True,3
"""cabin is very clean""",9,2020-03-28,"Bangkok to Hatyai. Customer-friendly service, Excellent, the cabin is very clean, the cabin crew were nice and friendly. The snack is very good! I felt safe flying Thai Smile Airways during the COVID19 period.",True,,Business,Economy Class,Bangkok to Hatyai,March 2020,5,5,"<span class=""star fill"">5</span>",5,5,,True,
"""Enjoyed the trip""",9,2020-03-27,Not Verified | Bangkok to Khonkaen. Enjoyed the trip. The staff provided hand soap gel and announce that they did clean the plane before we were on board. Snack and tea were good also.,False,A320,Solo Leisure,Economy Class,Bangkok to Khonkaen ,March 2020,4,5,"<span class=""star fill"">3</span>",4,4,,True,2
"""attendants were nice and relaxed""",9,2020-03-26,Bangkok to Krabi. Nice plane. With tv show and ok food. Drinks are good and it's comfortable for 1-hour travel. The flight attendants were nice and relaxed. The price of travel is good.,True,,Solo Leisure,Economy Class,Bangkok to Krabi,March 2020,5,5,"<span class=""star fill"">4</span>",4,5,,True,3
"""I strongly recommend""",9,2020-03-22,"Bangkok to Ahmedabad. Thai Smile Airlines is best Airlines I had flew. Very good ground staff,  good crew members, neat and clean aircraft, toilets clean.  Very good food, I booked fruits platter and I surprised to get many kind of fresh fruits and very delicious. Another good part they allow 30 kg for check in luggage and 7 kg cabin luggage it's really very good thing for all travellers. Just my request to provide good quality of Scotch whisky on board. Otherwise each and every thing is excellent. I strongly recommend to fly with Thai Smile.",True,A320,Solo Leisure,Economy Class,Bangkok to Ahmedabad,March 2020,5,5,"<span class=""star fill"">5</span>",5,5,,True,
"""a magnificent journey""",10,2020-03-19,"Bangkok to Siem Reap. It was a magnificent journey aboard Thai Smile Airways.  I already get breakfast on 1 hour flight. Flight attendants were friendly and kind. After this experience you will love aircraft, airline and Thailand.",True,A320,Solo Leisure,Economy Class,Bangkok to Siem Reap,February 2020,5,5,,5,5,,True,
"""Very nice flight""",10,2020-03-09,Not Verified |  Bangkok to Phnom Penh. Very nice flight early in the day. It was a short flight but they still provided a tasty hot chicken curry and noodles snack. I also appeciated the flight attendant at the cabin door with a hand sanitizer dispenser. Bags arrived quickly on arrival. I will fly again with Thai Smile Airways.,False,,Solo Leisure,Economy Class,Bangkok to Phnom Penh,March 2020,5,5,,5,5,,True,
"""efficient and friendly staff""",10,2020-03-06,"Not Verified | Khon Kaen to Bangkok. The low-cost arm of Thai Airways International. 20kg baggage, free seat selection and in-flight meal included in the ticket price. No annoying add-ons. Very efficient and friendly staff from the check-in to the flight and cabin crew. Aircraft cabins clean, bright and airy. Seat comfort average for short flights.",False,A320,Solo Leisure,Economy Class,Khon Kaen to Bangkok,March 2020,4,5,,5,5,,True,
"""Nothing to complain about""",7,2020-03-02,"Not Verified |  Bangkok to Chiang Mai. As ordinary as any other flight, no delay, no problems. Nothing to complain about. Snack on board was not good this time (sandwich liked), pastry preferred.",False,,Family Leisure,Economy Class,Bangkok to Chiang Mai,February 2020,3,4,,4,2,,True,
"""Good value for the price""",8,2020-03-01,Bangkok to Narathiwat. It was a pleasant fight. Good value for the price paid which included 20kg free allowance for checked-in baggage and complimentary meal in flight. Flight time was ideal in the day.,True,A320-200,Couple Leisure,Economy Class,Bangkok to Narathiwat,February 2020,4,4,,4,5,,True,
"""Excellent service""",10,2020-02-26,Bangkok to Ubon. Excellent service both from airport staff and cabin crew. Flight was very smooth and right on time. Food was lovely and plenty of legroom Very reasonably priced I will fly with them again.,True,A320,Couple Leisure,Economy Class,Bangkok to Ubon,February 2020,5,5,,5,5,,True,
"""service is very good""",8,2020-02-20,Chiang Mai to Bangkok. Air hostess service is very good. Beaming And the captain when taking the plane down The down is very soft. If having the opportunity to use the service again.,True,,Family Leisure,Economy Class,Chiang Mai to Bangkok,January 2020,4,5,,2,3,,True,
"""feel easy and comfortable""",9,2020-02-20,"Chiang Mai to Bangkok. I've been flying with Thai Smile for the past few years for every flights in Thailand and aboard where destinations available with Thai Smile flights. The service are always prompt, the flights are always on time (if there is ever a delayed there is an option to change flight and responded very well), the snacks are decent (sometimes even get a nice treat if you fly on a spacial occasion such as Valentine or Christmas!). I always feel easy and comfortable flying with Thai Smile. Hope they will expands more destinations in the future.",True,,Couple Leisure,Economy Class,Chiang Mai to Bangkok,February 2020,5,5,,5,5,,True,
"""staff were polite""",8,2020-02-16,"Not Verified |  Bangkok to Vientiane. The trip took place in compliance with the times set by the timetable. The check-in service was smooth and the staff were polite. On board the trip was quite comfortable and the hostesses were available and present for every passenger request. Upon arrival, the outflow from the aircraft was quick and orderly. Planes are small aircraft for small but comfortable routes.",False,,Couple Leisure,Economy Class,Bangkok to Vientiane,February 2020,3,3,"<span class=""star fill"">4</span>",3,3,,True,3
"""seat allocation was not customer friendly""",1,2020-02-16,"Khon Kaen to Bangkok with Thai Smile Airways. Check in was ok, seat allocation was not customer friendly. The aircraft was not fully booked but the passengers were allocated to sit very tightly to each other. I was sitting in the middle of 2 big men. Cabin was old. Damaged luggage, company unable to compensate after a few calls.",True,A330-300,Solo Leisure,Economy Class,Khon Kaen to Bangkok ,February 2020,1,2,"<span class=""star fill"">1</span>",2,2,,False,
"""On board service friendly""",10,2020-02-14,Bangkok to Khon Kaen. Only airline on the route. Mostly on time. On board service friendly & very efficient. Crew work fast to complete snack & drinks service on a 45 minute flight.,True,A320,Solo Leisure,Economy Class,Bangkok to Khon Kaen,February 2020,5,5,,5,5,,True,
"""best short route flights""",10,2020-02-14,Phuket to Bangkok. I flied with Thai Smile three times this february in Thailand. Thees flights were the best short route flights that I've had. The staff is so kind and helpful. They serve to all passengers a bottle of water and a snack. The seats are very comfortable. I will fly again with Thai Smile.,True,A320-200,Solo Leisure,Economy Class,Phuket to Bangkok,February 2020,4,5,,5,5,,True,
"""packings are from recycled materials""",8,2020-02-03,"Bangkok to Khon Kaen. Kudos to the Airline for its attempt to become green. All snack packings are from recycled materials except for bottled water which is made of recyclable PET plastic. Services from check-ins, inflight, and luggage retrieval are perfect.",True,A320,Business,Economy Class,Bangkok to Khon Kaen,November 2019,4,5,,5,5,,True,
"""the flight went smoothly""",8,2020-02-02,"Phuket to Bangkok. We checked in online, less than 24 hours before the flight, very easy, also to change seats (we had two bookings), no fees at all, and 20 kgs included. We came early to the airport, and we checked in, in less than 2 minutes. We left 20 minutes left from Phuket, mainly because passengers brought their suitcases on board, instead of checking them in. A family, two adult and two kids = 4 suitcases, maximum size, the father had to place them in different places. When we arrived in Bangkok, he jumped up as the plane stopped, to collect his suitcases. If all passengers act like this, it will be chaos. Anyway the flight went smoothly, more than enough space between the rows (i am 183 cm). We were served a roll, water and coffer/juice, included. The crew worked very fast and efficient, no thai smile though.We landed 20 minutes late in Bangkok, and had to wait another 20 minutes for our checked in bag. I must say i am surprised positively about Thai smile, and we will look for them, when we will book tickets in the future",True,A320,Couple Leisure,Economy Class,Phuket to Bangkok,February 2020,4,4,,5,5,,True,
"""crew service is excellent""",10,2020-02-01,Bangkok to Khon Kaen. The flight is arrive before time. The crew service is excellent. On board entertainment is good although it is a short flight. Ground service when check in is fast and efficient.,True,A320-200,Business,Economy Class,Bangkok to Khon Kaen,January 2020,5,5,"<span class=""star fill"">4</span>",5,5,,True,
"""best domestic airline""",10,2020-01-30,"Bangkok to Chiang Rai. This is the best domestic airline in Thailand which you can enjoy both an inflight drink and load your luggage up to 20 kilos. Moreover, you can select your prefered seat without extra cost. So try it like me, your travel will be happy with a smile.",True,,Family Leisure,Economy Class,Bangkok to Chiang Rai ,January 2020,5,5,"<span class=""star fill"">5</span>",5,5,,True,
"""flights proved to be smooth""",10,2020-01-29,"Vientiane to Krabi via Bangkok. On the flight from Vientiane to Krabi, I had only 1 hour to switch planes in Bangkok and was worried that that is not enough time. However, the flights proved to be smooth with no issues at all. Friendly, professional service and I was surprised, they even served food on these short 1 - 1.5 hour flight. Food was delicious, too. The connecting flight was delayed by 30 mins, but we were able to catch up and arrive on time.",True,,Solo Leisure,Economy Class,Vientiane to Krabi via Bangkok,January 2020,4,4,"<span class=""star fill"">2</span>",5,5,,True,1
"""always a reason to smile""",10,2020-01-27,"Not Verified |  Bangkok to Phuket. Thai Smile is always my first choice for domestic flights within Thailand. Friendly staff, clean airplanes, mostly on time, For me always a reason to smile!",False,A320,Solo Leisure,Business Class,Bangkok to Phuket ,January 2020,4,5,"<span class=""star fill"">4</span>",4,5,,True,
"""the entire journey was miserable""",1,2020-01-26,"I suggest anyone avoid Thai Smile if you're flying in a premium economy class or above. On my flight from Bangkok to Penang, the entire journey was miserable. There is no line for priority boarding as they allow economy class passengers to block the PE class passengers and travelers with children to board first. Thai Smile Airways never use a boarding bridge for this flight and making the entire boarding process a heavy mess. The seat of a PE and normal economy class is the same so if you wonder if there is any difference, the answer is no. No in flight Wifi and inflight entertainment as well. The food service is the most horrible part I have ever faced in my travel life, as I was given only 3 minutes to finish the full meal and the flight attendant insisted and took away my food while I was eating halfway. This is an absolute disgrace because I saw the attendant just want to finish the service quickly. There were still 80% journey to go! What a shame on you Thai Smile!",True,A320-200,Business,Premium Economy,Bangkok to Penang,January 2020,1,1,"<span class=""star fill"">1</span>",1,1,,False,1
"""Good leg room""",10,2020-01-20,Bangkok to Chang Rai. Better than European low cost airlines. Good leg room and food provided on a short distance flight. Enough space for cabin baggage and friendly approach of the staff.,True,,Couple Leisure,Economy Class,Bangkok to Chang Rai,January 2020,4,4,,4,5,,True,
"""Another delayed flight""",3,2020-01-14,Udon Thani to Bangkok. Lack of communication for late / delayed flights. Another delayed flight. I had international connections. Another no notification of delayed and the ground staff could not provide an estimated time for the delay? Then a bus journey from the plane to the terminal in Bangkok to add more delays.,True,,Couple Leisure,Economy Class,Udon Thani to Bangkok,January 2020,2,2,"<span class=""star fill"">1</span>",1,2,,False,
"""left near on 1 hour late""",5,2020-01-13,"Not Verified |  Bangkok to Udon Thani. Would have been awesome except for the fact we left near on 1 hour late. Service was good, travel was comfortable. Travel this route every 3 weeks, tried Thai Smile for a change and was first time being late. Not a good start.",False,,Solo Leisure,Economy Class,Bangkok to Udon Thani,January 2020,3,4,,3,3,,False,
"""Usually on time""",7,2020-01-09,Udon Thani to Bangkok. Very good Airline. Usually on time. Clean planes and Friendly crew. I fly 4 times a year BKK-UTH and UTH-BKK and my wife 2 times a year UTH-BKK and BKK-UTH.,True,A320,Solo Leisure,Economy Class,Udon Thani to Bangkok,August 2019,4,4,,4,4,,True,
"""most flights were Late""",3,2020-01-08,"Not Verified |  Unfortunately most flights were Late, current and in the past. On the Return flight in November 19 from Khon Kaen to Bangkok there was no bus ready to drive to the Terminal. We had to wait longer than 20 minutes. This is Not Professional. Many locals do not Check in their luggage, but bring several bags, backpacks etc. as hand luggage into the cabin, although only one hand luggage is allowed. Die to the stowage of the additional hand luggage, Boarding takes a lot longer because everyone is standing in the aisle!",False,A320,Solo Leisure,Economy Class,Khon Kaen to Bangkok,December 2019,2,3,,2,2,,False,
"""Don't be a minute late""",1,2019-12-14,"Bangkok to Phnom Penh. I knew i was going to be late even though i started my way to the gate 30 min before the flight. I rushed to the fast track lane and requested to enter through as i was running out of time. Fast track guys told me to go through normal passage. I excused myself and rushed through people in que and arrived at the gate about 6 minutes before the flight. The staff told me I am late and that gates close 10 min before the flight.  Going back to their counter they just told me I was late and I need to buy a new ticket and that they are not responsible for anything - at least a little sympathy would be handy. Don't be a minute late, these guys dont play around.",True,,Solo Leisure,Economy Class,Bangkok to Phnom Penh,December 2019,1,1,,1,2,,False,
"""stunningly poor safety procedure on landing""",3,2019-12-11,"Phuket to Hong Kong with Thai Smile Airways. I had been fairly impressed with this airline in terms of punctuality, seat comfort and service. However, a stunningly poor safety procedure on landing has changed my opinion! The passengers across the aisle from me boarded with takeaway meals and drinks bought in Phuket airport, and declined the meal that was served by the flight attendants shortly after take-off. However, a few minutes before landing, one of them asked for the hot meal he had missed and this was handed to him by cabin crew. This was after the seat belt sign for landing had been turned on. He then proceeded to eat his meal during landing, the tray on his lap. His hand baggage was scattered on the floor by his feet, not under the seat in front of him.  In fact, the cabin crew did not check that all passengers a) had seat belts fastened or b) hand baggage was safely stowed. This doesn't give me much confidence about the cabin crew's capabilities if there were an emergency of any kind.",True,,Couple Leisure,Economy Class,Phuket to Hong Kong,December 2019,4,1,,3,3,,False,
"""Decent experience""",7,2019-12-05,"Bangkok to Chiang Mai. Checkin at separate counter, very fast and efficient. Premium economy ticket gives you free entrance at Thai Airways' Royal Orchid Lounge in BKK terminal A. As it is before security control, you have to leave it latest, early 40 minutes before the flight is leaving. - Late incoming airplane, so take off delayed about 40 minutes, being a delay of 15 minutes when landing in Chiang Mai. Priority boarding for premium economy customers and ROP Gold an Platinum tier holders. Product on the plane equivalent with a European continental flight business class, having a bigger pitch and leaving the middle seats of the 3-3 seating free. A purple iced tea was served as welcome drinks. After take off a lunch was served, maki rolls and Teriyaki chicken breast, a small salad and a chocolate cake. Uneventful flight and priority baggage (32kg allowance) on belt first. Decent experience. Getting 402 qualifying miles at ROP. Other Star Alliance programs doe not credit any miles. On short flights in Thailand itself a good alternative to Thai Biz class tickets, costing just a little more than half.",True,A320-200,Solo Leisure,Economy Class,Bangkok to Chiang Mai,December 2019,3,4,"<span class=""star fill"">3</span>",4,4,,True,
"""a very pleasant experience""",10,2019-09-25,"Thai Smile Airline, Khon Kaen to Bangkok, economy class, September 2019. Overall a very pleasant experience, better than its low-cost competitors, but the with the same competitive price. Waiting area prior to boarding with AC, coffee and snacks. Airline Crew welcoming and helpfull. Recent A 310, cabin and seats in excellent conditions. Seats with good legroom and width (more space than its low-cost competitors). Snacks and drinks offered on board. 23 kg luggage free + cabin bag. I strongly recommend Thai Smile Airways.",True,,Solo Leisure,Economy Class,Khon Kaen to Bangkok,September 2019,5,5,,5,5,,True,
"""The service was minimal""",1,2019-09-17,"Bangkok to Phnom Penh. The plane was old. No personal TV, so zero entertainment. The service was minimal. Cabin crew rushed through everything. One cabin crew didn't even wait for me to take a sugar for my tea.",True,,Solo Leisure,Economy Class,Bangkok to Phnom Penh,September 2019,3,1,"<span class=""star fill"">1</span>",3,2,,False,
