header,rating,review_date,comment,trip_verified,aircraft,type_of_traveller,seat_type,route,date_flown,seat_comfort,cabin_staff_service,food_and_beverages,ground_service,value_for_money,wifi_and_connecticity,recommend,wifi_and_connectivity
"""satisfactory for a budget airline""",7,2019-12-30,"Osaka to Bangkok with Thai Lion Air. Original ticket booking was difficult, taking several attempts before the payment went through. Have to book baggage per exact kilogram, which is difficult to accurately predict months before the flight. Inevitably you end up buying more weight than you need and therefore overpaying. It would be better to have weight bands (e.g. 15 to 20kg, 20 to 25kg etc) like Air Asia and others do. Website said check in open 3 hours before departure. Email sent day before said 4 hours. Actually opened 2.5 hours before. Email suggested checking-in online, but website said this was “not possible for international flights.” Email was received 24 hours before flight and mentioned booking meals “up to 48 hours” before departure. So confusing and difficult to plan arrival time and other arrangements at the airport. Extremely slow check-in, with many passengers having baggage and other problems. Strict application of 7kg hand luggage policy. Payment for excess baggage in cash (JPY) only. Not a problem for me because I had pre-paid my baggage when I bought the ticket. Seat numbers changed even though seats had been selected and paid for when flight ticket purchased. Booked and paid for Row 12, reminder email said Row 3 and boarding pass said Row 20. Apparently this was connected to a change of aircraft in 3+3 seat formation (Boeing 737-800) - not what I had expected or was shown when I booked. I will request a refund for the fee I paid for the original seats. Flight on time. Smooth boarding etc. Plenty of empty seats so had three seats for two people. Free pastry and cup of water unexpectedly provided. Seats, service and other on-board issues satisfactory for a budget airline. Extremely quick out of DMK - no queues at passport control, short wait for luggage, no wait for taxi.",True,Boeing 737-800,Couple Leisure,Economy Class,Osaka to Bangkok ,December 2019,4,3,,2,4,,True,
"""Seats felt cramped""",6,2019-12-28,"Hanoi to Bangkok. Check in was reasonably fast and hassle-free, but the plane both left and arrived half an hour late. Seats felt cramped and the aircraft overcrowded. Crew looked tired. But it got us there.",True,,Solo Leisure,Economy Class,Hanoi to Bangkok,December 2019,2,3,,4,3,,True,
"""waiting to refund my money""",1,2019-11-27,Denpasar to Bangkok.I received my fragile item in many pieces at Bangkok airport and they didn’t want accept their responsibility. They forgot to served our meals (me and my 12 years old son) so we bought inside the airplane and I am waiting to refund my money for the food back.,True,,Family Leisure,Economy Class,Bangkok to Bali,October 2019,1,2,,1,1,,False,
"""flight no longer exists""",1,2019-11-24,"Don't book tickets here as they have the poorest airline customer service I've ever experience. We booked tickets from Bangkok to Phuket 2 months prior and they confirmed the flight. We arrived in the said airport and surprisingly flight no longer exists as the flight we booked was under summer promo (or whatever they called it) and why the heck did they confirm it in the first place? They claimed that they sent an update about our flight 4 days before our departure (which we didn't receive) and they didn't even bother that there was no acknowledgement from the passengers about this changes. The only thing they can offer was a ""full refund"" and book another ticket with another airline if you really wanted to be in Phuket to follow your itinerary (which will cost you double from original price). They won't be bothered if your running behind from your itinerary, they won't give you any assistance or even small compensation for the inconvenience they caused.",True,,Couple Leisure,Economy Class,Bangkok to Phuket,November 2019,1,1,,1,1,,False,
"""definitely fly with them again""",10,2019-11-17,Kathmandu to Bangkok. Absolutely perfect. Check-in staff were great. The plane was new and we even received a very good inflight snack and bottle of water - I have never received this with any other low-cost airline. We pre-ordered an inflight meal which not only was reasonably priced but also very tasty. I previously read that the airline was keen on over-sized cabin luggage but was astonished at the luggage that people tried to get away with in the cabin - this is unfair on other passengers who are compliant and then made to put their (compliant) luggage under their seat in front of then whilst overladen passengers get away with putting their luggage in the cabins above (and have foot-room as well). We did have a delay but this was due to the re-surfacing of KTM runway and the congested skies above the airport as a consequence. Luggage arrived on the belt at DMK before we did! The price of the ticket was exceptionally good (but may be due to DMK to KTM being a new route). I had no problem adding three lots of hold baggage post-booking using my UK credit card (I didn't even make my original booking with Thai Lionair but with an online travel agent). I would definitely fly with them again.,True,,Family Leisure,Economy Class,Kathmandu to Bangkok,November 2019,5,5,,5,5,,True,
"""no updates at all""",1,2019-11-16,"Flying with Thai Lion Air is definitely the worst traveling experience in my entire life so far. I have no I idea how their business still survives to this day. I bought my ticket through Traveloka - a third party. I also purchased check in luggage in advance, together with the ticket although their charge for this was surprisingly expensive for a domestic flight from a low-cost airline. About 1 month prior to my departure date, I was informed that my flight had been rescheduled, which was totally no problem to me. However, on my departure date, I gave myself 2 hours in Don Mueang Airport. I kept looking at the screen and couldn't find any info about my flight number, which row to check in and so on. It was like the flight number SL 524 never existed. I checked my mobile app and e-mail again and again, no updates at all. Then I asked the ground staff, they looked at the confirmation and told me to keep queuing and waiting. I was supposed to depart at 4.00pm. Finally, my turn to check in at the counter came, it was about 3.00pm then. The check in staff of Thai Lion Air looked at me like I am an idiot. She took my passport away and came back about 5 minutes later. She told me that ""Madame, you flight time changed, Madame, 3.30pm, hurry up. No check in luggage now, cannot load. All carry-on Madame"". I was totally shocked, literally. She only gave me my passport and boarding pass and kept urging 'Hurry up, hurry up'. She didn't even give me the last minute passenger tag or something like that to let other departments prioritize my following steps before I could board my flight. And of course, no one from this airline accompanied my next steps. Only the hurry up yelling lady! I rushed to the security counter like never before. The nightmare continued, the departure time was coming so close and the security staff asked me to open my suitcase to check - skincare products, sunscreen and many other things. That was why I pre-purchased check-in luggage. Then I had a bunch of my stuff all thrown away at the security counter, continued running like hell to the gate. I was the last person to get on the plane as flight attendants whispering to each other ""Vietnamese"". How funny it was to be treated this way. Notified flight time change 30 minutes in advance, paid for check-in luggage, had a bunch of stuff thrown away then had to carry every single thing onto the aeroplane and even being sarcastically mocked for my nationality. And none of these was my fault. That day was a disaster. From the ground staff at Don Mueang Airport to the check in staff from Thai Lion Air, all showed absolutely fantastic responsibility and support! The tips with this airlines is very simple - don't fly with them. Their prices can be cheap, but if you go with them, be prepared for the nightmare ahead!",True,,Solo Leisure,Economy Class,Bangkok to Chiang Mai ,November 2019,1,1,"<span class=""star fill"">1</span>",1,1,,False,1
"""baggage wasn’t ‘in their system""",1,2019-11-09,"Denpasar to Bangkok. Thai Lion scammed me using the same baggage trick that others online have described. I pre-booked checked baggage but the woman said it wasn’t ‘in their system’. even after showing evidence with an e-ticket specifying 15kg paid, Thai Lion Air still tried to get me to pay $220 extra for baggage on a flight that cost $160. I booked another flight with Jetstar instead for half the price, refusing to pay any more money into this scam airline. This happened in Denpasar airport. Thai Lion Air are scammers and should be shut down.",True,,Solo Leisure,Economy Class,Denpasar to Bangkok,November 2019,1,1,,1,1,,False,
"""Absolutely terrible airline""",1,2019-11-09,"Bangkok to Surat Thani. This is a terrible airline. The A/C didn’t work for the first 30 minutes or last 20 minutes (only worked for 30 minutes) of the flight. The temperature in Bangkok was 86 degrees Fahrenheit, so being stuck inside a packed plane with no moving air made it extremely hot, humid and stuffy. Passengers were using magazines to fan themselves and myself was dripping in sweat. It is ridiculous that a airline can think this is okay for customers. They clearly don’t care about their customers. There was also gum stuck to the handle. So gross to think they don’t even clean their planes either. Absolutely terrible airline. Avoid this airline if possible.",True,,Solo Leisure,Economy Class,Bangkok to Surat Thani,November 2019,1,1,"<span class=""star fill"">1</span>",1,1,,False,1
"""new depths of poor service""",1,2019-11-07,"Denpassar to Chiang Mai via Bangkok. I know not to expect silver service when booking a budget airline, but this airline is truly plumbing new depths of poor service and hidden money grabbing ploys. The staff are arrogant, unfriendly and a disgrace. The legroom on my 5 hour flight was not even suitable for a short domestic hop, let alone an international flight. The money saved in tickets is not worth the hassle and discomfort.",True,Boeing 737-900,Couple Leisure,Economy Class,Denpassar to Chiang Mai via Bangkok,November 2019,1,1,"<span class=""star fill"">1</span>",1,1,,False,1
"""very much below expectation""",2,2019-10-27,"Bali to Bangkok. Overall very much below expectations. On a Bangkok to Bali: delayed departure of 1h. It happens. But then on Bali Airport tarmac, we had to wait 20 minutes for the bus to arrive and take us to the Terminal. On the way back: smooth until you wait 30 minutes for the luggage at the belt. For both cases: no communication whatsoever which is far worst. Staff are nice and smiling. But also having fun, chatting, eating out in the open. Having fun at work is great of course, but not when it goes against service quality. I will avoid this airline in the future.",True,,Business,Economy Class,Bali to Bangkok,October 2019,2,2,,1,2,,False,
"""Staff are very friendly and polite""",10,2019-10-14,"Hat Yai to Don Muang with Thai Lion Air. Staff are very friendly and polite, staff member took me to my seat and put my carry on bag in the over head bin for me. The seat is comfortable. The airplane take off and landing was smooth. The flight departed and arrived on time. The fare is very reasonable, better than the bus and the train if you book in advance. Before buying ticket the travel agent let me know ahead one small carry on luggage is free. The other luggage will be charged.",True,Boeing 737-900ER,Solo Leisure,Economy Class,Hat Yai to Don Muang,September 2019,5,5,"<span class=""star fill"">5</span>",5,5,,True,5
"""extremely unpleasant journey""",1,2019-10-09,"Bangkok to Surat Thani. If you want to enjoy having an extremely unpleasant journey, I recommend you to take Thai Lion Air. This airline seems to want making money with every little thing they can. Watch out if the weight your luggage might be a bit more than you paid in advance (If you had the luck and prepaid for it at all). The fees for overweight luggage are extremely high. Thus ending up paying more than the original ticket price is not uncommon. When I took this airline from Bangkok to Surat Thani, most of the people seemed to pack everything they could into their hand luggage for not having to pay these fees. For quite a few passengers, there was hardly any space left. This is not only uncomfortably and shows a lack of customer care but is a safety risk as well. My flight was delayed because of bad weather conditions but even though the screens showed a delay, the staff wasn't informed about it at all when we asked them. Apart from that, I wonder why people who can hardly speak any English at all can qualify to work at an airline like this. Nevertheless, they have a strict no food policy and the seats are narrow and cannot recline. There are plenty of much more pleasant airlines going to their destinations too. It's your choice.",True,Boeing 737-800,Business,Economy Class,Bangkok to Surat Thani,February 2019,1,1,"<span class=""star fill"">1</span>",1,1,,False,1
"""unprofessional and unfriendly staff""",1,2019-10-08,"Not Verified |  Phuket to Bangkok. I have nothing good to say about them. Was only told that flight was canceled upon arrival at the air. Got booked onto another flight 8hrs later. Very expensive luggage charges, no leg room and very unprofessional and unfriendly staff. Was traveling with my family and had a really rough time.",False,,Family Leisure,Economy Class,Phuket to Bangkok,October 2019,1,1,,1,1,,False,
"""I took my phone out to film""",1,2019-09-13,"Not Verified |  Denpasar to Bangkok. I traveled only with pound sterling and a visa and MasterCard. Onboard the flight for food and drink I was told Thai bhat, US dollars or no drink. I didn’t have any of those currencies. I explained that I still needed to drink and asked if I could have some tap water or staff water the response was no. After an hour of begging for water I was  given a shot size cup of boiling hot water. After a further 2 hours I decided enough was enough so went up again and asked if one of the staff would mind allowing me one of the staff drinks just a 500ml bottle of water the response again was no. I couldn’t believe it so I took my phone out to film what was happening to me.  The cabin crew member grabbed my phone and made me delete the footage of him. In return for the commotion and deleting the photo, I was given a second thimble full of water.",False,,Solo Leisure,Economy Class,Denpasar to Bangkok,September 2019,1,1,,1,1,,False,
"""Nothing is offered free""",1,2019-08-26,"Bangkok to Chiang Rai. The gate closed 15 minutes pass the departure time to pack on more passengers.  Slow boarding and unboarding system (30 minutes delay). Nothing is offered free, water costs money.",True,,Couple Leisure,Economy Class,Bangkok to Chiang Rai,August 2019,3,1,,1,1,,False,
"""Terrible service and flights""",1,2019-08-25,"Tokyo to Bangkok. Terrible service and flights. They had an engine problem in Tokyo which delayed me for 3 hours. Missed all connections and they said it wasn’t their problem. Dumped me in the middle of the night in Bangkok with no accommodation. Also, they run a no outside food and drink policy. Will  not let you on with drinks. Then they try to sell you food on the plane. One sandwich for a 9 hour journey. Joke. They have films to watch, but no earphones! You have to buy them. But if you’re connecting you probably won’t even have Thai Bhat. Staff are rude and aggressive. And no toilet paper in the toilet.",True,,Couple Leisure,Economy Class,Tokyo to Bangkok,August 2019,4,2,"<span class=""star fill"">1</span>",1,2,,False,1
"""never fly Thai Lion Air again""",1,2019-08-23,"Dhaka to Bangkok. Thai Lion Air has some of the worst service I have experienced as a frequent traveler. When I called to have baggage added, they were unable to accept US credit card payments. The representative promised me that the payment would be according to the online amount (about 30 USD) since I couldn't reserve this baggage over the phone or online. She said that as long as I was in line at least four hours before my flight, I would be charged the online price. When got in line 5.5 hours ahead of time, the counter representatives were so inefficient that once I reached the counter, they charged me for about 300 USD without verifying the amount with me. I then disputed this amount, but Thai Lion Air will not acknowledge 1) their own inefficiencies of taking 2 hours to service the baggage check in, their own poor customer service both in informing about baggage pricing and honoring what was agreed upon, and 3) their outdated technology that cannot accept US credit cards. I will never fly Thai Lion Air againr.",True,,Business,Economy Class,Dhaka to Bangkok,June 2019,1,1,,1,1,,False,
"""very much disappointed""",2,2019-08-19,"Dhaka to Bangkok. I have used the aircraft of Thai Lion Air for this route. Their seat are very congested and cheap with the delayed time, which was very painful for all the passengers. They provide snacks after delayed in flight which was worst in taste and quality. Even though they didn't take any kind of activities for the passengers, who all were very much disappointed with the Thai Lion Air. Everyone including me said they never use Thai Lion Air in future.",True,,Solo Leisure,Economy Class,Dhaka to Bangkok,August 2019,1,2,"<span class=""star fill"">1</span>",2,2,,False,
"""cannot recommend this airline""",1,2019-08-10,Not Verified |  Shenzhen to Bangkok. Very bad service. Two time the flight was delayed 1 hour. Huge extra costs on baggage. The on board food is disgusting and even it would be good much too expensive. I cannot recommend this airline and I will avoid consider them again.,False,,Solo Leisure,Economy Class,Shenzhen to Bangkok,July 2019,1,1,"<span class=""star fill"">1</span>",1,1,,False,1
"""cramped with little legroom""",6,2019-07-05,Bangkok to Chiang Mai. Thai lion air is a subsidiary of Lion Air. Aircraft was cramped with little legroom. Landing was rough & bumpy. The flight took off & landed on time.,True,Boeing 737-900ER,Solo Leisure,Economy Class,Bangkok to Chiang Mai,July 2019,2,3,,3,3,,True,
"""such a terrible service""",1,2019-07-01,"Bangkok to Chiang Mai. One of the worst service from airline I ever had. The late evening flight was canceled recently, therefore they moved all flight to the evening flight. The change was made normally and I received notification as usual. But this time I received such a terrible service. Starting from mis-booking the flight by switching my departure flight and arrival flight, which making me unable to do the online check in. This problem occurs again on my return flight. I have contacted call center and the response I received is unacceptable. Firstly they started to ask me to check in online again in the morning, and of course, it did not work. So I kept calling again and received the response that “this problem is unexplainable, especially to customer. Even he explained to me, I am not going to understand anyway”. I had good service from this airline before, but this time could be the last one.",True,,Solo Leisure,Economy Class,Bangkok to Chiang Mai,June 2019,2,3,,1,1,,False,
"""charges for luggage are very high""",1,2019-06-03,"I was flying from Bali to Mumbai via Bangkok, while checking luggage I was told that check-in is not allowed and I had to pay extra 220$ for the same. Their charges for luggage are very high. Its totally unacceptable. Which airline charge check-in luggage wholly. I will never recommend this airline. And after paying so much you don't even get a glass of water you have to buy it. Totally disappointed and frustrated. They purposely tell you about check-in baggage prices on last moment when you don't have any other option.",True,,Couple Leisure,Economy Class,Bali to Mumbai via Bangkok,June 2019,1,1,"<span class=""star fill"">1</span>",1,1,,False,1
"""very high price for baggage""",1,2019-06-02,Bali to Bangkok. Very unprofessional airline. Did not know about check in baggage. Charged very high price for baggage. Had to pay 220 USD for check in baggage. Never fly this airline.,True,,Couple Leisure,Economy Class,Bali to Bangkok,June 2019,1,1,,1,1,,False,
"""never fly Thai Lion again""",1,2019-05-23,"Phuket to Hanoi via Bangkok. I booked a ticket that cost $20 more, with the belief that I was getting a pre-paid bag included. Apparently this was not the case. So, I learn at check-in that because I didn't pre-book my bag, I would have to pay 300 THB ($10 USD) per KG. My bag wieghed 16.6kg. So, they wanted me to pay $166 USD to check my bag! I said hell no! My bodyweight plus my carry-on was 84kg of weight and I paid $84 USD for my ticket. (It was listed at $67 but I paid extra, thinking the checked bag was included) I said I would just book a flight with another airline and check my bag for that price. I checked prices online and I would still have had close to $50 left over too, even with it being last minute! So, what did they do? They looked at the competing prices and said if I bought a new ticket on a domestic flight, the bag would be included ""free"". The new flight cost $83. This undercut the competition just enough where it made sense for me not to go to a competing airline. I really couldn't afford to do anything but accept their offer. And I did not get refunded for the first flight that I booked!  I was also told that if I had been there four hours before the flight left, I could have checked my bag at a much lower rate. I sat and waited for their counter to open, from 3:15AM until 5:00AM. My flight wasn't scheduled to leave until 7:25AM. The employees came and sat at their desks for more than an hour before letting me come to the counter! If I had been given service when I got there I could have gotten the discounted rate, but  I couldn't get it. This is unacceptable! I will never fly Thai Lion again.",True,,Solo Leisure,Economy Class,Phuket to Hanoi via Bangkok,May 2019,1,1,,1,1,,False,
"""have to pay for luggage""",1,2019-05-11,"Phuket to Kuala Lumpur. I tried to pay for baggage online. They did not allow to make payment after putting pnr number I have used my mobile as I did or have laptop or PC Then I called them to pay for 60kg for 4 person, they said 15kg per person is included to check in. I was 3.5 hours before my flight at airport they said you have to pay for luggage and the cost is 400 baht per kg per flight.",True,Boeing 737,Family Leisure,Economy Class,Phuket to Kuala Lumpur,May 2019,1,1,,1,1,,False,
"""won't allow extra luggage""",1,2019-05-09,"Phuket to Bangkok. They do not have transparent luggage policy. While booking you will not see any kind of luggage limit or so on, but while travelling they won't allow you with extra luggage. My travel cost was around 2300 THB for two person, and for extra luggage I have to pay around 7000 THB. Very cheap service, they are not contactable anyhow, nor they will reply to your feedback or emails. Even the water is chargeable during flight.  I personally suggest do not travel with this airline.",True,Boeing 737-800,Couple Leisure,Economy Class,Phuket to Bangkok,April 2019,1,1,"<span class=""star fill"">1</span>",1,1,,False,1
"""ended up cancelling the flight""",1,2019-05-09,"Not Verified | Bangkok to Taipei. First, it is very hard to get the customer service to reply by email or phone. Once you are luck to reach them by phone, you will find out the process - reschedule or cancellation is horrible. I ended up cancelling the flight as I am tired of listening to all those unprofessional customer representative that probably trained to put the best interest of the company instead of being realistic and fair to the customers. The cancellation process is horrible that you have to send the passport and flight details again which they should have those info already. I will never book the flight from Thai Lion Air as this is my first time to book and the experience of booking, reschedule, cancellation and customer service are all really bad that I can not imagine the experience of getting on the flight.",False,,Solo Leisure,Economy Class,Bangkok to Taipei,May 2019,1,1,,1,1,,False,
"""scam on baggage costs""",1,2019-04-24,"Chiang Mai to Bangkok. This company operates a scam on baggage costs where the website and call centre will not accept pre payment for checked baggage and then when you arrive to the airport they charge exorbitant fees per kilo (working out to be 4x the price of ticket in first place.They then recommended us to buy a new ticket with 20kg luggage included which worked out cheaper, then on complaining they eventually recommended it’d be cheaper for it to go on a cargo flight instead!) Ridiculous. The staff were rude and unhelpful. Then the flight was delayed and the seats so uncomfortable with no legroom.",True,,Couple Leisure,Economy Class,Chiang Mai to Bangkok,April 2019,1,1,,1,1,,False,
"""worst customer service""",1,2019-04-22,"Not Verified | Bangkok to Chiang Mai. Never fly with Thai Lion. They charge you 300 baht per Kg for your baggage. They do claim on their website the premium economy allows 20kg baggage for free, however, they don't even have premium economy seats. If you want to experience worst customer service, delayed flight, pay hundred bucks for your baggage - then fly Thai Lion.",False,,Solo Leisure,Economy Class,Bangkok to Chiang Mai,April 2019,1,1,"<span class=""star fill"">1</span>",1,1,,False,1
