header,rating,review_date,comment,trip_verified,aircraft,type_of_traveller,seat_type,route,date_flown,seat_comfort,cabin_staff_service,food_and_beverages,ground_service,value_for_money,wifi_and_connecticity,recommend,wifi_and_connectivity
"""most stressful experience""",1,2022-09-14,"They cancelled our flight and the next one was more than a day later! They refused to give us any compensation or place to stay which most airlines provide in case of delays and cancellations. On call, which was very hard to get through to, they did not help at all. They said sorry but we can not do anything. Even the refund they did not want to process. It is the worst and most stressful experience with any airline so please do not trust them. They seem to do this often form other reviews which i did not know of before booking.",True,,Solo Leisure,Economy Class,Bangkok via Mumbai,September 2022,,,,,1,,False,
"""don't have any intention to refund my money""",1,2022-07-20,"I booked a ticket on 26th July Phuket to Bangkok. They changed flight time and mailed me. Then I want to cancel my flight and want full refund as per airline norms. But they don't have any intention to refund my money. In fact i tried to call to there call center, no one reply to me. Also tried to call Indian call center. Same reflection. Thai Lion actual a cheater Airline company. They cheated our money. I have sent many many mail to them but didn't get any satisfactory result.",True,,Family Leisure,Economy Class,Phuket to Bangkok,July 2022,,,,,1,,False,
"""most horrible flight in my life""",1,2022-03-21,"Probably one of the most horrible flight in my life. There is just nothing right with this company, from the check-in, delay handling, to security in the cabin and complaint handling. Flight was delayed over 3 hours because of supposedly bad weather conditions, while other airlines were flying just fine for the same routes. Left without ANY updates of confirmed departure time, and more importantly, we were refused the ability to cancel our tickets.  We were not offered any food or drink for our over 3 hours wait in the terminal.  Staff English at the counter was below acceptable, as they were barely able to understand questions in regards to how to deal with my music instrument. Staff on board failed to give instruction in English. I was addressed multiple times in THAI, which I do not speak and I wasn't even given the chance to ask what it meant. Ground staff at arrival (Lost and Found counter) don't speak English at all. Call center (called 18th March 3:20PM) excuses failure to follow laws and basic security and information requirements by ""We are a low cost airline"".",True,Boeing 737-800,Business,Economy Class,Khon Kaen to Don Mueang,March 2022,2,2,,2,1,,False,
"""a pleasant no frills flight""",10,2022-02-25,"This was a pleasant no frills flight, flight was on time, friendly crew, clean aircraft. But what sets this carrier apart from other budget airlines are the 10kg checkin allowance. I can recommend this carrier.",True,Boing 737-900,Solo Leisure,Economy Class,Bangkok to Krabi,February 2022,5,5,,5,5,,True,
"""2 years of waiting for refund""",1,2022-01-29,They cancelled the flight last April 2020. That is 2 years of waiting for refund but I kept getting their response that it is still being investigated since there was huge volume of flights they cancelled. 2 years and still no refund up until now. Modern day thief!,True,,Family Leisure,Economy Class,Yangon to Bangkok,March 2021,,,,,1,,False,
"""worst refund experience""",1,2021-10-30,"Not Verified |  This is the worst refund experience, I ever have. They say only a credit account refund is possible, and you have to redeem within a year. My ticket was on 3 April 2020. And now the pandemic isn't over, there is no flight available from Taiwan to Thailand. However, there are no notice for any refund or extension.",False,,Solo Leisure,Economy Class,Taipei to Thailand,November 2020,,,,,1,,False,
"""I did not receive my money back.""",1,2021-09-20,"I had booked the flight from DMK to TST, at first they had changed my flight and I did not want to change so I decided to cancel it for to route going to TST. Then after that the flight back from TST to DMK had been changed again so I would like to cancelled because I had limited time so it was not convenient for me. I decided to cancelled for both flight and they told us to refund the money within 45 days or it could be a bit late as now there are so many passengers asked for the refund. I understood that so I was waiting patiently until now it's been 9 months, I did not receive my money back. I sent them email and they said it has been processing but do not know when it will come. Totally disappointed. To whom wish to fly with this airline, please consider again before you purchase their ticket because if there is something happened, you will lose your money forever.",True,,Couple Leisure,Economy Class,Bangkok to Trang,February 2021,,,,,1,,False,
"""no intention of providing refunds""",1,2021-02-19,"I had a flight booked in April 2020, which was obviously cancelled. I have emailed and called many times to request some sort of update on my refund, and the response is always the same: ""In regards to your email, your refund is still in process. it takes an unusually long time to process the refunds. Sorry for your inconvenience"". The response never changes and never provides any clear information. I definitely understand the last year has been challenging. However, I also had reservations with two other Thai airlines - one has processed the refund, and the other is at least providing updates and regular communication. At this point, it feels like there is no intention of providing refunds. I recommend booking with any other airline.",True,,Solo Leisure,Economy Class,Dhaka to Bangkok,April 2020,,,,,1,,False,
"""no money and no more contact""",1,2021-01-27,"Flight of march 2020 was (logically) cancelled. We requested a refund, which the system said was being processed and could take up to 45 days. Since then no money and no more contact. Phoned multiple times, waiting time up to an hour and when finally in the call, being pressed away again.",True,,Solo Leisure,Economy Class,Bangkok to Colombo,March 2020,,,,,1,,False,
"""still waiting for refund""",1,2020-12-01,"Like many others, still waiting for refund. Original flight plans was in mid-April but as they was understandably cancelled due to COVID I called them to receive a refund. Very hasty reply call center, was almost not able to finish what I wanted to say. Their waiting time has exceeded 30 min every time. Likely close to 40 minutes. Next call was in beginning of August after sending emails in between, I was told to wait until end of October. That has now passed by over a month and still no information and of course no refund.",True,,Couple Leisure,Economy Class,Bangkok to Osaka,April 2020,,,,,1,,False,
"""never fly with them again""",1,2020-12-01,"Paid extra for seat advanced selection but they changed aircraft type and my seats to something different than what I picked without informing me, only realized the change after boarding the flight. Made a complaint at their ticket office at Don Muang Airport after we landed and was told supervisor would call me to discuss refund. 3 days later and still no call, have tried to contacting call-center and put on hold for 20 mins with no one answering calls. Will never fly with them again and would not recommend them.",True,Boeing 737,Couple Leisure,Economy Class,Chiang Mai to Bangkok,November 2020,1,1,,1,1,,False,
"""they don't refund you""",1,2020-11-13,Bangkok to Bali. I wait for refund more than 215 days They told me with in 45 days you have refund I call 10 time minimum. Send 40 email minimum and still no refund. So watch out when book ticket they don't refund you.,True,,Solo Leisure,Economy Class,Bangkok to Bali,June 2020,,,,,1,,True,
"""Terrible airlines and terrible service""",1,2020-08-24,"Not Verified |  I have been waiting 6+ months for a refund, and they never reply to any emails or enquires. Terrible airlines and terrible service. They have basically taken free money for a service that was never provided. This airline is nothing short of a giant scam. Never will I ever book with Thai Lion Air again, and I will warn every single traveller to avoid this airline at all costs.",False,,Couple Leisure,Economy Class,Bali to Bangkok,April 2020,,,,,1,,False,
"""never take a flight with them again""",1,2020-07-29,"Due to Covid-19, Thai Lion Air notified me the cancellation of my April round trip flight from Taipei to Bangkok but without mentioning any remedy. I had to go to their website to find out the solution. Then I sent 2 emails with photocopy of my e-ticket and passport to request a refund, but got no any response and of course no refund since April. This is the worst airline I have ever experienced, and I will never take a flight with them again.",True,,Solo Leisure,Economy Class,Taipei to Bangkok,April 2020,,,,,1,,False,
"""really fed up and disappointed""",1,2020-07-25,In February 2020 I got email to refund for my ticket Singapore to Bangkok. They said within 45 days will receive but I ‘m been waiting 4 months. In between I tried to contact several time to hotline and email as well but no response. Now I really fed up and disappointed of that they do not keep their word. I will not be customer of that airline again.,True,,Solo Leisure,Economy Class,Singapore to Bangkok,December 2019,,,,,2,,False,
"""This is very poor service""",1,2020-05-04,"Singapore to Bangkok was cancelled due to Covid-19 situation, I had called to Singapore customer service hotline in last February to ask for refund but till now no respond from Thai Lion Air. Worst, the hotline was terminated in March. I've been keep sending emails to Thai Lion Air subsequently but no reply at all. This is very poor service and totally unacceptable. Will never book any Thai Lion Air flight if no refund back to me.",True,,Couple Leisure,Economy Class,Singapore to Bangkok,April 2020,,,,,1,,False,
"""poor customer service""",1,2020-04-16,I was so appalled by the poor customer service. I have never been spoken to as rudely as my a Thai Lion Air representative on the phone. I My flight from Bangkok to Bali was rescheduled twice by airline. I rang up. Waited 50mins. I understand Covid-19 led to cancellation. What I don’t accept is having to wait 60 working days for a refund. Told this is normal and I should be happy. Staff clearly don’t care. Asked to speak to manager told no! I’ve never known such arrogance and rudeness. Please stay away.,True,,Couple Leisure,Economy Class,Bangkok to Bali,March 2020,,,,,1,,False,
"""They did refund my money""",1,2020-04-08,"Not Verified |  I had a flight with my partner with Thai Lion Air from Bali to Bangkok on March 20th 2020 which cost 160 euros and we needed to get to Thailand to fly home on April 7, all this in the middle of the covid 19 crisis. Some days before I got check the flight status and it says unknown. I proceed to email Lion Air , as well as text them on Facebook and Twitter, as I didn´t have a phone to call. It is now April 8 and they have only now replied. When I got to the airport I found out that the last flight they would be operating to Thailand had been the day before, and they had given me no information. The staff was extremely rude and unhelpful to me, the customer service is terrible. They did refund my money right away in cash.",False,,Couple Leisure,Economy Class,Bali to Bangkok,March 2020,,,,1,1,,False,
"""Worst experience flying""",1,2020-03-16,"Not Verified |  Bangkok to Colombo. Worst experience flying of my life. They are a complete scam. They made us wait in line at check-in for over an hour and I was at the airport 2 hours early, then, when I get to the counter the have me paid for my checked bag which I anticipated a good $70-80 but they said now I was too late SO, $177 later I checked my bag. Awful. They had no customer service representative for us to talk to (there was a group of us). I don't care how much more I have to pay, I will never fly Thai Lion again.",False,,Solo Leisure,Economy Class,Bangkok to Colombo,March 2020,1,1,"<span class=""star fill"">1</span>",1,1,,False,1
"""the most horrible airline""",2,2020-03-06,"We’ve been traveling around Thailand for nearly 2 weeks - from Chiang Mai, Bangkok, Koh Sumai, Krabi and now heading to Bali, Indonesia for our honeymoon. And I had to take some time at the airport to leave this review because Thai Lion is by far the most horrible airline we’ve ever flown, period. They have no app and their website is complete crap. Always down. So accessing flight details or making changes is a nightmare, which makes the luggage bullet below even more frustrating. We had our flight cancelled and rescheduled 3 times within 48 - 24 hours from our flight which really cut into our plans in Bali. No explanation, simply an email sent. So we basically had to wake up at 3:00am to make our rescheduled flight, which still gets us there LATER than anticipated because of the layover. - We get to the airline and they dropped our luggage from our original tickets and would not let us check in without paying for luggage again. My husband (being the typical man, though he’s fairly good at this stuff) didn’t have a receipt so we had to repay for luggage. When you pay for luggage, you have to run to a separate counter and come BACK to the check-in area because they can’t process payments at the check-in area. What?! What century are you living in? Because we have a transfer in Bangkok, we have to pick up our own luggage from baggage claim and re-check it into our next flight.  The hassle just keeps getting worse! We finally get on the plane and notice my husband and I’s seats have been separated by an entire row. Which isn’t a huge deal, but just a cherry on top of all the chaos.  We finally get on and the plane is dirty. Still trash from the last flight. Another cherry on top. We almost missed our triple delayed flight to Bali all because of the incompetence of Thai Lion. And we weren’t even the most unlucky ones. Some people got dropped completely during the flight changes and were left stranded at the airport! Just don’t do it. Do yourself the favor and pay a little more for a separate airline - avoid the frustration, hassle, and risk. Wish we head know beforehand because we definitely would have.",True,,Couple Leisure,Economy Class,Krabi to Bangkok,March 2020,2,2,"<span class=""star fill"">1</span>",1,2,,False,1
"""I had to pay for the flight twice""",1,2020-03-05,"Not Verified |  After payment, I received a popup window telling me my booking failed and I need to try again. I then tried to contact the airline via phone and email for a booking confirmation. On the phone I was in the waiting line forever until I gave up and on my email I only received an answer over a week later, what was the day of my departure. Never have I received a bookig confirmation and then they write me 2 hours before schedueled flight time, that I am booked for the flight and can proceed check-in! Not knowing if I had a flight ticket, I booked a couple of days before my departure date with a different airline. I tried to resolve the matter with Lion Air, but their customer service is absolutely useless, replies weren't read, templates sent out, long periods between responses. I then requested a chargeback from my credit card provider what got turned down in the end. So I had to pay for the flight twice. Only to save a few Baht I would think twice now. Maybe a bigger provider is the better option.",False,,Couple Leisure,Economy Class,Treng to Bangkok,December 2019,1,1,,1,1,,False,
"""The worst company""",1,2020-02-12,Phuket to Bangkok. I booked a round trip on trip.com from Bangkok to Phuket including a baggage 12 kg. When I return they said that the baggage wasn’t included to the return fight on 11 February. They demand 950 baht / 29 euro. The worst company. Avoid them.,True,,Solo Leisure,Economy Class,Phuket to Bangkok,February 2020,1,1,"<span class=""star fill"">1</span>",1,1,,False,1
"""customer service is the worst""",2,2020-02-07,"Not Verified |  Tokyo Narita to Bali. Be sure to pay for baggage when purchasing ticket. We did not, and tried using their website a day in advance of our flight. No luck with the website, we went to the airport in Bali 5 hours ahead of our flight to get our bags prepaid. That failed as well ... there office was closed. Once the counter opened we were hustled into paying 430 US dollars for two suitcases, the heaviest weighed in at 12 kilos. No supervisor to be found. Ruined the ending of what was a great trip. Thai lion Air customer service is the worst.",False,,Couple Leisure,Economy Class,Tokyo Narita to Bali ,December 2019,3,3,,4,1,,False,
"""Not bad at all""",6,2020-01-22,"Krabi to Hanoi via Bangkok. Not bad at all. After reading reviews I was surprised. Paying for hold baggage was a pain and took a few phone calls but I managed. Paying at check-in is hugely expensive, which is common for budget airlines. Prepaying is much cheaper. Check in was fast and courteous. Boarding was no less manic than any other airline in Thailand. Flight was short and fine. As expected for an economy short flight. Bit of a Ryanair experience to be fair.",True,,Couple Leisure,Economy Class,Krabi to Hanoi via Bangkok,January 2020,3,3,,4,3,,True,
"""a terrible airline to travel with""",1,2020-01-19,"Kathmandu to Bangkok. This is a terrible airline to travel with. Please beware. This is the second time I am flying with Thai Lion Air and both times the flight was delayed. This time, it was delayed over 26 hours, and the boarding crew kept telling us that the plane was delayed for 2 hours, but we waited 11 hours at the airport. In the end the flight was cancelled and they put us up in a terrible hotel which did not even have hot water for a shower. They told us that we were going to leave in the morning, but in the end the flight was scheduled to leave at 2.15 pm and even then, the flight was delayed again. This is a terrible experience and I would not recommend anyone to fly with Thai Lion Air.",True,,Business,Economy Class,Kathmandu to Bangkok,January 2020,1,1,"<span class=""star fill"">1</span>",1,1,,False,1
"""the trip was really good""",7,2020-01-16,"Denpasar to Bangkok. Our flight was perfect, check in was 5 minutes, departed on time, crew were polite, arrived on time. Plane was not super comfortable but was fine with sufficient leg space. Considering the flight cost us 100 dollars the trip was really good.",True,,Couple Leisure,Economy Class,Denpasar to Bangkok,January 2020,3,5,,5,5,,True,
"""cheap way to fly around Asia""",5,2020-01-15,"Bangkok to Krabi. A cheap way to fly around Asia, knowing that, I don’t think you will be too disappointed with the no leg room, no customer service, excessive charges on carry on and checked baggage. So make sure you have your carry on weighed before you head to airport.  Then if you check any bag it’s very very expensive.  Somehow I made changes (twice) to my ticket. And after the whole transaction went through, they said they didn’t accept US credit cards! In shock. But the hotel clerk went into the site where I bought the ticket and twice was able to input my cc information. Just be aware, it’s Thailand, low cost carrier.",True,Boeing 737-900,Solo Leisure,Economy Class,Bangkok to Krabi,January 2020,2,2,,4,2,,True,
"""Ridiculous policy on carry-on""",2,2020-01-03,"Not Verified |  Bangkok to Chiang Mai. Ridiculous policy on carry-on bags. If your bag weighs more than 7k you have to take items out of your bag and hold them. I ended up walking with my backpack, neck pillow, toiletry bag, running shoes and make up bag. It was so inconvenient that I just put my stuff back in my bag, but there was another scale at the gate before boarding so we had to go through the process again. When we got on the plane we stowed the carry on bags and just put all the extra items up in the overhead compartments, completely defeating the purpose of lightening our bags. Once seated my partner and I took out our lunches that we’d packed, only to be told that in fact, outside food isn’t allowed on the plane,there were no signs or announcements outlining this policy. We had to sneak bites of our food during the flight. When we landed the airline operated shuttle bus was broken and we had to stand in the isles (holding all of our items that had been pulled from our bags) for 25 minutes. Overall it was a pretty funny experience! Weird policies (attempt to make more money by charging baggage fees and making people buy food on the plane?) and one inconvenience after another!",False,,Couple Leisure,Economy Class,Bangkok to Chiang Mai,January 2020,2,2,,2,2,,False,
"""had to pay for my bag twice""",1,2020-01-03,"Bangkok to Phuket. Flight was 25min late and changed time of my flight (still through thai lion) had to pay for my bag twice even though was still through same airline. (2 flights one from Chiang mai to Bangkok then Bangkok to Phuket) both same airline. I checked in online 24hrs before and paid for baggage but when I arrived to check, they told me it wasn’t paid for. The lady in Chiang Mai was able to find my reservation for checked bag but when I had to go to baggage claim go through airport again to go through same airline (made no sense) they couldn’t find my reservation for my bag so I spent 30min dealing with that and still had to pay again. Horrible experience.",True,,Couple Leisure,Economy Class,Bangkok to Phuket,January 2020,1,1,"<span class=""star fill"">1</span>",1,1,,False,1
"""they have lots of issues"" ",8,2020-01-02,"Bangkok to Osaka. Again, confusion over check-in times. Email sent 24 hours before said open 4 hours before, web-site said 3 hours and screens at the airport showed a check-in row number more than 5 hours before. Approached the check-in desk, which then had almost no queues, to be told that check-in opened at 2 am - 3.5 hours before the flight. All this information is completely contradictory and confusing. Returned to the check-in desk at 2 am and checked in very quickly - no waiting at all. Seat numbers had been changed (again) from those booked and paid for (due to aircraft change) but staff very helpful in moving us to more appropriate seats. Why don’t they communicate with customers when pre-selected and paid for seats are changed? This would at least give customers the option of trying to amend their booking to choose different seats, or automatically refund the price paid. I lost money by buying 25kg of luggage when my bag actually weighed less than 22kg. It’s crazy to expect customers to be able to predict their bag weight to the nearest kilogram, so inevitably people presumably end up buying more than they need. An enlightened approach to customer service is needed here. How about automatically refunding unused pre-paid luggage, considering the lucrative revenue stream they must generate from charging people at check-in who have underpaid? Fast and smooth through immigration and security. The long bus journey to aircraft via Gate 1 - groan. On time departure and arrival, uneventful flight. (The flight was re-timed several months before departure from 04:30 departure to 05:20. This was communicated effectively by email but was annoying nonetheless). Overall, considering this and the previously-reviewed outward flight, I might use this airline again if the price was right. However, they have lots of issues with their website, booking system, communications and policies generally that - even for a budget airline - leave areas where improvements could be made. There is room in the market for a low-cost operator to also show that they care about their customers - a lot of initiatives are not expensive. The check-in staff who helped me with my seats today got close and made a good impression, but the company itself has much more to do.",True,,Couple Leisure,Economy Class,Bangkok to Osaka,January 2020,4,4,,5,4,,True,
"""Crew was courteous""",8,2019-12-30,"Bangkok to Jakarta. No online check in possible, but the airport check in was smooth. Staff extremely lenient about grossly oversized hand luggage carried by many. Flight departed on time and arrived 15 minutes early. I was given an emergency row seat but could also find several empty rows on board, making for a comfy journey. Crew was courteous, only customs forms were not provided.",True,,Solo Leisure,Economy Class,Bangkok to Jakarta,December 2019,5,4,,4,3,,True,
