header,rating,review_date,comment,trip_verified,aircraft,type_of_traveller,seat_type,route,date_flown,seat_comfort,cabin_staff_service,food_and_beverages,ground_service,value_for_money,wifi_and_connecticity,recommend,wifi_and_connectivity
"""hottest flight I ever had""",6,2018-03-25,"Bangkok to Hat Yai. The positives were smooth boarding, on-time departure and generous legroom. A minor annoyance is the need to actually print out the web-check-in boarding pass, they don't accept digital boarding passes. The real discomfort however was the lack of aircon. I don't know if it was broken or just turned off for saving purposes, anyway it was the hottest flight I ever had. There was ventilation but it only recycled hot air. The temperature became more bearable as we reached cruising altitude but upon landing the Thai summer struck back. No free food or water, snacks available for purchase.",True,Boeing 737-800,Business,Economy Class,Bangkok to Hat Yai,March 2018,4,3,,4,3,,True,
"""worst airline experience""",2,2018-03-03,"Phuket to Bangkok. We bought our tickets on a travel website not really checking with what airline we would have to deal - that might have been a mistake. Thai Lion Air has this policy where you need to pay for extra luggage weight 4 hours prior to your flight. And if it’s a domestic flight you can only carry 10kg under the airplane. We didn’t get that in our two way ticket (it wasn’t explained clearly but still took the blame for it). We had to pay over 300$ CAN for our extra weight penality because we had 2 luggages weighing a little under 20kg (which is the norm for most airplane companies). So 4-5 days before our next flight departure, I called them to know how exactly I can pay for extra weight. They told me I can’t pay over the phone because they don’t take credit cards from Canada, United States, Japan and a few other countries over the phone. So they told me to pay via internet or come 4 hours prior to my flight at the airport to pay. Keep in mind that they know I’m leaving at 8 am. So first I try via internet with their website to pay for my extra luggages weight - it would deny my credit card payments. I tried at least 6 times during 3 days and it just would not work. So we were forced to go 4 hours earlier to the airport. Our flight was at 8 am so we had to get to the airport at least 5 hours ealier to get a chance to pay for our luggages. When we got there around 3 am the gates were not opened and I had to get to another terminal to get help from their office. When I got there the staff was not able to help me with anything and just repeated what was written on the internet like a robot. I asked if I could talk to a supervisor or if there where someone I could call and they gave me the same number I called at first. I finally found a pay phone on my own, called the airline, just to find out that I had to go back to the same terminal I was first to find the cargo department for help. When I got back to my terminal I found out the cargo departement was in another terminal 10 min walk away from my terminal. I asked the info center to call the cargo departement to see if they could actually help me. Cargo Departement told me that the airline had to help me and to call them back. I was so frustrated to lose hours of sleep to be played like that. Got on the phone with airline again and told them they had to make it work because this was nonsense. They told me they could not help and kept telling me to contact the Cargo Department, again. I hung up and waited 1 hour in front of the terminal for an agent to finally let our luggages pass without paying but with the worst attitude ever. Worst airline experience ever 2/10 just for letting us pass without paying for extra luggages and I’m being generous.",True,,Couple Leisure,Economy Class,Phuket to Bangkok,March 2018,2,3,"<span class=""star fill"">1</span>",1,1,,False,
"""Everyone sweltering hot and uncomfortable""",3,2018-02-22,Flew Thai Lion Air from Bangkok to Chiang Mai. I was waiting in the plane for 60 minutes in Bangkok with no air conditioning during the highest heat of the day in Bangkok. Everyone overheating but staff refusing to put on the A/C. Everyone sweltering hot and uncomfortable. Not happy with the service on this airline.,True,,Solo Leisure,Economy Class,Bangkok to Chiang Mai,February 2018,3,2,"<span class=""star fill"">1</span>",4,3,,False,1
"""Avoid to use this airline""",1,2018-02-14,"Bangkok to Denpasar. Avoid to use this airline. when arrived at the airport was told that flight was canceled (several months ago!). when asked them what to do got reply that they will refund the tickets - ok, but what about taxi, hotel, left baggage service, transaction fee, etcv- nothing. Iexplained that we have booked/prepaid hotel in Denpasar they replied its not their business,  there was no sign of any help from them, haven't offered another flight, haven't tried to do anything. Just replied that they will proceed my request for refund within 45 business days. That was several months after cancelation, so they should proceeded anyway before already. but thats their policy. They filled some piece of paper barely looking like an official form and have problems to put in their info, stamp, name etc at the end, we just walked away and booked with another airline for more than 2x more money to avoid more losses for next taxi, hotels etc.",True,,Couple Leisure,Economy Class,Bangkok to Denpasar,February 2018,,,,,1,,False,
"""Customer service line is unreachable""",1,2018-01-23,"To make your journey comfortable, we strongly advise you to avoid Thai Lion Air! They cancelled our flights (both Bangkok to Phuket and return), just gave us a new timing that did not fit our needs due to renting a car, accommodation etc. Now they are avoiding our e-mails! Customer service line is unreachable (called from Europe twice and waited 20+ min. without answer). Not recommended.",True,,Family Leisure,Economy Class,Bangkok to Phuket,January 2018,1,1,"<span class=""star fill"">1</span>",1,1,,False,1
"""Avoid at all costs""",1,2017-12-22,"Bangkok to Phuket. Avoid at all costs. The tickets are cheap and that is why the service and everything about this airline is cheap as well. I waited online for over an hour to check in on the no baggage check line. What makes it worse is they kept calling groups of passengers to jump the line because their flight was leaving soon. I guess getting there on time is not suggested because if you do you will wait over an hour, but if you arrive late they will just let you cut everybody. I then get on the flight and we were suppose to leave at 2:55pm, but they continued boarding passengers for almost an hour after take off time. Then an hour and 15 minutes after take off time they tell us we will be another at least 15 minutes because there are 5 planes ahead of us. If you don’t mind terrible service, delayed flights, packed with passengers who will arrive late and hold up the flight then by all means fly Thai Lion Air. In return the only benefit is the tickets are cheap.",True,,Solo Leisure,Economy Class,Bangkok to Phuket,December 2017,1,1,"<span class=""star fill"">1</span>",1,3,,False,
"""never fly this airline again""",1,2017-12-18,"Denpasar to Bangkok. Very disappointed with extra baggage charges at Denpasar airport. The Thai Lion website and the staff I spoke to at Bangkok stated $32 for 10kgs, but the staff at the airport tried to charge me $160. I got rid of 7 kgs and was charged $66 for a lousy 3 kgs. I feel very ripped of by the Thai Lion staff at Bali airport. They refused to call head office and said they could not do anything. They would not budge at all. Will never fly this airline again.",True,,Couple Leisure,Economy Class,Denpasar to Bangkok,December 2017,1,2,,1,1,,False,
"""do all I can to avoid them""",2,2017-11-17,"✅ Verified Review |  Bangkok to Yangon. I use this Thai Lion Air 2 to 6 times per month and I am regularly satisfied with their service. Nevertheless, I had in few occasions in the past and particularly this months a terrible one, from various services.  I tried the evening before the morning flight to purchase some additional kilos of luggage. Firstly through the phone. I stayed in 2 occasions more than 15 minutes on line waiting for an operator to reply. Hopeless. Then I tried on the website, which specify this possibility to buy extra luggage until 4hours before the flight. Spend 30 minutes navigating and it seems that there is actually no possibility to book luggage online. I arrived at airport 2h00 before the flight so I would have enough time to explain my case to Sales counter in Don Muang Airport. Basically told me that instead of paying 700 baht for 10 kg luggage (bought in advance), I would need to pay 500 baht ++ per kilos (total 5600 baht). They have been unhelpful, even rude, including before I would submit my request no greeting, so smile, no engagement. Terrible. The manager and 2 staff were not trying to help and did not care that their phone service and website was dysfunctional. I asked to speak to a real manager of customer serice director and they would decline. As they are not trained for this type of issues and complain resolution, neither have power to act, they called the security as I did not wanted to leave without resolution. To be noted that the Thai Lion security agent was a gentleman and tried to help. He even told me that this type of cases are happening often and that he felt sorry for me. I went to proceed to check-in and explained my case. The ground staff agent was also very unpleasant (no greeting, no smile, no attention) even before I exposed the issue. She then listened and asked her supervisor to come. She directly said that she was not ready to help (what kind of manager in an airline does not have better training and skills in issue resolution?). After arguing for 15 minutes she told me I would pay only for half even I explained again that it was still very unfair that I was not able to buy the extra luggage before because their customer care services are not functioning. She could only say I cannot help you and just complain online. Also could not give the name and contact of a real manager. I did pay and proceeded to boarding.  After flight, I received a satisfaction questionnaire, which I immediately filled adding a comment to ask for a Customer relations manager to contact me back. 48 hours later, nothing happened. To be noted that flights are usually comfortable with actually very professional stewards and hostesses. Most of the time departure are on time, all of this with really good deals. Such a shame that their sales and ground services are disorganised, dishonest and not trained. Will do all I can to avoid them.",False,Boeing 737,Business,Economy Class,Bangkok to Yangon,November 2017,2,4,"<span class=""star fill"">2</span>",1,3,,False,
"""pleasant, no delays or cancelations""",9,2017-09-21,"✅ Verified Review |  Chiang Mai to Bangkok. The flight was pleasant, no delays or cancelations, decent food as well. The only qualm I have is that Thai Lion Air is that when booking my flights through a 3rd party (expedia, momondo, etc.) Thai Lion Air's website won't allow me to see my booking at all, manage it, anything. I've booked all my flights through 3rd party websites and haven't had an issue like that before.",False,,Couple Leisure,Economy Class,Chiang Mai to Bangkok,September 2017,4,5,,5,5,,True,
"""Return as good as the first one""",9,2017-07-22,"✅ Verified Review |  Bangkok to Chiang Rai. Return trip as good as the first one. Both legs on time and bags on the belt before us. Again the only issue is the impossibility of check in through your final destination. Leg room is very tight but fine for an hour flight, I am 1.60 so I normally fit well in any airline seat. 15 kg checked bag is included in the price.",False,Boeing 737-800,Business,Economy Class,Bangkok to Chiang Rai,July 2017,3,3,,5,5,,True,
"""they include 15kg bag in the price""",9,2017-07-19,"✅ Verified Review |  Chiang Rai to Nakorn Si Thamarat via Bangkok and both flights were on time. Leg room is the tightest I've ever seen, but still ok for a 60 minute flight. No frills airline so don't expect anything free on board but they include a 15kg bag in the price. Our only issue with then was that you can't check your bags though even when connecting to a flight with the same airlane.",False,Boeing 737-900ER / 737-800,Business,Economy Class,Chiang Rai to Nakorn Si Thamarat via Bangkok,July 2017,4,4,,4,5,,True,
"""staff unfriendly and inexperienced""",3,2017-06-28,"✅ Verified Review | Flew Bangkok to Khon Kaen with Thai Lion Air. Boarding started 5 minutes after we should have departed (despite the aircraft being on the stand for at least an hour), and was done in an unprofessional manner, announcements not being made by the PA system but by shouting at passengers and in Thai only. We departed 30 minutes late, with no explanation for delay. Staff seemed unfriendly and inexperienced especially the ground staff. During the flight, there was an announcement that cabin crew would be selling food and drinks and to refer to the menu in the seat pocket, but there was no menus in the seats. Then the attendants came down the aisle with the trolley very quickly and didn't seem to want to sell anything. Recorded announcements were confusing and not given at the right time, for example we were told we were starting our descent just 5 minutes before landing. The flight itself was fine, but the unprofessional attitude of this airline and inexperience of the staff doesn't inspire confidence. On the plus side they give a free 15kg bag allowance and free seat selection when checking in online and the flight was cheap.",False,Boeing 737-800,Couple Leisure,Economy Class,Bangkok to Khon Kaen,June 2017,3,1,,1,4,,False,
"""seats are very tight""",3,2017-04-03,"✅ Verified Review |  Flight from Krabi to Bangkok delayed 1 hour and 40 minutes. Missed the next connection. Had to buy full price replacement ticket. No help from Thai Lion Air. Seats are very tight. Not designed for anyone over 175 cm. No complimentary onboard snack or drink, had to buy everything.",False,Boeing 737-900ER,Couple Leisure,Economy Class,Krabi to Bangkok,April 2017,1,1,,1,1,,False,
"""impressed with the airline""",10,2017-03-26,"✅ Verified Review |  I flew round trip from Ho Chi Minh City to Bangkok. The ground crew as well as cabin crew was wonderful, helpful, friendly and professional. The aircraft was clean and on time. I was impressed with the airline. Will definitely fly them again in the future. Only isue I had was the seat pitch was a little to narrow for tall people, but OK for shorter travellers.",False,,Couple Leisure,Economy Class,Ho Chi Minh City to Bangkok,March 2017,3,5,,5,5,,True,
"""great service and staff""",9,2016-12-20,"✅ Verified Review |  Bangkok to Phuket.  I was really surprised with Thai Lion Air. I often fly with this airline many times due to luggage allowance and low fares. Never had any trouble during purchasing the tickets or the flight itself. This time I faced a different situation where my plans changed and I had to change the date of my ticket. At first I didn't even want to try to do that since it usually turns out to be a nightmare, I thought it would be easier just to purchase new tickets, however after I decided to give it a try and was actually very surprised by how easy it was. It took me only 3 minutes to change the date of the flight and pay for it. The call-center operator spoke good english. They even called me back after to remind to change the insurance date. Great airline with great service and staff!",False,,Solo Leisure,Economy Class,DMK to HKT,December 2016,4,5,,4,4,,True,
"""disappointed apart from the cost""",4,2016-11-28,Booked return flights from Bangkok to Krabi with Thai Lion Air and have to say was well disappointed apart from the cost. We were travelling with a 4 year old and had been delayed so bought some drinks in the airport. When we were boarding the flight we were told that we couldn't take the drinks on the plane - expected just to take a 4 year old and refuse him a drink.,False,,Family Leisure,Economy Class,KBV to BKK,November 2016,1,3,"<span class=""star fill"">1</span>",2,3,,False,1
"""cabin crew were especially caring""",8,2016-07-15,Phuket to Bangkok with Thai Lion Air. Flight was operated by a new B737-900 which was really clean and very smart inside. The cabin crew were especially caring and moved me to row 1 on my own to give me more space. I also liked the free chocolate bar which I thought was a nice touch against an old sandwich. The onboard service and aircraft is better than Nokair or Airasia which I have flown before. However they are majorly let down by handling in both HKT airport and DMK airport. You do online checkin but have to still check in like everyone else as no bag drop available? And when you question this a glazed employee looks without any answer or explanation. Upon arrival in DMK we waited over 30 minutes for the first bag after the aircraft came onto blocks. This meant I nearly missed the free bus to BKK main airport. I would fly Thai lion again but feel they need to put the contracted handling company under some pressure to perform and also look at the online check-in policy and bag dropping facilities.,False,Boeing 737-900ER,Solo Leisure,Economy Class,HKT to BKK,July 2016,4,5,"<span class=""star fill"">1</span>",1,5,,True,1
"""flights were both punctual""",10,2016-06-13,"I'm not sure why people talk about delays. My Thai Lion Air flights (Don Muang to Chiang Mai and return) were both punctual. DMK to CNX on early Friday morning SL500. First flight from DMK. Very early - 5.50am, but a great time to be in Chiang Mai. Arrived 7am. No delay. CNX to DMK on Sunday afternoon SL509. Same, no delay. Arrived DMK 2.15pm. No turbulence. Great view of the ground. Plane not flying very high. Best thing TLA is the cabin staff who were all very well groomed and highly skilled in providing a great service, even though the travel time was only 1 hour. Drinks were served together with biscuits. Didn't expect any food or drinks, since flight was only 1hr. But still this basic need was provided. Cheap to fly too. So if you are travelling domestic, consider Thai Lion Air. The only sticky issue is use of electronic gadgets. These days with mobile phones containing music and videos, it is an entertainment module all-in. Asking me (repeatedly) to switch off my phone during the flight was a big nag. Besides, there are other airlines already providing wifi services in the sky. As a frequent flyer on planes, as long as we respect the take-off and landing, no surf periods, all should be fine in the sky.",False,,Solo Leisure,Economy Class,DMK to CNX,June 2016,5,5,,5,5,,True,
"""inefficient, non-communicative, unhelpful""",1,2016-06-04,"✅ Verified Review |  
Chiang Mai to Phuket via Bangkok with Thai Lion Air. I have now taken 4 flights with Lion Air and 100% of these flights have been delayed which is most frustrating when connecting. With Thai Lion Air, you must go through customs, collect baggage and check in all over again for your connecting flight. Yesterday our first flight was delayed by 1h 35mins meaning we made it to the check in desk for flight 2 with only 4mins to spare. The airline also stated that despite the delays being their fault, should we not make our connection they would not put us on a later flight. We could buy one if we wanted. I won't be flying with Thai Lion Air again. Stressful, inefficient, non-communicative and simply unhelpful. Their one positive is you don't pay for checked baggage.",False,,Solo Leisure,Economy Class,CNX to HKT via DMK,June 2016,2,2,,1,1,,False,
"""cabin crew were courteous""",9,2016-05-29,"✅ Verified Review |  I had never heard of Thai Lion Air before. The experience of flying from Bangkok to Phuket and back was as good as the best airlines on this route, and much cheaper. The check-in at both airports was very friendly, helpful, and efficient. The ground staff were very helpful in providing a seat suitable for my height. The seats were comfortable. (New planes.) The cabin crew on both flights were courteous and warm. On the flight from Phuket to Bangkok a passenger fell ill, the crew dealt with the many aspects of the situation very well indeed and in a very caring manner towards the passenger. There are 3 small points for improvement though: 1) Ground staff shouldn't be seen drinking anything at the Gate. It affects the professional image. (Phuket) 2) The return flight from Phuket to Bangkok left 55 minutes late. The staff at the Gate should have explained the reason why (even if it was most probably because of the bad weather) and the Captain should also have explained why the plane took ages to take off, and apologized for the 55-minute overall delay. The reason was obvious, but he should have explained why. If you want food, you can buy it. Not having to pay for luggage was welcome, and was the main reason for not flying with Air Asia.",False,Boeing 737-900er,Solo Leisure,Economy Class,BKK to HKT,May 2016,5,5,,5,5,,True,
"""they improved the service""",10,2016-05-10,"✅ Verified Review |  Phuket to Bangkok on 5 May, and tried for second time the add on Fast Service of Thai Lion Air. They improved the service. My compliments to the ground and in flight staff. Brand new aircraft, clean and pre booked meal was fresh. Fast personal check in, priority boarding with VIP mini bus, left first the aircraft and received my luggage from a ground staff upon arrived at the belt. The best domestic flight I have had. To improve the possibility to buy the fast service from the web site also.",False,Boeing 737-800,Solo Leisure,Economy Class,HKT to DMK,May 2016,5,5,"<span class=""star fill"">1</span>",5,5,,True,1
"""pre-booked meal deliciously fresh""",7,2016-04-15,"Service was satisfactory to a certain level but lots of improvements need to be made. 10 April - Don Muang - Phuket flight 766. Last time I traveled with Lion Air I had paid an extra fee for the Lion Fast Service that offers exclusive check-in counter, priority boarding, seat on the first rows and priority claim bag. I would first like to compliment the staff of Lion Air office in Phuket Airport (second floor – I upgraded to Lion Fast with them). Very professional and polite and with a great smile. On the day of the flight I arrived at the airport an hour before departure and to my disappointment I found out there was no exclusive check-in counter for Lion Fast. I waited in line for around 25 minutes, when one of their staff members asked the passengers waiting if there was anyone that was flying to Phuket. I replied and she asked why I came so late. I replied that I had the Lion fast upgrade and I was expecting to be checked-in at the Lion fast counter. The only answer I received was a smile but 10 minutes later I was at the gate as they did their best to check me in for the flight as fast as they could. During boarding time and as I was preparing myself to hear the announcement for Lion Fast priority boarding, I heard “please proceed for boarding rows 24 to 36 first”. To my disappointment there was no priority boarding. The two flight attendants on board were very professional. The pre-booked meal was deliciously fresh and one of the best I have tasted. When I arrived at Phuket Airport, I was finally given priority to leave the aircraft and to my big surprise the ground staff were waiting for me (before the claim area) and gave me my luggage. From the gate to the exit of the airport it took me only 5 minutes. According to my experience they are selling a fairly good product at a competitive price. They are trying to make improvements but in small steps. I would give 3 stars to the airport and gate staff and 1 to the Bangkok staff although it is clear that the lack of fast check in of fast boarding is not their responsibility. I would give 5 stars to the Phuket staff. I hope Lion Air will consider introducing a frequent flyer program soon. All the rest: navigation of web site, special services, extra payments with credit cards need a lot of improvement.",False,Boeing 737-800,Solo Leisure,Premium Economy,BKK to HKT,April 2016,5,5,"<span class=""star fill"">1</span>",3,4,,True,1
"""generally enjoyed the flight""",7,2016-03-31,"✅ Verified Review |  Singapore to Bangkok DMK. Surprisingly pleasant experience with low-cost airline, Thai Lion Air. The aircraft was new, service crew aboard was friendly and helpful. Unlike other low-cost airlines in the region, this one has a baggage allowance and get you a small snack/water (unnecessary in my case but nevertheless a pleasant move). A slight delay on departure wasn't a major thing, I generally enjoyed the flight with them.",False,Boeing 737-800,Family Leisure,Economy Class,SIN to DMK,March 2016,4,4,,4,4,,True,
"""acceptable to fly short haul""",6,2016-03-28,"Bangkok to Chiang Mai. Thai Lion Air is an acceptable airline to fly short haul. I tried to purchase a few extra options via website but not successful. Call Center is very difficult to reach and processing those requests cost a lot more money, so I give up. When onboard, I tried to buy a hot meal but was explained that one will be sold on flight longer than 2 hours only (not mentioned in their website). I think they still have minor problem to work on, but at least the flight are on time. Service at airport and in the air are good.",False,Boeing 737-900er,Solo Leisure,Economy Class,BKK to CNX,March 2016,1,5,,4,5,,True,
