header,rating,review_date,comment,trip_verified,aircraft,type_of_traveller,seat_type,route,date_flown,seat_comfort,cabin_staff_service,food_and_beverages,ground_service,value_for_money,wifi_and_connecticity,wifi_and_connectivity,recommend
"""usual amount of delay half an hour""",1,2020-01-21,Amsterdam to Thessaloniki. Flying at least every 6-8 weeks for the past 2 years and i almost never landed on time. The usual amount of delay is at least half an hour in almost every of my flights and today we are already stuck in Amsterdam for at least half an hour again due to the incompetence for not finishing the boarding in time.,True,,Solo Leisure,Economy Class,Amsterdam to Thessaloniki,January 2020,2,2,,1,2,,,False
"""no free food or drinks""",1,2019-12-28,"Amsterdam to Tenerife. Awful service, no free food or drinks, only paid overpriced drinks and snacks. Old plane's infrastructure: seats very shabby!  Also, the distance between seats is narrow: I am only 1.75 tall but my knees were stubborn into the front seat. No Wi-Fi, no intranet, no radio or TV.",True,,Solo Leisure,Economy Class,Amsterdam to Tenerife,December 2019,1,1,,1,1,,,False
"""not a low-cost company""",1,2019-12-14,"Amsterdam to Malaga. The only reason why I chose this company is that they have many routes. It is definitely not a low-cost company. Not worthy in terms of quality / service. Their luggage policies are extreme (even worse than Ryanair) and of course, you have to pay all on board. Often their flights are delayed (I have waited for 30 mins to 4 hours) and in general, the service is really bad. They sometimes don't explain to you even why all those delays. There is not much space for the legs (and I'm not very tall), they encourage you to ""take all the trash with you "" several times, no in-flight entertainment, rude hostess. As I said, I fly with them because is the easiest way to go to Spain from The Netherlands, but i always try to choose other companies if it is possible",True,,Solo Leisure,Economy Class,Amsterdam to Malaga,December 2019,1,1,"<span class=""star fill"">1</span>",1,1,,1,False
"""Left my jacket in overhead locker""",1,2019-12-02,"Innsbruck to Amsterdam. Travelling back from holiday, very early start. Left my jacket in overhead locker. Unfortunately I could not get all my hand luggage etc into one locker and forget I left the jacket in another locker. We were one of the last people to leave the aircraft. I contacted airline help desk 30 minutes after arrival. They said the cleaners must have taken it. They didn’t care, took no details told me to contact loss and found in the airport. Which required me going out of the departure area finding the lost and found desk. They said I should really go via the airline. I said I did and they then directed me to the online form. Had to go through security again etc. Basically a complete waste of time. Lost a lovely light weight winter jacket £225 plus sunglasses £100.",True,,Couple Leisure,Economy Class,Innsbruck to Amsterdam,November 2019,2,1,,1,2,,,False
"""never recommend Transavia""",1,2019-11-12,"Amsterdam to Reykjavik. The flight was delayed on the outbound journey, the plane was not clean, and some cabin staff were unprofessional. On the return flight, the flight was 2 hours 20 minutes delayed. We were offered 5 euros to buy a meal, but that only buys a cola? I would never recommend Transavia to people.",True,,Couple Leisure,Economy Class,Amsterdam to Reykjavik,November 2019,1,1,"<span class=""star fill"">1</span>",1,1,,1,False
"""overall service is poor""",2,2019-10-22,"Chania to Amsterdam. This is by far the worst airline I have ever travelled with. When you want to check in online a day before, it is not possible to select enough seats because they want to reserve seats for people who want to check in at the airport. Arriving at the airport I asked if it was possible to get 2 seats so the person I am travelling with could sit next to me ... the person at the check in desk did not listen so I had to explain myself multiple times, just to hear that it was not possible. Note: there were still many people behind us who needed to check in so they did not have a seat yet. Furthermore the flight was delayed because they lost 4 pieces of luggage? The overall service is poor, I would recommend Ryanair over Transavia.",True,,Couple Leisure,Economy Class,Chania to Amsterdam,October 2019,4,2,"<span class=""star fill"">1</span>",1,1,,1,False
"""Crew was pleasant""",6,2019-10-05,Heraklion to Eindhoven. Flight landed on time. Seats are very cramped on the newer airplanes of Transavia. No IFE on board. Crew was pleasant and correct. Prices for food and drinks weer average.,True,Boeing 737-800,Couple Leisure,Economy Class,Heraklion to Eindhoven,September 2019,2,3,"<span class=""star fill"">1</span>",3,4,,,True
"""cabin crew were very good""",6,2019-09-25,"Eindhoven to Heraklion. Our flight from Heraklion was delayed by 6 hours due to a technical problem with the computer. Transavia promised us to compensate us within 2 weeks after filing a compensation report so thats great! Flight was OK, legroom was poor, but cabin crew were very good. Also the sandwich I bought was good and for 4 euros well priced.",True,Boeing 737-800,Couple Leisure,Economy Class,Eindhoven to Heraklion,September 2019,2,4,"<span class=""star fill"">1</span>",2,4,,,True
"""book with a different airline""",2,2019-09-25,"Not Verified |  Pisa to Amsterdam. I do not recommend this airline. After having a three hour delay for my flight over to the Netherlands I didn't love the airline. After they cancelled our flight back to Pisa merely hours before we were supposed to board and leave without reason. When asked we were met with vague scrambled explanations and told there was no other option to fly back that day. Not only that, but they said they couldn't do anything for at least 48 hours! As a student who's studying abroad and needed to get back at least by Monday afternoon for class (which doesn't allow excused absences because of travel issues like most programs) I was very stressed. They finally after much arguing, to a representative who didn't even work for Transavia we were able to get a flight for Monday night .. which was delayed also. They did provide us with meal vouchers, though not enough to cover all of the meals we needed, and a nice hotel we still had to spend money on transportation to a different airport to fly home. This rant just barely covers what we had to deal with while traveling. I will be calling to get a refund. Definitely book with a different airline.",False,,Solo Leisure,Economy Class,Pisa to Amsterdam,September 2019,3,4,,2,1,,,False
"""check-in policy is ridiculous""",1,2019-09-02,"Verona to Amsterdam. One-and-a-half-hour delay on the outbound flight and three-hour delay on the return flight. On top of that, the online check-in policy is ridiculous: there are only a fixed number of free seats. When those are reserved, either you pay 10€ for a seat, or you ""conveniently"" check-in at the airport desk. This experience with this company counts twice for me: first and last. Ryanair feels like Emirates compared to Transavia.",True,,Solo Leisure,Economy Class,Verona to Amsterdam,September 2019,2,3,,1,1,,,False
"""denying the cancellation""",1,2019-08-05,"Paris to Seville. I purchased two tickets for travel in September from JUSTFLY, where no-penalty 24-hour cancellation was clearly stated. Unfortunately when I then had to cancel, neither JUSTFLY nor Transavia honored the policy. JUSTFLY told me I had to contact the airline, but no one at JUSTFLY had the Transavia phone number; on the Transavia website it said I had to ask the booking agent for authorization to cancel. Transavia wrote me denying the cancellation. This is dreadfully deceptive practice.",True,,Business,Economy Class,Paris to Seville,August 2019,,,,,1,,,False
"""such a poor service""",2,2019-07-13,"Amsterdam to Heraklion. Both flights were not very good. The food and drinks available were very limited. Some cabin staff could be more friendly. The plane was very warm - the air-conditioning was not good. The planes looked old. I also find the cost of Transavia flights very expensive for such a poor service, when compaired to EasyJet.",True,,Couple Leisure,Economy Class,Amsterdam to Heraklion,July 2019,1,2,,2,1,,,False
"""Horrendous luggage delivery""",1,2019-06-09,Ibiza to Paris Orly. Horrendous luggage delivery at orly airport. 1 hour delay delivery despite plane landing 15 minutes ahead of time. Nobody from Transavia around to inform or manage. Being low cost does not mean Transavia can drop its end to end responsibility. Missing the basics of Customer service.,True,Boeing 737- 800,Family Leisure,Economy Class,Ibiza to Paris Orly,June 2019,2,1,"<span class=""star fill"">1</span>",1,1,,1,False
"""never boarded a Transavia plane""",1,2019-05-20,"At 1:30 am the day of departure for a 6:30 flight from Orly to Dublin I received an email confirming our flight and saying I could sign in. I tried to do that, but it wouldn’t go through. So I arrived at the Orly airport at 4:00am ready to fly, and when I showed the confirmation of our flight was told “ It’s not your fault. There is no flight to Dublin today. It’s tomorrow. Your boarding pass is correct, but there is no flight. Go to the Transavia counter.” There we were told to call a number to get a refund after 8:00 am. Our phones were not connecting in France, so impossible, and there is no public phone in the airport. And a refund was not what we wanted. We needed a flight to Dublin. So after pleading for help from the Transavia agent she used her personal phone to find us a flight to Dublin that day on AerLingus. We TRULY appreciated her help. Of course this flight cost 5 times what we had paid to Transavia, and also left from Charles DeGaulle airport. So we took a bus there costing an additional €40, and managed to get to our destination in time to spend a night in Dublin and catch a Norwegian flight to the USA the next day. I still have not received any communication from Transavia regarding this change of schedule. It’s like it didn’t happen from their end. That’s not all! As a previous reviewer wrote, the week before our Transavia flight from Dublin to Orly was cancelled due to the controllers strike (understandable) but again no assistance. We ended up flying to Brussels on Ryan Air and trained from there to Paris, once again at great expense. So two for two, and we’ve never boarded a Transavia plane! And getting to refund requires effort on my part. They know I paid and didn’t fly, so why can’t they automatically refund my credit card? Never Again.",True,,Couple Leisure,Economy Class,Paris to Dublin,May 2019,,,,1,1,,,False
"""an airline I will avoid""",1,2019-05-12,Dublin to Paris. Flight cancelled because of the general strike in France. They sent me a link which did not work. Finally had to send a message through Facebook and their website and was told I had to wait 2-4 weeks to get my money back. In the meantime I had to book another flight with Air France (more expensive) but at least their service was great. As though this was not enough I received an email inviting me to check in for the cancelled flight and the next day an e mail as to what to do in Paris. After cancelling the flight they should at least take care not to send these annoying messages. This is an airline I will avoid from now on.,True,,Solo Leisure,Economy Class,Dublin to Paris,May 2019,,,,,1,,,False
"""Lack of Communication""
",5,2019-05-03,"My 2 friends and I flew first with KLM from Berlin to Amsterdam and then with Transavia from Amsterdam to Marrakesh (and back vice versa). Both trips with Transavia weren't 100% enjoyable due to the following reasons: 1. Lack of Communication on Luggage: before flying, there was no communication that there are differences in the hand luggage policy between KLM (1 pieces + accessory) and Transavia (1 piece). Yes, the additional hand luggage has been checked in by Transavia for free but an information beforehand would have been appreciated in order to consider packing in the first place. Reason provided by staff at airport ""we're a low budget airline"". Fair point - still created misunderstanding and negative experience. 2. Lack of Little Pleasantries: no free snack or beverage on a 3.5hrs flight 3. Lack of Visibility/Transparency on Flight Details: no possibility to check flight information online on website - reason provided by customer service: booking includes flights from 2 airlines (KLM & Transavia) 4. Lack of Communication: at airport in Marrakesh, at 6am, information screen stated that check-in counter is open, staff appeared at 6:45am (staff at airport only said that we've to wait) - it's okay to wait but then don't say that the check-in is open. In general, I have understanding for a lot of things but I'd just appreciate more communication and visibility on possible differences to other airlines up-front.",True,Boeing 737-800,Couple Leisure,Economy Class,Berlin to Marrakesh via Amsterdam,May 2019,3,4,,2,3,,,False
"""strict policy on 1 hand luggage""",3,2019-04-03,"Paris to Lisbon. Flight delayed by 1hr. Rough attitude from staff on the ground with strict policy on 1 hand luggage even if luggage fits size. Fast track service paid, useful when boarding but then chaos to the flight. Very disappointing and stressful situation not worth the saving in the price of the ticket. The company and staff need a bit more experience.",True,Boeing 737 800,Business,Economy Class,Paris to Lisbon,April 2019,4,3,,1,2,,,False
"""No sandwiches available""",5,2019-04-01,"Faro to Eindhoven. Left about half an hour late due to an oil spillage on the runway (not a fault of the airline). New aircraft with modern sky interior. Very tight and rock-hard seating, which led to an uncomfortable flight and back pain. Table was filthy, completely covered in coffee stains on the front and back. Asked the steward for a wet cloth and cleaned it ourselves. Flight departed at 18.30. No sandwiches whatsoever available (the plane had already made a return flight that day and catering was apparently not replenished). Also warm cheese sandwiches were sold out. So very little food items to choose from, which is unexceptable. Crew advised the passengers to send a complaint to customer services. Perhaps Transavia can also think of adding or changing their catering assortment onboard, beacuse it has been more or less the same (especially the sandwiches) for at least the past 10 years! A warm meal like other LCC's or even TUI offer for purchase could be an idea, also considering Transvia flies to far away destinations like Dubai. Cabin crew were friendly and flight calm and uneventful, but Transavia could make some effort in providing a better onboard experience.",True,Boeing 737-800,Couple Leisure,Economy Class,Faro to Eindhoven,March 2019,1,4,"<span class=""star fill"">1</span>",3,4,,,True
"""useless ordeal""",1,2019-03-20,"Porto to Paris (Orly). Horrible flight, delayed, incompetent ground staff. First and last time flying with Transavia. Ground staff made several people send their hand luggage to the hold, claiming that the cabin would be full. In the end, over 30% of all cabin space was empty. In a flight that was already delayed by over an hour, this useless ordeal made us delayed a further 30 minutes.",True,Boeing 737-800,Couple Leisure,Economy Class,Porto to Paris (Orly),March 2019,1,1,,1,1,,,False
"""cold and drafty""",5,2019-02-19,"Tenerife to Eindhoven. The cabin was extremely cold and drafty. Several passengers asked the crew to solve the problem, but it was neglected. The crew is working and keep warm, while the passengers sits still and get cold. It seems as they didn't understand and the problem was not solved. The crew was composed of very young and seemingly inexperienced persons. Several passengers including myself, had to put on our coats and huts to combat the coldness and draft. We had a second leg with Transavia with no problems though.",True,Boeing 737,Couple Leisure,Economy Class,Tenerife to Eindhoven,February 2019,3,1,,3,3,,,True
"""I was positively surprised""",10,2019-02-04,"I was positively surprised. I have flown with Ryanair and AirAsia a couple of times but Transavia is much better. We could choose a seat in front for free, the boarding went smooth, legroom was okay, food is reasonably priced and the cabin crew were very friendly. I got sick on the way to Marrakech and the crew immediately came to help me and gave me a free non sparkling coke, during the flight the asked me if I was okay two times. Would definitely choose Transavia again.",True,Boeing 747-700,Family Leisure,Economy Class,Eindhoven to Marrakech,January 2019,5,5,"<span class=""star fill"">3</span>",4,4,,2,True
""" were more then professional""",10,2019-02-02,"Amsterdam to Porto. Thank you so much to all crew of the flight HV6001 from Amsterdam to Porto on the 31st January 2019. Besides offering me a sit with more space for my legs, they spared no effort in making me feel comfortable once I informed them I was suffering from migraine. The care they put in helping me was such that I ended up having a quite pleasant flight, despite my poor condition. They were more then professional. They really seemed to care. I wish I could find a better way to thank them.",True,,Business,Economy Class,Amsterdam to Porto,January 2019,5,5,,5,5,,,True
"""very tired looking""",8,2019-02-01,"Paris Orly to Amsterdam Schipol with Transavia. We booked an extremely cheap flight of $59 dollars to get to Amsterdam for the weekend. The flight was smooth and only 55 minutes long, but the aircraft was old and clearly needed to be updated. It's not that it was not clean, it was just very tired looking.",True,Boeing 737,Family Leisure,Economy Class,Paris Orly to Amsterdam,December 2018,3,4,"<span class=""star fill"">2</span>",4,5,,1,True
"""disastrous quality of this airline""",1,2019-01-27,"Paris to Essaouira. I have used Transavia 3 times to various destinations. On the first flight, the airplane was about 1 hour late. The second time, the plane was again 1 hour late. However, the disastrous quality of this airline was best evidenced by my last trip. Before boarding the plane, the ground staff asked me to leave my cabin luggage before boarding the plane for the luggage to be checked in, despite the fact there was plenty of room in the overhead compartments. However, my luggage never arrived to the destination. Transavia provided poor information (with supposed ""French speaking staff"" not being able to speak French) on the matter and this airline did not proactively communicate on the fact that the luggage was definitely lost. The airline also provided a ridiculously low amount as indemnification (resulting in additional expenses for me for about 600 euros not covered by the indemnification).",True,,Solo Leisure,Economy Class,Paris to Essaouira,December 2018,2,1,,1,2,,,False
"""still not take responsibility""",2,2018-11-04,"I recently booked an open-jaw ticket AMS-OVD/TLV-AMS for March 2019. When my Amex card was going to be charged, a notice appeared in Dutch (see attachment) that corporate cards would be charged with an additional amount of € 10,52. After the payment had been completed I contacted Transavia, because when I booked a flight earlier this year, the extra amount was refunded. Their response was now that they have changed the rules and that I will not be refunded. However, I responded that the message appearing on the screen while paying, clearly stated that it applied to corporate cards. I have a personal Amex Flying Blue card. Amex has also indicated that I don't have a corporate card. After engaging with Transavia about four times, they will still not take responsibility for the information that appears on their website when booking a ticket paying by credit card. Transavia, when are you going to do something that will give credibility with your customers?",True,Boeing 737-800,Couple Leisure,Economy Class,Amsterdam to Tel Aviv,October 2018,,,,3,4,,,False
"""They refuse to compensate""",1,2018-10-27,"Munich to Amsterdam. Flight delayed over 17 hours. They refuse to compensate. My flight number is HV5202, supposed to depart from Munich International Airport at 21:35, but was delayed by over 17 hours. I only got notification 2 hours after it suppose to fly. It was midnight, and the staff just sent us all with our luggage and nowhere to go. Around 1AM we got email about the flight will be on the next day at 13.00 (but in the end it boarded on 15.00). I have no choice but to book a hotel to stay overnight. I contact their customer service asking for compensation and my first try is denied saying the cause of delayed is not preventable. I read that The Court of Justice of the European Union has interpreted passenger rights strictly, so that there are virtually no exceptions for airlines to evade their obligations for breach of contract. It's my first time using Transavia and it's really disappointing specially the customer service part. The time that is wasted cant be brought back.",True,,Solo Leisure,Economy Class,Munich to Amsterdam,September 2018,2,1,,2,2,,,False
"""Horrendous experience!""",1,2018-10-24,"Geneva to Rotterdam. Horrendous experience! I had to cancel the ticket with 30 minutes after making a reservation, and there was no such option. I filled out a form, they got back to me a week later checking if I still want to cancel and offered to refund airport tax of 13 Euros. I had a complex itinerary and was able to cancel reservations with other airlines, but not Transavia. Never again!",True,,Solo Leisure,Economy Class,Geneva to Rotterdam,October 2018,1,1,,1,1,,,False
"""I will not use them ever again""",1,2018-10-18,"Malaga to Paris Orly. Price was reasonable and it was easy to book online. The round trip flights Paris to Malaga we’re fine. The air crew was nice. Check in at Paris Orly was very confusing and disorganised. It was worse in Malaga, where we had to remind them to place tags properly on our bags, they were very sloppy and unfriendly. Sure enough, one of our bags was missing when we arrived in Paris Orly (14 July). We filed a report immediately and called everyday for updates. After 2-3 weeks they said my bag was found, but it’s never been sent to me. I’ve called and emailed 20x and they don’t know what to do. The Montreal Convention requires them to reimburse for loss after 21 days, so I filed a claim with receipts and everything (hours and hours to prepare). They haven’t paid, it’s been 90 days, and they still tell me my luggage was found and a supervisor would sort it out. Same story every two weeks, and I have to call them! I understand lost luggage, but not finding my luggage and not paying my claim? Worst experience in 30 years of flying. I will not use them ever again.",True,,Family Leisure,Economy Class,Malaga to Paris Orly,July 2018,3,3,,1,1,,,False
"""a wonderful experience""",9,2018-09-05,"Amsterdam to Fuerteventura. Superb experience. Great check-in, nice reminder and sufficient self service. Good service on-board. Taking price into account it was a wonderful experience!",True,,Couple Leisure,Economy Class,Amsterdam to Fuerteventura,August 2018,4,4,,4,5,,,True
"""it was a good flight""",8,2018-08-14,"Not Verified |  Marrakech to Amsterdam. We flew on Transavia from Amsterdam for our vacation in Morocco. The staff were kind and spoke good English, seats were quite nice for a low cost airline (also they’re green, so quirky!). We didn’t order food as these weren’t long flights. There’s no WiFi, seat power, or entertainment systems on the plane, but it was a good flight at a relatively cheap price.",False,Boeing 737-800,Family Leisure,Economy Class,Marrakech to Amsterdam,August 2018,4,4,,4,5,,,True
"""Basic but comfortable""",8,2018-06-22,"Porto to Amsterdam. Basic but comfortable and efficient flight. Check in experience in Porto was efficient and friendly. They don't seem to have as many silly, hostile rules and fees as some of their other LCC competitors. The cabin service on this flight was good, and I particularly liked the fact that the captain seemed to give plenty of announcements. As a somewhat-nervous flyer, hearing from the captain is always calming and re-assuring. The captain even stood at the exit with the flight attendants at the end of the flight and farewelled passengers! No free service or entertainment but it's an LCC so it's expected. Purchase-able food menu seemed okay, though I didn't buy anything. Seat was comfortable enough for the length of the flight. Flight departed somewhat late but managed to make up some time and so we only ended up arriving only 15 minutes past schedule.",True,Boeing 737,Solo Leisure,Economy Class,Porto to Amsterdam,June 2018,4,5,,4,5,,,True
"""can not have high expectations""",5,2018-06-20,"Flew Pisa to Amsterdam with Transavia. Very simple airline, so you can not have high expectations. The ground service at PSA airport was really painful, slow boarding and boarded by foot. The seats are not very comfortable and the space for legs is really small, you need to pay (crazy expensive!) for food and beverages. However, usually this airline is quite cheap and overall is acceptable for short flight!",True,Boeing 737-800,Solo Leisure,Economy Class,Pisa to Amsterdam,December 2017,2,3,,1,4,,,True
"""They play the silence mode""",2,2018-05-26,"Amsterdam to Malaga. Transavia lost my luggage.I did all the processes needed. They play the silence mode with customers, they don't answer emails, customer services send you to a website it doesn't exist.",True,,Business,Economy Class,Amsterdam to Malaga,March 2018,3,3,,1,1,,,False
