header,rating,review_date,comment,trip_verified,aircraft,type_of_traveller,seat_type,route,date_flown,seat_comfort,cabin_staff_service,food_and_beverages,ground_service,value_for_money,wifi_and_connecticity,wifi_and_connectivity,recommend
"""One of the worst airlines""",2,2022-10-26,"One of the worst airlines I've travelled with when it comes to service and onboard safety and comfort.  I always have difficulty breathing while on their flight. I never have this problem with other airline. This time, since I'm 5 months pregnant, I asked for oxygen and they refused to give it to me, repeatedly.  Me and my husband asked them for oxygen over 5 times and they told us that, unless I'm passing out or visually suffering, they will not give me oxygen. Then they proceeded in giving cold towels claiming I'm just over heating.",True,,Couple Leisure,Economy Class,Tel Aviv to Amsterdam,October 2022,1,1,"<span class=""star fill"">1</span>",3,1,,1,False
"""Nice flight with a cheerful crew""",7,2022-10-06,"Not Verified | Nice flight with a cheerful crew who managed to create a little bit of a warm hospitable atmosphere. Yes, it is a typical low cost experience, but not too bad. Short delay and a smooth landing. I was spoiled being allocated an emergency exit seat for the four hours flight however. Thank you!",False,Boeing 737-800,Solo Leisure,Economy Class,Amsterdam to Gran Canaria,September 2022,3,5,"<span class=""star fill"">1</span>",3,4,,1,True
"""service was incredibly good""",10,2022-10-05,"Staff and service was incredibly good, especially in a difficult time as no due to staff shortage. I’m getting married in Spain soon and I took a flight yesterday from Rotterdam to Malaga in the morning, HV5023. I was carrying my dress and was very nervous about keeping it well during the flight. The staff was really helpful and kind. It already started at Rotterdam airport while checking in. Also during the flight everyone was taking good care of us and the rest of the passengers! Big shout out to this incredible team! Thank you so much! You gave us an amazing experience!",True,,Family Leisure,Economy Class,Rotterdam to Malaga,October 2022,3,5,,5,3,,,True
"""seat was very uncomfortable""",1,2022-09-28,"Very bad airline that falls under KLM. On the way there was a rude head stewardess who refused to do the safety demonstrations in English and did not speak English on the flight. So someone who doesn't understand Dutch doesn't know what to do.  It is known that Dutch flight attendants have a very cold/rude attitude, also on this flight from Transavia and Stewards aboard with no experience.  People who think to pay 9 euros extra to be sure that you can take luggage with you are wrong. Most of them still had to drop off their luggage. Food & beverages are extremely expensive. For 1 sandwich you already pay almost 10 euros. I would not recommend this airlines for flight for over 1.5 hours. The seat was very uncomfortable and extremely small.",True,Boeing 737-700,Couple Leisure,Economy Class,Rotterdam to Barcelona,September 2022,1,1,"<span class=""star fill"">1</span>",3,1,,,False
"""felt in good hands at all times""",7,2022-09-19,"Short no-frills hop, for which I had to check in four hours in advance because of the current disgraceful situation at Schiphol. Extremely efficient self check-in process for luggage. For the flight itself, I didn’t expect much and I didn’t get anything, except the necessary and most important: I reached my destination safely. Very professional crew with clear safety announcements. Definitely felt in good hands at all times.",True,Boeing 737,Solo Leisure,Economy Class,Amsterdam to Pisa,September 2022,4,3,,3,5,,,True
"""never use this airline anymore""",1,2022-08-10,"Not Verified |  No online boarding which led to an hour and a half line to check in They took my hand luggage when boarding and told me that you need to pay extra if you want to be sure to have it on board (never got this information beforehand) . The aircraft members were so rude and treated me so badly with a very arrogant tone. Then I had to carry my heavy computer in my hands and they didn't offered me even a bag to transport it. I had 5 hours transit time between my flights and had to carry this laptop everywhere. They really don't care about the comfort of their passengers and just want to make extra money whenever they want. On top of that, my luggage was lost and not registered on my next flight when I asked the airline to check it out. I've been really lucky to find it at my destination but no proper follow up was possible. I will never use this airline anymore.",False,,Solo Leisure,Economy Class,Porto to Amsterdam,August 2022,1,1,,1,2,,,False
"""Better spend a bit more to get a decent airline""",1,2022-08-06,"Not Verified |  Checked my luggage even though I explicitly do not want my luggage in checked luggage as it can get damaged and I have to wait to pick it up. Also made comments about me being late, even though I was in the boarding queue, but they messed up cabin luggage and had to get my carry on luggage a label, which was also messed up. Better spend a bit more to get a decent airline.",False,Boeing 737-800,Solo Leisure,Economy Class,Seville to Amsterdam,August 2022,4,2,,1,2,,,False
"""Overall can’t really complain""",8,2022-07-29,"Booked KLM Cork to Seville via Amsterdam with Amsterdam Seville legs flown with Transavia. Overall can’t really complain. They are effectively the charter leg of KLM and as such pretty much like most charters. Unlike KLM legs any food /drink was purchase only, didn’t buy anything but prices were reasonable. Seats were pretty standard legroom not great not poor …. I kinda liked the green leather though some may find it a bit garish. Most reviews not great but I found them fine. On time crews were again really friendly and polite, worked hard to help passengers find luggage space . Also special mention to the Transavia guy in Seville who noticed my lad had a football he had purchased. He told us it needed to be deflated a little to compensate for aircraft pressure. We had nothing to deflate it with but he asked a lady in the check in queue for her hair clip and then spent 10 minutes using this to get it deflated - much to the amusement of the waiting passengers! All done with a smile so while others may have issues we had a positive experience so feel that deserves to be said. I travel a lot and often think we are very quick to criticise (myself included) but when things go well then maybe not so quick to acknowledge!",True,Boeing 737-800,Family Leisure,Economy Class,Amsterdam to Seville,July 2022,3,4,,5,5,,,True
"""my kudos to Transavia""",9,2022-07-28,"We were supposed to fly from Corfu, to Paris Orly airport and catch a connection from Paris Orly to Biarritz. We had two hours for the connection in Paris, which was tight since we had to retrieve our luggage and register them again. This was very clear from the beginning when I bought the tickets, so no question about it. Because of chaotic conditions in Corfu (widely understaffed for the first big summer vacation week end since Covid), we departed 2 hours late. The captain was good at communicating about the situation. I inquired with the cabin crew about my very short connection. Since I purchased the extra insurance to cover any travel interruption  he told me that their mission was to take us and our luggage to the final destination. As we were flying over Italy, the captain was able to communicate with the ground crew in Paris about our situation, the cabin crew checked our boarding pass for next flight, asked me about the color, size and brand of our luggage. We deboarded the plane and waited  outside the plane door as the cleaning crew was inside. Ground crew personally confirmed our luggage has been identified and was staying inside the plane. We then started boarding again with the new flight crew. So despite all the negative feedback that can be posted about low cost airlines, I am sending my kudos to Transavia with a stellar rating.",True,,Family Leisure,Economy Class,Corfu to Paris,July 2022,3,5,,5,5,,,True
"""most uncomfortable flight""",1,2022-07-25,"The worst airline ever. I traveled with this company back and forth from Tel Aviv to Paris. Both flights had delays of over two hours, the staff behaved appallingly, bad service, poor speech. The seat is the smallest and most uncomfortable flight I have ever been on, not recommended at all.",True,,Solo Leisure,Economy Class,Paris to Tel Aviv,July 2022,1,1,"<span class=""star fill"">1</span>",2,1,,1,False
"""no alternative flights are offered""",1,2022-07-24,Booked round trip flights from Amsterdam to Riga for a group of 17. Flights were booked 5 months in advance. 1 month before the flight Transavia informs me by e-mail that the flights are cancelled. Called them and was told by agents no alternative flights are offered. The only option is a refund. Alternative flights to Riga are currently 300 euros more expensive than what we paid at the time of booking. This means the actions of transavia resulted in 5000 (17*300) euro damage for us. Never again!,True,,Solo Leisure,Economy Class,Amsterdam to Riga,July 2022,,,,1,1,,1,False
"""horrible customer service""",1,2022-07-19,"If you want horrible customer service and mediocre flights this is the airline for you. They can cancel or change your flight and provide no compensation; we had our original flight at 8:25pm and got moved to a 2pm flight which ruined our whole plan - when we contacted to change the flight at least to the next day they said it was not available, when we ask to book us on an available KLM flight (Transavia is owned by KLM-Airfrance) our phone was cut and our email + form were just ignored (14 days and counting). The customer service will either pick up your call and pretend to not hear you. The funny thing is they put us on a KLM plane on our flight here (not communicated at all and last minute; I wonder how they could suddenly book that). There is no way to sugarcoat it, it is a horrible airline that is extremely overpriced for the service you get.",True,,Couple Leisure,Economy Class,Rotterdam to Barcelona,July 2022,1,1,,1,1,,,False
"""almost everything went very well""",9,2022-07-13,"When I first booked Transavia (France) I was very scared because of bad reviews I had read. To my surprise almost everything went very well. There was no problem with putting my 10kg luggage in a hold for free. Flight attendants were very nice. I had a lot of space for legs and my stuff (my height is 161 cm, my boyfriend's height is 180 cm he could fit comfortably as well). The only inconvenience we had was a 45 minutes delay, because we had to wait for a free slot to be able to take-off. However, the pilot managed to land quicker than planned so the delay was even shorter. In general I enjoyed my flight and I would decide to book Transavia France again.",True,,Couple Leisure,Economy Class,Berlin to Nantes,April 2022,4,5,,5,4,,,True
"""I will never book with this company again""",1,2022-07-06,"No ethics or decency. I had to cancel my flight 2 hours after booking because of family logistics and book a flight from Nantes airport instead of Paris. They would not refund the 277€, exchange the flight or even re-instate the original flight. It was an honest mistake and I have paid dearly for it. I will never book with this company again and urge others not to also. A company that has no decency should be boycotted because these companies abuse our trust and take our hard earned money for absolutely nothing. That’s not the way this world should be. Profiting off of peoples mistakes or misfortunes. To me that was a lot of money. I would rather drive 18 hours than fly with one of these unethical companies ever again.",True,,Solo Leisure,Economy Class,Paris to Faro,July 2022,,,,,1,,,False
"""the worst airline experience I’ve ever had""",1,2022-06-26,Not Verified |  This airline has provided me with the worst airline experience I’ve ever had. I travel a fair amount and have had my share of bad luck but this company wins the prize for biggest let down ever! Booked a flight directly on the website because I know that’s the best thing to do in case there’s an issue. Not so with this airline. After the slowest check-in experience I’ve ever had I finally find myself at the front of the line. I had everything that is needed for a normal airline to check in “the online and app check in was down which should have been my first red flag”. When I get to the counter the girl tells me I’m not booked on this flight. How can this be! I had everything I needed to prove that I was. The flight was 10.15am. Turns out Transavia changed my booking at 8.25am the same morning of my flight because they could not accommodate their overbooking. My new flight was 3 days later! I don’t think I need to say anymore. I could go on and on about how their customer service is the most lacklustre I’ve ever seen but I think by now you get the point.,False,,Solo Leisure,Economy Class,Funchal to Budapest via Paris,June 2022,1,1,"<span class=""star fill"">1</span>",1,1,,1,False
"""Never again Transavia""",1,2022-06-18,"Not Verified |  Two days before departure we got a message 'sorry your flight is cancelled'. They do not offer any more information. You have to look for other flights so we had to book by another company, paying by ourselves. We had to fly to another destination, first take the train from Sevilla to Malaga (over 2 hours), staying 1 night in Malaga, afterwards with a flight to Antwerp and afterwards by taxi to Eindhoven. (our car was parked at the airport) Taxi drive over 200€. Never again Transavia, that's for sure.",False,Boeing 737-800,Couple Leisure,Economy Class,Sevilla to Eindhoven,June 2022,,,,1,1,,,False
"""no cleaning of the plane has been done""",2,2022-05-14,"Flight started with severely disorganized and chaotic boarding process. We had paid extra for priority boarding only to hear at the gate that no priority boarding is supposed to happen on this flight (at least we were pushed to the head of the queue afterwards, but WTH?) The boarding itself apparently was started before the plane has even landed after its previous flight. As a result, the entire passenger queue, already after passing the passes control, has been waiting for another 20 minutes standing and waiting while the plane was being unloaded. Obviously, no cleaning of the plane has been done - we have found some used napkins on our seats. Speaking of the seats, those were extremely uncomfortable. They did have an average leg space for a low-cost, I'll give them that, but they had no proper head support and did not provide proper back support either. The armrests could only have been raised halfway, so you had a choice to either feel them at your sides or at your shoulders (normally we would just push the armrest between our seats up and fly without). I've even witnessed one of our fellow passengers standing up at the aisle for a while to read and rest from these seats. Now I'm writing this from home with severe back pain that I've experienced for the first time in my life after this flight and I blame the seats. For the reference, the specific plane was PH-HZX. Curiously enough, the first flight (AMS-SVQ) didn't have these issues - the only thing I can whine about was the long queuing time at the airport, but I expected nothing better during the holiday season anyway. In any case, now my stance towards the airline is never again, unless I'm really forced to.",True,Boeing 737-800,Couple Leisure,Economy Class,Seville to Amsterdam,May 2022,1,3,,1,2,,,False
"""flying with you annually for the past 7 years. Never again""",1,2022-05-12,"I have never been so offended by a service provider as this airline. First off, does this company even exist, as far as customer service is concerned, apart from over the phone? There is certainly no customer service at their counter at Schiphol airport. I was just told to get in touch by phone. A ticket I had purchased with them allows me to rebook my flight any number of times during a period of one year. The flight was initially booked for December 2021 but had to be rebooked when the Netherlands went into hard lockdown. I could not rebook the flight for the desired date of December 2022 as the airline had no flight schedule in place for the winter 2022 season. I was therefore forced to rebook the ticket to an unwanted date (March 2022). Come March 2022, their schedule was still not out so I had to rebook to another unwanted date (April 2022), so as not to lose the ticket, incurring extra charges on both occasions, all for no purpose. As the (unwanted) flight date drew near, and, with a winter 2022 schedule still not out and no more available dates left to book past April 2022, I contacted the airline to ask for a voucher/credit but was denied one, resulting in the ticket being forfeited. A customer forfeiting a ticket because of administrative issues i.e. being forced to book unwanted dates only to forfeit the ticket? I have a right to a booking, to hold on to that booking, and to rebook my flight to the desired date. None of those rights have been respected. International flights can be booked a year in advance, apparently not in this instance. What do you call it when an airline forces you to book unwanted dates and incur extra charges only to forfeit your ticket. I have a term for it. Let the reader judge. What makes it worse is their agents’ unprofessionalism and/or deliberate evasion of the subject matter. When I asked them for a voucher and pointed out there were no more dates to rebook their responses, included, for example: ""I understand your situation, however, as per company policies we won't be able to offer you a voucher. Our winter season flight will be out towards the end of April. However, once (they mean “since”) the flight is booked for tomorrow, if you do not want to lose the ticket, please change the route and date of your ticket. You can try and change it for October, so you do not have to change it again before the winter season flights are out.” This is just one example of the astonishing drivel I have received as a response. How can I change the flight for October if there are no flights in October, the subject matter being the Dubai-Amsterdam leg? How can I even “change it again (in April I assume) before the winter season flights are out” when there are no more flights dates left to rebook to? And even if there were, just to incur unnecessary costs? Is this deliberate evasion of the topic or lack of knowledge or what? Not only am I unnecessarily out of pocket, I’m without recourse, having contacted every relevant body. Thank you Transavia. I’ve been flying with you annually for the past 7 years. Never again.",True,,Solo Leisure,Economy Class,Dubai to Amsterdam,April 2022,2,4,,3,1,,,False
"""definitely fly again with Transavia""",7,2022-04-27,"Typical lcc. Booking process is very convenient. Changing reservations is no problem, even when using the telephone hotline. There is no waiting time, and they are very helpful and friendly! Departure was only slightly delayed, cabin staff was very friendly. The atmosphere was relaxing and professional. The food is not too expensive and of acceptable quality. Will definitely fly again with Transavia!",True,Boeing 737,Solo Leisure,Economy Class,Amsterdam to Innsbruck,April 2022,5,5,"<span class=""star fill"">1</span>",5,5,,1,True
"""intend to survive being non-ethical""",3,2022-04-24,"It was going to be my first flight with this airline, and I was looking forward having this experience, as they belong to AF/KL group and have many flights in Europe. A couple of weeks after buying my non-refundable ticket, they canceled the flight. They offered a new flight, that was not suitable to me, as well a the refund option, that I chose. They inform they would refund within 2 weeks. The following weeks, they went on sending the same information about flight cancelation, and I could check my reservation had not been cancelled. They did not refund me. Suddenly i received an email remembering check-in policies. Therefore I called their ""service center"", that was quick to answer. They indeed then cancelled my reservation, and said I would receive a refund within 2 weeks. Immediately after my call, I received an email from Transavia stating that I had decided to cancel a non-refundable reservation, and therefore would not be allowed to refund. I called again, and they said they kind-of fixed it. Then I received an email, informing of a refund on process. So far, no money; I understand that airline suffers from financial troubles. However, I wonder how they intend to survive being non-ethical. They are cutting the branch where they are sitting. Air travel is a matter of trust. We trust that we are dealing with safe and honest service provider. If they fail in being fair with us, it is the whole image which is damaged.",True,,Couple Leisure,Economy Class,Marseille to Rennes,April 2022,,,,,3,,,False
"""I will avoid this airline in the future""",2,2022-04-19,"The airline is fine if there is not a problem, if you don’t mind many needless indignities and discomforts, but it’s a terrible airline if anything goes wrong. Just experienced a two hour delay due to a late arriving aircraft and there was no communication from the airline, nothing on the airport screens, and no information available through the app or flight tracking sites. Even the delayed incoming flight could not be found. When arriving at Orly, the buses us into a non-Schengen gate, where we all had to go through passport control despite this being a Schengen area flight. Bags also took a long time to be delivered. The crew is nice, but the seats are cramped and the cabin was filthy. The fare we paid was the same as Air France on the same route, even though it’s sold on the same website, belies the complete lack of services. I will avoid this airline in the future.",True,Boeing 737-800,Business,Economy Class,Athens to Paris Orly,April 2022,1,4,,1,1,,,False
"""this shows their lack of professionalism""",3,2022-03-20,"Not Verified |  On the day 12th of January 2022, we had a flight from Amsterdam to Reykjavik at 16:45 - Flight HV 6887. This flight was canceled due the weather conditions in Iceland. In order to enter Iceland, we had to do an antigen test prior 72h the entry to the country. Our country of origin was Spain, where we paid €40 for two antigen tests, then we spent two days in Amsterdam and everything was planned in order to have the test still valid to travel to Iceland. Obviously we never took into consideration that our flight was going to be canceled and since that happened, we asked to a lady at Transavia’s counter if we had to repeat the test and her answer was “no, your test will still be valid”. The next day, when we managed to get to Schiphol Airport, we went again to ask at the Transavia’s counter to make sure if we had to do the test, and this time the answer was “yes, otherwise you might not be able to enter in Iceland”. So we repeated the test, which cost us €116. I emailed them that the fact that we had to repeat the test wasn’t our fault and if there was any chance to get a refund, and I didn’t get an answer in more than two months, the first email I sent was on the 13th of January, then again on the 21st of January (no answer from them) and again out the 15th of March, when I’ve been told that they couldn’t do anything because the flight was canceled due the weather conditions. What upsets me the most is the fact that two of their operators gave me two different answers, I’ve never got any apologies from them about this whole situation and they took more than two months to give me an answer. The final answer I’ve got was after five days that I’ve sent them the second reminder. They don’t seem to care much about their customers and it seems that they’re not really trained to deal with a situation like the one I had, this shows their lack of professionalism and it’s the reason why I will never travel with them again.",False,,Couple Leisure,Economy Class,Amsterdam to Keflavik,January 2022,2,1,"<span class=""star fill"">2</span>",2,3,,,False
"""they didn't have the time to let her in""",1,2022-03-13,"Not Verified |  My mother went to the airport 3 hours before the departure of her flight, and she did her check-in on time.  She waited in the lounge for the departure, she showed up at the gate at 15min before the departure. The flight crew forbids her to enter the flight stating that the gate was closed, they also told her she can take the next flight without having to pay. They had time to go take the luggage out of the plane, but they didn't have the time to let her in!  There weren't any LAST CALL for the flight at the airport. On the gate, they said they asked for her at the lounge. I tried to call the customer service, the woman said that is written on the boarding pass that passengers should show up at the gate at least 30min before the flight, when it actually says that the boarding starts 30min before the flight.",False,,Solo Leisure,Economy Class,Beirut to Paris,March 2022,,,,1,1,,,False
"""impossible to communicate with them""",1,2021-12-20,"Please stay away from this airline. It is impossible to communicate with them. Messages are not answered, phones are not working. We booked the flight for 28/12 but when we checked their schedule, this flight is not scheduled anymore apparently being cancelled. Nobody notified us and it is impossible to confirm or not confirm cancellation.",True,,Family Leisure,Economy Class,Porto to Funchal,December 2021,,,,,2,,,False
