header,rating,review_date,comment,trip_verified,aircraft,type_of_traveller,seat_type,route,date_flown,seat_comfort,cabin_staff_service,food_and_beverages,ground_service,value_for_money,wifi_and_connecticity,wifi_and_connectivity,recommend
"""will avoid flying Transavia""",2,2016-01-01,"I flew from Innsbruck to Amsterdam with Transavia and it was my worst flight ever. During check-in they tagged by backpack as ""not guaranteed on board"" and I didn't really mind it being taken to the hold as it was quite big. The plane was only half full though so they let me board with the backpack. The staff was very annoyed that I brought it on board, even though they previously let me through without additional charges and most of the lockers were empty. During the boarding I wanted to ask the staff member to help me find a locker for my hand luggage, she was four rows away from me but couldn't be bothered coming to me, I had to almost scream to her about it! Later she didn't help me with putting the bag inside the locker, though even Ryanair and Wizzair staff help people with their luggage! Next to me was a group of 10 young guys who were really noisy during the whole flight (screaming and shaking my seat!). The passengers were annoyed asked them to be quiet but no one from the staff reacted. While staff was serving drinks (you have to pay 3 euros for tea in Transavia btw) I first said I'm not taking anything, but 20 seconds later changed my mind - the lady was incredibly annoyed by that, said it wasn't my turn to order now ? Definitely will avoid flying Transavia in the future, they have to teach their staff to be nicer.",False,,Couple Leisure,Economy Class,INN to AMS,December 2015,1,1,,1,2,,,False
"""treat passengers differently""",3,2015-12-31,"Paris Orly to Lisbon with Transavia. This airline treat passengers differently - some passengers were allowed to carry luggage in the cabin while others like me (with only a small bag) they did not allow. And even they did not allow to put my coat because they need to have room for the luggage from the other passengers! I protested and the crew said that with Easyjet would be worse - but I was not flying with Easyjet! Then they said that someone from the crew would talk with me, but no one showed during the flight!",False,,Family Leisure,Economy Class,ORY to LIS,December 2015,3,1,,1,3,,,False
"""just suck in every way""",1,2015-12-15,"Total mess of an airline This is the 3rd time flying with Transavia and it will be the last. To begin, every single time I fly with them, they make such a stink, bothering every single person about their baggage. Instead of asking if anyone would like to check their carry-on baggage for free before boarding, knowing that they don't have enough space in the plane (and they know, because it's been a problem every single time I've flied with them), they always tell people to rearrange their baggage so that it fits their requirements during boarding, holding up the line and wasting everyones time. This last trip, our flight was delayed by an hour, and instead of using this time efficiently, to ensure quick and stress-free boarding, the staff did nothing until everyone was in line, when a gruff, rude man immediately tagged my bag as being ""not guaranteed to fit in the plane's carry-on compartments."" My bag weighed 6kg, if not less, and fit exactly their requirements for the smaller carry-on that is granted to every passenger. When we started boarding, the staff was coldly telling every other person in line that they had to put their shopping bags/tiny purses etc. inside their main baggage or their couldn't enter the plane. Everyone is stressed, people are held up waiting in line for everyone to conform to this airline's illogical and stupid rules, and we get delayed another half hour in addition to the lateness of the plane. Not one staff member apologized for the delay except the pilot right before take off, and the same man who tagged my bag earlier seemed to revel in the fact that I had to check it. In addition, the lack of logic to these ridiculous regulations astounds me. Before entering the plane, the staff proclaimed that there was no room on the plane for more baggage, but upon entering, we notice there would be plenty of room for baggage if people were just told to keep their coats under their seats.  One more thing is that this is an airline that likes to blame its client. On my flight from Paris to Barcelona, they decided that it was the fault of the people on the plane who ""didn't respect their baggage policy"" that this was why we were later than normal. And they made this very clear to us. But the real problem was that they forgot to check our IDs at the gate while boarding because they were so distracted harassing people about their bags that they forgot. They forgot to check IDs! Because of bags! Then they had to make everyone get out their baggage from the compartments to check them inside the aircraft. Beyond disorganized - if it wasn't so aggravating it might actually be so ridiculous it's amusing. Like I could almost write a comedy sketch about this. But no. If Transavia could just learn a little logic and basic customer service, maybe they could be an OK low-cost airline. But going by their record so far, they just suck in every way.",False,,Couple Leisure,Economy Class,Barcelona to Paris,December 2015,3,1,"<span class=""star fill"">1</span>",1,2,,,False
"""no apologies, nothing""",1,2015-12-10,"In my 27 years of flying, this flight with Transavia was the worst experience I've had, which is saying a lot because I fly with multiple budget airlines. I had already checked in online, but I had to check in again at the counter at the airport. Upon checking in, the gruff clerk weighed my bag and said that I needed to check it in. I had carefully packed the bag in accordance with the carry on rules, which is below 10kg. She stated that the limit was 8kg, which it is not, and I had checked multiple times to ensure this. She begrudgingly let us take it with us, saying it was not guaranteed that it could be carried onto the flight. We were then notified that boarding was delayed. No reasons, no explanation, nothing. We would be updated hourly. 2 hours after the scheduled take off time they finally had us line up for a measly drink voucher. Most of us had been here from early morning and it was nearing noon. Finally, after a delay of about 4 hours, hence wasting our precious time in Paris, we starting boarding. While I am a resident of the States, I am a South Korean National. There were two clerks checking our tickets and passport before going in. My sister, who has the same status as I, was checked by a female clerk, and was let into the plane without a hitch. Then I was check by a male clerk, and he asked if I had a Schengen visa. South Korean Nationals do not require a visa. Then he stated that France has lifted this visa, and was requiring people to have a visa for France specifically. This was merely a rumor and France had not done such a thing. This poorly informed clerk then rudely said that I need a visa when I clearly did not, and upon me showing proof online of such info, he leered at me and told me to step aside as he let everyone else in. After everyone else was let in, he then frantically made calls and checked online himself. As he was reading he realized how he had understood this falsely, and then without even making an eye-contact with me, told me and my sister that we could get onto the flight. No apologies, nothing.",False,,Solo Leisure,Economy Class,Madrid to Paris,December 2015,1,1,"<span class=""star fill"">1</span>",1,1,,1,False
"""page is not user friendly""",3,2015-12-01,I chose Transavia because it was my only option. The page is not user friendly. I could not figure out how to check in online. The booking I received was in another language. I came 5 min too late to for last check in at the airport due to traffic problems and my confusion of which part of the airport it was - which is my own fault. I did not have any luggage that had to be checked in which made me too optimistic about time needed. When I asked the staff if there is anything to do about that they send me back and forth between different stations of their airline in the flight which made me feel stupid. It would have been nice if they straight away could tell me that it was too late. The lady in information booth was absent for 25 min and empty information booth is unprofessional. Disregard the review of the flight itself it just had to be filled in.,False,,Solo Leisure,Economy Class,Paris to Fez,December 2015,,,,1,2,,,False
"""good low-cost airline""",8,2015-11-13,"TYransavia is a good low-cost airline with outstanding service. I fly at least 4 times a year with Transavia and it has always been a good experience. As I am a tall person, 198cm, it usually is quite hard for me to squeeze in to a economy seat. This is the same with Transavia, but every time I fly with them they try to give me better seats (for free), sometimes even premium if available, or they find a row with an empty seat. Their website as well as online service (email) are amongst the best I've experienced with any airline.",False,,Couple Leisure,Economy Class,Amsterdam to Athens,October 2015,3,5,"<span class=""star fill"">3</span>",5,4,,,True
"""acceptably-priced inflight menu""",9,2015-11-01,"Flown this route several times over the last few months, booking six weeks in advance and paying around EUR120 return. Online checkin with PDF boarding pass works well (although mobile boarding pass was not always available). Security at RTM is a breeze, pleasant little airport, quick boarding by foot across the apron to aircraft, on-time/early departures and arrivals in all cases, seats a bit tight with no headrest, but a friendly cabin crew and an acceptably-priced inflight menu. All in all I'm a satisfied customer and would recommend.",False,Boeing 737-700,Solo Leisure,Economy Class,Rotterdam to Vienna,October 2015,3,4,,4,5,,,True
"""recommend for short flights""",5,2015-10-29,"Not very nice on the ground, but cheap, on time and with nice staff. Seats ok. I recommend this airline for short flights.",False,,Couple Leisure,Economy Class,Paris to Marrakech,March 2015,3,4,"<span class=""star fill"">3</span>",2,5,,1,True
"""the worst in 20 years of flying""",1,2015-10-08,"No compensation given for misleading statements. I was in Malta and experienced decompression sickness due to diving – 24h after, my airline refused entry to my flight for medical reasons, and said to book a flight with extra oxygen on board. With all flights booked and my airline needing one week to provide oxygen, I call Transavia to book any flight to Europe that can guarantee a bottle of oxygen (I should have been at work already at this time so I decide to try and travel through a connection city back to London). The staff answers that the flight HV5774 from Malta to Amsterdam, 24 hours later, can be booked with a bottle of oxygen guaranteed - I only buy my ticket with them on the basis of the availability of this bottle, otherwise I would choose a different airline, as it is about my medical safety. The booking confirmation says: ""Transavia.com will provide extra oxygen on board"". When I check-in, I ask the employee at the counter if the oxygen is available for me. She makes a call and confirms that the oxygen is available. But once in the plane, a person from Transavia comes and says ""I'm sorry madam but we have no oxygen onboard - are you really going to need it?"" I had to make a call at my own risk and realised that Transavia had falsely stated the availability of oxygen – and not just one time! – and ignored my medical requirements. Desperate to get home as I already had 500€ of extra flight costs, weighting pros and cons, I decide to test my luck and stay on the flight. The person next to me – who happens to be a nurse – found the whole situation unacceptable, and proposed to check out on me regularly during the flight. Then I asked for a small bottle of water to help in case I’m not feeling well. The employees refused to give me the bottle and insisted on me paying 2,70€ if I wanted it.  Finally, the flight arrived with 30min delay, causing me to be unable to pick-up my luggage at the arrival as I would otherwise miss my next flight to London. I had to leave it behind and fill-in a form at the ""lost and found"" in London. (my luggage was “lost” for 5 days). I contacted Transavia to complain. They started by telling me it was my fault because I made my request with “too short a notice” and they need 72 hours. The employee answered then “we cannot give you a refund” and proposed a gift voucher. But I needed to first buy a ticket and then they would refund it (even though they just said that for my complaint no refund is possible – and anyway, who would trust a company that says “we will refund” when they just said “we have extra oxygen” and it was a lie?). Running out of patience I decide to accept the deal. The final joke was when I actually tried to buy a flight: I realised Transavia does not fly from London, so I will never be able to use what I was given! This experience was the worst I had in 20 years of flying and Transavia can be sure they will never see me ever again.",False,,Solo Leisure,Economy Class,Malta to Amsterdam,September 2015,1,1,,1,1,,,False
"""cabin crew did a good job""",7,2015-09-28,"Dublin to Paris with Transavia recently. It was quite cheap as it was very last minute and with the departure time of 19.55 it allowed me to get a full days work done before I went. However, I checked in online only to find that when it came to boarding that the system in the airport had not been updated as such and that those of us (the majority it has to be said) who thought we had checked in were not and so had to be manually checked in which took almost an hour. This isn't really the fault of the airline, they blamed the airport, but there was too much confusion in the run up to the point where they opened the flight. The ground staff could see there was an issue and should have opened boarding earlier. The result of which was those with boarding cards issued in the airport got on the plane and were sitting on it for over an hour before the doors closed. Moreover when we eventually took off over an hour late we landed in Orly as the busses were leaving for Paris. No trains, no nothing which meant hanging about waiting to get into the as a result of this it was nearly one am before I got tomy hotel. The flight itself was fine, it's pretty cramped in that spotless cabin with the Boeing Sky Interior, thankfully it was a short flight! The menu range was ok but a little limited looking. The cabin crew did a good job considering they looked like they were out of patience waiting to go, and handled a fairly drunk passenger who managed to smuggle two bottles of Guinness onboard with aplomb.",False,Boeing 737-800,Solo Leisure,Economy Class,Dublin to Paris ORY,September 2015,3,4,,2,4,,,True
"""will avoid to fly Transavia again""",3,2015-09-07,"I was flying a few days ago from Athens to Amsterdam with Transavia. No problem with the flight, on time, staff ok but not as friendly as expected. But before departure I received the usual email to check in, which I did (of course I had to pay 4 euros more to change my seat) - and when I received my confirmation I realized that this was for my return flight. (I have no idea how they managed to do this, it's supposed that I couldn't check in for my return flight yet, only 24 hours before). So I had to do it all over again. Anyway, yesterday I was flying back from Amsterdam. Once aboard I realized that this was not a Transavia airplane. The staff told me that the flight would be operated by Corendon. Has anyone heard of them before? Well, I hadn't. For me it's important to know a few things about an airline before I fly, concerning the safety in the first place of course. I was so frustrated. They could at least use a KLM airplane which would be acceptable since it's basically the same company. But they can't make passengers fly with an unknown airline. I'm very dissapointed and will avoid to fly with Transavia again. To be fair though I have to say that Corendon Airlines flight was very good, the staff super friendly and polite and it was my first time to fly with a woman pilot",False,,Solo Leisure,Economy Class,Athens to Amsterdam,September 2015,4,2,,3,3,,,False
"""friendly staff""",9,2015-09-02,"Flew Transavia from Rotterdam-The Hague to Girona,. Friendly staff, on time departure and early arrival. Clean cabin and inflight entertainment app is handy and convenient.",False,Boeing 737-700,Family Leisure,Economy Class,Rotterdam-The Hague to Girona,July 2015,4,5,"<span class=""star fill"">5</span>",3,4,,,True
Transavia customer review,9,2015-08-19,"It was a good flight, no problems whatsoever. The cabin crew were very friendly, if you had a problem they came in a second. The seats where comfortable in my opinion. Food could be better though, but I would recommend this airline.",False,Boeing 747-800,Family Leisure,Business Class,Eindhoven to Las Palmas,August 2015,4,5,"<span class=""star fill"">4</span>",4,5,,3,True
Transavia customer review,7,2015-08-18,"Rotterdam to Palma and paid for a seat with extra legroom (Emergency Exit). Good flight, on time, good seats. On return leg paid for extra legroom in row, 1 but these were not worth the money – not much legroom and narrower seats due to the tables being folded into the armrests. Overall a good recommendation. Rotterdam a brilliant airport.",False,Boeing 737-800,Couple Leisure,Economy Class,Rotterdam to Palma,August 2015,3,4,,5,3,,,True
Transavia customer review,9,2015-07-02,Very nice flight with from Orly to Dublin. Orly was very convenient to use and Transavia were not strict on hand luggage allowance and staff were very friendly. Flight departed about 40 minutes late with a flight time of 1 hour and 25 minutes. I would recommend Transavia and their fares from Paris are very competitive at 35 euros each way.,False,Boeing 737-800,Solo Leisure,Economy Class,Paris Orly to Dublin,July 2015,4,5,,4,5,,,True
Transavia customer review,1,2015-07-02,"Transavia's baggage-checking equipment broke and delayed many from checking into their flights. When finally fixed my group were given 2 options: leave luggage in Paris or don't get on the flight. No offer to see the luggage through to the next destination and no concern for this group's (primarily elderly) ability to reach their next destination. They could not leave their luggage and were stranded in a foreign country's airport. $1,000+ later flights have been purchased but not before this company declares they are free from blame even though it was their equipment that delayed over 100 people. Will never use them again.",False,,Family Leisure,Business Class,Paris to Prague ,July 2015,1,1,,1,1,,,False
Transavia customer review,5,2015-06-29,"Transavia does the job but there is no fun, pleasure or convenience. Extremely early departure from Schiphol (before 6am) and extremely late and delayed return from Faro (around 10 pm: with no explanation or apologies). Crew just ok, seating cramped (is that plastic they have covered the seats in? terrible), cabin hot and stuffy with tons of screaming kids. Transavia is obviously very concerned about luggage and changes its policies on that regularly. The latest is that it will accept certain size of bags on board but others may or may not make it depending on the actual situation. Those bags may be taken in at the gate and transported in the hold at no extra cost. This is especially frustrating as luggage handling at Schiphol is terrible. Common practice there is to offload a few suitcases to be able to (I guess)  report on time 'bag delivery' then wait for over 45 minutes to get the rest of the bags out.  I am also so annoyed by the self promotion of Transavia in their inflight magazine: they cant stop talking about how they have spent a fortune on restyling logos, livery and uniforms but passenger comfort is not mentioned. If you are low cost, we hate to see you invest money but not on things that are important to us. Final issue: Transavia finally joined the 'earning miles' scheme of KLM but despite code sharing with KLM on most flights it has its own rules that are totally not transparent. You can earn miles but only on fare types that no one has ever heard off (Transavia does not offer a choice of fares) and segments don't count: it's basically useless.",False,Boeing 737,Couple Leisure,Economy Class,Amsterdam to Faro,June 2015,1,2,,1,4,,,False
Transavia customer review,5,2015-05-11,"We were delayed for 2 and a half hours on a Barcelona to Amsterdam flight. This delay incurred unforeseen additional costs in the airport departures area. Buying food and drink is expensive when the kids say they are hungry. Onboard the ""operational excuse"" apology for the delay was brief (technical problems). Then the cabin crew quickly got on with the more important business of selling expensive drinks and food to tired and delayed passengers. The 3 hr rule means that compensation is not possible in this case. I will contact Transavia to determine why a courtesy goodwill drink is not offered to passengers in these circumstances.",False,,,Economy Class,,,4,3,,,3,,,False
Transavia customer review,8,2015-05-02,Lisbon-Eindhoven. Computer problems in Lisbon caused quite a long cue at baggage drop but no delay in the end. It would be nice if Transavia tells passengers on their boarding passes that they have to go to the - badly sign- posted - terminal 2 in Lisbon. It turned out we had to take a bus. Crew on board friendly and efficient. Paid 15 euros for seats 2E and F with more leg space. Still limited because of pantry wall. Emergency-exit seat offers more leg room. Transavia doesn't have an iPhone app for storing boarding pass in pass book which is rather old fashioned these days.,False,,,Economy Class,,,4,4,"<span class=""star fill"">1</span>",,4,,,True
Transavia customer review,2,2015-04-23,90mn delay for the flight BCN Paris Orly. Chaotic boarding very noisy passengers crew did not really care. Old B737-800 dirty. Not even a glass of water to apologise. Never again.,False,,,Economy Class,,,3,2,,,2,,,False
Transavia customer review,9,2015-04-19,Flew Amsterdam to Pisa. Small delay outbound due to changing a tyre on aircraft which was actually a KLM 737 which was nice. Overall a good flight friendly staff good service. On return flight was offered seat with more legroom with no extra cost. Loved the modern funky green cabin interior. Again good flight friendly service and even IFE which is a 1st for me on a low cost airline many national airlines don't even have that in short haul. By far the best low cost airline I have flown with and I have been on a number of them in Europe.,False,,,Economy Class,,,4,5,"<span class=""star fill"">4</span>",,4,,,True
Transavia customer review,5,2014-12-22,All time low airline experience. Going through Delta and KLM we somehow ended up on a low-budget carrier from Amsterdam to Marrakech. The material on the plane said Transavia -—never heard of it until I pulled the card out of the seat pocket after the flight attendant defended the lousy customer service by offering the description “ low-budget”airline. I didn't realize that I had reached the airline hinterlands when I booked through Delta. (The first leg of the trip was KLM which I would fly any time). When we boarded the plane it was freezing cold so I walked down the aisle in search of a blanket. Found some. Was told by the flight attendant that I could not have one they weren't officially offered on this flight. That was a first. Then the drink cart rolled down the aisle. We asked for water and a cup of hot water. Then they waited for payment. My husband handed back his bottle of water and I was informed that my waxed paper cup of hot water would be 2 Euros. In the most condescending voice imaginable he explained that the purchase prices were listed in the seat pocket. I said it didn't cross my mind that there would be a price for water and I handed it back. The flight attendant said he was quite sure that low- cost airlines in the US charged for everything. End of discussion but never in my airline experience have I paid for water (or any other soft drink). Just saying pay attention to the co-carriers and know what you are getting into. If I had known I would simply have bought snacks and drinks in the terminal. Schipol Airport has fabulous markets and shops I could have been well-supplied for the flight if I had known to be prepared.,False,,,Economy Class,,,1,1,"<span class=""star fill"">1</span>",,2,,,False
Transavia customer review,6,2014-10-20,AMS-GRO. Gerona return on descent flying times. Both in/outbound flights were delayed 1h to 1h30. Staff on board were friendly but BOB product is expensive prices at GRO airport were 30% less. Both flights were on a B738 both hired outbound GOL inbound Kulula South African with overhead entertainment and better seat pitch. A good choice to fly direct to Costa Brava. Gerona airport is a nice convenient airport. Upon arrival during heavy rainfall we where transported to the terminal by bus while next door Ryanair passengers had to walk. Transavia obviously being a good LCC.,False,,,Economy Class,,,2,4,"<span class=""star fill"">2</span>",,3,,,True
Transavia customer review,10,2014-10-13,Madeira to Porto and return - their product seems consistent without odd boarding procedures for hand luggage or hidden fees which often happens in other major European low cost airlines. Everything is very clear and simple with flight attendants being professional planes clean and no major delays.,False,,,Economy Class,,,5,5,,,5,,,True
