header,rating,review_date,comment,trip_verified,aircraft,type_of_traveller,seat_type,route,date_flown,seat_comfort,cabin_staff_service,food_and_beverages,ground_service,value_for_money,wifi_and_connecticity,recommend,wifi_and_connectivity
"""did not generate any reservation number""",2,2022-08-24,"Not Verified |  My problem begins with my reservation. I am planning to go to Uzbekistan with my family in Sept. 2022. I booked my tickets on line with Uzbekistan Air on their own website and paid in full via Visa card. The UZ Air system did not generate any reservation number. There is no active phone listing for the airline in USA. I tried to call Tashkent office to confirm my booking but none picks up the phone there. I tried to contact Uzbekistan Consulate in NYC, same thing. Phone rings for more than 20 minutes, wait music on but can not speak to anyone. Extremely disappointed with there customer (no) service. No one has contacted my via email/phone. What can one do in this situation. Who to complain. They have my money Can anyone help.",False,,Family Leisure,Economy Class,New York to Tashkent,August 2022,,,,,1,,False,
"""Avoid using this horrible airline""",1,2022-06-27,Avoid this airline. Regular delays. Soviet style terrible service. So unprofessional! Too bad that this is the only one national airline of Uzbekistan. Avoid using this horrible airline at all cost!,True,,Couple Leisure,Economy Class,Fergana to Tashkent,June 2022,1,1,"<span class=""star fill"">1</span>",1,1,,False,1
"""Safety was not a priority for cabin crew on this flight""",1,2021-11-07,"Very disappointed with Uzbekistan Airways service, from boarding until landing in Tashkent. Booked flight with my kids from DXB-TAS on the 7th of November. It started at the airport in DXB, where I requested to get seats in the forward cabin, as it is challenging with small kids to move with luggage all the way to the end of the cabin. The ground staff asked the supervisor if he could offer us forward cabin seats, he refused. He was rude not only with me but with the poor ground staff who was trying to tell him the correct procedure. I have flown many times with Uzbekistan Airways and I have noticed that he has been super rude with passengers and staff at all times (in Dubai and Sharjah). When I came onboard, surprisingly I noticed that there were so many empty seats in the forward cabin! So why did he refuse a mother with 2 small kids to offer a comfort? I assume he is backed up by someone, because this kind of unacceptable attitude for so many years and nobody takes any action! Inflight: - Safety was not a priority for cabin crew on this flight, for take off some windows were dimmed, some were bright - I had two obese passengers sitting through the aisle (35E,F) for take off with their seatbelts were not fastened. Grooming of the crew was extremely poor, especially 2 crew who were seated in L3/R3 door. Male crew who worked from the AFT was not interested to serve us and other passengers, he spoke to us as if we were at the military and he was the general with us, soldiers. When he was serving lunch, somebody asked him for a glass of water, he said that he only has white wine on top of his cart. When I asked him what chicken was served with, he had difficulty in answering. He saw me struggling during disembarkation with kids and my luggage, he didn't even offer to assist us to disembark the aircraft - Not to mention that lavatories were dirty throughout the flight. On this flight the crew didn't smile and welcome guests, they all gave impression that they were forced to come and do this flight, except one who was super positive and welcoming from boarding. During the flight she came and checked on us if we needed anything. Sadly, she was the only crew who worked and valued her job. Don't fly Uzbekistan Airways, unless you really don't have any option to choose from.",True,,Family Leisure,Economy Class,Dubai to Tashkent,November 2021,2,1,"<span class=""star fill"">1</span>",1,4,,False,
"""it proved to be a fine experience""",7,2019-12-19,"I flew from KL to Tashkent economy class, 7.5 hours each way, departing late November 2019 and returning mid December 2019. I had some apprehension about the flight but it proved to be a fine experience. The well experienced 767s were smooth and comfortable and on the first flight had a rudimentary IFE system which had its quirks that nearly resulted in a finger tip blister! (On the return flight on another 767 there was no seat back screen but instead had roof mounted screens that were quite useless). The cabin crew were friendly and the meal service was very adequate and I certainly wasn't hungry afterwards. Perhaps because of the age of the aircraft I felt that there was more room as they had a 2-3-2 seating configuration and on both flights there were many unused seats and even complete center rows of 3 seats left vacant for sleepers had I wanted to. All in all a good experience with Uzbekistan Airways.",True,Boeing 767,Solo Leisure,Economy Class,Kuala Lumpur to Tashkent ,December 2019,5,4,"<span class=""star fill"">3</span>",4,4,,True,
"""pleasantly surprised""",7,2019-11-21,"Tashkent to London Heathrow. I was pleasantly surprised by Uzbekistan Airways for this recent flight. Boarding was smooth and prompt (probably helps the flight was only half full), we pushed back near enough bang on time and from there had a very efficient flight to London, landing circa 35 minutes early. As mentioned the flight was only half full, it regardless there was plenty of legroom, over head lockers are very large, the whole cabin felt spacious. The only problem was the temperature, the plane felt like an oven for the entire journey. The in flight entertainment, whilst not particularly extensive, had enough to keep you entertained with a decent selection. The food and drink offerings were the only real negative. As a nation famed for its food I think Uzbekistan Airways can manage more than plain boiled white rice and a fried chicken breast, couple that with no beer or sparkling water available onboard led to the only real disappointment.",True,Boeing 787-8,Solo Leisure,Economy Class,Tashkent to London Heathrow,November 2019,5,5,"<span class=""star fill"">4</span>",4,4,,True,
"""not been worth the flight""",1,2019-11-17,"Paris to Delhi via Tashkent. Ground staff at Paris didnt know well to operate the systems to generate boarding pass resulting into start of boarding procedures late by an hour, no response or information to passengers resulting into chaos. Inflight staff - rude behaviour, gave water after 20 mins of asking and later denied for water when asked for 3rd time. Veg food not available and food available only as per counting, if extra food asked for, denied. Even fruits were denied stating that only the packet of nonveg available if required could be given and separately fruits cant be given. Pillow and blanket was denied stating that you have neck rest which works as pillow so not needed and you have jacket which could be warm enough so blanket is not required. Alcohol (only red / white wine available) which was denied when asked for 2nd time stating that the flight had only 1 bottle (of white wine) which is finished so cant be served repeated later on however 1 glass of red wine was offered stating that only 1 extra glass can be given. Peanuts denied 2nd time stating that per passenger gets only 1 packed and that's finished. I was first time international traveller I was not aware how to order veg food for flight online due to which I asked for Support for getting veg food for connecting flight which was replied that it's not their job to guide how to order veg food, their job is just to serve what ever is ordered. The staff was talking to passengers with rude tone with the ones who tried changing seat as the flight was empty. At Tashkent Airport, the transfers staff in charge of issuing boarding pass didnt know how to process the boarding pass taking about an hour for completing the process resulting into delay in flight. The inflight staff in connecting flight from Tashkent to Delhi was decent, they even offered alternative as fruits as veg food was not ordered. Overall the behaviour and experience has not been worth the flight.",True,,Solo Leisure,Economy Class,Paris to Delhi via Tashkent,November 2019,2,1,"<span class=""star fill"">2</span>",1,1,,False,1
"""Disorganised boarding""",6,2019-09-30,"Tashkent to Istanbul. Disorganised boarding. Passengers were not called by rows. It was a free for all with a long queue. Good cabin service. Limited options for entertainment. Only 3 or 4 films available. No music, etc.",True,,Solo Leisure,Economy Class,Tashkent to Istanbul,September 2019,4,4,"<span class=""star fill"">2</span>",3,4,,False,
"""Antiquated, surly govt owned airline""",3,2019-08-16,"Kuala Lumpur to Tashkent. It is like going back in time, about 30 years back. Our departure from Kuala Lumpur was 1 hour 50 late, dep Tashkent on time. I cannot believe this airline does not serve beer, only white or red wine is only alcohol available, they also have no diet beverages, the very limited choice dies not even come with ice so fruit juices are warm . On the return trip we bought cold beer at the airport to drink Food on both flights was terrible, very limited choices, served by surly unhelpful staff. The good thing was the generous recline of the seats Entertainment was a joke, flight out had screens in the roof, so 80's, return had seat back screens which were a waste of space, latest movie in english fir over 10 year olds was 7 years old. I watched my tablet on both flights. Blankets and pillows ran out after 10 people on the early evening outbound flight, return had enough for a quarter of the plane and very begrudgingly given out. Antiquated, surly govt owned airline.",True,,Couple Leisure,Economy Class,Kuala Lumpur to Tashkent,August 2019,5,1,"<span class=""star fill"">1</span>",4,2,,False,
"""Worst airline ever""",1,2019-07-06,"Not Verified |  Worst airline ever. We traveled by this from St Petersburg to Tashkent. That flight was good but the flight from Tashkent to Delhi number 421 was very old, no screens on seats, no pillows only child and women got pillows, no blankets for all, no wine or whisky, not enough flight attendants. Worst ever experience.",False,,Family Leisure,Economy Class,St Petersburg to  Delhi via Tashkent,July 2019,1,1,"<span class=""star fill"">1</span>",1,1,,False,
"""Crew very attentive""",8,2019-07-05,"Paris to Tashkent. Check in counters are located in CDG 2A terminal very quiet in the afternoon. Business tickets allow us to make a stop in the glamorous Cathay Pacific lounge : Champagne. And again Champagne as a welcome drink (Uzbek cuvée on the return ), warm nuts as an aperitif. Full dinner service, three choice). Light breakfast served before landing. Seats are 2-1-2, comfortable, amenities in a nice travel kit, IPad provided. Crew very attentive during all the flight, same for the return from Tashkent.",True,Boeing 767,Solo Leisure,Business Class,Paris to Tashkent,April 2019,4,5,"<span class=""star fill"">3</span>",4,4,,True,
"""exceeded my expectations""",7,2019-05-22,"Moscow to Tashkent. I did not expect much from this airline, however I was pleasantly surprised. The aircraft seemed to be new and the interior was very clean. The boarding started on time, well organized. Both flights departed and arrived on time. I paid a little extra for the exit seat and got a huge space for legs, etc. The personnel on board was average but meals were excellent and abundant, the in-flight entertainment system worked well (funny English dubbing by a Russian speaker, one voice for all actors in movies). The overall experience is naturally not comparable to companies like Qatar or Emirates but nobody expected that quality either. All in all this airline exceeded my expectations and can recommend it to other passengers.",True,,Couple Leisure,Economy Class,Moscow to Tashkent,May 2019,5,3,"<span class=""star fill"">4</span>",3,5,,True,
"""crew were not friendly""",1,2019-05-07,"Tashkent to Kuala Lumpur. The worst airline taken in all of my holidays. A week before we departed Singapore they sent an email to inform that flights home to Singapore are cancelled. We wrote in 3 times with no reply, called the Singapore office and the guy was impossibly unhelpful. We had no choice but to make our trip blindly and hope for it to get settled over in Tashkent. Our flight departing Singapore was delayed by an hour plus, and transit in KL, it was again delayed another hour. It happened the same for our flights home whereby new transit was in Jakarta, it got delayed an hour an half. We barely made it to catch our flight home with MH that the airline booked us home on. My luggage was left behind because of this. Flight crew were not friendly, barely smiled no matter how polite we tried to be. And they never once served water after the meal service. We had to keep going to ask for it and they always gave an unhappy look. Seriously, I don't know what kind of service industry this airline is in, because there wasn't any at all. The food from Singapore was okay, but the food from Tashkent was awful. Tasteless and dry. Our flight home was a night flight, yet the lights were not switched off for sleeping. It was a really suffering 18 hours journey home, with no food and no sleep and with unconfortable seats. Such a pity because the country is so beautiful and the Uzbeks are really nice people. The airline crew need to undergo intensive service training for sure.",True,,Couple Leisure,Economy Class,Tashkent to Kuala Lumpur,May 2019,2,1,"<span class=""star fill"">2</span>",3,2,,False,
"""experience was terrible""",1,2019-03-29,"Tel Aviv to Bangkok via Tashkent. The whole family - we are with two young children - 3 years and one year. We were preparing for this flight for long time, because flying with so little children is not a simple task. Before us there was a considerable selection of companies that offer the flight to Bangkok including some Israeli companies with flights even cheaper than Uzbekistan Airways. After much deliberation, we did choose to fly with Uzbekistan Airways because we also realized that the company has improved in recent years, and in terms of flight time with small children it suited and it was important for us to land early in Bangkok, since we had a flight from Bangkok to Koh Samui Island. And from there boat to Koh Phangan Island. The last boat leaves at 16, so landing in Bangkok at 6:40 am promised us an early arrival to Samui without having to stay there overnight but straight to continue to Koh Phangan. I would like to point out that on this journey we left with the full weight, since we are planning a long stay on the island. So it was very important for us that the road be continuous and without unnecessary stops with children and so many luggage. In practice everything happened the opposite! The flight from TLV was delayed in 5 hours. Not speaking about the food and the bad service during the flights, we arrived very exhausted to Bangkok at 13pm. We waited for 3 hours for the next flight (Our flight was at 9:40). We arrived to Samui much later after last boat to Pangan. We had to search for a hotel, carry all the suitcases and children. We arrive to Phangan in delay of day, which included all unexpected and unwanted expenses for taxi, food, lodging, not to mention the levels of fatigue we all came to. I was sorry for the moment when we decided to fly with this company. The experience was terrible, I do not wish anyone!",True,,Family Leisure,Economy Class,Tel Aviv to Bangkok via Tashkent,March 2019,2,1,"<span class=""star fill"">1</span>",1,1,,False,
"""a horrible experience""",4,2019-02-24,"London to Amritsar via Tashkent. It was a horrible experience with Uzbekistan Airways. The in flight attendants were inexperienced. They burned my arm and leg in departure and arrival flights with hot coffee. The staff even didn’t knew how to serve coffee in flight. Then the worse part was that they didn’t even offer First Aid. The food quality, inflight entertainment, broken seats is not worth mentioning.",True,,Solo Leisure,Economy Class,London to Amritsar via Tashkent,February 2019,1,1,,2,2,,False,
"""cabin clean and bright""",6,2019-01-20,"An internal flight from Urgench to Tashkent, As the airport is small has only 4 flights a day, check in was simple and fast, no chances of getting lost. You walk out to the plane on the tarmac Ryanair style. The cabin is clean and bright. With simple economy seats on a 3 - 3 fashion. The 4 staff soon had people on board and bags stored. The pre flight briefing was from drop down screens, that then showed a 15 minute video of Uzbekistan in flight. The crew served a selection of cold drinks after take off and this time no one was able to get tea from the business class section of the plane. The flight was straight forward and took around 50 minutes, landing in Tashkent was quick and we were taken from a remote stand to the terminal by bus. Bags where on the belt when we arrived.",True,A320,Business,Economy Class,Urgench to tashkent,November 2018,2,3,,2,4,,False,
"""crew were pleasant""",7,2019-01-20,"Tashkent to Urgench. Check in for this flight was simple and straight forward at the domestic terminal in Tashkent. Collecting a boarding pass and passing security took less than 10 minutes. We were bussed to the plane and boarding was simple and straight forward. The 4 crew were pleasant and spoke in 3 languages. Drop down screens gave the pre flight safety presentation, which 20% of the passengers ignored. Take off was swift and the captain gave a simple on board welcome in 3 languages. The cabin crew did not enforce seat belt rule on passengers not using them, but quickly stopped a person having lighting up a cigarette. Cold refreshment's (coke, sprite, juice and water) where served straight after take off, but people in economy walked into the business class section for hot tea. The 1 hour flight was in good weather and a low cruising altitude gave good views from the windows. The cabin was 3 - 3 seats and the interior was clean and bright. The cabin was a bit like Wizz Air. There was no IFE other than drop down screens that played a video of Uzbekistan. The landing was good and the empty airport was simple to navigate. Bags arrived within 10 minutes and we were out of the door into the clutch's of taxi drivers.",True,A320,Business,Economy Class,Tashkent to Urgench,November 2018,3,2,,3,5,,False,
"""recommend Uzbekistan Airways""",8,2018-11-02,"Moscow to Tashkent. Fast and efficient check in at the Domodedovo airport with a ample lounge to relax before boarding with great drinks and food choices. Boarding process was a bit chaotic, the plane was full and there was no separate line for business class so it took a while for agents to check documents and boarding passes of everyone in the long queues until I was allowed to board. 3 friendly flight attendants greeted me aboard the beautiful cabin of their new Boeing 787, took me to my assigned seat, hung my jacket, and offered me some champagne, with a refill shortly after. They spoke very good English and were genuine friendly and courteous. They distributed noise-canceling headphones, newspapers and magazines, a cool amenities kit - a nice touch since this was a 5-hours flight - and the landing forms, plus informed lunch would be served shortly after takeoff. Cabin was very nice with ambient lighting and logos and touches of Uzbekistan Airways. Seat was very comfortable but not as private as if it was on a 2-2-2 configuration. Since I had an empty seat next to me, I had all the privacy plus lots of additional space. Right after takeoff, a flight attendant came to offer hot towels, additional drinks with a few small plates, and a food feast began. Several courses were served and I was very impressed by the quantity and quality of the food presented. Even though they did not offer a printed menu, stewardess brought several choices of appetizers, salads, soups, main courses, and encouraged me to try different combinations. Also the desserts, I agreed with two choices, but they brought more and everything was high quality and well prepared and presented in porcelain with Uzbekistan colors and logos, very classy. Shortly after lunch, they offered a tablet with several movies and music programs to choose from. Flight attendants keept checking passengers by offering more drinks, blankets, etc. until Captain has announced the approach to Tashkent. After landing, they went to every passenger to thank them for flying with Uzbekistan and to welcome to their country. As the airplane parked at a remote stand, a bus assigned to business class passengers took us to a private arrival lounge, where private immigration and customs facilities were offered, and the whole process went quite fast. I was very impressed with the warm and professional service provided along with excellence and attention to details. Only aspect to be improved would be the boarding process for premium classes. I recommend Uzbekistan Airways and I am willing to fly with them again",True,Boeing 787,Solo Leisure,Business Class,Moscow to Tashkent,October 2018,4,5,"<span class=""star fill"">3</span>",3,4,,True,
"""a rude attitude towards us""",1,2018-09-19,"Tel Aviv to Bangkok via Tashkent. From the very beginning at check-in, we felt a rude attitude towards us, but that was just the beginning. We got a place in the middle of the plane and not like in almost all other airlines passengers with children gets seats in the front with more space. Space between the seats in our place was not more than 20 centimeters (with a 9-month-old baby)! 6 hours flight from Tashkent to Bangkok The air conditioner did not work ! The toilet was located next to the business class and when I went to the toilet I was shocked to discover that in the business class the air conditioner was working and even felt the smell of cigarettes from there - unbelievable - the plane was very old and dirty no entertainment systems. The attitude of the staff was not patient and sometimes even rude. The connection in Tashkent was as bad as the flight everything processed very slow the passport check the security check was so slow and not professional. The air conditioner at the airport did not work It was very very hot. There is no normal food to eat, There are only 3 cells in the toilet with a huge queue and the smells were horrible, and finally, they lost our baby stroller!",True,,Family Leisure,Economy Class,Tel Aviv to Bangkok via Tashkent,August 2018,1,1,,1,1,,False,
"""don't expect much""",5,2018-09-15,"New York to Tashkent. Uzbekistan Airways offers direct flights from JFK. The fleet has some relatively new Boeing 787, but don't expect much beyond knowing you'll get there relatively quickly. There's no online check-in on the website, so arrive at least 3 hours early for international flights and expect to queue. Food is ok coming from NYC, very mediocre coming from Tashkent. Lots of screaming kids running laps in the aisles, so bring earplugs or music. Entertainment system has lots of Russian/Uzbek movies, but the worst dubbing I've ever encountered. Rather than removing the Russian soundtrack, they simply put the English translation over it so that both play simultaneously. The English translation is just that: one guy reading all the male character parts with a Russian accent, and a woman doing all the female parts.",True,,Solo Leisure,Economy Class,New York to Tashkent,September 2018,2,3,"<span class=""star fill"">1</span>",4,3,,True,
"""26 hours in airport""",1,2018-09-12,"Moscow to Tashkent. Our plane was broken. We were 26 hours in airport without hotel and proper food. We could not leave the airport because flight was delayed every 30 min. They promised to fly immediately during 26 hours! We even could not finally enter the plane, which came instead of our one: Uzbekistan Airways simply forgot to re-issue our boarding passes. We had a nightmare crush during boarding, because new plane was smaller vs previous one. We even had an issues with police! finally air company refused us in any compensation.",True,,Family Leisure,Economy Class,Moscow to Tashkent,August 2018,3,1,"<span class=""star fill"">1</span>",1,1,,False,1
"""a bit too rough and ready""",6,2018-04-29,"London to Tashkent. Plane left and arrived roughly on time. Very old, tatty and worn out Boeing 757 with very uncomfortable seat for a night flight and limited leg-room. Cabin crew were friendly but with limited English. Food was tasty. First time flying with Uzbekistan Airways and wouldn't do it again if there were any other direct flights available. All a bit too rough and ready for a 7 hour overnight flight.",True,Boeing 757,Solo Leisure,Economy Class,London to Tashkent,April 2018,1,3,,2,2,,False,
"""rude customer service""",1,2018-03-11,"Riga to New York. Uzbekistan Airways is the worst airline ever. They are all rude - starting from the customer service via mail to staff on board! They don’t care about customer at all and do/say whatever they like. Do not recommend. The food is okay, enterteinment on board is okay but English is terrible..",True,,Family Leisure,Economy Class,Riga to New York,March 2018,1,1,"<span class=""star fill"">1</span>",1,5,,False,1
"""their rude flight attendants""",2,2018-02-07,"Kuala Lumpur to Tashkent. Worst airline ever with their rude flight attendants and ground staff. It’s the only airline in Uzbekistan and no competition, that’s why they act whatever they want. You can’t complain to anyone because no one going to listen to you! I don’t recommend at all. But food is good.",True,,Solo Leisure,Economy Class,Kuala Lumpur to Tashkent,March 2017,2,1,"<span class=""star fill"">1</span>",1,3,,False,1
