header,rating,review_date,comment,trip_verified,aircraft,type_of_traveller,seat_type,route,date_flown,seat_comfort,cabin_staff_service,food_and_beverages,ground_service,value_for_money,wifi_and_connecticity,recommend,wifi_and_connectivity
"""The worst rip-off an airline has ever performed on me""",2,2022-11-17,"The worst rip-off an airline has ever performed on me. They do go out of their ways to make you feel the pain of deciding to fly with them: they show you technical errors while you try many times to check-in online for your flight - so you cannot do it and then at the airport they charge you 40+ EUR per person for on-site check-in (4 people = 170 EUR!). They first ask for a screenshot of the technical mistake, you show it to them and then they say: ""You should have called our Call centre - it\s your fault."" So by their logic I should have paid 3 EUR a minute for a call in a foreign country for the sake of their technical ""error"" ( it is a usual ""error"" their system seem to be trained to create for several customers on that flight and each of their flights as we figured out at the airport talking to fellow-passengers who were ripped off the same way on the spot). I don't even mention that I paid extra for the seats but at check in they put my 5 y.o. daughter at the front of the cabin and us - at the very back! Please never use this airline - I hope it would go broke soon for such horrible business practices.",True,,Family Leisure,Economy Class,Gdańsk to Hamburg,October 2022,3,3,,1,2,,False,
"""€55 each to check in""",1,2022-11-13,"Probably the worst airline I have ever used. Go out of their way to rip customers off. Would prefer to pay more with another company than have them charge my family of 3, €55 each to check in when the online check in isn't working. Then, suggest that because we didn't call the £1.49 a minute help desk it was our fault (do you see anywhere in the check in screenshot where it says call the help desk?).",True,,Family Leisure,Economy Class,Varna to Liverpool,October 2022,3,3,,1,1,,False,
"""terrible flight attendants""",1,2022-11-13,"Not Verified |  I tried this company for the first time ever and for sure I’ll never repeat it! Please be aware that you are paying for a low cost company that if not checked in exactly 24h prior the flight they will charge you with 40 pounds more at the counter, people are rude as hell, I barely understood when she told me to size my bag and she raised the voice annoyed, and only accept card payments. Was the biggest mistake as through website while proceeding with the purchase they increased the flight automatically in 10 pounds extra (during the process of inserting card details, I should have suspected). No space for legs, no options on food, terrible flight attendants, that seemed they hate their jobs and are obligated to be there.",False,,Solo Leisure,Economy Class,London to Portugal,November 2022,1,1,,1,1,,False,
"""seats were quite comfortable""",7,2022-11-09,"I flew from Luton to Sarajevo on 29th October. The check-in process was quite efficient, The boarding process not so much. I don't know if this is a Luton management or Wizz Air management issue. However, cramming 200 passengers before the aircraft has even arrived in a small room with no ventilation was neither healthy nor with small children, significantly difficult. Flight took off on time. The seats were quite comfortable, and we landed in Sarajevo on time. On the return flight on 4th November, the service was quite better. A newer NEO aircraft, Smoother boarding process and a smooth flight - I'd advise that Wizz Air expands to other UK destinations like Bristol Airport to make it easier for South West & South Wales pax to connect with EU destinations without the extra journey.",True,A320-200,Family Leisure,Economy Class,London Luton to Sarajevo Int'l,November 2022,4,4,,2,4,,True,
"""Awful experience""",1,2022-11-08,Awful experience. I do not recommend it. Wizz Priority costs more but it is just a scam. Our original flight was changed afterwards so we lost nearly 2 Days. Our Original Seats (we paid extra) were also changed. Worst Company ever. We will never fly again with them.,True,A320-200,Couple Leisure,Economy Class,Nürnberg to Skopje,November 2022,1,1,"<span class=""star fill"">1</span>",2,1,,False,1
"""Never again""",1,2022-11-07,"Not Verified |  Never again. Booked upfront a flight with 4 nights in Venice, Wednesday (evening) to Sunday (morning). Reasonably cheap, alright. A couple of weeks before the outbound flight was postponed by 20 hours, meaning the trip became one day shorter. (BTW, they do not even bother to update you, it was the travel company which sent a note). But even this is not their ugliest record: on Friday get a message that the return flight is moved at 7am on *Saturday* instead of Sunday - 23 hours earlier than planned! (And again - no message from WIZZ, just from the travel agent). Say what? Making the itinerary two days shorter! Moving flight a day earlier a few hours before the new flight time with no rebook, refund, cancelation options! I could not even imagine this is legal. (As a result I had to book another return flight) All this comes on top of constant flight delays and cancelations. WIZZ, you lost my business in favor of more honest companies.",False,,Couple Leisure,Economy Class,Tel Aviv to Venice,November 2022,,,,2,1,,False,
"""Terrible airline and staff""",1,2022-11-04,"Not Verified |  Terrible airline and staff, kept us on the plane for 5 hours, after 3 hours of delays, and then finally cancelled the flight stating that staff cannot legally put in any more hours. Stewards charged people for meals and drinks even after 3 hours which is against their policy. Stewards promised that their own Wizz Air staff were at the airport and accomodation and rebooking would take place. Of course no Wizz Air staff, just a few beleaguered ground crew (employed by a totally different company) some of whom were rude. Also two burly armed policemen were standing guard in the area we herded into. No help, no guidance. No accomodation provided as everything was booked, no shuttles, no flights booked as they were all sold out. Wizz Air refuses to compensate. Disgusting and don't bother paying extra for priority, it's rubbish.",False,,Business,Economy Class,Luton to Tenerife,October 2022,1,1,,1,1,,False,
"""charge you for not checking in online""",1,2022-11-04,This airline is a scam. They will charge you for not checking in online when there is no email/option provided. It's not our first time to travel so we know that we can check in online before our flight but like I said there's no option provided. But the the lady keep saying it's impossible and then we observed that they have the same script to each and every passengers meaning they know its happening. So before booking in flight check the review first especially if it's a budget airline because you'll never know your spending more than booking a decent flight from a decent airline.  Their booking partners must take action with this ongoing issues from this airline too.,True,,Family Leisure,Economy Class,Rome to London Gatwick,November 2022,1,1,"<span class=""star fill"">1</span>",1,1,,False,1
"""I don’t recommend this company at all""",1,2022-10-30,"Not Verified |  After a delay of almost an hour, they crowded all the passengers in 3 buses and then they made us wait in front of the aircraft for about 20 minutes. People were getting sick because of the kerosene smell. After all this wait they announced that the flight was cancelled, I don’t recommend this company at all.",False,,Family Leisure,Economy Class,Lisbon to Bucharest,October 2022,1,1,"<span class=""star fill"">1</span>",1,1,,False,1
"""never fly this rubbish airline again""",1,2022-10-25,Not Verified |  Our flight was scheduled at 11.05. Now for the third time it is delayed to 15.02. We are travelling over for a funeral tomorrow and were to be picked up at Gatwick by friends travelling from Brussels. Not going to happen now. This is the 3rd time in 3 days this flight has been seriously delayed out of Faro. Totally unacceptable and nobody to talk to. Will never fly this rubbish airline again.,False,,Couple Leisure,Economy Class,Faro to Gatwick,October 2022,,,,1,1,,False,
"""stuck on plane, no information""",1,2022-10-23,"Not Verified | Terrible experience, avoid this airline whenever possible if you don’t want to ruin your holiday. Delays, unforeseen shaky landing, stuck on plane, no information - all the worst flying experiences you can find it here. Had a flight that was supposed to arrive at 9:20pm, still stuck on the plane after 1.5hrs. It's a Sunday evening flight people need to work tomorrow. Will never take this airline ever again.",False,,Solo Leisure,Economy Class,Budapest to London Gatwick,October 2022,2,2,,1,1,,False,
"""Wouldn’t recommend this airline""",1,2022-10-21,"They have untrained and inadequate staff, extremely rude. They occupy the front cabinets with their luggage which means that the passengers flying on rows 1 and 2 need to store their stuff beyond row 3. Their flights are delayed and they never compensate.  The irony lies on the fact that they are asking for a review after each flight to certify how awful they are and once you are confirming their level of unprofessionalism they are asking to compare our experience with Ryanair. Ryanair is far more professional than this inadequate airline. Wouldn’t recommend this airline not even to an enemy.",True,,Solo Leisure,Economy Class,Gatwick to Athens,October 2022,1,1,,1,1,,False,
"""cancelled flight in June with absolutely zero customer support""",1,2022-10-20,"Not Verified |  You are better off paying more for another provider or even walking to your destination than flying with this shambolic organisation. I would give 0 or even minus if I could. They cancelled flight in June with absolutely zero customer support at the time meaning we had to abort our holiday to Sicily and drive back from Gatwick to Bath as no Hotel was offered and no alternative flights we available. No one at the airport to talk to. Fast forward to October and we still haven’t received our £600 compensation which we needed to cover the cost of our hotel and travel costs to and drop the airport. Despite countless emails that are never replied to. We did receive an email saying it would be paid in 14-20 working days. This date came and went as we expected it too. They make it as difficult as possible to receive your money and are virtually uncontactable. The live chat doesn't work, several times I have joined and received a message saying 'agent has left chat' before it has even begun. I have spent hours trying to connect to someone with no luck. They are happy to charge £1.50 a minute to call their helpline which I refuse to do, as I will never spend another penny with this pathetic excuse for a company. It has been exhausting and has tainted my view on flying aboard, purely because of the level of hassle this has created.",False,,Couple Leisure,Economy Class,London to Sicily,June 2022,1,1,,1,1,,False,
"""don't use Wizz Air""",1,2022-10-18,Not Verified | I'm a frequent flyer (twice a week between UK and EU) and this airline is the worst I've used. They used to be good but not anymore. Almost always late and if you want to get any refunds or reimbursement retrospectively you cant forget - it will take ages. Just a friendly warning - don't use Wizz Air.,False,,Solo Leisure,Economy Class,,October 2022,1,4,"<span class=""star fill"">1</span>",2,1,,False,
"""want to receive the reimbursement""",1,2022-10-17,"Not Verified |  I spent the whole day to go in this trip. Drove more than 150km from Torino to the airport in Milan, I had to leave the car in a parking that cost 15 euro a day, then on the way to the airport I got a message saying that the flight it was postponed from 19:25 to 20:45 and then after a long wait at the airport I got another message informing that the flight it was cancelled. So basically I had to drive all the way home again and could not find another flight and lost a important course that I was going to do. I want to receive the reimbursement.",False,,Couple Leisure,Economy Class,Milan Malpensa to London Gatwick,June 2022,,,,1,1,,False,
"""Wizz has been an awful experience""",1,2022-10-14,"Booking was fairly easy and seemed a reasonable price. We only took hand luggage which worked well. Outbound flight to Podgorica went ok with a small delay and staff seemed fairly friendly. However, on our return flight we got delayed 5 times at the airport before being completely cancelled with no reason given. I had no mobile service and the airport had no wifi available for public use. I therefore asked airport staff for help who said they were unable to help and to contact Wizz directly. I eventually managed to get Wizz on the phone who offered me a refund for my cancelled flight but no further assistance. I therefore had to go around asking people to hotspot their mobile data so I could organise alternate flights, hotels etc. Because Podgorica is a small airport we had to travel to Dubrovnik, Croatia to get home. I have since sent a claim to Wizz, the claim was sent over 30 days ago and their website clearly states ""normally dealt within 7 days, certainly within 30 days"" - well that obviously is not true. I have tried contacting Wizz in other ways but they literally make it impossible with every member of staff saying they are unable to assist and unsure what to do. Overall Wizz has been an awful experience and for the sake of saving £50 each on air fares we're currently over £1000 worse off due to rebooking flights, accommodation, taxis etc. I really would recommend choosing a more reputable airline that at least helps out when flights inevitably get cancelled.",True,A320,Couple Leisure,Economy Class,London Gatwick to Podgorica,September 2022,3,3,"<span class=""star fill"">1</span>",1,1,,False,
"""return flight was a nightmare""",2,2022-10-14,"Cant complain about the outgoing trip, cheap, about what you'd expect, the return flight was a nightmare, The flight got cancelled 3 hours before boarding, we were informed at check-in, didn't get a notification for the airline about the cancellation. Compensation: still ongoing, they gave us credit for their airline, which we explicitly said not to, and got denied accomodation and rebooked flight refund. Their site and claims management is really bad, their site logs you out whenever you go to the claim forum, they dont support password resets (even tho they say they do, my father got locked out of his account and is unable to get in no matter how much he tried to reset the password), unnecessarily convoluted.",True,,Family Leisure,Economy Class,Tel Aviv to London,September 2022,1,2,,1,2,,False,
"""not refunded me yet"" ",1,2022-10-13,If you want to take a risk for the low cost airline go ahead but beware they will cancel at the last moment and you will have to pay double or triple the amount for the next ticket. This happened for me and the best part is that its been 30 days and they have not refunded me yet.,True,,Couple Leisure,Economy Class,Athens to Abu Dhabi,October 2022,,,,,1,,False,
"""doing everything in their power to ensure you can't check-in online""",2,2022-10-11,"Not Verified |  They are doing everything in their power to ensure you can't check-in online (deliberate bugs, no mobile compatibility, error messages etc.) so they can charge you in the airport 90 euro. This is my 3rd flight with them on the span of 2 years and the process is just becoming more harder and impossible online so they can steal money from you. ""Seat selection not available"" while trying to check in and then they ask you to use live-chat which never works because all reps are busy all the time (for 2 years), they force you to call their call centre which is a premium phone number! (2$ a minute!) and charge you 15 euro per each change or transaction (even check in over the phone when the online doesn't work).",False,,Family Leisure,Economy Class,Tel Aviv to Vilnius,September 2022,3,3,,2,2,,False,
"""worst experience ever""",1,2022-10-05,"No service - worst experience ever. I cancelled my flight 3 months prior to departure. Still I am fighting to get my money back. They play ""back-and-forth"" when it comes to requesting a compensation. Unclear communication, unfriendly customer service people, ambiguous and contradictory statements regrading your compensation status, no mail records regarding your conversations with customer service.. The worst ever customer experience I encountered with an airline.",True,,Family Leisure,Economy Class,Vienna to Reykjavik,August 2022,,,,,1,,False,
"""still no compensation from Wizz Air""",1,2022-10-05,"We booked a flight home months before, we knew it was an uncomfortable flight, meaning we should take off at 21:45 and land at 01:55. But, at 7pm i get a text from wizz that we have a 1h delay. After a few minutes another text that said the new take off hour is 1:10, the next day. After i get an email with a 4€ voucher for my trouble, and that’s it. At 23:00pm some flight attendants tell us with an attitude that our plane will land in about 1-2h and we will board. At 00:45 starts the boarding, with the same arrogant and angry attitude from the crew. I have paid extra for my seat and to have my suitcase with me, on the plane i had no place for my luggage and they were very upset when i pointed out i paid good money for that privilege. We take off qnt 1;30 and i get out of the airport at 5:30, and we had work the next day. They were unpolite and not helpful the whole time, considering everyone was exhausted from that long wait. And still no compensation from Wizz Air.",True,,Couple Leisure,Economy Class,Barcelona to Bucharest,October 2022,1,1,"<span class=""star fill"">1</span>",1,1,,False,1
"""Denied boarding with two young children""",1,2022-10-02,"Not Verified | Denied boarding with two young children, requesting a supporting letter with the passport, although not explaining what exactly they want, simply walking away, suggesting they are short of staff. I have missed my flight, returned home, yet still don't know what letter was I requested, nor knows the Embassy of the country I was traveling to. Simply unacceptable.",False,,Family Leisure,Economy Class,London to Chisinau,October 2022,,,,1,1,,False,
"""This is air travel at its most chaotic""",1,2022-10-01,"Expect delays - expect no information - expect the first delay to be extended by a second delay or more, don’t book priority boarding because there isn’t any and it’s a free for all. This is air travel at its most chaotic.",True,,Couple Leisure,Premium Economy,Larnaca to London Luton,October 2022,1,1,"<span class=""star fill"">1</span>",1,1,,False,1
"""no notification of delay""",1,2022-09-25,"I had a flight to Rome at 9.40 am and not only did we leave on time but there was no notification of delay. By 10 am I had already understood (by myself that my flight was delayed) and I had to wait for 10.15 to receive an email informing me of the next departure at 12.00. It is currently 12.08 and I have not yet left but I have not received a second email more or less 10 minutes ago that warned me of a subsequent delay of another 2 hours. At the very least, the company should have provided vouchers to buy lunch and so it was. The vouchers cover a cost of € 4 and in skiathos airport you hardly even buy a coffee for that amount. At the end, I'm still here waiting to leave with a very expensive lunch that I had to buy with my own money, hoping not to receive another email 5 minutes before my flight warning me of another delay!  Avevo un volo per Roma alle ore 9.40 e non solo siamo partiti in orario ma non vi è stata alcuna comunicazione di ritardo. Alle ore 10 avevo ormai capito (da sola che il mio volo fosse in ritardo) e ho dovuto attendere le 10.15 per ricevere una mail che mi avvertisse della successiva partenza alle ore 12.00. Attualmente sono le ore 12.08 e non sono non sono ancora partita ma non ho ricevuto una seconda mail più o meno 10 min fa che mi avvertiva di un successivo ritardo di ulteriori 2 ore. Come minimo la compagnia avrebbe dovuto fornire dei voucher per acquistare il pranzo e così è stato, peccato che i voucher coprono una spesa di 4€ e nell’aeroporto di skiathos per quella cifra non ci si compra quasi neppure un caffè. Terminando sono ancora qui aspettando di partire con un pranzo costosissimo che ho dovuto comprare con i miei soldi sperando di non ricevere un’ulteriore mail 5 min prima del mio volo che mi avverta di un altro ritardo!",True,,Couple Leisure,Economy Class,Skiathos to Rome,September 2022,,,,1,3,,False,
"""I wonder how this airline still operates""",1,2022-09-23,"Not Verified |  I wonder how this airline still operates. Possibly the worst company on planet earth. Cancelled flights, no compensation, no customer service to even know flights’ status. I wish I could rate with a 0.",False,,Business,Economy Class,Athens to Abu Dhabi,August 2022,1,2,"<span class=""star fill"">1</span>",1,1,,False,
"""Still hoping to see my money back""",1,2022-09-22,"I couldn't even fly because they cancel the flight less than 2 days before departure. The real annoying thing is they didn't provide the cash reimbursement which i asked for immediately. Apparently this option is available only until the day of supposed flight and they missed to accomplish it. So after few days I started requesting the 120% refund in Wizz personal account (like money you can spend for future bookings). Well it's almost one month from the date of supposed flight now, and my account is not yet funded. After few days they will be officially in delay. I wanted to book another flight but i have no credit for that! Many phone operators told me different things in the same day. They promised that within one month, one week, or one said even 1 day, the account would have shown my credit, and this was weeks ago but so far nothing. Still hoping to see my money back somehow.",True,,Solo Leisure,Economy Class,Abu Dhabi to Santorini,September 2022,,,,3,1,,False,
"""experience is horrible""",1,2022-09-19,"Try to avoid this airline at all costs. They will delay or cancel your flight with a 99% probability. On top of that, you can not communicate with them. They provide a chat bot that has zero answers, and when you ask for a human agent, there is nobody available ever. (I waited two times, the first for 4hours and the second for 5 hours, and still no human agent was available). Your other option is premium Tel number at 1 point something euro per minute!!! These people are trying to overcharge you with premium chat line charges EVEN FOR THEIR DELAYS. My flight was delayed by 24 hours, then by an additional 4, with zero support. Ground stuff are rude and insulting. Yes, the tickets are cheap. But you will end up paying for hotel stays, meals etc, as well as missing out on your holidays. So overall value for money is truly bad. Seats are good as the plane is new. Staff on the plane are tired and inattentive. Overall experience is horrible",True,A320,Solo Leisure,Economy Class,Athens to Abu Dhabi,September 2022,3,1,,1,1,,False,
"""never fly with this airline again""",1,2022-09-18,Not Verified |  I will never fly with this airline again! Their customer service is appalling. Even though we paid for seats with extra leg room we were reallocated seats when we arrived as they said we could not have the pre-booked seats because they were exit seats and one of us was arthritic. Put right to the back of the plane where we had a stewardess who spent most of her time sitting down texting on her phone and doing her expenses. The steward was more interested in eating a Snickers bar than doing anything else. So really cramped and painful flight and to cap it all the airline is making it impossible to communicate with anyone or thing to get a refund for the seats we paid for. This airline doesn’t our business and hopefully won’t be in business themselves for much longer. Buyer beware!,False,,Family Leisure,Economy Class,Gatwick to Malaga,September 2022,1,1,,1,1,,False,
"""experience was a complete nightmare""",1,2022-09-18,"Not Verified |  Landed in a completely different country.  Latvia instead of Lithuania, offered only a replacement bus then all staff disappeared and the bus took 3 hours to arrive to take us another 3 hours to Vilnius. The whole experience was a complete nightmare and the staff were rude through out it, will never travel with them ever again.",False,,Business,Economy Class,Yerevan to Vilnius,September 2022,1,1,,1,1,,False,
"""They are a nightmare company""",1,2022-09-18,"Wizz Air canceled my flight few hours before departure, leaving me without alternative options, without customer support as they can not be reached through any channels. On top of that I had to purchase ticket 3 times more expensive to get to my destination and wait 30 days for a refund. They are a nightmare company. Stay away!",True,,Couple Leisure,Economy Class,Belgrade to Abu Dhabi,September 2022,,,,1,1,,False,
