header,rating,review_date,comment,trip_verified,aircraft,type_of_traveller,seat_type,route,date_flown,seat_comfort,cabin_staff_service,food_and_beverages,ground_service,value_for_money,wifi_and_connecticity,recommend,wifi_and_connectivity
"""never use this airline again""",1,2016-07-23,"✅ Verified Review |  Budapest to Luton. Without doubt the worst airline I have used. First of all I changed my flights and had to pay £50 - I was frustrated yet accepting by this but it was the customer service (complete lack of) that made the experience so difficult. I then got charged £40 at the airport as my hand luggage was slightly bigger than the allowed sizes, despite taking the same luggage on the outgoing journey with no issue. I was ordered to pay, no compassion or understanding. How can you treat your customers so rudely? They charge fees which have no relation to the cost of the service e.g. Printing flight tickets. I also made a complaint about the service I received and to date I'm still waiting for a response! I will never use this airline again.",False,,Couple Leisure,Economy Class,BUD to LTN,July 2016,2,1,"<span class=""star fill"">1</span>",2,3,,False,
"""customer service is the worst""",1,2016-07-23,"✅ Verified Review |  I booked a Wizz Air flight from Birmingham to Wroclaw. They kept all the passengers waiting till the last minute to proceed to the boarding gate. Once they did, they turned everyone around without giving any information, except for the plane not being ready. They kept everyone waiting for 20 minutes and asked to return whatever they bought at the airport and follow them to a Wizz Air customer desk. This is when we found out that the plane never departed from Wroclaw (it was supposed to fly to Birmingham then back) and the flight is being cancelled. Not from the people that were supposed to help us or give out information. My dad gave them a call in Poland as the flight was long cancelled to find out that the plane has a technical issue.  All of the passengers had to go through a single service desk. 200 people. 1 desk! The Wizz Air customer service representative loudly exclaimed that he is not going to deal with anyone and will go home if people do not stop asking questions without waiting in line. It was around midnight already and many people did not not know what was going on, lots of them had no way to get home at this hour. Customer service was horrible, they just gave out ""your rights"" forms with a grumpy look on their faces without answering questions. We had the right to reschedule a flight to some other airport at the closest possible date. Wizz Air is supposed to provide shelter, food and transport in these cases. Do you think they did any of that? They don't care about their customers. When I asked them about it they told me to file a complain online. If it wasn't for kind people passing on information between each other, lots of them would not know what was going on. Luckily I came to the airport with my car, so I was able to book a flight at Luton next morning. What about all these people that did not have an option like that? When I got into the car I called the customer service quoting my rights and asking for help regarding my car park and dealing with the cancellation. The guy I called had no clue what to do in situations like these, he was no help at all. I hang up in anger as they charge ridiculous amounts for the calls.  I left the car park, booked another one at Luton and rushed home because the morning flight was at 9am. Thats when I found out that I had a return flight booked back to Birmingham. I called them to get this flight changed as well and they charged me 30 pounds for changing the booking even though I quoted the whole situation. The flight was supposed to take place 3 weeks ago. I still haven't been contacted by Wizz Air to receive my compensation and refund. I called customer support today and they just kept on asking for reference numbers and had no idea which one was correct. Then he informed me I will be contacted within 30 days but he thinks that there is no need for a refund.  I am very disappointed by their service, flight quality, the space between seats is so small. The customer service is the worst I have had.",False,,Couple Leisure,Economy Class,BHX to WRO,July 2016,1,1,,1,1,,False,
"""a very pleasant flying experience""",8,2016-07-21,"Had a very pleasant flying experience with Wizz Air in both directions. The aircraft was bright and clean and the extra leg room seats were great and available for a reasonable extra charge. Cabin Crew were friendly, polite and professional. Much better than other carriers that I have flown with. Our flights were a little bit late departing but it was no big deal. No problems with baggage, as unlike other passengers who have complained about having to pay extra for their cabin baggage etc, we read the airlines terms and condition relating to baggage. Passengers only have themselves to blame if they turn up at the airport with cabin baggage that is bigger that what Wizz Air allow to be carried for free. You are informed by email before you fly of the allowed baggage dimensions and it is also clearly printed on your Boarding Card. Would definitely fly with this airline again.",False,A320,Couple Leisure,Economy Class,Luton to Sofia,June 2016,4,4,,3,5,,True,
"""not be flying Wizz Air again""",1,2016-07-19,✅ Verified Review |  Vilnius to Luton. Awful. Flew out a few days ago and the flight was over an hour late. My girlfriend took a different flight on the same day and was also delayed. This airline seems to consistently predict flight times that they are aware they cannot meet. My flight back home today is once more an hour late. Further to that they call boarding before the plane has even touched down so your forced to stand and wait. Trying to be efficient and cut costs has resulted in an appaling customer experience and I suggest that you pay the additional money for any other airline. Will not be flying Wizz Air again.,False,,Couple Leisure,Economy Class,VNO to LTN,July 2016,1,2,"<span class=""star fill"">1</span>",1,1,,False,
"""insufficient leg room""",1,2016-07-09,✅ Verified Review |  Do not fly Wizzair. Flew from Luton to Prague. The Airbus A320 I have flown in previously but Wizzair's seating configuration made travel massively uncomfortable - seat base size inadequate and insufficient leg room. Planes were late and we were treated like cattle. Bad experience never to be repeated.,False,A320,Couple Leisure,Economy Class,LTN to PRG,July 2016,1,1,,1,1,,False,
"""one of the sneakiest airlines""",1,2016-07-09,"✅ Verified Review |  Sofia to Brussels with Wizz Air. Without a doubt one of the sneakiest airlines out there. Very unclear baggage allowances and whenever your bag is even a few centimeters too long they immediately smack you with a very high 'fine'. They are either not interested in creating clear guidelines or live off of the fines they hand out every flight. I had to search for half an hour on their website before I found out exactly how to make sure I would not have problems at the boarding, but I saw several passengers being sent back to pay more. Boarding crew was condescending and sneered answers instead of replying normally. Flight crew was lazy and appart from the fake smile at the entrance not friendly either. Definitely never flying with them again, horrible airline.",False,,Solo Leisure,Economy Class,SOF to BRU,June 2016,2,2,"<span class=""star fill"">1</span>",1,2,,False,1
"""very reasonably priced""",9,2016-07-08,I was very satisfied with my Wizz Air flight. The crew were friendly and looked very professional. No issues whatsoever and the flight from Luton to Gdansk was on time. No issues with my hand baggage. As long as you understand their company policies on baggage fees than you will be fine. Very reasonably priced. Certainly will fly again.,False,A320,Solo Leisure,Economy Class,LTN to GDN,July 2016,3,5,,4,5,,True,
"""Wizz Air redefines the low standards""",1,2016-07-08,"✅ Verified Review |  Complaining about airlines is almost redundant nowadays. We are all aware of long lines, bad service and endless excuses to make travel unnecessarily complicated. However, Wizz Air redefines the low standards most airlines abide by in today's travel landscape. I decided to travel with Wizz due to their decent hours, considering other flights would take longer to fly from Abu Dhabi to Norway. I had never flown Wizz, and quite frankly never will again. Their information and ticketing says that they allow one small carry-on piece and a personal item. Upon arriving at the airport it becomes a matter of 'or' rather than 'and'. Suddenly, strict rules and regulations apply and a fee of 190 aed ($52) is tagged on. Their definition of ""small bag"" is the size of a woman's purse according to the person at the counter. Furthermore, trying to argue about the size stated on the ticket and the counter person's definition is pointless as there is no manager available to verify the size. Again, most positions are not manned by people who can make one decision, instead they're only there to follow some ominous rules that I'm willing to bet they don't even know themselves. Airlines like Wizz prey on the blurred lines between miscommunication and misleading so to avoid that, follow their rules as many others have suggested. Better yet, I would suggest not to fly them at all. At face value the ticket price seems great, but quite frankly it's only a small percentage off of the price bigger carriers charge. In addition, Wizz flies out of DWC - an airport between Dubai and Abu Dhabi - for which a cab ride is 200 AED ($54). So, add the base fare, a small hand bag and a cab fare, and Qatar, Etihad and other local international carriers sound like bargain themselves.",False,,Solo Leisure,Economy Class,DXB to BUD,July 2016,2,2,"<span class=""star fill"">1</span>",1,1,,False,1
"""suggest not to fly them at all""",1,2016-07-08,"I decided to travel with Wizz due to their decent hours, considering other flights would take longer to fly from Abu Dhabi to Norway. I had never flown Wizz, and never will again. Their information and ticketing says that they allow one small carry-on piece and a personal item. Upon arriving at the airport it becomes a matter of or rather than and. Suddenly, strict rules and regulations apply and a fee of 190 aed ($52) is tagged on. Their definition of ""small bag"" is the size of a woman's purse according to the person at the counter. Furthermore, trying to argue about the size stated on the ticket and the counter person's definition is pointless as there is no manager available to verify the size. Again, most positions are not manned by people who can make one decision, instead they're only there to follow some ominous rules that I'm willing to bet they don't even know themselves. Airlines like Wizz prey on the blurred lines between miscommunication and misleading so to avoid that, follow their rules as many others have suggested. Better yet, I would suggest not to fly them at all. At face value the ticket price seems great, but quite frankly it's only a small percentage off of the price bigger carriers charge. In addition, Wizz flies out of DWC - an airport between Dubai and Abu Dhabi - for which a cab ride is 200 AED ($54). So, add the base fare, a small hand bag and a cab fare, and Qatar, Etihad and other local international carriers sound like bargain themselves.",False,,Solo Leisure,Economy Class,DWC to BUD,July 2016,2,2,"<span class=""star fill"">1</span>",1,1,,False,1
"""actual cost was close to BA""",1,2016-07-04,"✅ Verified Review | London Luton to Katowice with Wizz Air. Luton Airport bag drop off staff was rude and not organized. It's their daily job and not a difficult one at that, hence I just cant understand why they cant do it properly. Service at the plane wasn't better either, the staff were gossiping a lot about their colleague which was very unprofessional. The actual cost was close to BA as they charge lots for checking bags and paying via credit card. It was my first and last time with Wizz Air, there are plenty of carriers between London and Poland therefore only use them if you have no other choice.",False,,Couple Leisure,Economy Class,LTN to KTW,July 2016,1,1,"<span class=""star fill"">1</span>",1,2,,False,
"""just follow the rules""",10,2016-07-04,"I frequently fly with Wizzair and always was happy with their service. Good value for money, just follow the rules stated on their website. Flight Târgu Mureș to Luton was on time, services according to travel contract. Contrary to previous menu deficiencies, this time they provided tomato soup on board. It was somehow weird that card payment on Wizzair flight did not work with WizzMastercard (Bancpost), but it did with card issued by another bank.",False,A320,Couple Leisure,Economy Class,TGM to LTN,June 2016,5,5,,5,5,,True,
"""great value for intra-european flights""",7,2016-06-28,"✅ Verified Review |  Milan Bergamo to Bucharest. Wizz Air is a low-cost airline, which delivers what it promises. When you only pay 9,99 to 19,99 EUR for the ticket, you cannot really ask for more. Read the rules carefully, stick to them and you should not be charged anything abusively. Delays happen and they are generally handled reasonably. Low cost airlines usually do not re-protect you on other carriers so if you fly on less served routes and the flight is cancelled you may have to wait for a couple of days for the next available flight. Overall, great value for intra-european flights.",False,A320,Business,Economy Class,BGY to OTP,June 2016,2,4,,3,5,,True,
"""don't provide explanations""",3,2016-06-25,"✅ Verified Review |  Bucharest to Barcelona. Wizzair has very often delays and don't provide explanations. In Romania they put you to pay the check-in in case you don't make it online. Check-in free service should be available for all kind of flights. The flight attendants during my flight were rude, making jokes and gossiping about one of their colleagues. I will fly with this company only when there's no other alternative. The flights to Barcelona are not so cheap, so it maks no sense choosing them.",False,,Solo Leisure,Economy Class,OTP to BCN,June 2016,2,2,,2,2,,False,
"""some sort of delay""",2,2016-06-21,"✅ Verified Review |  Almost every time I fly with WizzAir there is some sort of delay that the company always seems to have an explanation for, whether it's winter or summer, regardless of the airports. Just yesterday, 20/6/2016, I had a horrible experience when my flight was delayed by 2h from Debrecen to London Luton. In just 5 days, both flights on my return ticket had at least 1h 45min delays. Prior to this, when I flew in January, the flight was cancelled and they never gave us any information, just kept us in the poorly-managed airport in Debrecen. Then we were finally taken out of the waiting area and back to the check in area, and given the option to be taken to Budapest Airport which is a 3-4hr drive.",False,,Solo Leisure,Economy Class,DEB to LTN,June 2016,1,2,"<span class=""star fill"">1</span>",1,2,,False,1
"""£30 for a large cabin bag""",1,2016-06-17,"I bought what I thought was a cabin sized bag, upon arrival at Luton I was greeted by a Wizzair attendant who demanded that I pay £30 for a ""large"" cabin bag to be placed onboard the flight.  As it transpired, there is a small cabin bag and a large cabin bag (who knew) and although my cabin bag squeezed itself into the small cabin bag allocation, the height was 4 inches to tall. Following minutes of discussion and debate with the attendant, when boarding the plane, it happened there was no more cabin space available!  All the supposed ""small"" cabin bags are meant to be stored under seats, leaving the more expensive and paid for larger cabin bags to be stored above, no, the staff initially demanded I pay extra to hold it in the store below.  A quick movement of ""small"" bags from the overhead locker under a seat and hey presto, space! What made this whole process worse is that not all passengers were charged for their large cabin bags upon entry, and only those more honest than deviant!  Never again will I fly this airline or from this airport. Train journey from London £27, baggage £65, total £92 on top of the original cost.",False,,Solo Leisure,Economy Class,LTN to BUD,June 2016,1,1,,1,1,,False,
"""never fly with Wizz air again""",1,2016-06-09,"✅ Verified Review |  Luton to Budapest with Wizz Air. Absolute disgrace of an airline. Upon arrivals we were unsure as to whether we needed to check in as we had checked in online, printed our boarding cards and only had cabin luggage. However, as we didn't want to get it wrong we waited in a long queue anyway, only to be told that our bags where to big and had to pay an extra £63 for them (despite them being cabin sized bags). The guy at the counter went on to say that as we had checked in online, we didn't need to queue and if we had gone straight to departures then we also would to have had to pay the £63. He then added that online it would have cost £8. Absolute joke, will never fly with Wizz air again.",False,,Couple Leisure,Economy Class,LTN to BUD,June 2016,1,1,"<span class=""star fill"">1</span>",1,1,,False,
"""I am fuming after my trip""",3,2016-06-01,"I am fuming after my trip with Wizz Air. Biggest con and scam of an airline. Not only did they make us pay an extra £30 after booking to sit near (not next to) my partner, (which is okay as sometimes expect this with budget airlines) I experienced the worst customer service on the way home and hope this review helps others avoid the same charges I faced for hand luggage allowance.  On my flight out to Budapest I took my hand luggage on board with no problems.  It was even smaller than my partners shoulder bag in weight and size. On the way back to London, the staff seemed to be stopping every other person to have their bag ""checked"" for measurements. It was here that the staff member took a tape measure and measured my bag to tell me it was 7cm - yes 7cm over their guidelines in height. Despite it fitting in their bag tester stand that most airlines have. They informed me this very specific measurement was in their booking t&c's and that I had to now pay £35 in fees to cover the extra 7cm. Despite the fact that my bag wasnt full and was half the weight of their 15kg allowance, and I flew out with them and no one said anything. I had to pay, and was very polite about it, and then reluctantly got back in the queue to get on the plane - watching about 50 other passengers also having to pay the £35 fee for the same reason. This seemed like the biggest scam and also completely unreasonable, and did not make sense to me. Whether or not it is in their small print or their individual airline rules is besides the point, I have never experienced anything so ridiculous. Very few hand luggage bags would meet this specification. Warning to all - take the smallest hand luggage possible or just save the hassle and book a normal airline!",False,,Couple Leisure,Economy Class,BUD to LTN,May 2016,2,2,,1,1,,False,
"""worst airline I have experienced""",1,2016-05-30,"Wizz Air is the worst airline I have experienced, both flights from London to Warsaw including the return were delayed by over 1 hour. They didn't let us know until we were on the plane, and on the way back they only let us know after we had sat in an unventilated bus on the runway for 15 minutes. We were then instructed to leave the bus and head back to our gate. The cleaning standards and baggage allowance is lower than any other budget airline. I would never recommend flying with them.",False,,Couple Leisure,Economy Class,LHR to WAW,May 2016,1,1,"<span class=""star fill"">1</span>",1,1,,False,1
"""waiting 20 mins in the cold""",1,2016-05-30,✅ Verified Review |  We are in the long queue outside gate 3 at Luton Airport right now for our Wizz Air flight from London to Gdansk. Have already been waiting 20 mins in the cold in a queue in front of the aircraft including speedy boarding passengers and families with children. No reason given. Their staff are under the aircraft doing nothing with passengers just having to wait outside.,False,,Couple Leisure,Economy Class,LTN to GDN,May 2016,1,1,,1,1,,False,
"""some kind of scamming""",1,2016-05-25,"Lisbon to Budapest return. I had no baggage problems since I carefully read all the rules. I bought a 23kg bag and had a smaller bag which was for free. My problem was when I got to the check in point and was told by the rudest passanger service agent that the name I had on my boarding pass was incorrect and I had to go to the office and change it. The problem is that changing your name will apparently cost you 100€. And my name was in fact right because it was my first and last name and never have I ever been bothered with such a thing. But according to the lady I should also have had my middle name. After further research online and on Wizz Air website I have yet to find any warnings that you are obliged to enter your full name. So I can only say that this is some kind of scamming to get people to pay for yet another fee. I did however manage to pass without changing my name which leads me to believe even more so that it is a scmm. Because if they in the end let me go through without any changes or extras paid it must mean that the alteration is not necessary, Even more so since I did the opposite flight (Lisbon to Budapest) and had no problems whatsoever. The aircraft is not too bad and the flight attendants were ok. I just wished I wasn't in such a hurry and had had time to get the names of the two ladies check in points because I've never seen such terrible customer service and lack of care. And the photo shows my bag on the floor because it fell while it was been taken on the cart. Great work Wizz Air and Budapest Airport.",False,,Solo Leisure,Economy Class,BUD to LIS,May 2016,3,3,"<span class=""star fill"">1</span>",1,1,,False,
"""no longer a cheap airline""",3,2016-05-14,"✅ Verified Review | Stockholm Skavsta to Gdansk with Wizz Air. My general comment is beware. Wizz Air is no longer a ""cheap"" airline. With all the extras you have to pay the price amounts to what ordinary air ticket with all other established air companies cost. What is irritating are all the extras that are semi hidden. The information is written in small letters and you as customer realise late that what you pay in the end is a regular fare. In future I will try to avoid as much as I can this air company.",False,,Solo Leisure,Economy Class,NYO to GDN,May 2016,1,2,,2,2,,False,
"""not getting what you paid for""",1,2016-05-12,"✅ Verified Review |  Budapest to Warsaw with Wizz Air. This airline is not about getting what you paid for. I thought I had booked in online after receivibg a vague email, only to find out at the airport I had merely confirmed the email. On this email's link it announced that receiving a boarding card at the airport was free - that proved to be false as it costs 40.00 euro for this - I am not sure why, as i could have tried again online at the airport but was told this was not possble. Was not sure why with nearly 3 hrs before boarding, but was told time had elapsed. I cannot be bothered to fly with them again. Enough is enough. They have bent the rules so far it is basically cheating people.",False,A320,Business,Economy Class,BUD to WAW,May 2016,4,1,,1,1,,False,
"""invented new baggage standard""",2,2016-05-09,"✅ Verified Review |  Basel to Warsaw. It is ineresting to realize that Wizz has invented a new cabin baggage standard which they allow for free: ""Kleines Handgepäckstück: Falls Ihr Handgepäckstück die Maße 42x32x25 cm nicht überschreitet, darf es kostenlos mit an Bord genommen werden."" I had never heard of this definition with any other airline before. What was usually accepted by other airlines as a overhead bin compatible cabine bagage size is not free at Wizz Air. See their original text: ""Großes Handgepäckstück: Falls Ihr Handgepäckstück größer als ein kleines Handgepäckstück ist, aber die Maße 56 x 45 x 25 cm nicht überschreitet, können Sie es gegen eine Gebühr mit an Bord nehmen. Es muss in das Gepäckfach passen."" So given that the world had been travelling for years with this size of bagage, every passenger that buys a ticket with Wizz and was used to take his cabin carry-on, needs to pay for it.",False,A320,Couple Leisure,Economy Class,BSL to WAW,May 2016,1,3,,1,2,,False,
"""40 euros just for the check in""",1,2016-05-08,"✅ Verified Review |  Budapest to Luton with Wizz Air. The online check-in system closes 3hours before the flight.  The email says: Please don't forget to check-in online or via the mobile application at least 3 hours prior to the scheduled departure time of your flight (at airports where online check-in is not available airport check-in is free of charge). So went to the airport confident, when I got there they said this is not a free check-in airport as it has online check-in (by the way good luck to catch the wifi there). They made me pay 40 euros extra charge just for the check in. People were in queue to pay each 40 EUR. Everybody there was very upset and their customer service personnel smiling at asking to pay the fees. I also saw a lady with a small cabin bag that couldn't fit in their luggage checking cage (with Ryanair that would have passed easy). She had to pay another 50 eur.  Pay a little more and have a decent company respecting you and working for your comfort.",False,,Solo Leisure,Economy Class,BUD to LTN,May 2016,2,2,,1,2,,False,
