header,rating,review_date,comment,trip_verified,aircraft,type_of_traveller,seat_type,route,date_flown,seat_comfort,cabin_staff_service,food_and_beverages,ground_service,value_for_money,wifi_and_connecticity,recommend,wifi_and_connectivity
"""I tried to change my ticket""",1,2020-03-14,"Luton to St. Petersburg. Booked a flight for the first time with this airline then due to the Coronavirus I was not willing to travel. I tried to change my ticket but they wanted a ridiculous fee which is more than a new ticket. I was not asking for a refund I just wanted to either get credit or change my flight for the next month or two until all this blows over but after waiting on the phone for over 25 mins they said no. Poor service, shame on you all at Wizzair.",True,,Business,Economy Class,Luton to St. Petersburg,March 2020,,,,,1,,False,
"""misleading information""",1,2020-03-12,"I am very surprised by the misleading information Wizz air provide to their passengers regarding carry on bags.  Was traveling from Eindhoven to Katowice  on flight number W6 1072 and i purchased basic 4 tickets 2 ways including carry on bag of 10kg and i also booked 20 KG extra bag. At the boarding gate i had to pay 25 EUR for the carry on bag which is included in the price, and when i was trying to explain that to the counter girl she was very rude and unprofessional and finally she turned her back and left me talking to the air. Its the last time to fly with Wizz Air.",True,,Family Leisure,Economy Class,Eindhoven to Katowice,March 2020,1,1,"<span class=""star fill"">1</span>",1,2,,False,1
"""the worst experience""",1,2020-03-11,"Brussels to Sofia. Wizz Air is the worst experience every time! Their competitive prices attract you, but once at the airport you sometimes pay double the price of your plane ticket. I use wizzair every year to go to Sofia to see my family and every time I get fucked up. If it is too big a bag, a problem of online check-in I find myself paying up to 70€ more. Sometimes to pass online check-in you have to select seats on the plane, but you have to pay 35 € / person. This time, because the plane was advanced one day, there were problems with online check-in. My husband and I decided to go to the airport earlier to avoid paying the fees. But there again we had to pay € 70 to print our tickets! A shame ""We understand but there is nothing we can do the service is blocked"". In addition to uncomfortable planes, barbaric schedules, absent customer service, there are delays and cancellations every time. And in the end we pay as much as a normal first class plane. Wizzair is the worst experience every time. They make every trip painful.  Wizz Air est à chaque fois la pire expérience! Leurs prix compétitifs vous attirent mais une fois à l’aéroport vous payez parfois le double du prix de votre billet d’avion. J’utilise chaque année wizzair pour aller à Sofia voir ma famille et à chaque fois je me fais avoir. Si c’est un sac trop grand, un problème de check-in online je me retrouve à payer jusqu’à 70€ en plus. Parfois pour réussir le check-in online il faut sélectionner des places dans l’avion, mais il faut payer 35€/personne. Cette fois, parce que l’avion a été avancé d’un jour, il y a avait des soucis de check-in online. Mon mari et moi avons décidé d’aller plus tôt à l’aéroport afin de ne pas payer les frais. Mais là à nouveau on a dû payer 70€ pour imprimer nos tickets! Une honte « Nous comprenons mais on ne peut rien faire le service est bloqué ». En plus des avions qui sont inconfortables, des horaires barbares, un service client absent, on a, à chaque fois des retards ou des annulations. Et au final on paye aussi cher qu’un avion normal en première classe. Wizzair est la pire expérience à chaque fois. Ils rendent chaque voyage pénible.",True,,Couple Leisure,Economy Class,Brussels to Sofia,March 2020,1,1,"<span class=""star fill"">1</span>",1,1,,False,1
"""I was denied boarding""",1,2020-03-10,"Berlin to Budapest. Unfortunately, I see myself forced to write a negative review for my first and only experience with Wizz Air. If you are a traveller or enjoy visiting new cities please take 2 mins to read this: I had a flight from Berlin to Budapest on 6.12.2019, it was overbooked so I was denied boarding. I contacted the airlines in the next day and until today I didn’t receive the compensation as per the EU regulations. I was accused of not showing up at the counter to take the denied boarding form. This is not true because I showed up in the counter and was given back the check-in money in cash. In addition, I was granted a one night stay at the airport’s hotel and the officers clarified to me to claim the compensation online. So how can I not show up in the counter and take these? I understand that an overbooked flight can just happen but what is not accepted is to spend 40+ days sending several emails to get the compensation. At the moment I am not sure if this review will move something yet I think that when someone reads this will definitely think twice before booking with Wizzair.",True,,Solo Leisure,Economy Class,Berlin to Budapest,December 2019,,,,1,1,,False,
"""Ticket was extremely cheap""",7,2020-03-08,"Bratislava to Skopje. Departure on time, arrival about 10-20 minutest before scheduled time. Flight was operated by 10y old Airbus A320 (HA-LPX). Interior was clean enough, seats were comfortable, but legroom was horrible. Flight was without any problems, during approach and landing at Skopje airport were severe turbulence, but pilots still made perfectly smooth landing. Boarding was quite slow and gate staff were quite rude, but service during flight was perfect (for low cost company, of course). Ticket was extremely cheap, 250CZK (about 10€) from Bratislava to Skopje.",True,A320-200,Solo Leisure,Economy Class,Bratislava to Skopje,February 2020,2,5,"<span class=""star fill"">1</span>",2,4,,True,
"""Unfriendly ground crew""",2,2020-03-08,Not Verified |  Vienna to Athens. Lot of delays without providing anything for assisting the passengers. Unfriendly ground crew both in Vienna and Athens. Not helping with informing the customers.,False,,Solo Leisure,Economy Class,Vienna to Athens,March 2020,2,3,"<span class=""star fill"">1</span>",1,2,,False,
"""will never choose them again""",1,2020-03-07,"Bucharest to Catania. WizzAir is claiming to be a low cost but extra and hidden costs make it the same price with reputable airlines (and other companies do care about their customers) They don't care about the customers and in the middle of the coronavirus outbreak in Italy they just don't want to refund or cancel the tickets. They tell me ""better to buy Flex next time"" Don't worry Wizz Air, I will buy from another company next time. Bad service, bad attitude and will never choose them again.",True,,Family Leisure,Economy Class,Bucharest to Catania,March 2020,1,1,,1,1,,False,
"""The agent was extremely rude""",1,2020-03-04,"Vienna to Cologne. Our flight date was changed. Not the flight time, mind you, no. The date. On the notification email it said we would be able to either accept this change or rebook. We weren't able to rebook via the website, so contacted customer support. The agent was extremely rude and insisted that he couldn't help us because ""we had booked the flights through a travel agency"", which was simply a lie since we booked it through the Wizz Air website and I also got the confirmation emails from Wizz Air directly. He also couldn't tell me which agency it was supposed to have been. Now we have to either book a new flight without getting our money back for the original one, or book an additional night in the hotel room as well as an additional day for the rental car we need.",True,,Business,Economy Class,Vienna to Cologne,March 2020,,,,,1,,False,
"""pay or lose your flight""",1,2020-02-24,"The size of the hand luggage is ludicrously small for one piece. During the booking I bought an extra 10kg cabin bag for €52. For some reason the cabin bag that i bought seemed as a ""checked in luggage"" on my boarding pass which i noticed during the boarding process when an employee of Wizzair charged me €35 extra because i did not ""checked in the bag"" or ""purchased extra the priority pass"". Please note that there was nowhere such an option during my booking. The employee was rude and gave me the ""option"" pay or lose your flight.  More than 12 people had the same issue in the same flight and were charged extra. Unfair treatment since other people that had same luggage as mine did not have the same problem.",True,,Family Leisure,Economy Class,Luton to Larnaca,February 2020,1,1,,1,1,,False,
"""never recommend this airline""",3,2020-02-24,"Budapest to Gatwick. Their customer service was quite poor. Though I live in Hungary I come from a Caribbean territory which is part of the commonwealth countries. Note that I was traveling with an infant. After passing immigration at Budapest airport without any issues. The persons at the boarding area for Wizz Air took it upon themselves to question us on whether we needed a visa. When we explained that we didn't and attempted to show both old tickets as well as information on commonwealth territories, they ignored us and rudely spoke over us. Then when they finally acknowledged us they spoke in a very unpleasant tone to tell us to basically be quiet while they get information (information that we already had). They had us just standing there not explaining anything to us with an infant while our flight was boarding. I would never recommend this airline due to their lack of knowledge, poor customer service and product/service quality.",True,,Family Leisure,Economy Class,Budapest to Gatwick,October 2019,3,1,,1,1,,False,
"""reducing their service quality""",2,2020-02-24,"Wizz Air never seems to stop surprising with its tendency of maximising their profit and reducing their service quality at the same time. This time we flew from Luton to Sofia  and back. And despite doing everything in the same way as before each time I failed to have all my family sitting together when opting for the automatically allocated seats. And I’m not talking about being split by isle or next row but 5-6 rows apart. So now the only way to have all of us sit together is by paying a premium of 17 Euros per person each way which adds nearly 140€ to our already high fares (half term craze)! I could be listing all minor issues with Wizzair for hours but another major one is the ridiculously low luggage allowance they call “free on-board baggage” which really only allows you to have a small backpack or ladies purse. The only way around it is guess what (?) paying around £50 extra to have a 20kg checked-in bag or purchase priority service which then gives you the same allowance you’d get with every other airline in the world. Finally just to show how bad their service is, when we were being transferred back to Sofia airport and been asked which terminal we’d be flying from, there was no way of getting this information from neither the Wizzair emails, their ticket or even their website. Instead we had to google it and verify from a 3rd party website which is just a joke! Anyway, enough to say that if we had any choice we’d never fly with Wizz.",True,,Family Leisure,Economy Class,Sofia to Luton,February 2020,1,4,"<span class=""star fill"">1</span>",2,2,,False,1
"""pay extra for check in""",1,2020-02-24,Not Verified |  Just the old school bad company to fly with - not focused at all about guests experience. Could not check in online then forced to pay extra charges for the 2 minutes check in process.,False,,Family Leisure,Economy Class,Oslo to London,February 2020,1,1,"<span class=""star fill"">1</span>",1,1,,False,1
"""dissapointed with attitude""",2,2020-02-24,"Luton to Kosice. There was a storm so they delayed a flight from 16:50 to 18:50. I was already in the airport and waiting for delayed flight. Their email arrived at 18:18, saying it that it will be rescheduled to take off 18:00! I checked the flight on the board and it showed as GATE CLOSED. I run to the gate 6 and they said run to gate 28. When I arrived there was only staff packing things up and the plane doors was already shut. Feeling very disappointed about the airline, since I didn't receive call, message and from staff do their best to inform passenger. I believed that plane wont take off an hour earlier than given on the schedule. I missed the flight and got no refund for it. Very dissapointed with attitude as it looks all about money not customer experience. Feeling ripped off.",True,,Solo Leisure,Economy Class,Luton to Kosice,February 2020,3,1,,2,3,,False,
"""Appalling size of carry on allowed""",2,2020-02-20,Budapest to Luton. Appalling size of carry on allowed. Staff at boarding walk around singling people out to be told to fit bags in the tiny space in front of everyone else. People forced to kneel down in front of monosyllabic empty staff members with no compassion. Utterly degrading. My bag fitted within the checked size but needed readjusting. Unfriendly experience from start to finish. I will never travel with wizz again.,True,,Solo Leisure,Economy Class,Budapest to Luton,February 2020,2,3,"<span class=""star fill"">1</span>",1,2,,False,1
"""Worst flying experience""",1,2020-02-19,"Not Verified |  Lisbon to Vienna. All bad. Started by charging extra 27EUR for my small trolley. No Portuguese receipt. Bad seats, little space, bad service. Avoid avoid avoid. Worst flying experience ever.",False,,Family Leisure,Economy Class,Lisbon to Vienna,February 2020,1,1,,1,1,,False,
"""can't fault them at all""",9,2020-02-18,"Not Verified |  Warsaw to Edinburgh. I was worried after reading bad reviews. I would like to say they were fantastic, probably the best I have flown with. The staff were friendly, plane was comfortable, took off on time, can't fault them at all.",False,,Family Leisure,Economy Class,Warsaw to Edinburgh,February 2020,4,5,,5,5,,True,
"""could not check in""",1,2020-02-18,"Frankfurt-Hahn to Sibiu. Worst airline, website did not work so could not check in. Arrived very early to airport as it said if we arrive 2 hours before flight we will be assisted free of charge. We got there not only to have to pay 70€ (35 per ticket) for them to print a paper worth no more than 10 cents, but were also told that the flight we booked months ago was over booked and we do not have seats due to us not checking in online. Offered no assistance. They are horrible and will never use them again and i advise you to stay away as well. Attached photo of the message we received.",True,,Couple Leisure,Economy Class,Frankfurt-Hahn to Sibiu,February 2020,1,2,,3,2,,False,
"""worst flight I‘ve ever had""",1,2020-02-10,"Cluj-Napoca to Berlin. This is the worst flight I‘ve ever had. The flight attendant just offered some short persons XL chairs, although behind them were very tall persons. The seats are the smallest seats I‘ve ever sat in. I wouldn’t recommend anyone over 185 cm to fly with them. Bad food, bad flight attendants, very small seats and it‘s very cold!",True,,Solo Leisure,Economy Class,Cluj-Napoca to Berlin,February 2020,1,1,,1,1,,False,
"""I had to stand for half an hour""",1,2020-02-09,"Not Verified |  Belgrade to Malta. I wouldn’t recommend Wizz Air to anyone. On the flight to our destination I had to stand for half an hour (which is a third of our flight as it lasted an hour and a half) because the rude cabin crew didn’t want to let me pass from the on board toilet back to my seat. Then, they didn’t inform us that we need to check in for our returning flight (which is possible 3 hours before the flight) so when we arrived at the airport 2 hours before the flight, our tickets were canceled so we had to pay an extra 70 euros for the two of us in order to get back home, which really ruined our overall experience.",False,,Couple Leisure,Economy Class,Belgrade to Malta,February 2020,1,1,"<span class=""star fill"">1</span>",1,1,,False,1
"""they just don’t care about their customers""",1,2020-02-07,"London Luton to Tirana. I would give 0/10 but that is not an option. The size of the hand luggage is ludicrously small for one piece. When booking I bought the extra size. I was then annoyed to see at the check in those who had larger than the allowed size were being let through without having to pay more, some had two or three bags. The staff were mentioning it was too big to some but letting them through anyway, some they were charging. If the policy is to allow bigger bags fair enough but what is really unfair is my bag was only slightly bigger than the allowed size, so why did others not have to pay for bigger and I did? (I took pictures to prove it). I complained about this via the form on the website and the response had nothing to do with the complaint. I replied saying this and they said it was too late now. Their number is really hard to find but I called and was told I would be transferred, I was put on hold for 20 minutes and then they cut me off. I called back, no apology, I was told someone would call me back that day, a week later nothing. I left messages on twitter, they ignored them – although they “liked” a reply to one of my messages which suggested I called them again, so they were aware but not bothered to try and resolve it. I kept on leaving messages on twitter, eventually they told me to call the number I originally, although that was a battle to get it from them. I called and was told no one on that number could help and as for the lack of service he wouldn’t apologise “as it was nothing to do with him”. He didn’t listen to what I was saying but eventually said he would escalate it and I would get an email – which is rubbish by this point. Over a week later nothing. I am now far more angry about the way they deal with their customers, they seem to want to aggravate them, rather than resolve issues. They put down so many hurdles in the hope we will give up – they just want to take the money and not have to worry about us. It’s a real shame as they could have resolved this in one email, but instead they have proven they just don’t care about their customers.",True,,Solo Leisure,Economy Class,London Luton to Tirana,January 2020,2,2,"<span class=""star fill"">1</span>",1,2,,False,1
"""going down hill very rapidly""",1,2020-02-06,Not Verified |  Luton to Kraków . Been flying with Wizz for about four years now. At least three times a year if not more. At first thought it was a good airline and no complaints but now seems to be going down hill very rapidly. Airline staff good but check in staff rude and customer services absolutely appalling. Had so many issues this year so far and it’s only February. I know all airlines reschedule flights but we’ve had six flights changed already and it was an absolute nightmare trying to rebook them. The app wouldn’t let us book and customer services were rude and unhelpful. Took us many attempts speaking to different customers services operators to get it done. We also had to change our parking at the airport which we’d booked with Wizz and ended up being out of pocket by £80 but as Wizz said to us that is not their problem. They just don’t care. After all that stress and having to change leave at work I have now just had another email from them telling me they’ve rescheduled the flights all over again and on top of that I’ve just spoken to customer services and they’re saying I haven’t paid for one of my flights which is untrue. You couldn’t write this stuff! Just a word of warning to all. The number they give on their app for customer services is £1.45 per minute.,False,,Couple Leisure,Economy Class,Luton to Kraków ,December 2019,3,3,,1,3,,False,
"""haven’t give me any refund""",1,2020-02-05,"Worst company. They had to cancel the flight from 19.12.2019 from Doncaster to Cluj, and they haven’t give me any refund. I have submitted several complains and they haven’t replied neither. Try to avoid!",True,,Family Leisure,Economy Class,Doncaster to Cluj,December 2019,,,,1,1,,False,
"""charged 37 Euros for check in""",1,2020-02-05,"Gatwick to Budapest. I would give you zero stars if i could. System would not let me check in online, because Wizz changed our flight time by 20 min. I kept getting error messages. Got to the airport and was charged 37 Euros for check in and another 57 Euros for checking a bag. Everyone i have interaction with from check in to plane was extremely rude and uncaring.",True,,Solo Leisure,Economy Class,Gatwick to Budapest,December 2019,1,1,"<span class=""star fill"">2</span>",1,1,,False,
"""everything went extremely smoothly""",10,2020-02-04,"Budapest to Oslo. Excellent flight! Honestly, I felt compelled to write a review as after reading reviews here prior to booking my flight I was very nervous to fly Wizz. As a result I bought a top tier ticket in hope things would go more smoothly. This was not required at all! Was a fantastic flight, everything went extremely smoothly. Easy check-in, lots of email reminders and was clearly told of airport fee if don't check in online. Perfectly on time departure and arrival, very orderly boarding and leaving, very helpful and friendly staff. Bag arrived promptly. Comfortable and very clean plane. Friendly pilot. Have taken quite a few budget flights, and this may have been the best. Will very happily fly Wizz again and look forward too!",True,,Solo Leisure,Premium Economy,Budapest to Oslo,February 2020,5,1,,5,5,,True,
"""the worst I have had""",2,2020-02-02,"Cluj-Napoca to Barcelona, we were asked to pay an extra 35€ per person, because they said we should have checked in online, but that wasn't mentioned anywhere on the ticket. Plus the person there at the desk was very rude. On the return flight, suddenly nobody was allowed to carry the documents small bag, or the women's purse, besides the cabin luggage, because they were considered 2 bags. The boarding was very late, and one of the flight attendants was very rude. I have flown with many companies, but this round trip to Barcelona with Wizz Air was the worst I have had.",True,,Couple Leisure,Economy Class,Barcelona to Cluj-Napoca,January 2020,3,1,,1,2,,False,
"""the flight is overbooked""",1,2020-01-26,"Vienna to Malaga. They separated the whole Family.  We have booked 4 tickets 2 Adults 2 Kids (7 ,8). Online checkin did not work for us, so we arrived at the airport and had to pay 125 Euros to checkin. We had to run to another terminal to pay this fee, and come back to show the receipt, otherwise no boarding passes??  According to ticket we were allowed to take 4 small bags. We have bought 4 small bags specifically for this trip with a maximum of 6 kg as described (same size as a backpack, but very small trollies). Nevertheless the weight and size didn't matter to checkin staff and they made us pay another 65 euros, since they were not a backpack and looked like trollies. For what reason does Wizzair have weight and size restrictions if they don't stick to . Arriving at the Gate, without any seats assigned we went to the lady at the gate, who told us that the flight is overbooked and we will have to wait until the end with our 2 little kids to see if they can take us. The screen at the gate showed families with children have priority boarding (didn't look like). At the end only my wife was able to board the plane, and I was left behind with my two kids. The third party handling agent at the gate told us to leave the terminal and go outside to the 3rd party ticket counter to get alternative plans. This did dot happen since the had to booked another ticket online at the gate to catch a flight VIE-BCN-AGP, which airline was able to accept us at the gate with bags and without additional costs for checkin and luggage. I would recommend not flying Wizzair, this behaviour should not be tolerated.",True,A320,Family Leisure,Economy Class,Vienna to Malaga,January 2020,1,1,"<span class=""star fill"">1</span>",1,1,,False,1
"""Absolutely recommended""",9,2020-01-24,"Budapest to Berlin. Its nice to have finally the new Terminal in Budapest for Low Cost Airlines. Walked to Aircraft, from the terminal only few steps. Aircraft Landed late from Frankfurt, but Wizz App informed me about 30 Min delay. We landed only 19 minutes delay in Berlin. Bought an aircraft model on board for 10 eur. Absolutely recommended, comfortable seats, nice crew and cheap tickets!",True,A321Neo,Solo Leisure,Economy Class,Budapest to Berlin,January 2020,5,5,,5,5,,True,
"""Plane was new, nice seats""",10,2020-01-23,"Frankfurt to Budapest with Wizz Air. Boarding was on time and comfortable from the terminal building straight in to aircraft. Low cost uses buses at Frankfurt Airport. Plane was new, nice seats and crew has beautiful uniform. Good variety of food on board, I had a nice bottle of wine and a tapas box. Very tasty, Wine was chilled.",True,Airbus A321Neo,Solo Leisure,Economy Class,Frankfurt to Budapest,January 2020,5,5,,5,5,,True,
"""don't recommend this airline""",1,2020-01-21,"Frankfurt to Budapest. This airline has terrible service. I paid for my seat reservation but when I went there, I found that it has been to given to someone else. They gave me alternative seats and all of them are at different places. calls to Customer service have heavy charge.  Luggage transfer is terrible, broke handle. Be prepared to travel inside airport approximately 30 mins in bus to board flight. I wrote an email to customer service. They respond to you once in 3 months and also , they acknowledge the issue after 3 months but it will not get resolved. I don't recommend this airline at all. My refund is still pending after they accepted that it is an issue and they will rectify it.",True,,Family Leisure,Economy Class,Frankfurt to Budapest,July 2019,3,3,,2,2,,False,
