header,rating,review_date,comment,trip_verified,aircraft,type_of_traveller,seat_type,route,date_flown,seat_comfort,cabin_staff_service,food_and_beverages,ground_service,value_for_money,wifi_and_connecticity,recommend,wifi_and_connectivity
"""absolutely useless""",1,2018-10-15,"Luton to Larnaca. Do not use this airline. You will end up paying for everything, they charge you for not checking in. We paid for the check in luggage but when we got to the airport we were told that we haven't and they tried charging us. I showed them my bank statement showing the payment being taken then they spoke to their accounts team who confirmed the payment. Customer service at the airport is absolutely disgusting very rude does not have any communication skill what so ever. It seems like they don't enjoy their work and is there for the sake of the money. This was first time I used Wizz Air and will be last time. I will never ever recommend my friends and family to use this airline. Please stay away from this company they are absolutely useless and you will end up paying extra for everything.",True,,Couple Leisure,Economy Class,Luton to Larnaca,October 2018,1,1,"<span class=""star fill"">1</span>",1,1,,False,1
"""Extremely poor site and service""",1,2018-10-14,"Extremely poor site and service. Experienced a system issue with the Wizz Air site that disallowed me to proceed with an online check without an assigned seat. Tried on various computers/mobile devices and ilnet connection to no avail. It was definitely an issue with the Wizz Air site. Turned up to the airport early to explain this to the Wizz Air customer service desk and still had to form out a 32.50 Gbp fee for a printed ticket. The fee is steep but understandable for those that forget to print their ticket. I feel I should have had the fee waived given my circumstances. Raised an online ticket for refund asking them to check my log data for my login attempts to verify system issue experienced. After no update from Wizz Air I contacted the listed UK number for existing bookings found on their website only to be told I contacted the wrong number. I offered to direct him to he website advising of error and he simply replied ""look man, I know that's on the site but this only for people who need assistance"". Extremely poor site and service. Take my advice and fly with a different airline. The amount of issues you'll face is not worth the 10 quid you'll save with this mob.",True,,Solo Leisure,Economy Class,Luton to Bucharest,October 2018,1,2,,1,1,,False,
"""long, long waits in the bus""",7,2018-10-14,"Budapest to Kiev. Boarding involved long, long waits in the bus to the aircraft, and in accordance to Wizz's new policy hand luggage couldn't be taken into the cabin, but other than these, it was a smooth, pleasant flight with lovely crew.",True,,Family Leisure,Economy Class,Budapest to Kiev,September 2018,4,5,,3,4,,True,
"""a bunch of cheeky scammers""",1,2018-10-10,Warsaw to Keflavik. A scandal - this is all I can say. WizzAir appeared to be a bunch of cheeky scammers. They produce a really bad app and they will tell you that you need to check in 3hrs before the flight. Then the app will not work (because it's horrible) and they will charge you approx. 100EUR for 2 people for a check in at the airport. It's not about the money - I felt robbed and you never forget these things.,True,,Couple Leisure,Economy Class,Warsaw to Keflavik,September 2018,1,1,"<span class=""star fill"">1</span>",1,1,,False,1
"""What a terrible experience""",1,2018-10-09,"Bratislava to Luton. What a terrible experience! Would never use this airline again. Staff unprofessional could not hear announcements including safety ones when this was mentioned to cabin crew she just smiled and walked away! Plane was dirty still had rubbish on floor from previous flight. I Could not wait to land back home and get off, would not recommend this airline to anyone.",True,,Couple Leisure,Economy Class,Bratislava to Luton,October 2018,1,1,"<span class=""star fill"">1</span>",1,1,,False,1
"""no one responded 44 days later""",4,2018-10-05,"Suceava to Luton. I submitted claim as per Wizzair guidelines and filled online form on 21/08/2018. Automatic response was send same minute but no one responded 44 days later to my claim which is regarding service I paid for and did not receive (company policy states it takes up to 30 days to respond). Called call center on 0330 977 0444 number today asking about update regarding my claim. Answer was ""They are very busy"". I asked can I speak or call to ""Them"" answer was no. When I asked can I speak to manager, answer was that managers are not answering phone calls. The customer service contact details are well hidden, I called the contact number provided above but did not get any answers nor advise what should I do next.",True,,Couple Leisure,Economy Class,Suceava to Luton,August 2018,2,2,"<span class=""star fill"">1</span>",1,3,,False,1
"""baggage policy is a joke""",1,2018-10-03,Birmingham to Bucharest . The baggage policy is a joke because they do not check and people bring very large bags on board. The spaces between chairs are way too small to be legal. I do not know how they can operate in legal conditions. I've seen animals travelling in better conditions. None of the pilots speak good English. I never understand what it is the pilots say. The priority boarding is a joke. I will never fly with them again. I have learned my lesson.,True,,Solo Leisure,Economy Class,Birmingham to Bucharest ,October 2018,1,2,,1,1,,False,
"""No benefits whatsoever""",1,2018-10-03,"Wizz Air used to be a small airline with nice fares and helpful and friendly staff. They have recently expanded in a short period of time, and I believe this is where the problem lies. I have had 3 errors while making three different bookings in the last 2 months. I travel between university and home approximately every 2 months, and sometimes my family visit so you can imagine, there are a lot of bookings. No benefits whatsoever - no collecting airmiles, no benefits for frequent travellers. You have to buy a membership to get cheaper flights but nothing apart from that. The website is ridiculous. For example, last month (Sept 2018), I used my bank card for a booking and at the end of the transaction, I received an error notification that the bank card did not work and I was instructed to repeat my transaction again. A phone call came and I did not manage to try immediately. 2 minutes later, I receive an email with a summary of my booking because the transaction was actually complete! So luckily, I had not tried a second time. Another example (Sept 2018) is when I tried to add 2 suitcases to an inbound flight. But instead, they were added to the outbound flight! That is 2 suitcases of 20kg, so I am still waiting for my refund of almost £50. No emails from Wizz Air yet. I have travelled with Wizz Air for 5 years now, it used to be an affordable airline, simple way to get from A to B. Now each booking comes with a problem. Each time I am on the website, it feels like I am gambling today. Am I going to end up losing £50 or will everything go well maybe this time? I am a student, so it is really difficult. But I imagine it is the same for anyone.",True,,Family Leisure,Economy Class,Budapest to London,September 2018,1,1,"<span class=""star fill"">1</span>",1,1,,False,1
"""Worst customer service ever""",2,2018-10-02,"Worst customer service ever. The information re extra luggage is misleading and false. I added an extra suitcase, checked both ways box, the system clearly showed the charge for both ways (top and calculated in the bottom) and then I got a confirmation email that covers one way only, for 63£! The Call center refused to refund me for the charge and so far, there's no response to my complaint form. I was forced to leave the suitcase at the destination so I wouldn't be charged both ways. The flight went smoothly with no delays and the crew were polite and efficient. Yet, I would expect to receive efficient service when things go off plan and it does not seem that Wizzair are capable of that. If you decide to travel with them, do your homework first. I won't repeat the same mistake again.",True,,Couple Leisure,Economy Class,Luton to Tel Aviv,September 2018,3,4,,4,2,,False,
"""Appalling customer service""",1,2018-10-02,"Not Verified |  Athens to Bucharest. Appalling customer service. Don't be fooled by the apparent great deal you get on your ticket. It will cost you much more in the end: like 30 euros per person for a check in which apparently we started online ""but haven't fully completed"". Which seems to be a rather common occurrence with this airline.",False,,Family Leisure,Economy Class,Athens to Bucharest,September 2018,3,3,,1,2,,False,
"""the seat was comfortable""",9,2018-10-01,"Luton to Athens. Not a bad experience for a budget airline - way better than Ryanair. I had extra legroom and didn't eat or drink any Wizz food. On the way to Greece a woman asked to sit in an extra legroom seat two seats from me and was allowed to, so maybe it's not necessary to pay extra for that if you travel alone. My only complaints would be: confusion about the baggage allowance meant I worried a lot about whether I could take my small bag on the plane (I was allowed, but according to their rules I should have been fined as I didn't have Priority), and the check-in desk was very slow to open at Athens, so a long queue formed. Otherwise, we boarded on time and the seat was comfortable.",True,,Solo Leisure,Economy Class,Luton to Athens,September 2018,4,5,,4,3,,True,
"""strongly recommend avoiding""",1,2018-09-29,"Ljubljana to Brussels. Absolutely terrible. Online check-in was unclear and the summary of booking information, which I carefully went through in the morning of my flight, contained no information about it being necessary to avoid a 30€ payment at the airport. I was first given a boarding pass with no problems when I arrived at Ljubljana airport and the boarding to the plane was about to start, as suddenly I was called to information situated outside the security. I was called to pay the 30€ because I had done the check-in at the airport (paper? The 2-second service?), and given no option to fight back because my flight was about to leave. I was treated like an idiot because I had not figured out that online check-in was needed while apparently having ""ticked the box"" to agree to do it online while booking. Apparently I would have figured this out by logging into their website. As if I had nothing better to do with my time than browsing their website just for fun. This was my first time with Wizz air and I had no idea this company had all these different ways to trick the customers. They probably make a fortune with the misleading check-in information. I am sure they have received many complaints but there are still no reminders nor links to the check-in sent to the customers. I strongly recommend avoiding, they give you a headache.",True,,Business,Economy Class,Ljubljana to Brussels,September 2018,1,1,"<span class=""star fill"">1</span>",1,1,,False,1
"""charged 37 euros to check in""",1,2018-09-29,"Tallinn to Luton. I was unable to check in via app, and then was charged 37 euros to check in at the counter. Will not use this airline again, and I do not recommend it.",True,,Solo Leisure,Economy Class,Tallinn to Luton,September 2018,2,2,,1,1,,False,
"""Horrible service, rude staff""",1,2018-09-26,"Not Verified |  Flew London Luton to Larnaca. Absolute worst ‘company’ I’ve ever flown with! Charged me and my boyfriend £64 for the pleasure of checking us in at the desk which I’m pretty sure is their job, so why they think it is okay to then charge us so they can push a couple of buttons, I’ll never know! Horrible service, rude staff and just an absolute awful experience! Will never fly with Wizz Air again.",False,,Couple Leisure,Economy Class,London Luton to Larnaca,June 2018,1,1,"<span class=""star fill"">1</span>",1,1,,False,1
"""most terrible experience""",1,2018-09-24,Berlin to Kiev. The most terrible experience one might have. If you didn’t register online you will pay registration fee at the airport! To register you and print a boarding pass apparently will cost you 35€ per person. Almost half of your ticket price. I guess paper cost so much money that they can’t even give you a discount.,True,,Family Leisure,Economy Class,Berlin to Kiev,September 2018,2,3,,1,1,,False,
"""pay £30 to check-in""",1,2018-09-24,Flew Wizz Air from Wroclaw to London. Please don’t give them your money. For me it feels like a scam company. You pay £20 for the ticket and then online check-in does not work and you need to pay £30 to check-in at the airport. Should have bought a far better (and in the end cheaper) flight from another company.,True,,Solo Leisure,Economy Class,Wroclaw to Luton,September 2018,1,1,,1,1,,False,
"""Would fly Wizz Air again""",10,2018-09-18,"Skopje to Berlin. Having read other reviews on this website, I was surprised that my flight with Wizz Air back home was (like the outbound one) flawless: easy booking process, informative app, speedy check-in process, orderly boarding process, aircraft less than one year old, professional crew, affordable inflight food and drinks - you name it! Can also recommend their Limo transfer offered on their website or app. Not their fault, Berlin is not able to get its act together running a decent airport. Baggage delivery in rotten Schönefeld airport (worst airport in Europe let alone of a Western capital) took ages. Would fly Wizz Air again in a heartbeat.",True,A321-200,Couple Leisure,Economy Class,Skopje to Berlin,September 2018,5,5,,3,5,,True,
"""pay a little bit extra""",1,2018-09-18,"Barcelona to Bucharest. The worst service and flight company ever. The flight was delayed with 1 and half hours without any good reason (the weather was good, other flights were on time). The arrival hour should have been at 2am in the night and they landed at 3am. Before boarding, they changed the gate 3 times. Then, also before boarding, they labeled the cabin luggage randomly and by force: I told them that I want to take with me in the cabin and that it was very small luggage, below the maximum limits for cabin luggage. They didn't care and lied that it will not necessary go to drop off, the flight attendant will hold them only if there will be no more space in the cabin. It was a lie because we were among the first to board and they took the luggage to the drop off. The places for luggage in the cabin were almost empty near our seats, so it was only mockery what they did. Besides that we had to wait at 3:30am half an hour for the luggage. Another problem is that the space in the seat is too small. I have 1.7 meters height and I stood with my knees stuck in the front seat. I cannot imagine how taller persons can fly 3 hours in that tiny place. Conclusion: never, ever flight with this joke of company, they have the absolute worst service I ever experienced. You better pay a little bit extra money and fly with another company, but do not make the mistake to fly with Wizz Air.",True,,Business,Economy Class,Barcelona to Bucharest,September 2018,1,1,,1,1,,False,1
"""pleased with my flight""",9,2018-09-17,"Larnaca to Katowice. I was pleasantly surprised and very pleased with my flight, the price my son and I got was a great deal. No delays, flight staff pleasant, check in was great! My bag was to be on hold but I asked at larnaca if I could take it on board as I have a bus to catch right away when I get to Poland.The agent was fine with that, leaving Poland was amazing the staff at the airport were friendly and very accommodating!  My son paid for priority so he is able to board 1st.We had tried to modify my booking when we booked and it wasn't letting us add the priority for myself. But at the end it didn't matter cause in Poland I asked the employee of wizz Air if I could be with my son in the priority section or line so that I could possibly sit with him. The flight wasn't full, she told me yes u can, she lifted the rope and said it's fine she told the agent in the priority that I was ok to be there. I actually was able to sit with my son too. I will be flying Wizz air again in the future!",True,,Family Leisure,Economy Class,Larnaca to Katowice,September 2018,3,5,,5,5,,True,
"""Absolutely abysmal service""",1,2018-09-15,Not Verified |  Absolutely abysmal service. Travelled with my partner and friend from Luton to Larnaca and return. My friend requires assistance on and off the aircraft. The airport staff were fantastic but the airline insisted that he must sit at the back of the aircraft in a centre seat despite the fact that he had paid priority with an extra leg room seat. The priority boarding at Luton and Larnaca was an absolute insult to intelligence. 5 lanes of check in for standard fare and one lane for priority. The entire flight was checked in before the priority queue had moved. Priority boarding is only priority through the gate and not boarding the aircraft. My friend ended up foregoing any assistance to board the aircraft In order to keep his extra leg room seat as he would have been in a great deal of discomfort over a 4 hour flight. As a business traveller flying around 50 times a year I have never witnessed such poor service. Needless to say I will never fly with Wizz air again and will certainly not recommend them to any of my associates or friends.,False,,Business,Economy Class,Luton to Larnaca,September 2018,3,3,,1,1,,False,
"""Appalling customer service""",1,2018-09-13,"Luton to Dubai via Katowice. Booked with Wizz Air via Kiwi.com and paid for the 20kg baggage option. Made sure to check the Wizz Air website - their baggage page shows '20kg Paid x 6'. I had less than 20kg worth of baggage - a backpack and a guitar case. Because it was two pieces of luggage, not one, I was charged £61. I submitted a complaint about the unclear website and ridiculous charge, it took them 36 business days to respond. An unsatisfying email conversation later, I still haven't been refunded. They hid behind the fine print. Appalling customer service. Flyers beware of the add-on costs when flying with Wizz Air.",True,,Solo Leisure,Economy Class,Luton to Dubai via Katowice,July 2018,2,2,,1,1,,False,
"""I decided no more Wizz Air""",1,2018-09-13,"Prague to Luton. Never again. Our flight was cancelled and nobody could tell us what happened and why it is cancelled. We don't know it even now. Communication with this company is terrible - one mail = 2 weeks. They don't want to pay us 250€ compensation despite that's our right. The price is low so is the quality too. You can buy some meal on board for normal airline price but with regard to the staff, they were quite rude. When return flight I asked them ""excuse me"" because I wanted to go back to sit, she said me rudely ""wait I can't now"". I decided no more Wizz Air. I pay rather 180€ return ticket via EasyJet than with WizzAir. I'm not the only person who makes complaint about this airline and even not the last.",True,A321,Solo Leisure,Economy Class,Prague to  Luton,August 2018,1,1,"<span class=""star fill"">1</span>",2,3,,False,1
"""had not checked in online""",1,2018-09-09,"Tirana to Budapest. I travelled about a month ago to Albania with Wizz and on my return I was meant to take Wizz to Budapest and Ryanair thereafter to London. The night before flying out I tried to login and check-in online, which of course did not work – so I assumed as I had never needed to complete check-in online on flights from Tirana that it wasn’t a service that was offered. The next day I went to the airport about 3 hours before departure, queued up at the check-in desk, only to be refused a ticket because “I had not checked in online”. I was told in no uncertain terms that unless I paid 35 EUR I would be denied boarding. The fact that their website did not work and that they had not at any stage advised of the need to check in – unlike Ryanair (who emailed and texted me a day before the flight), did not serve any purpose and I was forced to pay. As Wizz doesn’t do customer service, their pathetic attempt to respond to my complaint was left to customer service whose final attempt to look into my complaint said “We would like to kindly inform you that we have done a thorough investigation and we are delighted to inform you about the reason, why you were requested to pay at the airport”. Avoid like the plague!",True,,Solo Leisure,Economy Class,Tirana to Budapest,August 2018,1,1,,1,1,,False,
"""great value for money""",8,2018-09-03,"Riga to London Luton. I recommend this airline. Great value for money, cabin crew was really nice, seats comfortable, great selection of food and drinks, on time departure and landing. Would definitely reccomend Wizz Air.",True,A320,Solo Leisure,Economy Class,Riga to London Luton,August 2018,4,5,,3,4,,True,
"""ripping off passengers""",3,2018-09-03,"Luton to Cluj-Napoca. The company is completely ripping off passengers when it comes to fees for luggage and seats. Most times these costs are higher than the flight itself. You cannot use Club Discount for anyone else but your own fight: for example, I've tried to book a fight for my mother using club discount- guess what?? No can do. And as a passengers there's nothing you can do because they are the only company flying your way, so there's no competition. 
Staff service there's no complaints from me there, they do they're best with what they have. They've always been professional, polite and very helpful with me.",True,,Solo Leisure,Economy Class,Luton to Cluj-Napoca,June 2018,2,5,"<span class=""star fill"">2</span>",2,3,,False,1
"""Service on board a mess""",1,2018-09-03,"Luton to Bucharest. Service on board was a mess. The staff making the announcements on board was a shame, she was not able to do that because her colleague  was making her to laugh all the time. Just short after landing in OTP a lot of pax were standing up and talking on their phones even we were still moving to the terminal, the cabin crew let them to continue without being firm - disappointing. When the aircraft parked the bins were opened already and bags out. I will not travel anymore with Wizz because of lack of safety.",True,A320,Couple Leisure,Economy Class,Luton to Bucharest,August 2018,1,1,,3,1,,False,
"""35Euro to get a boarding pass""",2,2018-09-03,"Kosiche to Luton. I only booked with Wizz Air because I had no alternative for this journey. I was prompted to check in online with Wizz Air by the company I bought the ticket from. I tried this on several occasions. On 28 August it still hadn’t opened - but when I tried again on 30 August, the day before my flight, it had closed. Apparently it had been open for just one day, on the 29th. At the airport I was charged 35Euro to get a boarding pass because I hadn’t managed to check in online in this one-day window of availability. A blatant effort to rip-off the customer.",True,,Solo Leisure,Economy Class,Kosiche to Luton,August 2018,2,3,"<span class=""star fill"">1</span>",2,1,,False,1
"""ashamed of the new lows""",1,2018-09-02,"This is regarding the flight from Bucharest to London Luton, scheduled for 3:00pm. At 9am in the morning the same day, the Wizz website had an update on the flight status i.e. it was 1.5 hours late and would depart at 4:30pm now. I had already paid to check-in a 20kg bag along with my ticket. I had checked in online earlier and had to drop off my check-in bag. I reached the check-in desk at 3:00pm. The lady said that they had closed the bag check-in and I should take the bag to the gate directly. So, now I had to get my check-in bag scanned as a hand luggage and all my perfumes, etc were thrown away by the airport authorities. When I reached the gate, the Wizz staff asked me to pay 65 euros to check-in my bag. I clearly said no and she and her colleague would not let me board the flight. According to them, if the flight had been delayed to 9pm, I should have been at the airport by 1pm to check-in the bag. The flight was further delayed to 5pm. I called the Wizz complaints department and asked them for assistance, to which he replied that I should just pay the money for the bag. After having argued with them for half an hour, I had no choice other than to pay! I ended up paying a total of more than 100euros for a 12kg bag to get it from Bucharest to London. My bag was cheaper than that! Wizz should be ashamed of the new lows that they go to, to extract money from passengers.",True,,Business,Economy Class,Bucharest to London Luton,August 2018,2,2,"<span class=""star fill"">1</span>",1,1,,False,1
